speaker,speech_text,speech_number,meeting_id
徐志榮,大家早安。有關醫事法第十一條，依現行法第十一條是採原則禁止、例外開放的立法寫法，例外範圍僅限於山地、離島、偏僻地區，而本席版本的第十一條是考量到遠距醫療在國外已實施1、20年，各種因應非常地普及，況且這次新冠疫情爆發，衛福部及健保署都有在遠距醫療這部分做很多的努力，成效也非常好，所以我的版本是建議將例外範圍再擴大，將實施範圍定義為「因應醫療需要」，同時配合第三項「由中央主管機關定之」，也就是要保留實施遠距醫療最大的彈性，讓主管機關衛福部可以參酌醫學上的需要、醫療技術的進步、通訊技術的發達，甚至像這次的新冠疫情一樣，考量流行病學的控制作與時俱進的調整，謝謝。,1,LCIDC01_1118201_00002
吳玉琴,謝謝主席今天排審物理治療師法。物理治療師法在上一屆也是臨門一腳，沒有通過修法，因此這一次再請召委協助排案，也謝謝召委排審。有關於物理治療師，有鑑於2025年臺灣即將進入高齡社會及超高齡社會，我們每個人都希望能夠活得長又活得好，其中物理治療師和職能治療師其實扮演滿重要的角色，然而目前物理治療師法第十二條的限制是，無論你要做什麼，即使是相關的評估都必須取得醫師的診斷、照會或醫囑，其服務的可近性相當不足。其實各類醫事人員業務的執行範圍大多有各自獨立執行業務的部分，像是護理人員法、心理師法及驗光人員法都有相關的授權，但是物理治療師到現在相關法令還是沒有隨著多數民眾的需要而調整，因此這次我提出了物理治療師法的版本，是希望物理治療師在執行專業服務上能夠適度且合理的放寬。其實物理治療師法已經訂定近30年，整個臺灣環境也做了滿大的改變，我要特別提到的是，尤其在長照領域，民眾常常都會尋求物理治療師的專業服務和協助，如果這個部分也要取得醫師的診斷、照會或醫囑，這樣不但要繞一圈，可能還會浪費健保資源。所以針對這部分，我們希望接下來能夠討論怎麼讓物理治療師的專業可以因應高齡以及現在整個長照，或是從讓大家能夠活得更好、更有生活品質的預防性角度出發，讓物理治療師可以在健康促進、傷病預防、延緩失能照護、運動防護、特殊教育的部分一起協助，使民眾的生活品質更好，也希望所有的委員都可以一起支持這次的修法，謝謝。,2,LCIDC01_1118201_00002
蔡壁如,本院台灣民眾黨黨團，有鑑於現行物理治療師法第九條和第十二條自1995年制定到現在已經27年，中間只進行過文字的修正，而沒有做任何內容的調整，在此同時，2012年到2020年間，臺灣每萬人口物理治療師執業的人數已經從1.59人成長到2.66人，僅8年的時間就成長了1.67倍，由此可見，目前物理治療師身處的醫療體系、醫療市場、人力結構已經與1995年制定的物理治療師法規有明顯地不同，所以與時俱進的必要性不可言喻。再加上近年來我國人口結構的高齡化、民眾運動風氣的興盛及健康意識的抬頭，為提供民眾接受物理治療服務的可近性，除現行醫療照護領域的物理治療外，更應該拓展教育、體育、勞動、維持健康、預防延緩失能、長期照顧，尤其是長照系統和社會福利等體系之專業服務，俾提升我國國民健康，增進民眾福祉。爰此，台灣民眾黨擬具「物理治療師法第九條及第十二條條文修正草案」，敬請諸位同仁及大家支持，謝謝。,3,LCIDC01_1118201_00002
王婉諭,謝謝主席。物理治療師法的修法，可以說是一個非常艱辛的過程，從上一屆立法院審議就可以看得出來，明明都已經通過了委員會審查，甚至到了協商，但最後卻還是不了了之。基於屆期不連續原則，這次的修法期程又必須從頭開始，本席希望這次的審查過程，大家能夠實際的針對實務問題討論，不要再用一些似是而非的誤導說詞，讓物理治療師法的修法繼續拖下去。尤其這幾年我們看到臺灣社會一直提倡要改變運動風氣，提升國民健康，甚至隨著人口結構的改變，更被迫面臨高齡化社會的挑戰，而在這樣的情況下，如何維持健康不失能，是我們每一個人早晚都必須要面對的問題。在這樣的挑戰之下，物理治療師扮演著其中不可或缺的角色，在他們的協助之下，我們期待能夠更積極的促進健康、預防、治療和復能，進而提升生活品質。我們知道目前全世界已經有75%的國家允許物理治療師直接對一般民眾或患者協助，再依需求轉介給醫生，但臺灣卻沒有辦法，而且在社區端的服務量能部分，臺灣自行開業的物理治療師只占了7%，反觀美國或澳洲等國都已高達30%到40%，顯見我國的物理治療師法已經不合時宜，有許多與實務工作狀況嚴重牴觸的範圍，所以為增進全民健康及福祉，同時符合現實實務上需求，時代力量提出物理治療師法第九條及第十二條修正案。我們這次的修法，是希望讓物理治療師能夠更貼近實際上的執行層面，更重要的是，能夠增加民眾接受服務的可近性，一起協力往全能醫療照顧、全能健康促進來努力。我們希望物理治療師在民眾需要的時候，可以更直接的提供相對應的協助，一起來促進全民福祉，所以希望這次能夠順利通過物理治療師法的修法。謝謝。,4,LCIDC01_1118201_00002
賴惠員,"（9時23分）部長早安！近日本土確診案例不斷攀升，昨天已經到了六萬五千多例，而本土案例累積也超過了80萬3,337例，從這些案例的分析可以看到年齡層的分布是從零歲到天花板的八十幾歲，可是今天我要跟部長探討的是，本土案例不斷上升，但從累積的數目跟當日確診的數目上，統統看不到零到6歲兒童確診的狀況，請問部長，衛福部有沒有針對這一塊的統計數目？就是有沒有零到6歲孩童的確診數目？",5,LCIDC01_1118201_00002
賴惠員,7.0%。部長，12歲到17歲完成第一劑施打的比率，我手上的資料顯示是已經達90%，甚至就是……,6,LCIDC01_1118201_00002
賴惠員,那第二劑呢？,7,LCIDC01_1118201_00002
賴惠員,第二劑也是80%。,8,LCIDC01_1118201_00002
賴惠員,目前6到11歲才剛開始施打，所以第一劑大概才達到9.1%，是這樣的數據嗎？,9,LCIDC01_1118201_00002
賴惠員,意思是大家對輝瑞疫苗有所期待。此外，本席是非常讚賞衛福部這段期間的努力，讓快篩試劑沒有缺乏的情形。我們關心5至11歲有沒有疫苗與快篩，另外還有0至4歲幼兒不僅沒有疫苗可打，唾液快篩劑也沒有辦法使用，我擔心這會成為防疫的破口。其實6歲以下幼兒的採檢非常不容易，唾液快篩劑只是用吐口水的方式，在檢測幼兒上有相當大的困難，鼻腔快篩又容易產生孩子非常不舒服的情形。你們有沒有什麼好方法讓0至4歲這些孩子預防染疫？萬一確診該如何去面對呢？,10,LCIDC01_1118201_00002
賴惠員,可是這在臨床上已經發生了，如果說還沒發生前預防性的措施，針對0至2歲這階段的幼兒該怎麼辦呢？你也講的非常清楚，唾液快篩操作指引正面表述2至18歲兒童與青少年要由家長陪同使用，等於漏掉0至2歲。現在大家普遍面臨困難，我們也接到很多陳情的電話，其實大人不怕自己被感染，而是因為家裡有小朋友所以特別的害怕。除了宣導以外，請問衛福部有什麼比較積極的作為？,11,LCIDC01_1118201_00002
賴惠員,儘量在家休息，然後儘量宣導大人要趕快打疫苗！,12,LCIDC01_1118201_00002
賴惠員,好，謝謝。最後一個問題，我們週一有在財政委員會的聯席會議討論菸酒稅法第七條部分，加熱菸已經是進行式了，海關查扣的菸品要怎麼處置？因為近幾年來海關查扣的新興菸品非常多，在菸害防制法修法通過以後，是要全數歸還輸入者？還是要溯及既往繼續查扣？針對這個問題，你有什麼看法？,13,LCIDC01_1118201_00002
賴惠員,法規當然還沒通過啊！我要問的是你們雙方的態度是如何？那之前扣的這些怎麼辦？上次財政部部長回答我要看衛福部的態度，現在衛福部又告訴我要看財政部，兩造互踢皮球。這個問題再找一個時間，請兩個部會一起到辦公室來報告好嗎？顯然現在是沒有答案啦！,14,LCIDC01_1118201_00002
賴惠員,沒有答案啦！你們兩邊講的……,15,LCIDC01_1118201_00002
賴惠員,財政部又說他們尊重衛福部。,16,LCIDC01_1118201_00002
賴惠員,是啊！部長。,17,LCIDC01_1118201_00002
賴惠員,對，沒錯。,18,LCIDC01_1118201_00002
賴惠員,部長，財政部是在害你，你要特別小心！好，謝謝。,19,LCIDC01_1118201_00002
吳玉琴,"（9時31分）謝謝召委，部長早。今天就衛福部業務及物理治療師法修法跟您質詢。5月13日新聞報導有提到，因應5月份新制，24小時住宿型機構住民一旦確診，輕症就是原地收治，儘量維持醫療量能。這部份長照司也特別強調，109年就有編列防疫補助津貼及獎勵要點，目前護理人員補助一班5,000元，照服員大夜班3,500元，小夜班及日班3,100元，社工師8小時5,000元。請問一下適用的對象，有包括護理之家還有社區式的精神復健機構嗎？",20,LCIDC01_1118201_00002
吳玉琴,好，不要漏了，因為常被漏掉。,21,LCIDC01_1118201_00002
吳玉琴,這款項是給機構還是給工作人員？,22,LCIDC01_1118201_00002
吳玉琴,是給員工，但由機構來申請是嗎？,23,LCIDC01_1118201_00002
吳玉琴,那為什麼只列護理人員、照服員還有社工師？那其他如廚工及司機這些行政人員就沒有獎勵嗎？,24,LCIDC01_1118201_00002
吳玉琴,給直接第一線照顧者，可是行政資源也滿重要的啊！所以我要問的是，對機構有沒有相關獎勵？,25,LCIDC01_1118201_00002
吳玉琴,沒有，其實它們目前也滿辛苦的。請問這個補助是什麼時候可以開始申請？申請的期限為何？還是只要照顧確診的……,26,LCIDC01_1118201_00002
吳玉琴,這個有回溯到4月1日嗎？從4月1日開始嗎？,27,LCIDC01_1118201_00002
吳玉琴,這個有確認嗎？,28,LCIDC01_1118201_00002
吳玉琴,瞭解。另外，因為疫情大家都疲於奔命，護理及老人福利機構的評鑑都宣布要延後到明年。但是現在機構面臨了另一個建管消防檢查問題，建管公安H1兩年一次、F1每年一次、消防半年一次。現在狀況是機構有確診隔離收治的案例，檢驗人員不敢進來啊！檢查時間到了我們怎麼辦？會違反公共和消防安全規定。這部分能不能請衛福部、營建署及消防署討論一下？機構不是不做，是因為防疫期間檢驗人員進不來而延遲申報，這些狀況怎麼去克服？,29,LCIDC01_1118201_00002
吳玉琴,暫緩。,30,LCIDC01_1118201_00002
吳玉琴,它就要隔離了，其他人也不能進來。,31,LCIDC01_1118201_00002
吳玉琴,是不是要有一個相關的行政程序通報或者討論？,32,LCIDC01_1118201_00002
吳玉琴,好，麻煩你。再來，目前住宿型機構大概有六百多家的工作人員或住民確診，這些大概都分布在哪些區域？現在碰到一個問題，口服藥物如默沙東、莫納皮拉韋可以提供給長照管灌的老人以及洗腎的病人使用。這個藥滿重要的，但是有機構跟我反映，中南部好像只有成大醫院有這個藥，是不是有時間的落差，導致機構得到的訊息不夠精準？,33,LCIDC01_1118201_00002
吳玉琴,所以中南部也都會有吧？不會說只有北部、中部。,34,LCIDC01_1118201_00002
吳玉琴,如果機構有缺要向誰反映？向地方衛生局嗎？,35,LCIDC01_1118201_00002
吳玉琴,好。所以是要向指揮中心這邊……,36,LCIDC01_1118201_00002
吳玉琴,好的。如果有需要，再向指揮中心反映，謝謝。接下來有關物理治療師法，部回應對修法是持肯定的態度，也要謝謝陳部長。對於物理治療師法我就不用多說了，上一屆我們修法臨門一腳沒有過，因為「屆期不連續」原則現在重新再來。2019年的新聞報導都還說治療師提供長照服務，是遊走在違法的邊緣！長照領域我待很久，物理或職能治療師其實都有這疑慮，為什麼這樣講呢？物理治療師法第十二條第二項規範，執行業務時應依醫師開具之診斷、照會或醫囑，等於所有的業務都需要醫囑。如果違反前述規範伺候他的是，處2年以下有期徒刑，得併科3至15萬元罰金，枷鎖是那兩年的刑期。而衛福部的說法是，並沒有案例啊！事實上不是沒有案例，而是因為它有兩年的刑責所以他們碰到的時候，趕快認罪協商以換取緩起訴，因此沒進入到判刑2年內的情形，這是一個很大的枷鎖！當所有的物理與職能治療師執行業務都有疑慮的時候，如何扮演健康促進和預防失能角色？這是未來臺灣很重要的職業。所以這次修法應該要適度放寬，稍微解開枷鎖，讓他們可以適度去執行專業。我們沒有要擴權，只是要合理的執行業務。請問部長要不要針對物理治療師法的修法跟我們說幾句話？,37,LCIDC01_1118201_00002
吳玉琴,謝謝部長，對於物理治療師法，希望今日能順利討論通過。,38,LCIDC01_1118201_00002
蘇巧慧,（9時40分）謝謝主席。部長，這個是我要來質詢之前自己寫的標題，也是我個人對這一陣子防疫作為的感覺，對於即便我們想要從10樓降到平地1樓，樓梯要一階一階下，不可能直接從10樓跳到1樓，跳下來粉身碎骨都有可能！防疫控管當然也是一步一步鬆，這是我個人的想法。但是昨天最新的防疫措施，繼4月26日「3+4」之後，昨天開始是打滿三劑者可以免隔離，進行到「0+7」的階段。我回到地方，得知地方出現兩種聲音，第一種，哇！一下子就放寬到「0+7」了！這樣是不是我們風險變的非常大，年輕媽媽很擔心，不要說害怕小孩染疫，也擔心自己會不會帶病菌傳染給年幼的孩子。另一種，直接主張你看我就說要「0+7」！21天前就主張要「0+7」，為什麼現在才實施？真是太慢了。部長，在這光譜兩邊極端的意見當中，能不能解釋一下，我什麼我們現在的政策是這樣？從「10+7」居隔到「3+4」到昨天開始「0+7」，根據是什麼？,39,LCIDC01_1118201_00002
蘇巧慧,意思是說，如果21天前如果我們直接「0+7」的話會有這樣的風險？,40,LCIDC01_1118201_00002
蘇巧慧,所以可以說這21天內，我們第三劑的疫苗覆蓋率又再往上提升相當多嗎？,41,LCIDC01_1118201_00002
蘇巧慧,可以告訴我們大概數字是多少嗎？,42,LCIDC01_1118201_00002
蘇巧慧,第一，這21天裡面，我們疫苗的覆蓋率是增加的；第二，這波疫情裡面，我們主要看的是中、重症的發生率，在這21天裡面有變化嗎？,43,LCIDC01_1118201_00002
蘇巧慧,在原來的……,44,LCIDC01_1118201_00002
蘇巧慧,所以總結一句話，在4月初這波疫苗施打之後，近21天以來，我們防疫策略還是不斷在增強。而隨著我們的防疫工作做得越完善，居隔才可以越來越鬆，應該是這樣的態度。這就是我所謂的防疫是一步一步鬆，樓梯要一階一階下。我也給部長參考一下，我們自己做了一張圖表，去年Alpha流行同樣是5月到7月，大家度過的是三級警戒，今年Omicron發生到現在也是大概一個半月，為什麼去年發生Alpha的時候，我們要提升到三級警戒？因為那時候的致死率大概是百分之五點多嘛！,45,LCIDC01_1118201_00002
蘇巧慧,是，所以去年爆發Alpha的時候，100個人有5個人左右會不幸遭遇身故意外，雖然今年確診人數到80萬人，可是死亡率自始至終因為有效控制，雖然之後可能還會增加，但目前為止都還控制在0.03%左右吧？,46,LCIDC01_1118201_00002
蘇巧慧,大家可以看看這個圖表，就可以很清楚地解釋，為什麼同樣爆發社區感染，去年我們是加強警戒到三級，而今年是防疫措施一步一步做好之後，其實是在放鬆，希望能夠回到正常社會、正常生活的狀況。這樣解釋應該是合理的吧？,47,LCIDC01_1118201_00002
蘇巧慧,他不是從3樓跳下來，可能是從10樓就跳下來了。,48,LCIDC01_1118201_00002
蘇巧慧,我認為一步一步來是很對的，有一步是我認為基層醫療診所的防疫工作非常重要而且辛苦，他們反映現在配送的公費家用快篩試劑，有看到一張函文是目前所配送的公費試劑會到6月30日或試劑用罄為止，但有一些診所的公費快篩試劑已經用罄，診所很想知道未來是不是還會繼續配送公費快篩試劑？我個人認為應該要，因為診所其實是防疫的第一線，所以我主張這個部分應該要補足並且繼續下去，不是只到6月30日。因為坊間認為6月30日是不是就是落日、沒有了？部長可以解釋一下這個部分嗎？,49,LCIDC01_1118201_00002
蔡壁如,（9時48分）部長好。部長最近真的很辛苦，但是在問今天的議題菸害防制法之前，我先來問一下時事題。因為最近、大概從上禮拜開始，防疫保單之亂真的是非常亂，不知道保單跟衛福部有沒有關係？你的防疫政策有沒有受到保單的干擾？,50,LCIDC01_1118201_00002
蔡壁如,比如3+4現在變成0+7，這樣的政策會不會是受到影響？你的政策思考是不是……,51,LCIDC01_1118201_00002
蔡壁如,你剛剛有回答這是一個專業的決定，但是會不會受到其他部門影響？其中可能就是最近防疫保單之亂的干擾。會不會？,52,LCIDC01_1118201_00002
蔡壁如,不過事實上呢？,53,LCIDC01_1118201_00002
蔡壁如,事實上，真的很亂。,54,LCIDC01_1118201_00002
蔡壁如,你對我說你的政策是以科學為依據，不會亂，實際上執行卻是非常亂。,55,LCIDC01_1118201_00002
蔡壁如,合約怎麼訂就應該理賠，對不對？,56,LCIDC01_1118201_00002
蔡壁如,所以叫財政部、金管會不要干擾你的政策。,57,LCIDC01_1118201_00002
蔡壁如,這次防疫保單之亂真的很亂。部長，我再問一個時事題，剛剛有幾個委員都說現在本土案例已經突破80萬，我看很快就會超過100萬，而我也染疫了。部長剛剛一直在講科學，那我們來講比較科學的事情，你會不會想要做全民抗體的study，透過這樣的研究知道我國自然感染率的狀況？,58,LCIDC01_1118201_00002
蔡壁如,所以有這個計畫了？,59,LCIDC01_1118201_00002
蔡壁如,所以會做？,60,LCIDC01_1118201_00002
蔡壁如,我會支持這樣的計畫，因為這一次大爆發的Omicron，對我們來講，也是一個公衛上很好的study。我稍微提一下這個……,61,LCIDC01_1118201_00002
蔡壁如,從捐血中心開始來……,62,LCIDC01_1118201_00002
蔡壁如,一定要透過知情同意書（informed consent form）讓民眾知道，不要……,63,LCIDC01_1118201_00002
蔡壁如,我覺得好好講應該很多民眾都願意參加，至少我也願意參加。我們還是回歸到今天要討論的議題，上禮拜財政委員會在討論菸捐跟菸稅，部長有抽菸，對嗎？,64,LCIDC01_1118201_00002
蔡壁如,你是在戒菸嗎？,65,LCIDC01_1118201_00002
蔡壁如,要那個是什麼？,66,LCIDC01_1118201_00002
蔡壁如,你開始戒菸了嗎？,67,LCIDC01_1118201_00002
蔡壁如,好，你可以跟全國民眾講一下。上週大家在財政委員會討論菸捐跟菸稅，你認為現在一包菸大概90至110元，貴嗎？國健署曾經做過調查，世界銀行曾經建議菸品的稅跟捐應該占菸價的三分之二到五分之四。假如我們的菸捐再往上調，你真的會戒菸，還是繼續抽？多少你可以忍受？,68,LCIDC01_1118201_00002
蔡壁如,部長，我現在要跟你說的是健康問題。,69,LCIDC01_1118201_00002
蔡壁如,現在我們是以價制量嘛！,70,LCIDC01_1118201_00002
蔡壁如,真的很矛盾！,71,LCIDC01_1118201_00002
蔡壁如,目前菸捐不會再調了。,72,LCIDC01_1118201_00002
蔡壁如,如果以世界銀行的建議，事實上現在菸捐是偏低。,73,LCIDC01_1118201_00002
蔡壁如,對，我們要往那個方向，所以我想問部長的感受。如果往那個方向，你就會有決心要戒菸，還是不會？,74,LCIDC01_1118201_00002
蔡壁如,OK，你今天說了，我們就給部長定一個……,75,LCIDC01_1118201_00002
蔡壁如,董氏基金會應該很快會跟部長定戒菸的期程。,76,LCIDC01_1118201_00002
蔡壁如,今天出委員會，部長就要開始戒菸了，所以今天菸害防制法一定要過。,77,LCIDC01_1118201_00002
蔡壁如,所以召委今天一定要認真讓它出委員會。,78,LCIDC01_1118201_00002
蔡壁如,我的質詢時間到了，但是還是讓我問完，好不好？部長，菸捐每年大概會收到300億元，現在可能不到300億元。,79,LCIDC01_1118201_00002
蔡壁如,但是本席比較關心的是，因為我長時間在臺大醫院工作，其實抽菸這件事情是很多疾病致死的單一因子，不管是抽菸或二手菸，每年造成的醫療費用將近500億元，所以吸菸造成的社會成本是遠大於利益。所以還是請部長以身作則，我為什麼要問部長，如果我們再把菸捐加上去，部長就有決心要戒菸，結果現在不用，只要我們今天菸害防制法過了，部長就有決心要戒菸了，我覺得這是一個很好的示範，長遠目標還是要降低社會整體的菸害，所以還是要請衛福部國健署努力。再來，在2018年菸捐已經不足300億元，而菸捐其實有挹注在其他部分，如健保、癌症防治、醫療研發及疫苗基金，如果這些受挹注項目的費用慢慢地減少了，有沒有因應措施？還是這個部分的經費其實是不用煩惱的？,80,LCIDC01_1118201_00002
蔡壁如,之後就慢慢由公務預算把它補起來。,81,LCIDC01_1118201_00002
蔡壁如,多出來的？,82,LCIDC01_1118201_00002
蔡壁如,本席要支持開始加菸捐。最後，請召委再多給我問一題，因為今天還有物理治療師的修法。,83,LCIDC01_1118201_00002
蔡壁如,我10秒鐘內講完，不用部長回答，部長剛剛在業務報告的時候說，他非常支持物理治療師法的修法，部長，是不是這樣子？我看到你們在2020年有一個函釋，這些非以疾病治療為目的之業務，不需要依照這個order去開立，部長是同意的嗎？,84,LCIDC01_1118201_00002
蔡壁如,所以今天我們的修法應該會很順利，謝謝召委。,85,LCIDC01_1118201_00002
洪申翰,（9時58分）部長好。昨天5月17日公布的今年確診人數，目前看起來已經超過80萬人，我今天想要繼續請教關於疫情的問題，尤其是我一直很關心Long COVID的問題。關於長新冠的後遺症，我已經不是第一次在這邊詢問，去年10月我在衛環委員會也質詢過幾次，雖然Omicron大多數是輕症或無症狀，並不像Alpha或Delta病毒的症狀那麼大。但是很多專家認為長新冠（Long COVID）的狀況還是會出現，尤其是當基數變大的時候，Long COVID還是會持續增加，請問部長怎麼看染疫的後遺症接下來在臺灣的狀況？,86,LCIDC01_1118201_00002
洪申翰,大部分都是近期才染疫的。,87,LCIDC01_1118201_00002
洪申翰,其實這幾天也有一些相關的報導出來，尤其是我自己身邊有滿多家長的小孩染疫，他們都非常非常關注這個問題，所以我甚至想要建議部長，衛福部應該針對Long COVID未來的狀況，訂定一個相關的監測計畫。我們現在才開始有大量的染疫者出來，雖然是輕症或無症狀為多，但是否可以訂定一個相關的監測計畫？尤其我認為應該把兒童的部分也放進去。部長，我們有沒有可能這樣做？,88,LCIDC01_1118201_00002
洪申翰,我之前質詢時就有提到整合性的門診很少，部長當時有承諾，在各地確實有開始成立Long COVID的整合性門診，我們當時要求，只要有確診病患的縣市都應該要有這樣的門診存在。我們現在看到健保署COVID-19染疫康復者門診整合醫療計畫，的確像部長說的有一百多間整合性門診可以配合，但是從5月最新的醫院名單發現一個狀況，就是基隆、澎湖以及我負責的選區馬祖這三個縣市，目前看起來並沒有配合或是合作的整合性門診。請問部長，我們能不能更積極的宣導？因為基隆其實也是現在疫情相對嚴重的地方，可是目前在基隆縣市裡面看不到Long COVID的整合性門診，所以是不是可以在這個部分宣導、要求，不要漏掉任何一個縣市，讓每個縣市的染疫者都有相關的資源？有資源你才會去接觸，你才能夠得到相關資訊，因為有時候你根本就不知道或漏了，或是把它當作別的疾病就過去了，這部分可不可以請部長幫忙？,89,LCIDC01_1118201_00002
