speaker,speech_text,speech_number,meeting_id
賴香伶,部長這麼有自信。我們的申訴平臺其實只有兩項，第一項是薪資有沒有回扣，第二項叫工時，嚴格講起來，還有這一類是他們對於執法或者是在工作上面的一些建言，你們是不是就可以擴大平臺，然大家能夠為好的事情提供見解，不是只有申訴個人，還包括政策，好不好？,56,LCIDC01_1108601_00006
賴香伶,回去檢視一下這個平臺，謝謝部長。,57,LCIDC01_1108601_00006
邱泰源,（9時58分）部長、大家好。今天比較專注在精神疾患整個長照的議題，他們也會老，也有長照的需求，所以我們來關心這個題目，個人對主席感到敬佩，排這個重要的題目來關心，我們在這裡也有一段時間比較沒有探討長照整個布建方面，過去部長領導的團隊，把整個長照的資源布置得非常完整，不曉得做到現在有沒有什麼困境或需要突破的點？我只是想瞭解現況有沒有困境，還是需要再努力的方向？,58,LCIDC01_1108601_00006
邱泰源,好，謝謝。這一、兩年來賡續布建的部分，當然有一學區一日照中心、持續推動住宿式機構布建，特別今天比較相關的主題，我們也有布建失智照護服務的計畫，這個部分工作進度狀況如何？有沒有什麼困難？,59,LCIDC01_1108601_00006
邱泰源,好，謝謝。因為其實我回想滿多年前，可能有10年前了，長照司就拋出一些計畫在訓練長照的Level 1、Level 2等等，當時都是以失智這部分的主題在處理，那時候因為我在擔任醫師公會秘書長，所以我也寫了這些計畫，一直跟衛福部這邊做很多的訓練，培養很多人才，現在這些人才怎麼發揮？我突然想到這很重要，將來可以投入這個部分，因為他們都有證書，將來怎麼樣有一個長照資源，否則十多年來，大家打拚，禮拜六也上課，到全國各地上課。,60,LCIDC01_1108601_00006
邱泰源,好，謝謝我們長期的培養。另外也值得敬佩的就是我們也提出相關政策，其實我想這個部分，部長也非常關心跟推動，尤其是圖表左邊，居家失能個案家庭醫師照護方案，總統也很關心，她其實滿喜歡居家照顧的周全性，我們又能連接到出院銜接的準備，這兩個計畫其實也花了不少心思，我知道長照司、衛福部也花了不少的心思在處理，這兩個主題推動的情況怎麼樣？,61,LCIDC01_1108601_00006
邱泰源,那麼出院準備銜接這個部分，看起來家數是有成長，但是在做這個工作的出院準備小組這部分，我們有沒有關注他們的需求？,62,LCIDC01_1108601_00006
邱泰源,關於這部分，我有聽到醫院的團隊表示在處理這個部分要花很多時間，所以他們的意願真的是覺得為社會國家做一點事情，不然其實是非常的辛苦跟有一些困境，這也需要醫院鼓勵，團隊才會做得更好。,63,LCIDC01_1108601_00006
邱泰源,這部分也拜託關心一下。,64,LCIDC01_1108601_00006
邱泰源,這也是醫療銜接長照相當重要的，也是我們政府很關心的一個部分。我們強調今天的精神疾患，我們看起來它有幾個方案可以來照顧所謂的精神疾患，因為你問精神科醫師，我們要談精神疾患長照的時候，他們突然都楞了一下，精神疾患患者包括什麼？定義為何？可大可小，沒關係，至少我們網羅三大法在這邊照顧他們，第一，精神衛生法；第二，身心障礙者權益保障法，都各有條件。第三，長照法，只要失能當然就可以進來我們這邊服務，整個國家這樣很完整的照顧失能或精神身心障礙的人，我想非常的好，不過我們還是要探討一下，到底精神疾患長照資源夠嗎？有沒有需要加強？還有如何區別精神病患是不是真的有長照的需求？因為有些好像並沒有長照的需求，這就是過去大家一直在討論的部分。現在我們也有提一個示範計畫，也非常好，這個部分稍後會再講細節，我想先檢討一下這個流程，不曉得這個示範計畫實行的怎麼樣？,65,LCIDC01_1108601_00006
邱泰源,因為執行一年了，有關這個計畫，有沒有什麼結論或要改善的地方？發現了什麼？鄭專門委員淑心：因為這個計畫目前才剛推動一年半左右，所以我們也持續在蒐集……,66,LCIDC01_1108601_00006
邱泰源,因為在處理這部分的一些精神醫學的專業會覺得一般的長照中心據點，因為對精神病人比較沒有那麼瞭解，所以會拒收精神病人，讓他們產生困擾，現在長照司設計的長照需求評估表其實評估起來都沒有長照需求，但其實他是可能有，這部分……,67,LCIDC01_1108601_00006
邱泰源,不過我知道你們有一直在努力。最後，這是我們跟精神醫學會討論的，對於今天的主題─精神疾病患者長照的建議，因為是他們嘔心瀝血出來的建議，如果可以的話，就給本委員會一個書面回答，看看這樣的建議有沒有辦法改善，包括第一、對「長照需求評估量表」的修正；以及照專、照服員這部分的教育訓練能夠列入常訓課程，當然還有建議增加「長照失能個案醫師意見書」列為精神疾患長照失能等級改判之參考，這樣可能比較可以直接解決問題。,68,LCIDC01_1108601_00006
邱泰源,我們都知道這個意見書花了大家很多的心思，一些比如補助精神疾患的限制、個人的部分負擔等等可否再檢討一下，可否移除或減免？第三、我們鼓勵精神據點的社區融合，這是一個很好的方向，但是這樣的鼓勵措施他們好像覺得不足；最後，現在都希望要回歸社區，可是適當的機構和病房還是要一直規劃，因為這還是有他的需求，大概就是這幾個問題，拜託！,69,LCIDC01_1108601_00006
邱泰源,謝謝部長。,70,LCIDC01_1108601_00006
廖國棟,（10時9分）部長好。我覺得現在所談精神疾病的部分跟我們過去的認識不太一樣，整個社會環境有很大的改變，我們對它的認知也就不同了，到底這是病還是一種罪犯？因為他有病，所以其罪責就有所減少，常常在病和罪之間造成一個模糊的地帶，不曉得你們在執行上關於病罪之間，你自己的經驗或是所碰觸的，或心口司所經歷的，到底是如何來辨別？,71,LCIDC01_1108601_00006
廖國棟,是罪，對。,72,LCIDC01_1108601_00006
廖國棟,對。,73,LCIDC01_1108601_00006
廖國棟,這部分我們必須要跟社會共同來研討，到底要怎樣去做這件事，否則就像剛才你講的，明明他是病人，應該要進入醫院接受治療，但是很模糊的地方就是我們看不出他是什麼樣的狀況，等到發生事情時又擴大渲染，變成一個社會的重大事件，造成大家很大的壓力，所以這部分在精神衛生法修法時，恐怕法院、法務部、衛福部要共同面對事情。第二、我跟地方的衛生單位也稍微做了聯繫，才發現現在我們的社工人員還是遠遠不足以應付目前的需求，因為有很多病人根本是看不出來的，他沒有發作就看不出來，或者他沒有產生危害時，你根本就不知道他是，所以近親或是近距離的關係連結在社會上是非常重要的，只有近親或是離自己比較近的小群體，才會知道這些，但是你們現在整個管理的佈局是以長照機構，還是像你們講的文健站A、B、C站這三種，從那邊發掘到病人的比例不曉得怎樣？,74,LCIDC01_1108601_00006
廖國棟,要不然就是他出事了，我們才知道。,75,LCIDC01_1108601_00006
廖國棟,所以我現在的意思是說我們從關懷的角度來看，你們現在所設的A、B、C站是一個很重要的點，從那邊可以細膩發掘，所以現在我要跟部長講的是這一些人的訓練非常重要，我們不能要求他們一定要發掘什麼，而是要教導他們怎麼樣去觀察、怎樣去發掘這樣的病人，你們現在有沒有這樣的教育？,76,LCIDC01_1108601_00006
廖國棟,那就有一點像我們在追究一些疑似的病人時，大概就是走這個系統。我的意思是我們從社群或社區，甚至從居家來發掘病人，也是非常重要的因素之一。現在很多社區都有設置，原民會叫文健站、你們則是叫ABC站，從那邊發掘的病人，有沒有這樣的研討或讓我們將來得以借助這樣的機構、機關或單位？,77,LCIDC01_1108601_00006
廖國棟,另外，他們還是跟我反映有資源不足、點數不足的問題，你們開研討會時有沒有談論到這些ABC點，或是原民會文健站在點數上不足的狀況？,78,LCIDC01_1108601_00006
廖國棟,現在是433個。,79,LCIDC01_1108601_00006
廖國棟,我看到你們現在的政策是病人的從中發掘到後續的支持和治療，因為病人還是要生活、還是要就業，所以支持系統是非常重要的，我們如何建置支持系統，讓他在治療好了，或是可以一面接受治療，同時家居生活也沒有問題，甚至就業都沒有問題，我們才算是真的把他們照顧好，如果是一直把他關起來，就是一個失敗的治療方式，怎麼讓他能夠回復社會，進入就業職場才是100分。,80,LCIDC01_1108601_00006
廖國棟,衛福部和法務部應該經常就這個部分研商，怎麼共同支持這個制度，好不好？,81,LCIDC01_1108601_00006
廖國棟,最後一個問題，關於文健站的部分，我發覺現在老人家的人口數基本上是走下坡的，所以不管A站、B站或C站，我認為未來規模只會縮小，因為少子化關係，將來的發展一定是人口越來越少，你們有沒有未雨綢繆，將來文健站的發展會是如何？昨天我已經問過原民會，我認為將來會萎縮，部長剛好在這裡，他管理整個一大塊，雖然文健站是由原民會負責，但是基本上文健站和衛福部的關係還是非常緊密的，你們有沒有預期將來要怎麼發展起來，是讓它自然萎縮，還是有其他方案可以做？,82,LCIDC01_1108601_00006
廖國棟,服務人員是不是？,83,LCIDC01_1108601_00006
廖國棟,部長，我的意思是不管是ABC站或文健站，應該共同看到未來整個人口趨勢的改變，甚至將來的服務內容如何去強化集體性、社區性。我本來要問一個問題，原民會開了433個文健站，有沒有曾經透過這樣的系統發掘過輕微、輕度的精神病人？,84,LCIDC01_1108601_00006
廖國棟,原民會呢？也沒有，OK！我們將來要細膩，而且再教育的部分非常重要，部長，對於從業人員的再教育一定要加強，好不好？,85,LCIDC01_1108601_00006
蔣萬安,（10時20分）部長好。臺灣已經進入高齡化社會，預估在2025年就會邁入超高齡社會，也就是65歲以上人口會達到20%，這是一個我們要迫切面對的問題。今天召委安排了這樣的專案報告，特別針對關於精神病患或其長期照顧相關資源布建，行政單位到底準備好了沒有。首先請教部長，2018年開始長照ABC據點的數量，其實我們都有持續在擴增相關據點，也都有在每一年設立相關的目標，部長知道我們的目標值是都有達到、超過或是什麼狀況嗎？,86,LCIDC01_1108601_00006
蔣萬安,品質部分我相信你們有相關的管控機制、評鑑等等，但回過頭來看，部長看到這個達成率的數據不覺得有些問題嗎？簡單講，這應該是去年的相關數據，最新到今年7月。,87,LCIDC01_1108601_00006
蔣萬安,"針對ABC三個據點，衛福部都有設定目標值，A級據點各縣市合計大概469個，達成率達到149%；B級據點的目標是829個，實際數是6,530個，達成率788%，這樣合理嗎？C級據點一樣也是超過。坦白講，我們當然希望設定目標之後，實際達成率能夠達到，但是當你嚴重超標的時候，就要回過頭來想是不是相關的資源分配，或是哪一個環節出錯。我們到各縣市的時候，其實這些長照業者、地方政府或民眾都會來跟我們反映，現實狀況是中央有資源、相關經費，也有撥給地方政府，提供相關補助，希望他們能擴增相關據點。地方政府希望這筆預算用來請業者擴增相關據點，同樣它也需要把這筆預算分配出去，結果造成業者為了搶食這樣的預算大餅，後續可能就會導致品質下降，或是最後有實際需求的人沒有被照顧到。譬如，為什麼特別集中在B級據點，超過788%？",88,LCIDC01_1108601_00006
蔣萬安,去年監察院就有針對數量暴衝、嚴重超標、分配不均的狀況提出糾正，去年6月份的糾正報告提到，衛福部非但沒有進行相關的管控、評估，反而任由其無止境地擴充，顯然失去了當時設定目標值的實質意義，也難免有消耗預算之嫌，實在有欠妥當。部長，監察院的糾正報告是在去年6月提出，我剛剛前面提到的數據是過了一年之後，結果今年7月還是存在這樣的問題，部長有沒有去瞭解？要怎麼解決？,89,LCIDC01_1108601_00006
蔣萬安,部長，因為數據呈現出的暴衝現象，包括監察院糾正以後，當然各界會質疑是不是有消耗預算的問題，這也是監察院指出來的一個問題點。當然部長你們現在可能會調整一些方案，也就是說你們採論量計酬，依據服務量能來給付就可能避免消耗預算這樣的問題。同樣地剛才部長也講到希望能夠提升品質，也確實希望能夠照顧到有需求的人，但我們看到實際上長照服務的涵蓋率在去（2020）年只有54.69%。部長可以看到推估真正有長照需求的人數有82萬人，但是實際使用服務的人數45萬人，所以長照的涵蓋率只有54%，這真的也未免太低了吧！把上述兩個問題合起來看，本席質疑的是，當我們發現衛福部規劃的政策是要擴充ABC級據點，也給地方政府去執行，地方政府委託業者執行，結果我們看到實際的達成率相較於設定的目標值是嚴重超標，也就是說各縣市設置的ABC級長照據點非常非常多，但是回過頭我們卻發現真正對長照服務有需求的人並沒有得到照顧。再回到前面講的，到底有沒有消耗預算的問題，這些搶食預算大餅的業者到底有沒有真的去照顧這些需要照顧的人？很顯然沒有，才會有這樣的落差。我不敢說這些來申請經費成立長照服務據點的可能都變成閒置的空間，但是一定有資源分配不均的情形，也就是說現實的狀況有大概40萬的需求人口沒有照顧到，但是你又告訴大家據點的設置量不僅達標，甚至是超標到700多%，那大家直覺的反應是，目前是不是有很多的據點是閒置的，甚至是空著的蚊子館，否則不會有40萬的需求人口無法享受相關的服務。,90,LCIDC01_1108601_00006
蔣萬安,部長，如果排除掉使用外勞的人數，然後再把C據點使用的人數納進來，比例是多少？,91,LCIDC01_1108601_00006
蔣萬安,我相信大概也不會很高，也就是說你還是有漏接掉真正有需求的人而未被你的長照服務涵蓋到，所以即便你說這個數據沒有涵蓋到C據點的服務量能，我把它納進來，然後排除已聘用外勞的需求人數，把這樣的數據提供給本席和委員會，我相信也不會很高。那實際狀況是什麼？也不可能像你設置的據點這樣這麼多，所以其中有很大的落差。最後我下一個結論就是，衛福部應該檢討先把現有的資源運用妥適，然後去瞭解現實各縣市的狀況。譬如最後我舉台北市為例，台北市的老人福利機構長期處於供不應求的狀況。部長請看，下面這條橘色的線是供給線，也就是供應的床位數大致上沒有增加，甚至108年到109年還減少，但是上面這條代表需求床位數的藍色線卻不斷地攀升，也就是說各縣市會有不一樣的狀況。都會區床位數不足，但其他縣市可能因為據點非常多，空床很多，這是一個問題。所以，部長，我希望衛福部去重新盤點檢討，我們都很希望給你經費，也希望錢用在刀口上，也不希望各地方縣市出現為了搶食大餅，各路人馬紛紛來分這筆經費而造成剛剛B及據點數量嚴重超標、分布不均還有各種搶個案的亂象，甚至還有未曾參與過長照服務業的地方人士來設立A據點跟B據點，這些問題我希望都能夠重新檢討。我們真的希望面對超高齡化的社會，我們有健全完整的長照服務體系，好不好？,92,LCIDC01_1108601_00006
蔣萬安,謝謝部長。,93,LCIDC01_1108601_00006
陳玉珍,（10時31分）部長，我們現在都不能污名化精神病患，對吧？,94,LCIDC01_1108601_00006
陳玉珍,有聽見嗎？可以啊！,95,LCIDC01_1108601_00006
陳玉珍,這樣會不會好一點？,96,LCIDC01_1108601_00006
陳玉珍,你看我們部長多客氣啊！我說我們現在對精神病患都不能污名化，對吧？,97,LCIDC01_1108601_00006
陳玉珍,對嘛，尤其很多事情要防範於未然，因為如果有這樣的情形產生，小的話可能會破壞整個社會安全網，大的話說不定會有國安危機，是吧？,98,LCIDC01_1108601_00006
陳玉珍,對，而且最重要的是我們要防範未然，遇到這種可憐的……,99,LCIDC01_1108601_00006
陳玉珍,比如我看部長在回答我們委員的質詢時，雖然你平常日理萬機，很多事情很忙，你都非常的沉著冷靜，從來也沒有看到你對我們大小聲。前天我看到在國會蘇院長對鄭麗文這種「暴走式」的行為，我覺得他在情緒控制上有很嚴重的問題，我很誠心的建議，為了避免造成國安危機，我們也有公費的精神科醫師或心理諮商師，衛福部是不是要幫院長做一個初步的評估，讓他諮詢一下，這是為了國家好，可以嗎？,100,LCIDC01_1108601_00006
陳玉珍,不是，在正常的質詢之下，他會有這樣反常的行為，看起來就是有情緒控制的問題，這是國安問題，如果萬一因為情緒暴走可能做出錯誤的決定，所以我是給部長良心的建議，如果當院長恢復到像部長這樣正常的答詢行為的時候，應該對國家就好了。以上是我的建議，請參考，回去在院會提報。,101,LCIDC01_1108601_00006
陳玉珍,回去提報沒有問題喔，至於他有沒有問題當然要由專業的醫師評估，我也不敢說有或是沒有，只是看起來這個行為就是比較奇怪。我們沒有污名化精神病患者，因為這是一個正常的過程。接著我想跟你討論一下金門的精神疾病的防治和心理衛生的狀況，金門地區的追蹤訪視大概都有達到中央要求的4.15次的績效，但是真的有像數據上這麼好嗎？我們來看一下金門的實際情況。在金門領有精神障礙手冊的大概有550人，目前列入管理個案的有403人，這其中有100多人的差距，請部長告訴我，未列入管理個案的這100多人因為沒有需要還是什麼原因呢？,102,LCIDC01_1108601_00006
陳玉珍,您的意思是說有500多位領有精神障礙手冊，但是只有403位列入管理個案，剩下的100多位是因為情況穩定，是嗎？,103,LCIDC01_1108601_00006
陳玉珍,好。即便如此，金門還是有403位的情況是比較不穩定的，看起來是這樣。,104,LCIDC01_1108601_00006
陳玉珍,對，需要關懷的。根據金門衛生局所做的109年度的期末成果報告，金門地區在這部分遇到的問題包括計畫人力編制不足、待遇偏低；然後疫情期間沒有用電訪取代家訪，造成訪視員暴露在高風險之下；第三點是由於疫情期間要達到計畫指標，導致疲勞過度而產生離職潮。以上是期末報告所寫的，是金門地區遇到的三個問題。另外，我想瞭解一下，明年衛福部要增加心理衛生社工人力到329人，要擴大心理衛生社工的服務對象，包括精神疾病、自殺防治、離開矯正機關、結束監護處遇等等個案。這部分可以給金門多少人？,105,LCIDC01_1108601_00006
陳玉珍,一個？部長，全國三百多個鄉鎮，金門有六個鄉鎮耶！給我們一個是不是太少了？,106,LCIDC01_1108601_00006
陳玉珍,你是說金門地區的整體精神狀態比較穩定，是這樣嗎？,107,LCIDC01_1108601_00006
陳玉珍,但是你要了解，離島……,108,LCIDC01_1108601_00006
陳玉珍,我現在要向你爭取的也就是這個。您看一下，精神病患除了在醫院期間的治療，後續還要進入長照體系，但是我們看金門縣的醫院跟整個新北體系相比，我們的精神病患出院後只能回到家裡，我們沒有長照體系資源，而新北市可以回到社區相關的長照體系，可是金門沒有，所以家屬其實是非常辛苦的，病患從醫院出來以後，可能就要在家裡由家屬自行照顧，當然家屬比較沒有這方面的專業。所以長照體系後備資源這部分在金門是不足的，衛福部要怎麼給我們協助呢？,109,LCIDC01_1108601_00006
陳玉珍,那是針對一般病患，而我說的是關於精神病患資源的部分，針對一般病患是有的，我知道。,110,LCIDC01_1108601_00006
陳玉珍,融合是指安置到醫院的融合？還是安置到其他一般長照體系的融合？,111,LCIDC01_1108601_00006
陳玉珍,您是指要讓精神病患融合到一般長照機構，是嗎？,112,LCIDC01_1108601_00006
陳玉珍,穩定的患者就可以融合到這個體系嘛！,113,LCIDC01_1108601_00006
陳玉珍,那不穩定的部分呢？,114,LCIDC01_1108601_00006
陳玉珍,所以衛福部在這部分應該給我們大力的支援，因為我們現在遇到的問題其實就是這樣。有幾個比較大的問題，第一是我們的社工人力不足，常常招募不到，我不知道衛福部有沒有理解到金門的情況。,115,LCIDC01_1108601_00006
陳玉珍,我知道現在收入比以前高，我也觀察過，但問題是否在於金門是離島？社工本來就比較缺，大家可能也比較不願意離鄉背井去離島，應該是這類原因。所以在待遇提升部分能不能特別針對金門處理？因為金門是離島，大家更不願意去，為了讓我們有比較充足的人力，能不能幫我們考慮提升待遇？,116,LCIDC01_1108601_00006
陳玉珍,對，所以居民的情緒都比較穩定，像我們在議會質詢時情緒都很穩定，我們絕對不會……,117,LCIDC01_1108601_00006
陳玉珍,但是離鄉背井畢竟仍是很多人不願意的，所以比較務實地講，重點還是待遇的提升。,118,LCIDC01_1108601_00006
陳玉珍,待遇部分也幫我們加強嘛！請你幫我們思考一下，外島畢竟辛苦一點，很多人還有家庭因素。第二個是透過長照體系的介入，給家庭照顧者喘息的機會，因為很多照顧者實在是辛苦，必須讓家人就醫，他才有喘息的機會。長照也有喘息機制嘛！,119,LCIDC01_1108601_00006
陳玉珍,我知道各地長照都有喘息機制，但我指的是精神病患照護的喘息機制，這部分請你們也要注意一下，同時要注意在融入過程中怎麼降低對精神病人的排斥。所以本席提出幾點，請你們回答我，讓你們研究一下，兩個月內答復本席。第一是如何補足各種計畫的社工人力，請具體地告訴我，因為我們確實缺人，待遇也需要加強。第二是幫助金門縣政府規劃醫療結合長照體系的照顧模式，對於以前沒有辦法融入一般長照的部分，請研究如何幫助我們融入，以減輕病人家屬的照顧負擔。部長，沒有問題吧？,120,LCIDC01_1108601_00006
陳玉珍,金門這部分沒問題喔？,121,LCIDC01_1108601_00006
陳玉珍,行政院長的部分，也請您多關照，可以嗎？為了國家。,122,LCIDC01_1108601_00006
陳玉珍,為了國家，也要關注我們最高首長。,123,LCIDC01_1108601_00006
莊競程,（10時51分）部長，依據精神衛生法的精神，精神醫療應該在最小強制手段原則下提供病患適當的治療，且對於人身自由加以限制的治療方式，包括強制住院、監護處分等等，都須經過強制審查會審查或法院判決後才可以執行。請問部長，目前司法矯正單位所需要的精神醫療服務應該是由精神醫療機構提供支援業務，這樣的理解應該沒錯吧？,124,LCIDC01_1108601_00006
莊競程,就是法院、司法矯正單位現在所需要的精神醫療服務、鑑定服務是由精神醫療機構提供資源，這樣的理解應該沒有錯吧？,125,LCIDC01_1108601_00006
莊競程,司法院提出的刑事訴訟法部分條文修正案增訂第十章之一「緊急監護」，規範檢察官要聲請緊急監護時應到場陳述理由，並提出必要之證據，但對於需要多久時間準備以提出證據有沒有相關的配套？衛福部有沒有給過相關的建議？尤其是在精神疾病患者犯罪之後的精神鑑定方面，有沒有鑑定時間表？,126,LCIDC01_1108601_00006
莊競程,我的意思是，檢察官向法院聲請緊急監護時必須到場陳述意見，並提出必要之證據，證明該患者或犯人之精神鑑定狀況，這需要多少時間鑑定出來以提供這樣的證據給檢察官到法院作陳述？,127,LCIDC01_1108601_00006
