speaker,speech_text,speech_number,meeting_id
楊曜,好，謝謝。部長，我今天給你多一點時間讓你說明有關勞保基金的相關問題。我國人口自2020年就開始呈現負成長趨勢，預期工作年齡人口在2070年會比今年減少一半以上，而且年齡結構老化，在2025年我們進入超高齡社會，依賴人口（幼年跟老人）總計在2060年會超過青壯年人口，這些數據都在在顯示臺灣的勞動力可能不足，臺灣的勞保給付將會面臨繳的人少、領的人多，這個問題的產生是一個長久性的，可是我們大概也不得不面對，只是用什麼方式來處理。立法院預算中心指出，我也知道大概已經連續4年，勞動部是用公務基金撥補的方式來做，可是公務基金撥補可能不是一個長久的方案，部長這邊有沒有什麼想法？,204,LCIDC01_1119301_00004
楊曜,還有投資的效益……,205,LCIDC01_1119301_00004
楊曜,投資的效益……,206,LCIDC01_1119301_00004
楊曜,我看一看現在最容易的就是我們怎麼精進投資效益。,207,LCIDC01_1119301_00004
楊曜,部長，這個真的要顧好，我們還是請部長回去加速研究，有機會我們再討論。,208,LCIDC01_1119301_00004
楊曜,我最後再問一個問題，青年的失業率偏高，還有薪資偏低，109年跟110年因為COVID-19的影響，所以全體的失業率是提升的，特別是青年的失業率比全體高出許多，青年的平均收入也比全國平均收入大概少了1萬元，大概是3萬元左右到4萬元，平均收入4萬元是你們的統計數字。部長，我們要怎麼解決青年失業跟低薪的問題？,209,LCIDC01_1119301_00004
楊曜,對。,210,LCIDC01_1119301_00004
楊曜,因為你們有提出很多政策……,211,LCIDC01_1119301_00004
楊曜,部長，因為時間的關係，我也不想占用其他同仁的時間，請你們把相關的書面資料給我。,212,LCIDC01_1119301_00004
楊曜,好，謝謝部長、謝謝主席。,213,LCIDC01_1119301_00004
陳椒華,（11時24分）部長好。勞動部在2015年的時候有主動邀集金管會、財政部、法務部，針對企業發生營運或者是財務相關有具體重大資訊的時候，可視為有大量解僱勞工情事之預警指標，當時新增的幾個預警指標包括事業單位發生影響股東權益或證券市場波動之重大事件、財務長頻繁更換的情事、事業單位經票據交換所公告列為拒絕往來戶、存款不足致退票、事業單位有欠稅資訊、經聯合徵信中心信用報告異常、資金轉出或者是資產設備移出等情事，當前如果有幾個相關指標情事發生的時候，勞動部的新聞稿說政府會在第一時間安排查訪事業單位，瞭解財務跟經營狀況，適時採取必要輔導協助措施來預防相關的勞資爭議。部長，針對以上的預警指標，有關府院高層介入鏡電視執照審議的爭議，鏡電視實際營運上出現的問題是本席最擔心的，不是哪個大老闆有虧錢的問題，而是鏡電視勞工權益的問題。在媒體報導上我們可以看到，鏡電視8月的時候就跟NCC說明目前的資金只剩下3億元，預計可以支持營運到11月，當時鏡電視員工數是450人左右，目前應該是有500人，這樣子的數目規模絕對不是一個小數字，請問部長對不對？部長，8月就已經出現鏡電視資金吃緊的消息，勞動部有沒有掌握？勞動部內部有沒有預先討論過相關勞工權益的問題？請問部長有沒有？,214,LCIDC01_1119301_00004
陳椒華,但是法規裡面有特別針對上市櫃嗎？那其他的公司勞動部可不可以主動關心？,215,LCIDC01_1119301_00004
陳椒華,因為時間有限，現在就是要請問部長，即使不是上市櫃公司，鏡電視現在有發生這樣的情況，我們看到2021年至今的一年內換了4位董事長、2位財務長，請問這樣有沒有符合前面勞動部的預警指標？,216,LCIDC01_1119301_00004
陳椒華,會來關心嘛？,217,LCIDC01_1119301_00004
陳椒華,部長，現在已經10月了，媒體再度報導鏡電視20億資本額在11月底就會燒完，那這代表什麼呢？就是鏡電視將發不出500名員工的薪水，這是非常嚴重的事情，勞動部是不是要趕快來啟動大量解僱預防措施，包括鏡電視公司之前的勞健保提撥、勞工退休金的提撥，還有積欠工資墊償基金提繳的狀況，請問部長現在有沒有掌握？,218,LCIDC01_1119301_00004
陳椒華,希望勞動部可以趕快來啟動預防大量解僱的措施。,219,LCIDC01_1119301_00004
陳椒華,之前也質詢過部長，有關超商店員因為長久站立造成靜脈曲張、膝蓋骨骼等傷害的問題。我們知道2020年零售產業的規模已經成為第一大綜合零售的通路，怎麼樣讓這些員工可以在職場上也能夠避免身體的傷害，2009年美國零售巨頭Walmart因未提供一張板凳，而遭員工集體訴訟，最後以19億臺幣和解。再來，職業安全衛生設施規則第三百二十四條之五條文是不是可以把「休息時」改成「工作中」？修改成這樣的文字至少在法規面可以讓勞工在工作中有椅子可以坐，部長可以好好做這樣的修法嗎？,220,LCIDC01_1119301_00004
陳椒華,我想大家一定會對這個很有感的，也拜託勞動部。請問要多少時間呢？,221,LCIDC01_1119301_00004
陳椒華,一個月好嗎？兩個月太久了。那一個半月好了，好不好？,222,LCIDC01_1119301_00004
陳椒華,我們希望這樣能夠照顧勞工，也是勞動部體恤勞工一個好的表現，一個半月，可以嗎？,223,LCIDC01_1119301_00004
陳椒華,謝謝。,224,LCIDC01_1119301_00004
林為洲,（11時31分）部長好。請問你今天這個業務報告的內容是什麼時候核稿的？,225,LCIDC01_1119301_00004
林為洲,幾天前？請問一下召委，我們這個議程多久之前給他們的？應該是上禮拜幾？上禮拜三還是上禮拜四？應該是禮拜四。,226,LCIDC01_1119301_00004
林為洲,我要講的是，你很久以前就核稿了，因為業務報告一定會做的，這是必要的嘛！也不會變動嘛！,227,LCIDC01_1119301_00004
林為洲,因為你都已經做好準備了，我要講的是我們辦公室都不會收到你們的email或是LINE，也沒有收到紙本或電子檔，我們都不會收到，所以這是什麼情形？你是不給我們準備是不是？,228,LCIDC01_1119301_00004
林為洲,你們螺絲鬆掉了。,229,LCIDC01_1119301_00004
林為洲,你們以後都要送啦！,230,LCIDC01_1119301_00004
林為洲,如果你不想印紙本，電子版本也可以送，要送到辦公室啦！,231,LCIDC01_1119301_00004
林為洲,也沒有送給我，也沒有給辦公室。,232,LCIDC01_1119301_00004
林為洲,我來這邊才拿到。,233,LCIDC01_1119301_00004
林為洲,是啊！回去查一下啦！,234,LCIDC01_1119301_00004
林為洲,是漏掉還是怎麼樣？還是你們認為我們都在選舉，以為我們都不來了？,235,LCIDC01_1119301_00004
林為洲,還是要來啊！,236,LCIDC01_1119301_00004
林為洲,好，會後說明。,237,LCIDC01_1119301_00004
林為洲,有關勞保破產的問題，其他委員都提到了，勞保局今天有人來嗎？,238,LCIDC01_1119301_00004
林為洲,請教副局長，這部分你比較瞭解嘛？,239,LCIDC01_1119301_00004
林為洲,那也一併請教保險司。保險司有來嗎？,240,LCIDC01_1119301_00004
林為洲,根據你們目前的精算報告，勞保在民國幾年會破產？說明一下。,241,LCIDC01_1119301_00004
林為洲,對啦！就是破產的意思、就沒有了嘛！除非要一直撥補，對不對？現在都是用撥補，恩給制！看高興要撥補多少就補多少，碰到選舉就撥補多一點。,242,LCIDC01_1119301_00004
林為洲,這不是好辦法，總是要改革嘛！,243,LCIDC01_1119301_00004
林為洲,軍公教年金改革時，你們一下子就砍下去……,244,LCIDC01_1119301_00004
林為洲,是，但是這個畢竟不是長久之計，還是要做調整，不然會撥補越來越多，影響到整個國家預算的平衡。,245,LCIDC01_1119301_00004
林為洲,"當撥補到一個程度，要撥補500億、1,000億的時候，整個預算會失衡，你瞭解嗎？是不是這樣？這不是長久之計，除非撥補越來越少，但是可能嗎？以我們現在的收支以及你們每年的投資效益，看起來是越撥補越多、洞越來越大。你說撥補也是一種方法，對！短期來看是一種方法，但是除非撥補越來越少或是維持撥補固定，不會再增加了，否則到最後一定預算失衡。當時，我本來也有一種比較短淺的想法，反正這是政府舉辦的、政府是保險人，部長剛剛講過，政府要負最後責任，一定讓大家領得到，於是一直補，撥補越來越多，推越多，要領得越多，那就補到讓大家可以領，每個人都領得到，保證領得到。問題是預算規模就是那麼大，到時候撥補的金額超過一定額度是編不出來的、撥補不出來的！除非你把國防預算、教育預算砍來補，但是這樣對國家整體的預算結構，行嗎？如果超過一個額度。所以你們有方案嗎？",246,LCIDC01_1119301_00004
林為洲,還是要面對啦！,247,LCIDC01_1119301_00004
林為洲,越早處理，到時候衝擊反而比較小，不是嗎？,248,LCIDC01_1119301_00004
林為洲,不要像軍公教年金一樣，突然用力一砍，造成國內的衝擊，我覺得這個影響頗大，因為它沒有逐步地改革，造成我們國家內部不團結的一個因子，這幾年來就我的觀察，對立這麼嚴重，跟這個是有關係的，因為沒有及早因應，那個剝奪感特別大，突然一砍下去50%、40%、30%，他原來領的可能就直接砍到見骨，所以這對國家內部團結是不利的。再來我請教部長有關最低工資法，最低工資法是蔡英文總統2016年提出來的政見，最低工資法要立法，現在最低工資都有一個辦法在處理，到底要不要調？你們大概都是每4年處理一次，是不是？,249,LCIDC01_1119301_00004
林為洲,每年？,250,LCIDC01_1119301_00004
林為洲,就我觀察起來，每到選舉年就比較會處理。,251,LCIDC01_1119301_00004
林為洲,所以也是恩給制。,252,LCIDC01_1119301_00004
林為洲,看執政者高興，那就來調一下。,253,LCIDC01_1119301_00004
林為洲,你們那個辦法沒有立法、沒有法制化。,254,LCIDC01_1119301_00004
林為洲,把它立成法律不行嗎？,255,LCIDC01_1119301_00004
林為洲,你送到行政院了？,256,LCIDC01_1119301_00004
林為洲,行政院處理得如何？,257,LCIDC01_1119301_00004
林為洲,什麼時候可以送出來？,258,LCIDC01_1119301_00004
林為洲,我今年5月19日其實已經有排審了。,259,LCIDC01_1119301_00004
林為洲,已經有討論5條了喔！,260,LCIDC01_1119301_00004
林為洲,其實總條文才17條啦！,261,LCIDC01_1119301_00004
林為洲,其實主要就是把你們原來的辦法立成法律，把它的位階提高變成法律，讓大家有一個依據，而且可以期待，一定要按照法律去做，而不是想做的時候做，不想做的時候就不做，還有包括它的額度等要怎麼計算、如何提高最低工資等等，法制化嘛！這個是蔡總統的政見耶！現在是怎樣？蘇貞昌不買單，是不是？,262,LCIDC01_1119301_00004
林為洲,院長不買單？,263,LCIDC01_1119301_00004
林為洲,你們的院版什麼時候可以送來？,264,LCIDC01_1119301_00004
林為洲,上一次我們討論的時候，執政黨的委員都跟我說等院版來，我們再一起審，我說OK，所以我們才會審5條就等院版，問題是要等多久？這個會期會不會送來？,265,LCIDC01_1119301_00004
林為洲,要審預算了喔！我在這邊宣告，先跟你報告，如果你們再不送來的話，那審預算……第一個，這是你們的政見，你們總統2016年提出來，搞了5年，17條的法律都弄不出來，條文只有17條耶！而且原來就有辦法了，就是按照那個辦法訂定最低工資法，5年了耶！大學都畢業了，延畢了！,266,LCIDC01_1119301_00004
林為洲,好啊！就不同啊！不同就趕快送院版啊！,267,LCIDC01_1119301_00004
林為洲,你現在的意思是行政院的問題嘛！所以你們勞動部已經送到行政院了，我們現在就很清楚地知道，最低工資法一直出不來，不是勞動部的問題，是行政院的問題。好，沒關係……,268,LCIDC01_1119301_00004
林為洲,這個會期要審預算，我們會讓你們比較辛苦一點喔！儘量把它送過來啦！這個不是情緒，這個是你們的承諾，17條條文有那麼難嗎？如果2016年承諾到現在，連17條條文都送不進來，這是詐騙嗎？不然這個算什麼？詐騙啦！,269,LCIDC01_1119301_00004
林為洲,好啦！這個會期你們就送進來，說那麼多沒有用嘛！把它送進來，大家來討論，不要再用同一個理由，說等院版，那你院版要送來啊！我們就審。謝謝。,270,LCIDC01_1119301_00004
高嘉瑜,"（11時43分）部長好。先就勞動基金的部分，因為今年上半年的投資虧損已經達到4,456億元，6月單月虧損達到2,144億元，創史上第二高的虧損，以現在的狀況來講，今年看來勢必是一路虧損到底，是不是這樣？",271,LCIDC01_1119301_00004
高嘉瑜,"光是6月就已經2,144億元，將近是整個上半年的一半，現在才10月，今年下半年的虧損幅度是不是還會再擴大？",272,LCIDC01_1119301_00004
高嘉瑜,那到年底……,273,LCIDC01_1119301_00004
高嘉瑜,主要的虧損來自於什麼？,274,LCIDC01_1119301_00004
高嘉瑜,主要是股票波動的損失嘛，對不對？,275,LCIDC01_1119301_00004
高嘉瑜,因為我們也去看了勞動基金相關的投資，發現其實股票的占比非常地高，受到臺股波動的影響就會很大，有三分之一的勞保基金都拿去投資股票，八分之一是投資債券，現在市場波動這麼大的情況之下，勢必對我們勞動基金的影響就會很大，就這個部分的分配比例，到底當初是怎麼樣去決定的？,276,LCIDC01_1119301_00004
高嘉瑜,其實我們之前有提過勞退自選的部分，這個等一下再講。我們先來講剛剛說的，勞保是不是要破產的問題，因為106年的時候曾經精算過，大概115年就會出現負值；109年重新精算之後，是117年，問題是勞保潛藏債務的負債已經達到10.8兆元，其實最主要的問題就來自於勞工退休金的提存率非常地低。如果以現行確定給付制的國家來看，最高的是芬蘭，有125%的提存率，其他國家像是英國96%、美國56%、冰島32%。臺灣在現在這種提存率的狀況之下，負債只會愈來愈多，已經連續5年收支是失衡的，光是109年就短缺500億元，所以以現在的狀況來講，勞保的改革其實是迫在眉睫，之前小英總統也特別提到要趕快進行相關的改革。當然院長、部長也說政府會負最終給付的責任，問題是在負債的狀況持續地惡化之下，政府還負得起責任嗎？依照相關的數據，50年後，基金的累積餘額是負71.4兆元，請問政府的GDP一年是多少？光是每年GDP的歲出也才兩兆多元，71.4兆元是相當於臺灣6年的GDP，所以以這樣的狀況來講，政府負得起這個責任嗎？部長。,277,LCIDC01_1119301_00004
高嘉瑜,目前的進度到底是什麼？因為行政院在106年4月有召開一個改革方案會議，甚至衛環委員會也有召開公聽會，但是之後就沒有相關的進度。105年5月小英總統就職演說提到「年金制度改革，現在不做，馬上就會後悔。」現在已經是111年了。,278,LCIDC01_1119301_00004
高嘉瑜,所以現在的進度到底是怎麼樣？有沒有預期的進度跟目標？從105年說「現在不做，馬上就會後悔。」到106年召開公聽會，有相關的改革會議之後，到現在……,279,LCIDC01_1119301_00004
高嘉瑜,那有沒有一個目標，例如2年內、3年內或是多久內會推出一個改革方案的目標？,280,LCIDC01_1119301_00004
高嘉瑜,適當的期程是什麼時候？因為106年召開公開會到現在也已經5年了，請問還要多久？,281,LCIDC01_1119301_00004
高嘉瑜,所以目前沒有這個方向就對了，也沒有方案可以推出來，短期內沒有嗎？,282,LCIDC01_1119301_00004
高嘉瑜,2年內都不會有嗎？,283,LCIDC01_1119301_00004
高嘉瑜,政府會持續撥補？,284,LCIDC01_1119301_00004
高嘉瑜,因為大家都知道，這個東西現在不趕快去改革，未來的負債、未來的提存比率就會越來越高，影響勞工的權益會越來越大。也就是拖越久、越晚改革，後續是乘數加倍的效果，這個真的影響非常的大，我想大家也都非常清楚長痛不如短痛。所以之前也有提出勞保基金改革方向，包括如何建立永續財務基金制度，還有提存率逐年改善，我想部長都相當清楚，甚至勞保基金是不是要朝法人化或公司化管理。最後，就是關於剛剛所說的勞退基金自選的部分，當基金局爆發重大弊案的時候，這樣的聲音也越來越大。到目前為止其實包括公教人員等，都已經有退休自選的方案，包括公教、私校退撫都有勞退自選，那為什麼所謂開放勞退基金自選的組合，到現在勞動部都沒有方案出來呢？,285,LCIDC01_1119301_00004
高嘉瑜,最新的調查，這是周刊辦的，多數民意是表達支持，包括立委也是83%支持。,286,LCIDC01_1119301_00004
高嘉瑜,你們自己辦的狀況是怎麼樣？,287,LCIDC01_1119301_00004
高嘉瑜,現在我們提出來的方案，勞退自選平臺上自願提繳退休金的勞工有兩個方案可以選擇，一個是由原本、舊的方案繼續維持；另外一個就是新增自選平臺的方案讓民眾可以兩個並進做選擇，這部分到底困難在哪裡？你想要自選就自選、你想要維持舊的方案就維持舊的，讓民眾多一個選擇，等到操作或型態慢慢穩定之後，我想民眾的想法也會開始改變。但目前的狀態就是我寧可都不改變，由勞金局繼續代操，是這樣子嗎？,288,LCIDC01_1119301_00004
高嘉瑜,多一個選項讓民眾去選擇到底對你們有什麼困難？,289,LCIDC01_1119301_00004
高嘉瑜,在你們的意願調查裡面，現在已經有四成的勞工同意他可以自選的。,290,LCIDC01_1119301_00004
高嘉瑜,還是有六成嘛！所以六成就是舊的方案啊！四成就自選啊！,291,LCIDC01_1119301_00004
高嘉瑜,你增加一個平臺的選項可以先用試辦或用其他的方式，讓有意願的民眾去做，金管會之前也有這樣的建議啊！,292,LCIDC01_1119301_00004
高嘉瑜,請補充書面資料然後來跟我們說明一下，好不好？,293,LCIDC01_1119301_00004
高嘉瑜,因為這個部分我們也關心很久，也希望能有些改革好不好？,294,LCIDC01_1119301_00004
高嘉瑜,大概多久可以給我們一個回復？一個月好不好？,295,LCIDC01_1119301_00004
高嘉瑜,謝謝。,296,LCIDC01_1119301_00004
張其祿,（11時54分）部長好。跟部長討論一下，我們已經開放了，關於最近旅宿業人力荒這件事，媒體也報導很多，房務人員職缺達一萬多名，甚至主管都下來做基層的房務。3月份旅館商業同業公會調查，建議同意開放外籍，不過部裡面這邊覺得不太可以，而且訴求也包括是不是讓外籍實習生能留臺久一點，或者實習的時數可以加長，這是他們提出來的方案，部長應該清楚有這些方案。現在我們時間非常有限，我先直接說，等一下再給部長回答。過去也有個案性的提供開放，譬如當時商辦有引進移工，所以不是沒有個案性的，但也出了一些問題，譬如引進來，到底我們會不會剝削他們，或者外籍學生本來是來唸書變成打黑工這些問題。今天這個問題是這樣，飯店缺工這件事，按目前勞動部媒合專案來看，有其結構性的問題。立法院法制局也做了滿好的研究，點出真實的問題，就是他們經常性薪資真的非常低，才2.8萬元；薪資3萬元以下的甚至占85.84%。講白的就是說，旅館業急需要人，但他們薪資也是低到滿離譜的。所以部裡面現在需要幫忙業者，當然另一方面有它們實際要解決的問題。但是重點中的重點，到底它們薪資結構上，飯店業能不能自己也付一點企業社會責任，真的把它提高點，我覺得這是整個大的問題。當然引進外籍的人力，雖然可以治一下目前的問題，這有點治標不是治本，但也是可以做一點，可是這些目前都有點卡住。所以部長，您覺得這問題要怎樣更有效來解決？甚至它們真的要把薪資結構調整這件事情有沒有機會，或者我們有沒有其它誘因可以做？,297,LCIDC01_1119301_00004
張其祿,太低了。,298,LCIDC01_1119301_00004
張其祿,說實話，四至五萬元，他們也不是說付不出來。,299,LCIDC01_1119301_00004
張其祿,部長，我現在回到政府端，部裡面有沒有什麼誘因？如果這些業者真的配合把薪資提高，也許我們先短期給他補貼，我覺得這些是可以做的。,300,LCIDC01_1119301_00004
張其祿,我們常常講，你給香蕉就只能請到猴子，事實上也是如此，長期以來服務業這些的薪資超級偏低，是不合理的。,301,LCIDC01_1119301_00004
張其祿,我們當然非常希望政府端能夠誘導他們把這部分加上去，因為現在業者會變成是，他們一直在抱怨找不到人，但處方又是想盡辦法比如就移工部分，其實概念上還是要找低廉的人力來做，他們只是替代人力。,302,LCIDC01_1119301_00004
張其祿,這並不是正本清源的好方法。您剛剛講的，我們還是給予肯定，但我們希望政府端透過各種方式誘導業者，就真正的核心來講，我想法制局的建議也是正確的，薪資結構仍然不對。在這麼低薪的狀況下，尤其一切又有通膨現象等等，他們不可能找到好的人力，而如果處方上還是一直希望找更低廉的勞力來代替的話，就完全無解了。因此，我們還是希望部裡面加強這個部分。,303,LCIDC01_1119301_00004
張其祿,你們也窮盡一切方法，這我承認。是不是也做一定的檢討？,304,LCIDC01_1119301_00004
張其祿,希望看看你們的這個方案，到底有沒有促進他們提高薪資，好不好？,305,LCIDC01_1119301_00004
張其祿,可能2、3個月之後給我們委員會一份檢討報告，好不好？,306,LCIDC01_1119301_00004
張其祿,好，給我們一份檢討報告，送給委員會及我們辦公室參考一下，希望部裡面能夠真正自根本把這件事做好。,307,LCIDC01_1119301_00004
張其祿,謝謝部長。,308,LCIDC01_1119301_00004
邱顯智,（12時3分）部長，今天想要跟您討論的是，關係企業工會申請實施勞動檢查，到底其有沒有勞動檢查的陪檢權？首先請教一個問題，工會法所定義的企業工會有三種，廠場工會、事業單位工會及關係企業工會。勞動檢查法第二十二條第一項及施行細則第十九條也規定，勞檢員實施勞動檢查時要告知工會。請問這裡所指的工會是不是包含關係企業工會，也就是關係企業公司有沒有陪檢權？,309,LCIDC01_1119301_00004
邱顯智,企業工會，依照工會法第六條第一項第一款，寫得非常清楚，它包含廠場工會、事業單位工會及關係企業工會這三種。部長有看到這個條文嘛！,310,LCIDC01_1119301_00004
邱顯智,這樣的話，關係企業工會有沒有陪檢權？,311,LCIDC01_1119301_00004
邱顯智,現在我是說這個法律。,312,LCIDC01_1119301_00004
邱顯智,是，法律最基礎的就是文義解釋，所以當然包含關係企業工會，其應該有陪檢權。剛剛問部長的這個問題，如果拿來問基層勞檢員，可能會得到不同的答案。問題在於，以前勞委會訂了一個勞檢員勞檢時告知工會之處理原則，它是行政規則，只是供勞檢員作為參考，他去勞檢的時候看要怎麼處理，因為勞檢會遇到各種狀況。基本上它在勞動部的法令檢索系統裡面也找不到，對外不發生法律效力，這是清楚的。但這個處理原則第五點規定，要勞檢員優先通知有關之最基層企業工會。問題來了，「優先通知」這4個字實務上衍生出非常多的問題，像是勞檢只通知最基層的工會，甚至有廠場工會的情況之下，事業單位工會和關係企業工會都在場，勞檢員還是拒絕，這是非常荒謬的，特別是在企業裡面有複數工會的情形。問題的癥結在於，為什麼勞工會跑去向組織範圍比較大的企業工會求助？原因可能是最基層的企業工會效能不彰，或者根本就是雇主的御用工會，最糟糕的狀況是請鬼拿藥單，也勞檢不出個所以然。在這種情況之下卻排除提出申訴的工會，亦即這個企業工會是提出申訴的工會，結果你們還把他們排除了，就會讓勞工覺得勞檢是不是在配合雇主打假球。請部長好好地思考一下。,313,LCIDC01_1119301_00004
