speaker,speech_text,speech_number,meeting_id
莊競程,好，今天已經有很多委員提出了一些方向，我想大家去整合、研擬一下，思考有沒有更好的方式，讓失聯移工都可以儘量出來施打疫苗，謝謝。另外，我想再問一下有關外送員的問題，雖然勞動部在報告中有提到，經輔導後的外送員都有投保團體傷害保險，而且110年起不幸罹災的，保險給付平均都達到300萬元以上。,157,LCIDC01_1111201_00006
莊競程,但是我想法律上還是有未盡的事宜，因為承攬關係下的外送員，職安署有表示要修訂職安法，相關的進度及辦理情形如何？目前承攬外送員的勞動權益如何保障？因為勞動部有介入輔導，所以目前大部分的承攬外送員可能都有被照顧到，但是法無明定的話，未來出問題其實也只能就個案來認定和辦理，這樣其實大家也都會覺得沒有保障，勞動部這邊是否有計畫要補足相關法令的問題？,158,LCIDC01_1111201_00006
莊競程,所以法律面已經補足了？,159,LCIDC01_1111201_00006
莊競程,好，謝謝。最後一個問題，部長，就物價上漲最近一直有許多聲音出來，研究發現，工資調整所造成的影響其實是微乎其微。,160,LCIDC01_1111201_00006
莊競程,勞動部是不是應該正視這樣的問題？就這些研究成果，未來進行薪資審議的時候都可以作為參考。,161,LCIDC01_1111201_00006
莊競程,勞動部在2018年進行「107年基本工資調整對我國企業及勞工影響之研究」，透過這樣的資料分析、問卷調查跟座談會與總體計量的模型模擬，分析基本工資調整對總體經濟的影響，在基本工資加薪、改善薪資分配不均方面，研究結果顯示都無相關性或相關性不高。,162,LCIDC01_1111201_00006
莊競程,我想這個都要作為未來薪資審議會的參考。,163,LCIDC01_1111201_00006
莊競程,是，因為有一些資方可能認為，這樣的薪資調整會大幅影響出口競爭力。,164,LCIDC01_1111201_00006
莊競程,但是研究上看起來影響是很微弱的，也要把這些方面的研究都呈現出來，未來在薪資調整方面要做特別的研議。,165,LCIDC01_1111201_00006
莊競程,好，謝謝部長。,166,LCIDC01_1111201_00006
蔣萬安,好。部長，那昨天為什麼會發生失聯移工去施打疫苗，結果被上銬還上腳鐐被逮捕的事情？是不是……,167,LCIDC01_1111201_00006
蔣萬安,警政署和移民署，我知道你們之前都有回答，但我想還原一下，昨天的情況到底是如何，簡單說明一下為什麼會發生這樣的事情？,168,LCIDC01_1111201_00006
蔣萬安,指揮中心日前就已經宣布對於失聯移工不會逮捕，而且百分之百掛保證。,169,LCIDC01_1111201_00006
蔣萬安,請問有沒有發公文給你們各單位？,170,LCIDC01_1111201_00006
蔣萬安,6日？前天？,171,LCIDC01_1111201_00006
蔣萬安,指揮中心什麼時候宣布的？,172,LCIDC01_1111201_00006
蔣萬安,6日宣布，也有發公文，那為什麼還會發昨天這樣的事情？,173,LCIDC01_1111201_00006
蔣萬安,對，你們有通報。昨天是幾日？昨天是7日啊！所以事前有公文、有通報，為什麼還去逮捕失聯移工？,174,LCIDC01_1111201_00006
蔣萬安,你們要檢討？,175,LCIDC01_1111201_00006
蔣萬安,好，以後不要再發生。,176,LCIDC01_1111201_00006
蔣萬安,因為這是政府的政策。,177,LCIDC01_1111201_00006
蔣萬安,接下來我們當然是希望不要再有防疫破口，希望失聯移工能出來施打疫苗，包括NGO、社福團體，請他們協助、轉達。在你們的程序當中，失聯移工出來施打疫苗，如果提不出居留證相關的身分證明，怎麼辦？你們還是會讓他施打疫苗，對不對？,178,LCIDC01_1111201_00006
蔣萬安,「內部機制」是什麼意思？比如失聯移工現場沒有辦法提出相關身分證明文件的話，你們會不會讓他施打疫苗？還是按照你們的程序仍會要求他提供？,179,LCIDC01_1111201_00006
蔣萬安,他沒辦法提供，你們怎麼做身分的確認？,180,LCIDC01_1111201_00006
蔣萬安,好。現場你們會要求他留紀錄嗎？比如你們會詢問他的住址、聯絡電話或做任何的註記嗎？,181,LCIDC01_1111201_00006
蔣萬安,好。我想了解整個相關的程序，也就是現在政府然有這樣的政策，你們應該把整個過程很詳細地說明清楚，雖然我們鼓勵失聯移工出來施打疫苗，但是他們會有疑慮，比如一開始他會不會被逮捕、敢不敢提供相關身分證明文件，如果他不願意或沒辦法提出，有沒有辦法施打？接下來，你們會不會被詢問地址等聯絡方式，要他留下相關的紀錄？我覺得現階段你們要做很完整清楚的說明，消除失聯移工的這些疑慮，讓他們願意出來施打，也願意讓他們的友人或社福團體願意帶他們出來施打疫苗，如果有任何的疑慮，他們不願意，都有可能造成防疫的破口。這部分你有沒有辦法很清楚地看是用什麼樣的宣傳方式能夠告訴大家，而不是說「你不會被逮捕，我百分之百掛保證」？但是相關的細節他們並不了解，你們有相關的規劃嗎？,182,LCIDC01_1111201_00006
蔣萬安,好，這樣講就很清楚了，我們希望指揮中心下午的記者會也可以很完整地說明，謝謝。接下來請教部長，我還是詢問一下，中高齡就業專法上路剛好已經滿週年，回過頭來檢視這一年相關的成效，但我們發現中高齡者的勞參率其實也只增加0.36%。不用跟OECD的平均值比，我們跟其他周邊的國家比，包括南韓跟日本，他們的中高齡者之勞參率都有35%、25%，但是我們只有8.8%，這是在去年，今年大概9%，雖然我們中高齡就業專法上路1年了，但與其他國家相較還是有一段距離。部長有沒有相關的目標，以及預計達成的階段性目標？,183,LCIDC01_1111201_00006
蔣萬安,部長，你們檢討以後，能不能提一個具體的報告給本席還有委員會？,184,LCIDC01_1111201_00006
蔣萬安,就是接下來你們大概要怎麼改進、怎麼做。,185,LCIDC01_1111201_00006
蔣萬安,最後，我提一個數據，中高齡就業專法當然有很多面向，其中大家很關心的就是雇主不得有年齡的歧視。,186,LCIDC01_1111201_00006
蔣萬安,第十二條規定「不得以年齡為由予以差別待遇」、不能「為下列事項之直接或間接不利對待」，但有份調查顯示，中高齡者及高齡者就業促進法上路1年以來，高達69%的企業坦言對聘僱員工確實有年齡的顧慮，比例將近七成。如果換成是主管職職缺的話，也還是有47%的企業坦承存在著年齡的顧忌。另外，該調查也指出，63%的中高齡勞工認為這部專法現階段無助於改善年齡歧視的狀況，這就是勞動市場目前很現實的情形，因此還望勞動部重視。然專法通過了，也上路1年了，部長也承認並不滿意這樣的成效，但不管原因如何，我想深刻地檢討是必要的，而且也要提出改善的措施。,187,LCIDC01_1111201_00006
蔣萬安,請將這份報告提供本席及委員會。,188,LCIDC01_1111201_00006
蔣萬安,謝謝部長。,189,LCIDC01_1111201_00006
黃秀芳,（11時16分）部長好。前一陣子聽說勞動部提出移工變移民的政策，會這樣提出當然有你們的考量，國內移工大約70萬人左右，社福移工就有25萬人，產業移工有45萬人，因此請教勞動部，移工要變移民，滿足6年這個條件的移工大約有多少人？你們應該會有統計吧？,190,LCIDC01_1111201_00006
黃秀芳,所以你們現在是還在研討？,191,LCIDC01_1111201_00006
黃秀芳,是預計明年上路嗎？,192,LCIDC01_1111201_00006
黃秀芳,所以你們現在還不清楚大約會有多少人嗎？你們在討論當中應該也會……,193,LCIDC01_1111201_00006
黃秀芳,光符合6年年資之資格者就有18萬人嗎？,194,LCIDC01_1111201_00006
黃秀芳,還要有技術和薪資……,195,LCIDC01_1111201_00006
黃秀芳,已經有這個資格了？,196,LCIDC01_1111201_00006
黃秀芳,部長，剛剛講到的這些，很多都是傳統產業，對方的技術很純熟，公司希望然技術這麼成熟就不要有工作年資的限制。原來是12年，但還可以再延長2年，所以總共是14年。以目前看來，對方技術這麼純熟卻沒辦法繼續留在臺灣的話，也許就會到臨近的國家，諸如日本或韓國，甚至是回到他自己的母國，這也會造成臺灣的損失，所以我認同你們目前規劃的方向。剛才部長講到了技術層面，請問你們要怎麼認定對方的技術是純熟還是頂尖？對於怎麼認定，我覺得你們可能也要好好思考。移工變移民以剛剛講的標準，年資要滿6年來看的話，總共就有18萬人，但不知道會有多少人來申請，請問未來這樣會不會影響到本國勞工的工作？請部長先回答。,197,LCIDC01_1111201_00006
黃秀芳,我認同這個政策，如果這個移工真的非常認真，其技術也非常純熟，在臺灣待了那麼久，而且還是在一門技術工作上待那麼久，一方面公司應該也非常認同這名移工，另方面他也是真的非常認真有純熟的技術，公司才願意協助他申請移民。但我們擔心的是，這些人未來會不會影響到本國勞工，我覺得這是勞動部應該要關心的。,198,LCIDC01_1111201_00006
黃秀芳,但我看到你們是說明年要上路，計畫是不是預定這樣做？,199,LCIDC01_1111201_00006
黃秀芳,接下來再花一點時間問部長，因為缺工的狀況真的非常嚴重，昨天彰化在做棧板的……,200,LCIDC01_1111201_00006
黃秀芳,"就是放貨的棧板。對方說疫情期間從去年到今年，就是請不到本國勞工，所以就一直在等待移工，但因疫情的關係，我們開放的人數又很少，整個原物料一直在漲，因為沒人要做所以還拖工，造成他墊高了很大的成本，其實這也是通貨膨脹的原因，因為會把價錢轉嫁到貨物或產品上。勞動部前陣子是不是說開放了1,500名還是1,700名的移工進來？",201,LCIDC01_1111201_00006
黃秀芳,"在12月的時候。我發現引進的那1,700名移工大部分都在做現在的重大建設……",202,LCIDC01_1111201_00006
黃秀芳,如果沒有相關的話，因為疫情的關係也是影響非常大，現在傳產缺工的狀況真的非常嚴重，雖然職訓局也有一直在做職業培訓……,203,LCIDC01_1111201_00006
黃秀芳,可是有一些工作就是沒人要去做，他們就是要靠移工。目前缺工非常嚴重的行業大部分會去申請移工（外籍勞工）進來，你們要讓臺灣的勞工有工作做，可是如果這些產業真的沒辦法招募到臺灣的勞工，也要請勞動部媒合。移工也好，本國勞工也好，不要一方面讓這些企業沒有勞工，一方面又說你們都有在做職業訓練，問題在於這些工作就是沒人要去做。,204,LCIDC01_1111201_00006
黃秀芳,好，我覺得這是滿嚴重的問題。,205,LCIDC01_1111201_00006
黃秀芳,由於疫情的關係，從去年到今年兩年的時間……,206,LCIDC01_1111201_00006
黃秀芳,缺工的狀況真的是非常嚴重。,207,LCIDC01_1111201_00006
黃秀芳,對，缺工的狀況真的是非常嚴重。,208,LCIDC01_1111201_00006
黃秀芳,是啊！然部長知道他們都缺工，要去把這個缺口補齊，好不好？,209,LCIDC01_1111201_00006
黃秀芳,謝謝。,210,LCIDC01_1111201_00006
林德福,（11時26分）部長，你好。幾個問題要請教。現在我國差不多有70萬名外籍勞工，目前這些勞工朋友疫苗接種的情況怎麼樣？,211,LCIDC01_1111201_00006
林德福,未來你們計畫如何提升外籍勞工的疫苗覆蓋率？,212,LCIDC01_1111201_00006
林德福,部長，日前指揮中心宣布，將針對教育部、經濟部、勞動部及衛福部4部會管理的多項場所，強制要求接種滿二劑疫苗才可以上工，新制將從明年元月1日開始。請問勞動部，針對這些外籍勞工，是否會打算採取同樣的要求？會不會？,213,LCIDC01_1111201_00006
林德福,外勞呢？,214,LCIDC01_1111201_00006
林德福,我認為這個配套也要趕快處理。,215,LCIDC01_1111201_00006
林德福,最近不是有開放逃逸外勞施打疫苗，請問現在逃逸外勞差不多有多少人？10萬人？,216,LCIDC01_1111201_00006
林德福,現在委員及民眾都在擔心將來這會不會變成一個破口，今天你們要是沒有規劃很完善的制度，讓這些逃逸外勞能夠安心來施打，將來會依點線面擴散，他們真的會變成一個破口。,217,LCIDC01_1111201_00006
林德福,我知道，但是這個事情要積極處理，不能拖……,218,LCIDC01_1111201_00006
林德福,拖愈久，到時破口一出來，就很難收拾！,219,LCIDC01_1111201_00006
林德福,畢竟他們本身也都在擔憂。,220,LCIDC01_1111201_00006
林德福,"好。部長，根據勞動檢查統計年報的109年職業災害統計行業別災害次數分析（50人以上事業單位），運輸及倉儲業有1,436次，是所有行業最高的，勞動部認為這個原因是什麼？",221,LCIDC01_1111201_00006
林德福,請說明。,222,LCIDC01_1111201_00006
林德福,對，本席要探討的就是很多外送員為趕單造成車禍，我在路頭路尾經常看到外送員為趕時間竄來竄去，因為外送平台業者片面修改薪資計算的制度，使外送員面臨比較苛刻的工作環境，我認為這個就是要配套，為什麼？因為環境愈苛，外送員為達到業績就會趕單，我在路頭路尾經常看到，那樣實在很容易出車禍，你們可以去統計或調閱資料，發生最多的就是外送員，真的，我經常在路頭路尾看到他們發生車禍，一件又一件。對於這個事情，政府不能不重視，這已經變成常態，你們總不能放縱，讓他們繼續這樣，這主要是因為他們面臨到比較苛刻的工作環境，我認為是源頭的也要抽很多，而外送員為達到業績，沒有辦法，就是衝，結果造成很多問題。部長，你有什麼看法？,223,LCIDC01_1111201_00006
林德福,對。,224,LCIDC01_1111201_00006
林德福,現階段就是這個樣子啊！,225,LCIDC01_1111201_00006
林德福,好啦！我是希望這一點要積極處理。,226,LCIDC01_1111201_00006
林德福,最後一個問題，談到超商店員遭受攻擊的事件，我認為你們在這個部分要去做一些配套，尤其在夜間，因為問題確實存在，尤其這一段時間。講實在話，疫情指揮中心講的那些話讓全國人民都看不下去也聽不下去！超商是根據政府的規定、法令來走，但是他們講的那些話都很冷血。站在勞動部的立場，我認為你們要保護勞工。你們要提出配套，讓人民有感，好不好？,227,LCIDC01_1111201_00006
林德福,好，謝謝。,228,LCIDC01_1111201_00006
李昆澤,"（11時33分）部長你好！按照審計部的統計資料，全國正式登錄的外送員超過10萬2,000名，包括foodpanda的及Uber Eats的。這些朋友賺的都是辛苦錢，而且因為相關的平台業者自認是科技業，不是外送業，也不是運輸業，所以長久以來這些外送員的勞動權益及交通安全一直是我們要重視、要推動的重要項目。我們看到2020年重大交通違規資料，外送員的違規件數超過5萬件，違規人數也超過3萬名，超過所有登錄的外送員三成，因為他們都要趕時間搶單賺辛苦錢，生活不容易，造成這種違規的樣態，其實九成五以上都是和趕時間有關。我們看到外送平台的相關管理，在大家的共同努力之下，勞動部終於將這些外送員以承攬或僱傭的方式作為管理的基礎。勞動部也在2020年3月推動食物外送作業安全指引3.0，對於外送員的勞動權益，勞動部有什麼更積極的作法？",229,LCIDC01_1111201_00006
李昆澤,這個是有關交通安全的部分，當然要由交通部跟警政署負起更大的責任，對於外送員的勞動權利，勞動部必須要再加把勁。,230,LCIDC01_1111201_00006
李昆澤,部長必須提出更具體方案。,231,LCIDC01_1111201_00006
李昆澤,這個方向是對的，但是要有具體的政策和方案出來。,232,LCIDC01_1111201_00006
李昆澤,接著請教交通部路政司陳司長，有關市區道路條例第四條的規定，內政部是市區道路的中央主管機關，直轄市及縣市是以地方政府為主管機關，造成相關的保險和車輛管理發生一些狀況，尤其是跨縣市的車禍意外，相關的法令問題其實是各地法規不一樣，容易造成這些混亂的狀況。我們也知道這些地方縣市政府，他們自行制定相關的管理規定，也造成無論是外送員的車禍處理、車輛管理、意外事故等等，法規不一造成很大的問題。這個部分中央應該要規定交通安全教育的訓練時間，以及車輛的使用登記、保險交通事故的通報等等，也要有相關的規範，請問路政司有什麼具體的規劃？,233,LCIDC01_1111201_00006
李昆澤,但是中央跟地方的法規不一樣啊！,234,LCIDC01_1111201_00006
李昆澤,因為是由地方政府自行規定，要做統一的規範啦！,235,LCIDC01_1111201_00006
李昆澤,因為時間的關係，我們再來看外送平台三大常見的違規樣態，就是超速、違規臨停跟闖紅燈，都是為了拚生活才導致這樣的違規樣態。其實不只外送平台，貨運的物流業者、家長接送也有相關的臨停問題。警政署跟交通部應該要研議，協助地方政府在避開車輛動線的地方，規劃臨時上下車區或臨時停靠區。請司長說明。,236,LCIDC01_1111201_00006
李昆澤,"最後我提醒一下許銘春部長，這些外送平台現在非常盛行，也是一種國際趨勢。當然目前國內的法規也允許這樣的平台經營，但是對於外送員的相關勞動權利，必須提出更具體的保障，全國有超過10萬2,000名的外送員在賺辛苦錢，部長必須提出更具體保障勞動權益的方案。",237,LCIDC01_1111201_00006
范雲,（11時40分）部長早安。我跟剛剛的委員一樣關心交通跟勞動的議題，但是我覺得首先必須要釐清交通跟勞動的關係。為什麼交通事故率會升高？我的團隊要跟部長分享一下我們看到的資料，本來外送員接單後一單70元，現在變成30、40元，所以他們現在每天平均要跑11-13個小時，才能賺到跟過去差不多的收入。目前臺中市已經有組成外送人員職業工會，他們發現今年3月就是因為每單的最低價格調降後，一個月內至少會收到4件職災申請，這個職災就是交通事故，相比於以前平均每月1.5件。這裡有非常清楚的資料讓我們看到這個趨勢與關係，是因為每單的單價變少，所以工時拉長了，交通事故風險就會上升，要先釐清這層因果關係，才能知道怎麼解決。外送員的交通事故之所以會升高，跟平台的管理模式密切相關，因為陷入平台實質上的指揮監督，隨時都是為了趕送餐時間、件數獎勵、不被客訴等，這是他們在馬路上橫衝直撞的主要原因。橫衝直撞當然有錯，可是勞動條件變成他不這樣做就賺不到足夠的錢，所以我覺得改善外送員的交通安全一定要治本，治標可以，但是治本更重要，要保障外送員的勞動條件。我們知道交通部在處理這件事的時候，要求外送員把違規紀錄提供給平台管理而引起不少爭議。第一，這些交通違規個人已經受到行政罰。第二，平台說外送員不是他們僱用的員工，不給他勞動相關權益，這個權利義務很不對等。第三，交通部又把問題丟回勞動部，說僱傭關係認定是勞動部主管。其實這次的預算我已經有一個提議，許部長應該知道，我提議要求這種平台最基本的薪資計算要公開透明，對這些外送員來講，他們完全不知道薪水是怎麼算出來的，只能模模糊糊去猜測，這對他們不公平。當時勞動部也承諾你們有一個研究案，會跟交通部一起來努力。我今天其實想先問部長，全國外送平台的外送員人數，您有沒有掌握最新的數據？,238,LCIDC01_1111201_00006
范雲,其實就是給這10萬人基本合理的勞動條件，平台有合理的管理機制，才能降低交通事故的風險，沒有人會為了多賺一點錢，冒著生命危險橫衝直撞。我覺得是交通的問題，我們也要瞭解背後的原因。很簡單，我相信部長在預算提案的時候有同意，真的要加快腳步，勞動部和交通部可不可以一起聯手合作，把因果關係弄清楚？依據我看到的資料，應該要確保他們有合理的勞動型態，平台有合理且公開透明的管理機制，才能從根本面降低交通事故率，而不是一再壓低每一單的錢，結果他們一天要跑11、12個小時，這樣其實是我們一起讓他們的交通事故增加，他們也付出了冒生命風險的代價。我相信部長會做到，我們也會繼續監督，謝謝部長。,239,LCIDC01_1111201_00006
邱顯智,（11時44分）部長，有關美麗華工會的問題，之前也有請教過部長，簡單講就是公司利用企業的分割，達到癱瘓工會的目的，這也是侵害集體勞動權。現在的問題就是4月8日的時候，美麗華就宣布要做企業分割，把一間公司分成下面4間公司，其目的就是好不容易成立了工會，我們的工會法規定要30人以上，然而分割成4間公司之後，每一間公司的人數就不到這麼多了。結果同一群人分成4個公司之後，分別受僱於4間表面上看起來不一樣的公司，但是這群人其實仍然在同一個高爾夫球場繼續工作。我在4月21日的時候也曾經質詢過部長，部長也當場表示美麗華工會可以直接更名組織變更，變成是一個關係企業工會，這沒有問題。勞動部在4月29日也發函表示更名修章符合工會法的規定，5月3日的時候工會也召開會員大會修改章程，5月10日工會獲得新北市政府換發新的工會證書，5月11日開始工會就發起罷工，這也是一個合法的罷工沒有問題，8月23日簽訂協議結束罷工。現在問題來了，在101年12月的時候資方拒絕提供勞資會議的紀錄，資方的回函表明「目前本公司並無工會，故公司無義務提供勞資會議紀錄。」，我想請教部長，當初你也承諾可以更名關係企業工會，現在資方說公司並沒有工會，請問部長這個問題要怎麼處理？,240,LCIDC01_1111201_00006
邱顯智,是，我現在就是要告訴部長，如果演變成這種狀況，以後臺灣的公司大家都用這招，這是一個將工會整個掏空的新型態、瓦解工會的方式，所以我才一直問勞動部的對策是什麼？因為對方現在就是這樣回覆：本公司並沒有工會啊！連一個勞資會議紀錄都沒辦法提供。部長剛剛提到新北市政府，新北市政府勞工局的狀況也是一樣，新北市勞工局的回函顯然也認為美麗華的工會不是工會，部長瞭解他們的意思嗎？就這種狀況中央到地方應該要有一個態度嘛！否則以後都用這一招就好，全臺灣都沒有工會了，像這樣變成4間公司就好。,241,LCIDC01_1111201_00006
邱顯智,而且他們也發動了一場合法的罷工。,242,LCIDC01_1111201_00006
邱顯智,好，我再請教部長，主要其實有三題，因為原來的企業變成4間，工會因應修章更名之後，在政策上是否應該允許本來的有工會有剛剛部長提到的工會權利？第一個是勞資會議勞方代表選舉辦理權，意即工會跟公司到底誰有勞資會議的選舉辦理權？第二個是勞基法的四大同意權，這些都是非常重要的，包括延長工時、變形工時、開放七休一、下修輪班間隔等等，工會是否擁有相關同意權？第三個是勞動檢查工會陪檢權的問題。以上三點請部長說明。,243,LCIDC01_1111201_00006
邱顯智,第一個沒有問題，勞方代表的選舉辦理工會優先沒問題。第二個問題是這樣，他們都可以發動罷工而且是合法的，如果最後這個關係企業工會無法擁有勞基法四大同意權的時候，就會產生一個狀況，資方只要透過這種方式，馬上就能癱瘓工會四大同意權的權力，這樣就達到目的了嘛！未來全臺灣的公司是不是都用這招？所以我要提醒部長的是，這會產生一個法律上的漏洞，勞動部應該要有態度才對。,244,LCIDC01_1111201_00006
邱顯智,最後一點，首先是剛剛提到的關係企業工會能否向公司請求勞資會議紀錄。其次無論是資助或政策，因為我們的工會法規定一定要30人，當資方把公司變成4間之後，造成子公司勞工人數不足無法籌組工會，在勞動基準法上工會或關係企業工會又無法擁有同意權的時候，這樣的結果就是達到實質上用企業分割癱瘓工會的目的。最後就是30人的工會人數門檻是否該予以檢討，否則基本上就會造成這樣的漏洞。,245,LCIDC01_1111201_00006
