speaker,speech_text,speech_number,meeting_id
蔣萬安,好，最後1分鐘。今天次長還有教育部官員也在這裡，我希望再次反映現在許多家長的心聲，現在即將走向疫情的高峰，剛剛次長也講到是即將到高峰，在這段期間裡面，很多家長希望避免孩子在疫情高峰期間到學校上課而增加染疫風險，最後再帶回家裡，大家真的非常擔心，因為孩子的疫苗施打覆蓋率還是非常低，像12歲以下，我看了今天的數字，大概只有9%，所以大家很擔心，再加上現在雖然採取線上、線下上課的方式，但事實上，對於教學端的老師，他一方面要顧實體教室的學生，二方面要架機器、要照顧線上上課同學的狀況，其實是分身乏術的，家長面對的是停課、復課、停課、復課，也造成很大的困擾。所以指揮中心應該先跟勞動部溝通，當家長有需要請假、請防疫照顧假在家陪孩子線上上課，應該要給予防疫生活津貼補助，讓家長可以安心在家陪孩子線上上課，學校端也可以減輕壓力，然後家長也可以放心讓孩子在家線上上課，而不用擔心到學校會增加染疫風險，至少先度過疫情的高峰，是不是這兩個星期或者是一直到學期末？這個部分希望指揮中心可以跟勞動部、教育部好好的討論、溝通，即刻作出決定，否則現在是疫情高峰，大家很擔心孩子在還沒有打疫苗的情況下染疫，如果發生不幸，其實大家是非常難過也不願意看到的，這個部分希望指揮中心能夠好好的趕快扛起責任，跟教育部、勞動部把相關配套做好，然後趕快有一個統一的規定。本席在此再次呼籲，希望次長、教育部官員把這樣的意見帶回去，好不好？,468,LCIDC01_1118201_00002
蔣萬安,謝謝次長。,469,LCIDC01_1118201_00002
楊曜,我覺得召委剛剛提案說明的部分講得很好，有關輻射的部分，必須要有精密的檢測，這個部分我們應該要求行政機關必須加強自己的檢測能力，不能依靠輸入國而已，我們自己的邊境把關必須做好，至於把特定有害的添加物也好、污染也好，種類太多了，單獨把這一項立法，我怕以後我們立法會立不完，所以我覺得應該是在本法裡面，加強其他部分的罰則也好，然後要求行政機關提升檢測能力及檢測的決心，這是我的意見。,470,LCIDC01_1118201_00002
楊曜,所以你們不應該再依賴國外的檢測，自己要有能力。,471,LCIDC01_1118201_00002
徐志榮,召委，你講的我都贊成啦！看是要保留，還是要怎麼做。剛剛你有講到有關草莓的農藥殘留，一而再，再而三，我在質詢已經講過幾次了，所以當發現這種狀況的時候，你看如何讓它不能進來，不能投機取巧，有給你查到，就退運或者銷燬；如果沒有查到，就讓它進來了。所以草莓農藥超標的，我記得好像三天兩頭報紙都在登，你一個輸出國家，不知道你要輸入對象的國家是要檢驗哪些標準，不是也很奇怪嗎？一而再，再而三，日本講起來也是很注重食安的國家，就舉草莓為例，怎麼會出這樣的紕漏？當要賣到臺灣來，臺灣要檢驗哪些項目，他會不知道？有問題的話，在他的國內就不應該輸出來了。我想就照召委講的，你要先停止輸入還是用什麼其他方式。,472,LCIDC01_1118201_00002
莊競程,講起來剛剛徐委員所說的，就是綜合剛剛楊委員講到的，如果這樣訂定輻射標準，農藥也可能會這樣訂定，接下來可能很多有害人體的物質是不是都可以這樣訂定，這個可以來討論一下。另外，我看您增加這一項的後半段，即「國內經確認有此個案，政府應負照護責任，並主動向廠商及出具相關證物文件國家請求損害賠償。」這是有什麼個案？上面的這一段是指有超標……,473,LCIDC01_1118201_00002
莊競程,但直接就說「有此個案」，是只要有超標，政府就要跟他求償嗎？,474,LCIDC01_1118201_00002
莊競程,對！,475,LCIDC01_1118201_00002
莊競程,對，但是有什麼個案？,476,LCIDC01_1118201_00002
莊競程,是中毒的個案，還是超標的個案？,477,LCIDC01_1118201_00002
莊競程,對超標的個案要怎麼去做照護責任？,478,LCIDC01_1118201_00002
莊競程,不是，政府應負照護責任，應該是對中毒的個案才要照護吧？,479,LCIDC01_1118201_00002
莊競程,中毒啊！因為你說吃到超標的核食，而造成身體中毒或怎麼樣，才需要這個照護嘛……,480,LCIDC01_1118201_00002
莊競程,對啊！並不是超標的個案，因為文字這樣寫起來會感覺是只要有超標，政府就要跟那個廠商直接請求損害賠償，而且是主動的。,481,LCIDC01_1118201_00002
莊競程,我想另外一個思考點，就是中毒個案的認定可能會非常複雜，他到底是不是因為輻射而造成的中毒，這樣原因的認定可能會非常、非常複雜。,482,LCIDC01_1118201_00002
莊競程,等一下，現在先釐清一下，現在福島那邊的食品進來的抽查標準是逐批，還是怎麼樣？,483,LCIDC01_1118201_00002
莊競程,全部都是逐批的話……,484,LCIDC01_1118201_00002
楊曜,如果有，你們是不是本來就有罰則了？,485,LCIDC01_1118201_00002
楊曜,本來就有了。,486,LCIDC01_1118201_00002
楊曜,對……,487,LCIDC01_1118201_00002
楊曜,就會落入循環，像徐志榮委員講的，農藥殘餘的危害也不見得比輻射少。,488,LCIDC01_1118201_00002
楊曜,也要看超標多少，我是覺得假如要一直把特定的有害物質入法，修法會修不完，應該是第十五條本身就已經有「有毒或含有害人體健康之物質或異物」、「殘留農藥」、「受原子塵或放射能污染」、「未成熟而有害人體健康」的相關規定，我知道召委非常重視這個問題，可是我覺得立法這件事情應該是要一般性、通用的比較多，不要把……,489,LCIDC01_1118201_00002
莊競程,召委，我們知道你是抄前面那段。,490,LCIDC01_1118201_00002
莊競程,然後你看上面的邏輯是，「國內外如發生因食用安全容許殘留乙型受體素肉品導致中毒案例時」才停止喔！你下面的文字是超標就停止了，後面有照護，但是照護又要主動去找到底有沒有誰中毒，上面的邏輯是我發現有中毒馬上停止，邏輯不一樣喔！,491,LCIDC01_1118201_00002
莊競程,邏輯不同喔！,492,LCIDC01_1118201_00002
蘇巧慧,輻射中毒。,493,LCIDC01_1118201_00002
莊競程,輻射是看暴露量，暴露量多少、有什麼風險，還要看時間久不久，所以輻射中毒……,494,LCIDC01_1118201_00002
莊競程,這邊有放射科的人，等下可以講一下，輻射是劑量的問題，在什麼量下暴露多久會造成什麼風險，其判定有學術上的一些專有名詞，我是沒有聽過輻射中毒這種名詞，所以你要怎麼去定義因為輻射而造成人體的傷害……,495,LCIDC01_1118201_00002
莊競程,我的意思是要先發生這樣的案例才可以去做停止，你懂這個邏輯嗎？但是你說因為輻射造成人體的傷害，這樣的一個判定……,496,LCIDC01_1118201_00002
莊競程,當然，我剛剛講的是要在怎麼樣的輻射量下暴露多少時間，那個都可以計算的，這樣的時間也只是傷害機率的問題而已，所以我覺得這跟上面的……,497,LCIDC01_1118201_00002
楊曜,其實大家剛好講到乙型受體素的問題，這個剛好是我反對再立法的理由，我們在立法上真的不能因為某件事件發生就特別再增訂一個條項，立法應該是立一個原則，要求行政機關嚴格把關、一視同仁，我想大家對於國人的健康都很重視，可是這是一回事。另外一個就是應不應該在美牛、美豬進口的時候就增加一個乙型受體素的規範，現在遇到福島食品的時候，我們再立一個輻射，假如再多幾件相類似的問題，第十五條可能會很長喔！我覺得還是回歸原則，強力要求行政機關落實執行，這個才是根本之道。,498,LCIDC01_1118201_00002
楊曜,它其實應該就已經涵蓋在第一項第三款裡面了，剛才講的牛……,499,LCIDC01_1118201_00002
楊曜,應該就已經包括在第三款裡面了。,500,LCIDC01_1118201_00002
楊曜,我的意思是在立法政策上……,501,LCIDC01_1118201_00002
楊曜,對。,502,LCIDC01_1118201_00002
蘇巧慧,我們覺得保持原條文就好了。,503,LCIDC01_1118201_00002
蘇巧慧,對啊！我們保持原條文。,504,LCIDC01_1118201_00002
吳玉琴,對啊！我們是保留在委員會啊！,505,LCIDC01_1118201_00002
蘇巧慧,我是要保留原條文。,506,LCIDC01_1118201_00002
賴惠員,主席，我支持蘇巧慧委員，保留在委員會。,507,LCIDC01_1118201_00002
蘇巧慧,我是保留原條文。,508,LCIDC01_1118201_00002
賴惠員,保留原條文在委員會。,509,LCIDC01_1118201_00002
賴惠員,我們有共識啊！,510,LCIDC01_1118201_00002
蘇巧慧,我澄清一下，我剛剛的意思其實是保留原條文。,511,LCIDC01_1118201_00002
蘇巧慧,坦白講，就是反對召委您的版本。,512,LCIDC01_1118201_00002
蘇巧慧,因為你剛剛詢問大家有沒有意見嘛！不好意思召委，我這一次沒有支持你的版本。,513,LCIDC01_1118201_00002
蘇巧慧,我認為這個是多的，理由就是雖然感佩召委的用心，為國人食安把關，但是您用第六項來比照第五項，雖然形式上看起來一樣，但是比照的內容，第五項是到中毒，也就是在個人有發生狀況的時候才停止；而你是在超標的時候就已經把所有的東西都攔下來，這個差之毫釐，失之千里啦！而你又說那我們修正文字，但因為我們沒有那麼厲害啦！我們沒有辦法在這邊就馬上想出比你還厲害的內容。,514,LCIDC01_1118201_00002
蘇巧慧,所以我們覺得這一條，雖然你的不通，但是我們想不出來新的，所以我們認為保留原條文，照原條文就好了，這是我的意見。但召委，因為今天您是召委嘛！您綜合全場的意見，如果你覺得要出委員會，那我也沒有意見啦！這樣好不好？,515,LCIDC01_1118201_00002
邱泰源,我很敬佩各位委員，針對我們現在怎麼把病人照顧得更好，做很多的研議跟建議，也提出修法的方向跟內容，剛剛行政部門醫事司也有做重點式的報告。如果真的要再比較進一步的話，我有提一個修正動議……,516,LCIDC01_1118201_00002
邱泰源,我還是要報告一下，有時候是特殊情況，不要變成正常狀況，臺灣現在一天有100萬以上的人次是醫跟病面對面在看病，這當中無論是身體、心理等各方面的說明、治療都要很順暢，才能夠穩定社會。這也是世界醫學會一直在宣稱的，面對面的診療還是原則，除非有特別的狀況，譬如說在山地、離島等偏遠地區，或者是特殊緊急情況之下，像現在在COVID-19疫情當中，當然就是一切以防疫為優先。你看現在每一個人都在視訊，也沒有問題、也沒有違法啊！表示現在的法並沒有做任何的限制，而是相當地靈活，所以如果真的要調整的話，我覺得當然可以更進一步，但是不要失掉它的原則，然後又有更多的彈性。所以在我的提案裡面就多了「因特殊情況無法親自就醫者」，這可能是大家比較多在討論的，「得委請他人向醫師陳述病情，醫師依其專業判斷病情穩定而不易發生變化之病人，得再開給相同的方劑，由受病人委請之人領回。」，這個部分大家以前有比較多討論，我們把它以文字為之，但是基本上我還是尊重行政部門的意見。謝謝。,517,LCIDC01_1118201_00002
蘇巧慧,不好意思，雖然委員之間彼此不互相詢問，但是我們剛剛聽到召委在說您的版本，所以想要請教一下，現在的條文是如果山地、離島、偏遠地區有特殊急迫的狀況，可以用通訊方式詢問病情；您的版本是得以電子通訊，加了「電子」兩個字，請問電子通訊跟通訊的差別是？,518,LCIDC01_1118201_00002
蘇巧慧,對，那你是改成……,519,LCIDC01_1118201_00002
蘇巧慧,所以你是調換順序？,520,LCIDC01_1118201_00002
蘇巧慧,還有特殊急迫的狀況之外……,521,LCIDC01_1118201_00002
蘇巧慧,一般也可以。,522,LCIDC01_1118201_00002
蘇巧慧,一般也可以就對了？,523,LCIDC01_1118201_00002
莊競程,召委，不好意思，你的文字其實原版本都有啊？你的第一項從第二行開始嘛！對不對？,524,LCIDC01_1118201_00002
莊競程,「但為應醫療需要，得以電子通訊方式為之。」，接下來是「但於山地、離島、偏僻地區或有特殊、急迫情形，為應醫療需要，得由直轄市、縣（市）主管機關……」，有特殊或急迫情形也是醫療需要，跟你上面的醫療需要是不是有重疊？就是下面已經有包含你的範圍了嘛！您是加了電子通訊，我想電子通訊跟通訊理論上要表達的意思是應該是一樣。,525,LCIDC01_1118201_00002
蘇巧慧,你的比較現代化。,526,LCIDC01_1118201_00002
莊競程,通訊一定是都包含，如果你要用飛鴿傳書也可以。,527,LCIDC01_1118201_00002
徐志榮,我主要的意思也是擴大這個範圍，至於要多大、什麼時候要做、什麼時候不做要停止，這個彈性都很大，都由主管機關認定。另外，有關邱委員泰源的修正動議，其實在醫的方面，要跟邱委員講這個就是很失禮了，但是我可能想比較多，相同的方劑在不方便的情況下委託他人去領是合理的，我擔心的是，無法親自就醫而委請他人向醫師陳述病情，這會不會發生一種情況，譬如我說肚子痛，結果他聽錯了，他跟醫生講我心臟痛。或者我們講極端一點，譬如老婆對我懷恨在心，但我不知道，我委託老婆去講，結果我講東，老婆卻講西，我必須吃東的藥，老婆卻拿西的藥回來給我吃，會不會有這樣的風險？是想太多了，我都不好意思啦！對於代為領藥，我是一定贊成的。,528,LCIDC01_1118201_00002
邱泰源,我們已經有一個視訊診療的辦法。,529,LCIDC01_1118201_00002
邱泰源,不一定要在這邊做開放，對於視訊診療辦法，當然將來還可以再做討論，但是那個部分，現在不論是平常或是特別的情況，其實都做得滿順暢的，應該是ok的。,530,LCIDC01_1118201_00002
賴惠員,針對第十一條就教衛福部，有關以通訊的方式詢問病情，所謂「通訊的方式」是涵蓋什麼？根據通訊保障及監察法第三條對於通訊之定義：「本法所稱通訊如下：一、利用電信設備發送、儲存、傳輸或接收符號、文字、影像、聲音或其他信息之有線及無線電信。二、郵件及書信。三、言論及談話。前項所稱之通訊，以有事實足認受監察人對其通訊內容有隱私或秘密之合理期待者為限。」據此，我們要如何解釋以通訊的方式詢問病情？這樣子恰不恰當？,531,LCIDC01_1118201_00002
蘇巧慧,謝謝主席。這一條從上一屆，然後到這幾個會期，我們也都在討論，在疫情之前，我們看到的是偏遠地區醫療缺乏的問題，看能不能因為現代科技的增加而來解決偏遠地區醫療資源的不足，後來疫情之後，我們又有以視訊看診的方式，所以大家認為這是一個好的解決方法。不管哪一黨派都有提出相關的修正條文版本，我想主要的目的都在於解決兩大類，第一類是對象，包括一、偏遠地區；二、個人年長或獨居無法出門就醫者；三、社會全體面的急迫性，例如因為疫情導致整體無法就醫的狀況。謝謝召委排這樣的議程，對於這些包括偏遠地區、個人無法就醫、社會急迫無法就醫的狀況，透過今天的討論，如果現行的條文都能夠涵蓋的話，其實我們擔心的問題就可以解決了，顯然也不見得一定要再動到哪一個文字。另外，包括所有委員都在討論和關心第二類的問題，就是方式的問題，剛才次長也解釋了所謂通訊到底是什麼義涵，通訊是否包含了現代科技的通訊方式？還是只有以前的寫信、打電話？其實剛才已經說明，通訊診察治療辦法第六條已經細部的把任何新的科技也涵蓋進去的話，似乎我們的擔憂在這個部分已經得到解答。既然對象有得到解答、方式有得到解答的話，我是可以支持衛福部的意見，也就是維持現行條文。以上。,532,LCIDC01_1118201_00002
賴惠員,我原本也是要講通訊診察治療辦法第六條，剛才蘇巧慧委員已經提到了，其實通訊有沒有加電子並沒有關係，現行條文就已經規定得非常明確了。謝謝主席。,533,LCIDC01_1118201_00002
吳玉琴,可能要請衛福部再做回應，各委員提出的版本有幾個重點，一個是非親自診察不得施行治療，邱委員提的是特殊情況可以由別人來求診。另外，面對現在的疫情期間，其實整個通訊診療都開放，所以原來的條文其實是限定在山地、離島、偏僻地區或有特殊、急迫情形，我們對這部分要不要開更大一點？通訊診療這件事是越來越普遍化了，所以有沒有可能把它放寬？這個衝擊有多大？或到底這是不是未來的一個醫療模式或診療模式？所以要釐清一下，我是看到這兩者有不同版本之間的差異。,534,LCIDC01_1118201_00002
蘇巧慧,我覺得很有道理。召委剛剛舉的例子很有道理，而且是應該被解決的，但是現行條文的文字其實已經不限於山地、離島，而是有把「特殊」、「急迫」放進去，而這個特殊、急迫包含了個人性的特殊、急迫，還有社會性的特殊、急迫，這點剛剛已經解釋清楚，有共識了嘛！所以我建議召委，我們是不是維持現行條文，然後一起盯著衛福部把通訊診察治療辦法修好？我覺得這樣比較務實，因為那個辦法比較可以與時俱進、不停改變，這樣對社會幫助是不是反而更大？,535,LCIDC01_1118201_00002
蘇巧慧,對。,536,LCIDC01_1118201_00002
蘇巧慧,還是儘量面對面，以醫生親自診療為主，就像剛剛邱醫生說的。但是視訊診療的部分要與時俱進，尤其此時此刻，大家都有一個全新的概念之後，應該盯著衛福部趕快把新修訂的辦法拿出來。下個會期你繼續做召委！,537,LCIDC01_1118201_00002
徐志榮,我沒有意見，我只是說國外的遠距醫療已經一、二十年了，我們要加油。,538,LCIDC01_1118201_00002
徐志榮,可以啊！我沒意見啊！,539,LCIDC01_1118201_00002
邱泰源,如果用附帶決議的方式，那個辦法要修改的時候，可不可以請衛福部一定要找社區醫師的組織？因為現在很多視訊診療是從大醫院直接到病人，都沒有善用廣大的基層醫師，其實基層醫師才瞭解社區很多病人的狀況，未來如果視訊診療結合基層醫師，基層醫師可以做居家的，也可以做社區的，這樣才是一個完整的醫療體系，所以修訂辦法的時候，拜託找基層醫療的組織，請他們提供建議。謝謝。,540,LCIDC01_1118201_00002
吳玉琴,因為我們是要維持現行條文，所以好像就沒有什麼附帶決議，既然大家有共識，是不是就在委員會中以臨時提案的方式通過，交付衛福部處理？,541,LCIDC01_1118201_00002
吳玉琴,臨時提案。,542,LCIDC01_1118201_00002
蘇巧慧,大家應該有共識了嘛！,543,LCIDC01_1118201_00002
蔡壁如,好，我沒有意見。,544,LCIDC01_1118201_00002
蔡壁如,其實這一題我沒有什麼想法，就尊重行政院版。,545,LCIDC01_1118201_00002
徐志榮,主席，我也尊重委員會的決定，只是要表示遠距醫療在國外執行了一、二十年，我們要加緊腳步。但是你剛剛講的那個辦法，像召委講的遠洋漁船，我們有想到就會在辦法裡面加上去，但是我們沒有想到的不知道還有沒有，如果到時候又想到一個情況，那個辦法又要再增訂，就是說你想到的遠洋漁船不是唯一的問題。,546,LCIDC01_1118201_00002
徐志榮,是，我的意思是這樣。當然我尊重委員會決定，但不要下次又想到有哪一個情況像遠洋漁船也很需要規範，又沒有在規範裡面，我們又要在辦法中增訂。,547,LCIDC01_1118201_00002
吳玉琴,依照世界衛生組織菸草控制框架公約，是把加熱菸視為菸品，在定義裡面這部分當然就是菸品，而且加熱菸是放在其他菸品裡面。我質詢的時候一直請衛福部或國健署能夠釐清楚，因為第七條就談到指定菸品，第十五條也提到指定菸品要經過相關的安全審查，當中就提到必要的組合元件，就是剛才主席一直在談的加熱菸的那個電子產品，你們好像都完全沒有針對它予以定義，可是在後面的條文卻有出現，因此我一直請衛福部應該要釐清。我的修正條文是，第三條第一款句末為「、其他菸品及其他必要組合元件。」我是把它放到這邊以定義這個菸品，這部分是不是可行？如果不予定義，到底所謂的必要組合元件是指什麼？進行安全檢定或審查的時候，會不會即使第十五條要求除了加熱菸之外，還要附上必要的組合元件一併審查？這部法有點讓我覺得很亂的地方就在於沒有一致性，就整部法來看，有的部分是到後面才出現、指定菸品還要加上必要元件，有時候會讓我覺得有點混淆。,548,LCIDC01_1118201_00002
吳玉琴,是不是請衛福部也能夠說明一下？,549,LCIDC01_1118201_00002
林奕華,關於第三條，一開始大家就有不同的意見，首先要提一下，我在質詢時特別提到，因為我們有回去看WHO的相關文字，關於加熱菸草，一些國家是禁止的，一些國家把它列入管理。亦即WHO並沒有說加熱菸可以開放，而是做事實的描述，有些是完全禁止，有些是列入管理，這是我首先要說明的。回過頭來講，就第三條的差異性，我已經把它變成是雙禁的定義，菸品部分還是在於傳統的菸品；新型菸品部分，包括電子煙、加熱菸，以及未來可能有其他的新型菸品，因此我的版本中第二款是寫「或其他……」，也提到「一○九年一月一日前於國內合法販售菸品相異……」後面還包括主席提到的一個很重要的部分，「尼古丁或其代用品之製品及零配件。」也就是針對零配件，同時須把它納入新型菸品的範圍。再者，有關電子煙、加熱菸，我的定義裡面都包括其零配件的部分。第六款的菸品容器，跟行政院版不一樣之處在於，我的版本是包括「新型菸品、或新型菸品零配件」所使用之包裝盒、瓶罐或其他容器，這些都納入菸品容器的範圍，行政院版針對容器部分的定義則寫得非常含糊。再者我的版本多了「菸品吸食器」，之前對於菸品吸食器不予管理，以傳統的菸品來說，可能包括菸斗、鼻煙壺等，假如最後是一開一禁，同樣的，所謂的加熱器本身就是菸品的一個吸食器，原本行政院版本的條文針對菸品吸食器並未做很多規範，透過菸品吸食器的定義，後續我們才能將它一併納入管理，這是跟行政院版很不一樣的地方。至於第八款、第九款，要留在第三條或像行政院版是移到第十二條，這個可以討論。但一開始的「本法用詞」、定義部分本席有意見，是從雙禁的角度，加熱菸、電子煙等，包括所有新型菸品及相關的零配件都必須納入管理。,550,LCIDC01_1118201_00002
張育美,電子煙，加熱式菸品等新興菸品的管制模式是本次修法的重點之一，各方都有意見而備受激烈討論。其中將電子煙定位為類菸品，並禁止輸入、販賣與使用，雖然已經獲得普遍的共識，但對於加熱式菸品是不是應該同樣禁止輸入、販賣與使用，則仍然有相當多歧見。對此，我格外重視修法後對青少年族群的影響，根據國健署統計，108年相較107年，高中職生吸菸率從8%到8.4%，電子煙和加熱菸品合計的新興菸品使用率則從6.1%升高到7.2%，顯示無論是傳統的紙菸或是新興菸品，對青少年族群的危害都是呈現上升趨勢。我認為加熱菸開放與否，仍需官方本土性實證研究，藉科學的角度分析新興菸品的入門效應、並用風險等影響，以免加熱式菸品可能產生的入門效應，吸引更多年輕人吸菸或增加不同菸品並用的風險。菸害防制法修正草案在紙菸部分，雖然已經做了相當的努力，但是在新興菸品的管理上，尤其是對青少年的危害，乃至於整個青少年的禁菸作為上，我認為應該要有更周延的思考，如此才能契合國際間菸害防制上減少供應、減少需求及減少傷害的三減策略。以上，謝謝。,551,LCIDC01_1118201_00002
