speaker,speech_text,speech_number,meeting_id
邱議瑩,謝謝主席。感謝主席排審這次的審查，因為本席提有「營養師法第十條及第十三條條文修正草案」案以及「癌症防治法第十六條條文修正草案」案，所以本席就兩案一併說明。關於營養師法的部分，有鑑於營養師法公布施行之後，執業的營養師人數持續上升，國內營養師執業場域範圍已逐漸擴大，現行的法條規定對於長照機構或在山地、離島、偏遠地區常常有不敷使用的狀況。因為現行法令規定營養師要親自執行業務，如本席剛剛所說的山地、離島、偏遠地區民眾因為交通因素或其他因素，常常讓營養師無法親自到場，所以本席提出第十三條條文的修正案，希望在山地、離島、偏鄉地區或是特殊情況之下，營養師執行業務可以用遠距通訊的方式，以保障偏鄉地區的照護權益，也懇請大院支持。關於癌症防治法的部分，近年來癌症治療的新藥跟新科技納入健保給付其實相對困難，根據2013年到2020年的資料顯示，癌症新藥從申請健保到給付生效平均要730天，2022年底的最新數據是高達787天，反之一般的非癌症新藥的申請給付所需時間僅396天，給付速度的差異甚遠，所以癌症新藥的價格高昂造成健保的財務負擔、財務衝擊會成為健保是否給付的主要考量。根據2019年癌症新藥通過健保給付適用病人涵蓋率顯示，即使癌症新藥獲得健保給付，給付的範圍也嚴格限縮，大概只涵蓋三成左右的癌症病友可以獲得健保給付，所以本席認為為了讓癌友及時取得最適切的治療，建立癌症新藥獲得健保給付前的過渡型支持機制，並參考英國成立癌症藥品基金，就是像Cancer Drugs Fund的經驗，希望能同時考量臺灣的現況設置、設立臺灣癌症新藥多元支持基金，於健保體制外以額外的財源支持癌症新藥基金，融入多元參與，同時兼顧照顧經濟弱勢的癌友，並確保健保的永續發展。以上幾點簡要說明，懇請衛福部以及各位委員支持，謝謝。,1,LCIDC01_1123101_00006
王婉諭,大家好。很高興今天排審癌症防治法，時代力量黨團分別提出第八條及第十六條的條文修正草案。首先針對第十六條的部分做說明，主要就是希望國家能設置癌症新藥的多元支持基金，我相信這也是大家今天審查的核心焦點。我們知道癌症長年來居於我國十大死因之首，不僅是許多國人心中永遠的痛，更帶走了許多國人的性命，留下無數破碎與沉痛的家庭，所以國家也的確投入相當的資源，希望透過先進醫療的發展，進而解開癌症之謎，實際上近年來我國內外在研究癌症上有很多突破，許多試驗藥品或創新療法也陸續推出，但是這樣的新藥以及新興醫療因為研發過程的困難，往往要價非常高，而且對癌症病友們以及他們的家庭來說，這絕對是一個非常沉重的經濟負擔，導致許多病友們只能眼見醫療技術發展的同時錯失治療的機會，無法獲得醫治。我們看到二代健保施行到現在已經面臨迫切永續改革的時間點，既有的財政結構拮据之下，對於新藥及新興醫療的預算也在使用上變得非常侷促，審查時間拉長，更讓病友們的等待遙遙無期，所以希望能夠兼顧健保的財政健全與顧及癌症病友們的權利，希望立法院能夠儘快通過癌症防治法的審查，同時也希望能夠建立癌症新藥多元支持基金，由政府建立過渡性支持機制，讓病友及家屬們能夠在納入健保給付之前，就能夠獲得一定的協助，希望讓大家看得到我們醫療的進步，同時也能夠實際挹注到這些病友及家庭們，謝謝大家。主席（賴委員惠員代）：請提案人吳委員玉琴進行提案說明。,2,LCIDC01_1123101_00006
吳玉琴,今天我就二個法案來綜合說明。有關營養師法第十三條的修正，原條文主要規範要求營養師除需要親自執行業務外，還明定執行第十二條第一款、第二款業務時，應該當面進行。可是在實務上，很多時候提供評估或諮詢協助常常有像出院返家後出現一些疑問或需要協助的樣態，但是營養師因為受限於第十三條後段「當面」二個字，而無法透過簡訊、通話或視訊方式來幫助民眾，只能請民眾來一趟醫院或是營養師到家去協助，才能符合法規，這樣的限制在疫情期間就會造成民眾及營養師莫大的困擾。所以綜觀醫事人員相關法規，除了營養師以外，相關條文都沒有寫「當面」這二個字來規範，所以專業人員應該要親自執行業務，這沒有問題，營養師也是一樣，但是因為醫療資訊的快速進步，疫情期間通訊診療的廣泛應用，如果還受限於「當面」二個字，其實已經不符合現況需要，而且營養師也是專業團隊的一環，應有一致的標準，希望能夠修訂營養師法第十三條，詳細內容等一下跟各位委員一起討論，希望各位委員一起支持。另外，對於癌症防治法第十六條的修正，我相信已經好幾次質詢衛福部，在預算審查過程中也請衛福部能夠重視這樣的議題。其實臺灣癌症一直都是十大死因排行第一名，而且已經40年來都是這樣，所以癌症對國人的影響其實是非常嚴肅及嚴重的一件事，臺灣從1995年開辦健保，雖然有新藥預算，但是近幾年對於癌症病友來講，等待新藥已經是不可承受之重，以2022年的數據來講，癌症新藥需要等待時間為787天，超過2年的時間，如果對於確診晚期的病人來講，恐怕是真的等不到新藥，而等待新藥的病友其實有很多是受限於經濟條件而延誤治療的案例，所以這些對病人、家庭及社會都相當不利，由於健保財務真的是滿龐雜的，各項決策因素又非常多，因此癌友們、團體們都希望能夠在全民健保以外，另設一個新的機制來提升癌症新藥的可近性，我覺得這是政府應該積極來承擔的責任，所以我提出癌症防治法第十六條的修正，希望該條讓癌症新藥多元發展基金能夠明定其經費來源及用途，也期待協助癌友新藥及新興治療的可近性，所以也希望各位委員一起來支持，為癌友提升癌症新藥可近性一起來努力，謝謝大家。,3,LCIDC01_1123101_00006
蘇巧慧,主席、各位官員、各位同仁。從1982年起癌症就已經成為我國十大死因之首，在許多前輩努力下，2003年我國催生了癌症防治法，施行迄今滿20年，該法也未有大幅度盤整修正，然而癌症持續蟬聯我國十大死因之首已經連續40年，這樣的趨勢並未因我國建立癌症防治法而有所逆轉，因此本席認為癌症防治法已有必要通盤檢討，所以在今天提出了癌症防治法修正草案的全文修正，從本來的18條，因為有新增條文，而到達了19條，我的版本重點如下：第一，將癌症防治工作範圍擴大，從醫療保健擴大到教育、社政、勞政、環保等領域相互協調合作，確保癌症防治策略能平等落實。第二，為能整合推動癌症防治工作，且考量癌症新興診療不斷推陳出新，在健保財務平衡及新興診療快速納入健保之間如何平衡為長期所面臨的艱難課題，故增設基金作為健保給付前之過渡機制，降低癌友診療之負擔，這也就是今天的重點──第十六條。第三，為了建構癌症病患及其家人能夠安心生活於社會，除提供適當癌症治療及照顧外，也應提供相關支持服務，包含心理支持及社會支持事項，使其能與疾病共存，降低癌症死亡率。第四，鼓勵民間參與財政防治工作或相關研究，且民間捐贈有關癌症防治篩檢之經費，以及捐贈癌症診治及治療基金，準用所得稅法賦稅減免相關規定。以上四點跟其他委員及整部現行癌症防治法有相當不同之處，但是很顯然因為本席是做全文修正，茲事體大，可能還過於超前，所以目前和衛福部還需要更多完整的溝通討論，坦白講今天藉著提案說明，本席也預先告知今天的修正範圍，本席同意以多數委員、包括本席有共識要修正的第十六條條文為主，至於全版的修正條文，本席當然希望能夠得到多數委員的支持，但若主席裁示多數委員共識僅是修數條，尤其是第十六條的話，本席也可以先予以支持第十六條等修正條文，我會繼續努力尋找機會，讓本席的全文修正可以通過，謝謝。主席（吳委員玉琴）：謝謝巧慧委員的體諒。原則上今天上午詢答至登記委員發言結束後休息，下午2時繼續開會，進行條文審查。請提案人林委員宜瑾進行提案說明。（不在場）林委員不在場。請衛福部薛部長報告，報告時間為10分鐘。,4,LCIDC01_1123101_00006
賴惠員,（9時33分）部長早。我想先問一個時事議題，請問指揮中心何時退場？因為目前各項政策都鬆綁了，像輕症不用通報，如果輕症不用通報，現在每日確診已經在1萬例以下，屆時可能只會剩下幾百例，這樣的話請問指揮中心何時要退場？,5,LCIDC01_1123101_00006
賴惠員,可是就像我剛才講的，到時候可能1天只剩下幾百個人確診，而指揮中心擺在那個地方的時候，其實就是有一個象徵的意義，這也會造成我們整個生活上的起伏和情緒上的緊張。,6,LCIDC01_1123101_00006
賴惠員,所以本席在此建議，就是衛福部速度要加快，也要增加臨時編制的人力，因為指揮中心的退場，其實對我們社會來說是正向的，就是讓我們的生活一切恢復正常，然後我們所有的產業也都會跟著上來。總之，這是有一個正向的效果。,7,LCIDC01_1123101_00006
賴惠員,我還是要跟部長建議，要退就是完全裸退，讓我們的生活回到正常的狀況。,8,LCIDC01_1123101_00006
賴惠員,"好，謝謝部長。再來各縣市關於女性凍卵一事有予以加碼，所以中央有沒有辦法做到公費補助呢？像新竹市最近發表一項新的政策「祝你好孕」，即凍卵補助經費的政策即將在今年5月母親節上場，內容是一個女性一輩子補助一次，金額是3萬1,000元，那是全臺第一個執行推動的縣市，現在有地方開始推動這項政策，其他縣市可能也會陸續跟進，衛福部屆時勢必也會面臨到類似的問題。我們知道110年7月時衛福部曾推動一項擴大不孕症治療方案，也就是試管嬰兒的補助方案，當時有收到4萬件資格審查的申請，其中有二萬七千多名獲得此項補助，我們也恭喜這二萬七千多對夫妻成功產下3,000名的新生兒，請教部長，你是如何看待這樣的案例？在相關醫學報告中，像臺大醫院婦產科團隊，從2002年開始進行追蹤，在這20年間，凍卵的645名女性中，其凍卵的使用率不到一成，如果以分析成本來看，凍卵的成本當然是越年輕越便宜的，35歲以下是35萬元、36到39歲是52萬元，至於40歲以上的女性，花費就更多了，必須花到107萬元，甚至連公共政策參與平臺，在2021年也提出一個相對應的提案，可是最後是沒有成案的，請問部長如何看待這個政策？",9,LCIDC01_1123101_00006
賴惠員,恭喜！恭喜！,10,LCIDC01_1123101_00006
賴惠員,是。,11,LCIDC01_1123101_00006
賴惠員,部長，我的建議是未婚的女性跟已婚的女性都同時可以享受到這樣的政策。,12,LCIDC01_1123101_00006
賴惠員,沒有，她就不想生。,13,LCIDC01_1123101_00006
賴惠員,"部長，法律上有很多需要去修正，也請部長能正視這個議題，甚至我希望你再針對已婚女性做一個凍卵的意願調查，其實現在很多年輕女性，基本上他們結了婚，是不願意生小孩的，所以這點是我們應防患未然並且要提醒她，這是必須要做的。再者，針對健保的總額分配，有關癌症用藥的改善計畫，我們是不是有辦法回應癌症患者的期待？部長，我們的健保總額從從2015年的5,908億元，一直到2023年的8,364億元，在這8年當中，我們新增了這麼多健保總額的給付，並編列這麼多的預算，可是從這些政策裡頭，我們看到新科技、新藥的編列，其實才占45.57億元，尤其它又分散在新增的癌症、慢性病傳染改善的計畫7億元，針對這項癌症治療品質的改善計畫政策是5.17億元，可是我要建議的是，其實有很多癌症篩檢的陽性個案，個人就醫的意願非常低，有可能錯失一個治療的機會，所以是否可以把它編列在經費裡，以便用來追蹤，這樣可以讓我們早期發現進入療程，你今年新增的癌症改善計畫裡面，針對這些癌症患者的需求，有沒有進行規劃？",14,LCIDC01_1123101_00006
賴惠員,篩檢陽性要追得到，這樣後段的醫療給付會縮減。,15,LCIDC01_1123101_00006
賴惠員,所以在這裡跟部長再做最後一個建議，未來如果癌症慢性病化的話，其實會耗掉我們很多的醫療資源，當然在這裡我也有兩個主張，就是你是不是應該設置癌症的治療基金以獲取公會支持這些新藥的費用，甚至採取設置癌症的健保總額，當然這茲事體大有可能會排擠到現在的總額，可是我們一旦決定要另外加入的話，這個層面，我們就必須提前討論，這是本席對部長的提醒，也希望你們針對這樣的態度加以研究。,16,LCIDC01_1123101_00006
賴惠員,是。,17,LCIDC01_1123101_00006
賴惠員,好，就是後段的部分？,18,LCIDC01_1123101_00006
溫玉霞,（9時45分）部長早！我們今天要審查營養師法，請問部長，營養師的核心業務是營養評估嗎？,19,LCIDC01_1123101_00006
溫玉霞,護理師不同於營養師？,20,LCIDC01_1123101_00006
溫玉霞,既然不同的話，為什麼你們2月24日有公布一則新聞稿說護理師執行居家護理與營養評估，結果使得營養師公會發函給衛福部表達說其實營養評估是屬於營養師的專業領域？請問部長，你們怎麼會發生這種疏漏？你們發新聞稿不用去校稿嗎？,21,LCIDC01_1123101_00006
溫玉霞,營養評估是營養師的核心業務，剛才我們就已經說其不同於護理人員的業務。,22,LCIDC01_1123101_00006
溫玉霞,但你們發出的新聞稿卻說是營養評估。,23,LCIDC01_1123101_00006
溫玉霞,你們發布這則錯誤的新聞稿，經過報導有很多單位，包括僑委會2月27日在官網也同樣跟隨衛福部發布這樣的訊息，但你們都沒有在官網正式提出澄清，其實你們應該公開提出澄清才對，不然大家都跟著你們走，這樣就會影響到民眾，同時也影響到營養師的權益，畢竟營養評估是屬於營養師的專業，怎麼現在連護理師都跟他們做同樣的工作？所以本席現在要求你們是否應當公開澄清？讓報社及相關的公家單位能夠了解。營養師法第十三條規定：「營養師應親自執行業務，不得由他人代理；營養師執行前條第一項第一款、第二款業務時，應當面進行。」，請問部長，什麼叫做「當面」？一定要「當面」嗎？現在醫師法、物理治療師法、職能治療師法抑或心理醫師法裡面，都沒有規定要當面進行，為什麼營養師法卻要求要「當面進行」？,24,LCIDC01_1123101_00006
溫玉霞,所以我們今天要進行第十三條的修正，針對這部分，我們是不是應該把它劃掉？,25,LCIDC01_1123101_00006
溫玉霞,對，連醫師都可以視訊問診了。,26,LCIDC01_1123101_00006
溫玉霞,可以把「當面進行」這幾個字拿掉？好，謝謝。再者，營養師還希望爭取擴大營養師的職登處所，目前規定營養師僅限於在醫院、學校、老人福利機構執業，他們現在希望擴大至藥局、藥妝店、健身房，甚至營養師公會也有跟藥師公會溝通，要將藥局納入職登處所，部長是否同意？,27,LCIDC01_1123101_00006
溫玉霞,用函釋就可以，不必放在法律裡面規定，不是嗎？,28,LCIDC01_1123101_00006
溫玉霞,我現在是說，如果衛福部同意，用函釋就可以了，可以擴大他們職登處所嘛！,29,LCIDC01_1123101_00006
溫玉霞,好，再來我要請教，今天「癌症防治法」也要修正，剛剛委員有講過，癌症已經連續40年為國人首要死因，根據109年的資料顯示，平均4分19秒就有1人罹癌；去年衛福部的統計顯示，癌症發生的時鐘比109年快20秒，也就是現在不到4分鐘就有1個人罹癌。最諷刺的就是，臺灣的醫療水準這麼進步，可是罕見疾病和癌症新藥納入健保的速度卻非常慢，甚至臺大癌症中心醫院院長楊志新也說，新藥上市太晚、給付條件太苛刻，愈來愈多新藥臨床試驗的國家也不在臺灣做實驗，使得臨床醫師因沒有辦法實驗新的藥物，所以他們的學術論文也沒有辦法再發表，甚至讓這些罹癌病友參與臨床試驗的最後救命機會都沒有了。我舉一個例子好不好？以胃癌和食道癌為例，國外早在5、6年前就使用新藥去抗癌，並列為標準的治療法；但是臺灣仍然沒有納入健保給付，導致臺灣癌友的死亡率比日本與韓國多了2倍到3倍。前健保署長李伯璋也曾說，罕病與癌症新藥納入健保議題一直是他心中的痛！請問一下部長，他心中的痛是不是也是你心中的痛？,30,LCIDC01_1123101_00006
溫玉霞,現在你們納入健保的速度太慢，導致有些人乾脆就不要做了。,31,LCIDC01_1123101_00006
溫玉霞,最重要的要有case，我要請問，臺灣每4分鐘內就有一個人罹癌，怎麼會沒有病患？case不是很多嗎？,32,LCIDC01_1123101_00006
溫玉霞,你們從拿到新藥到要通過共同擬定會議審查須耗費一年半的時間，你們能不能動作快一點？太慢了啦！花一年半的時間太會拖延了，若罹癌時也要拖到來不及用藥。,33,LCIDC01_1123101_00006
溫玉霞,我現在請問最後一個問題，請問我們是不是要學習英國癌症藥物基金？今天的報告裡面你們說只要做可行性的評估，因為你們說錢不夠用。如果錢不夠，我們是不是可以提撥一個叫做癌症藥物基金、是不是可以有這種作法？,34,LCIDC01_1123101_00006
溫玉霞,這個評估需要拖延多久的時間？,35,LCIDC01_1123101_00006
溫玉霞,沒有啦！現在我的問題，第一點，你們共同擬定會議的審查要拖延一年半的時間，這個審查的動作要加快一點。,36,LCIDC01_1123101_00006
溫玉霞,第二點，你既然有計畫要成立癌症藥物基金，希望成立的進度能夠快一點，不要只說要評估，結果一評估就3年，請問在你任內可不可以達成？如果在你任內達成的話，你是在做一項很好的功德，我看所有老百姓及癌症病友都會為你鼓掌、跟你感謝呢！,37,LCIDC01_1123101_00006
溫玉霞,變得比較快，這樣對啦！,38,LCIDC01_1123101_00006
溫玉霞,我現在是要求速度啦！不要一晃又是3年、5年，你的任內趕快加速審查，動作快一點大家都會感謝你，等於你在做功德、做好人，人在公門好修行。,39,LCIDC01_1123101_00006
溫玉霞,再給我30秒就好，上次我曾經問你救護技術員要納入醫事人員這種建議，你告訴我說，消防署有意見啦！我不知道你的消息是從哪裡得來的？我有去問過消防署，消防署跟我回應說「樂觀其成」四個字。,40,LCIDC01_1123101_00006
溫玉霞,消防署都這樣說了，我不知道你們是問誰，跟我問的是不是不同的人？,41,LCIDC01_1123101_00006
溫玉霞,這個你們再去查看看。,42,LCIDC01_1123101_00006
溫玉霞,這是上次你答復的，你要再確認一下，跟我問的答案不一樣。好，謝謝！,43,LCIDC01_1123101_00006
莊競程,（9時56分）部長好。我國在2000年通過罕見疾病防治及藥物法，成為全球第5個立法保障罕見疾病病人的國家，而且健保更以專款專用模式來給付罕見疾病的藥物，2016年聯合國成立罕見疾病非政府組織委員會，還特別邀請非聯合國會員的臺灣進行報告。但是近年來我們國家罕見疾病用藥的權益日漸萎縮，罕見疾病的病友得到救命治療好像愈來愈困難，根據統計在2013年之後的二代健保，罕藥通過健保給付的數量明顯逐年變少，整體給付率從過去的86.8%下降到47.6%，在近10年申請給付47款罕見疾病的藥物中，有13種藥物正在審查中，有9種藥物曾經被否決掉，整體的族群少、藥物單價高，但是沒有傳統療法替代的罕見疾病，常常是被技術性限縮給付的對象。部長，專款專用之後給付率卻下降至五成以下，且這個藥物否決率居高不下，是什麼原因造成？,44,LCIDC01_1123101_00006
莊競程,是。,45,LCIDC01_1123101_00006
莊競程,是，這個我理解，因為我當立委之前也做過罕見疾病研究，也是做小朋友的。112年健保預算中，健保署提出寬列罕見疾病的預算，讓苦等救命罕藥的病患有得到治療或控制病情的機會，但是過去6年，罕見疾病藥物專款未執行的預算累計達到35.87億，而且通過給付的新藥直接進個位數，提高預算卻沒有執行，也沒有新藥可供執行。請問部長，這樣的情況是為什麼？健保署寬列罕藥預算預期的成效是什麼？執行率的問題我們該怎麼解決？,46,LCIDC01_1123101_00006
莊競程,因為限縮新藥跟新科技的給付，健保政策將走向成立真實世界的證據，並以醫療科技評估，作為制定給付政策的依據。原本是淘汰許多療效不明或是低價值的給付，例如指示用藥、感冒藥、復健或中醫傷科等等，減少隱形的黑洞，希望把資源用在有意義或高價值的項目，新藥或是新的科技上。上面提到的這些情況有替代治療的選擇，但是罕見疾病大多沒有，如果把這些指標套在根本沒有替代治療選擇的罕病治療效益上，藥物效益對這些罕病患者而言，可能是看起來療效不顯著的50分，但是不給用藥可能就是無藥可醫的0分。除了爭取新藥給付困難之外，目前給付的藥物或項目也可能隨時被停藥退場，病友們其實相當擔心這樣的問題。這些情況衛福部有哪些措施，能夠盡力協助病友們？部長也知道罕藥真的是因為數量少，藥廠可能不太願意研發，這些病友在國內的話，衛福部有哪些措施可以協助他們？,47,LCIDC01_1123101_00006
莊競程,罕藥的問題特殊，因為個案數少，臨床試驗其實也都不長，所以療效及安全性的不確定性也都比較高。其實近年罕見疾病藥物的價格都昂貴，衛福部也因此花了許多心思跟廠商交涉，不過衛福部去年修訂藥物給付標準，給付協議更具彈性，加入療效、財務風險分攤的概念，意思是療效到哪裡，健保就給付到哪裡，甚至未來如果效果不彰，還可能要求廠商合理的退款。,48,LCIDC01_1123101_00006
莊競程,前面也提到罕見疾病的個案少，所以療效、安全性及不確定性很高，衛福部如果加上這些給付條件之後，會不會讓提供罕見疾病藥物的藥商不願意進入審查？,49,LCIDC01_1123101_00006
莊競程,OK，希望衛福部可以好好審視罕見疾病用藥的迫切需求。大家一起努力，好不好？,50,LCIDC01_1123101_00006
莊競程,謝謝。,51,LCIDC01_1123101_00006
吳玉琴,（10時6分）部長早。今天就營養師法跟癌症防治法就教部長。有關營養師法，剛剛部長有提到，我自己也在盤整衛福部管的醫療專業人員，裡面要「親自」提供服務的，我整理下來好像只看到醫師法跟營養師法，可是應「當面」進行的，看起來各法都沒有。我自己還很認真地回去看93年修法的時候營養師法第十三條到底怎麼修的，真的沒有人知道為什麼有「當面」這兩個字。,52,LCIDC01_1123101_00006
吳玉琴,對，就是行政院提出版本，委員沒有意見就照案通過，所以不知道為什麼。但是當時規定當面很自然，可能當時的資通訊沒那麼發達，所以當面好像是必然的，可是19年後呢？現在因為新冠肺炎的因素，連醫師都可以視訊看診。這個部分我們是不是可以把「應當面」這幾個字拿掉，重新檢視一下營養師在執行業務上，對通信服務方式重新進行整體盤點？,53,LCIDC01_1123101_00006
