speaker,speech_text,speech_number,meeting_id
莊競程,好，謝謝次長及司長。另外，請教交通部祁次長，本席看到貴部有提出「安心防疫旅館」相關獎補助辦法，相信這不僅可以給旅館業者生機，更重要的是提供居家檢疫者有更好、更安全的空間。目前各縣市都有居家檢疫者，但是各縣市成立檢疫旅館的進度有快有慢，都不一，我們也知道防疫旅館不是說加就加，必須要確實依照CDC的指引才能加入，我想請問，目前全臺灣的防疫旅館到底有多少？你們的目標是預設到多少？,41,LCIDC01_1092101_00006
莊競程,另外，請問防疫旅館進行人員訓練、培訓課程及建置防疫設施，大概要多久的時間可以完成？,42,LCIDC01_1092101_00006
莊競程,我還有一個問題想問，像檢疫旅館跟安心旅館，一個是給居家檢疫者本人住，一個是推動讓家屬去住，有沒有可能同一間旅館同時有檢疫者，也有其他的檢疫者家屬，這樣會不會有問題？,43,LCIDC01_1092101_00006
莊競程,區塊上做區隔？還是要把檢疫旅館跟安心旅館分開來？,44,LCIDC01_1092101_00006
莊競程,用獨棟的方式來處理，所以這方面真的要比較完整地去查看看到底會不會出問題。,45,LCIDC01_1092101_00006
莊競程,最後一個問題，有旅館業跟我們提出陳情，交通部提出由信保基金來讓他們有一些紓困的貸款，但是他們說跟銀行申請的時候，信保基金都以各種理由拒絕他們，有沒有這個情形發生？,46,LCIDC01_1092101_00006
莊競程,這個是在那時候做的？,47,LCIDC01_1092101_00006
莊競程,好，謝謝。,48,LCIDC01_1092101_00006
莊競程,好，謝謝。,49,LCIDC01_1092101_00006
廖婉汝,（10時21分）主席、各位列席官員、各位同仁。次長，辛苦了！我有幾個問題請教，其實幾個禮拜之前，我在二二八連假時就已經提出未來清明節可能會有更嚴重的事情發生，因為本席來自於屏東恆春車城，二二八我回娘家時看到那個車流就嚇死了，我認為大家在二二八連假這麼沒有警覺性，未來的清明連假一定是個問題。你看，連部長都到恆春去監督了，為什麼？我不曉得問題出在哪裡，我很擔心，因為臺灣太沈迷在國際媒體對我們防疫成效的肯定當中，而迷失了，現在國外都羨慕我們還可以上學，還有物資可以買，而且檢疫做得很成功，武漢肺炎的確診人數也不多，尤其我們又在中國大陸旁邊而已，對我們的防疫成效非常肯定。但是我擔心我們防疫的超前部署破功，尤其從這次所有的中央部會都進駐到墾丁就知道，為什麼？我們從一開始都說沒關係，在戶外不用戴口罩，而且南部的天氣比較熱，武漢肺炎病毒很怕熱，可以不用戴口罩，有些錯誤觀念還是深植民心當中，最早的宣導就是這樣。當然這是很矛盾的，以交通部觀光局或地方首長的立場來講，他們可能覺得產業都這麼弱了，希望能夠振興，所以希望大家出來走一走、走春，清明節到南部曬曬太陽、散散心，順便掃墓，尤其是遇到連續假期，這就很兩難。有在看電視的南部民眾都知道武漢肺炎很嚴重，但是南部民眾的警覺性還是相對比較弱，尤其令人擔心的是，所有防疫措施的超前部署當中，現在境外移入的案例比較多，一開始我們都說只要居家檢疫、居家隔離，可是居家造成什麼結果呢？家人先中獎嘛！我們為什麼不採取普篩呢？為什麼輕症不二採呢？如果從一開始就這麼做，當然這是事後諸葛，剛開始我們都認為不太嚴重，但是當境外移入的個案增加，我們發覺不對的時候就要緊急踩煞車，用全部普篩的方式，可能造成的影響就不會那麼大。尤其現在我們不知道潛伏期會有多少天，可能不是兩個禮拜就可以發現的，今天發現這個問題，昨天才宣布再延長7天自主健康管理，結果超前部署常常慢半拍，後續還要善後，我覺得很可惜、很憂心。過了二二八、過了清明節，現在又要擔心五一勞動節連假，所以我覺得有一個原則，雖然現在高峰期已經過了，境外移入及國外回來的慢慢減少了，但是我認為國外疫情還是很嚴重，入境還是要採取普篩，包括輕症不二採，只要居家檢疫或自主健康管理就好，我認為入境的時候還是要從嚴。第二點，全面宣導一定要落實，不管是居家檢疫或隔離，尤其是居家檢疫的部分，我上次質詢時也和署長、次長提過，從國外回來的留學生，他的爸媽都嚇死了，他們住在都會區，可是又怕人家知道，就只好送到南部老家，南部老家也不曉得這裡有一個居家檢疫者，雖然你們都有控管，控管的人是村里長。屏東現在有7例，居家檢疫者聽說有兩、三百人，也不知道在哪裡，村里長、縣市長或所有衛生單位知道，可是統統都不能講。我覺得不要不能講，全民草木皆兵都可以，要讓全村、全鄉、全縣一起來防疫才有用啊！你們說要考慮人權，所以不能講，結果我們就不曉得他到底是居家檢疫還是居家隔離，當然他不是確診，因為確診者都會在醫院。我覺得要讓大家知道他是居家檢疫者或居家隔離者，就像次長也提過，感謝醫護人員、感謝全民一起防疫，我們才有今天的成效，但是感謝沒有用，全民一起來防疫才有用。如果能夠讓大家都知道，我們不是要鄙視他們，我們也不是防著他們，把他們視為病毒或什麼的，而是在他們居家檢疫期間，我們共同來關心，那他才不敢趴趴走。鄉下現在很多村長只要一聽到誰家有警察在看守的消息，就知道有可能是居家檢疫、居家隔離的案例，大家都會注意，可是又不知道哪一家，讓大家知道就可以共同來維護。有幾個居家檢疫跑出去的案例最後是誰來通報的？就是隔壁鄰居打電話到警察局通報誰又跑出去了或是又騎摩托車出去了，讓警察去把他們逮捕回來，就是這樣子而已。我認為我們的執法觀念和居家檢疫的觀念還是沒有很落實，他覺得騎摩托車很方便，而且一下子就回來，有什麼關係！但是全國有十萬多個人做過檢疫，沒事的就沒事，有事了要怎麼辦？現在為什麼所有部會的部長、地方首長都跑到墾丁去，因為看到嚇死人的人潮，而且誰有帶原不知道，誰有帶病毒也不知道，一發生狀況真的就破功了，不是產業破功而已。我上次在二二八詢答時就講過，我們真的很希望他們到屏東遊玩，但擔心當中有一例發生在墾丁所有的產業會統統都沒有了，會造成觀光產業停頓、停擺，所以預防很重要，宣導也很重要，落實檢疫也很重要。我們也不是不尊重人權，而是既然要全民防疫，要守住臺灣防疫成功的典範，我們就要更落實一點。從入境開始，對每一個入境者盡可能集中檢疫，檢疫旅館也有了。其實最早當武漢肺炎發生的時候，高雄市長韓國瑜提出要用營區當作集中檢疫所，沒有人信，到現在有檢疫旅館，檢疫旅館又怕人家知道，其實本來就應該這樣做，可是你們考慮太多錯失了良機，要如何補救呢？我覺得政府還是要趕快站出來。現在就趕快集中檢疫，不要只有大陸回來的才要集中檢疫，其他從國外進來的就不用，所有出國留學的學生都是家庭富裕，他還到處趴趴走，家人嚇得要死，沒有辦法找到第二個家的就在家裡居家檢疫，結果就造成家人被傳染，找得到老家或其他的第二個家的，搞不好是誰被傳染也不知道。如果集中檢疫，而且不要只有兩個禮拜，改成三個禮拜，馬上辦，這樣就可以減少疫情的擴散，雖然沒有辦法預知到結果，但是既然全世界都肯定臺灣的防疫工作，而我們現在發覺有一些不對的地方就要趕快來補救，不然的話，真的耶，集中檢疫要做，普篩要不要做就要趕快思考。我總結一句話，我們的防疫指揮中心還是要提升到副總統級或行政院長級啦，為什麼？部長做得很好沒有錯，陳時中做得很好，這是全世界都肯定的，沒有錯，在醫療這一塊他做得很好，但是碰到需要接地氣的民情、觀光、地方產業什麼的，他可能就比較陌生。他考慮到這一塊卻沒有考慮到觀光產業，你看，一個假期，當大家都跑到墾丁，部長就跑下去了，這個就是他在思考上可能沒有預估到的地方，而這就是指揮中心的問題嘛！謝謝。,50,LCIDC01_1092101_00006
徐志榮,（10時31分）主席、各位列席官員、各位同仁。主席，這個禮拜跟上個禮拜的開會情況好像不太一樣哦，現在要看到沒有戴口罩的人可能很難看到了，大家幾乎都戴口罩了。,51,LCIDC01_1092101_00006
徐志榮,這樣大家真的辛苦了！祁次長，有關客運的部分，不管是空運還是海運，我們現在都禁止外國人進來，但本席今天要講的主要是有關貨運的部分，目前空運、海運對貨物的部分都還沒有禁止，那我們對船員的管制是如何管制的？,52,LCIDC01_1092101_00006
徐志榮,一個是3天，一個是5天。,53,LCIDC01_1092101_00006
徐志榮,船員有比照這個3天跟5天嗎？,54,LCIDC01_1092101_00006
徐志榮,他有檢疫14天嗎？,55,LCIDC01_1092101_00006
徐志榮,現在先談小三通的部分，不要講到國際的部分，小三通的部分有居家檢疫14天嗎？,56,LCIDC01_1092101_00006
徐志榮,貨運還有啊！,57,LCIDC01_1092101_00006
徐志榮,一樣？,58,LCIDC01_1092101_00006
徐志榮,是不是可以拜託次長提供資料，如果不會很麻煩的話，從3月份開始，船舶停靠的資訊你應該都有嘛。,59,LCIDC01_1092101_00006
徐志榮,好，另外也拜託衛福部疾管署提供開立居家檢疫的名單，讓我們可以兩邊比對一下。我是聽說船員好像還沒有要做居家檢疫，當然，我們的防疫大作戰是需要大家共同來努力的，不過因為我有聽到這樣的聲音，怕有這樣的破口產生，但是聽次長這樣說就可以安心一點了。剛剛提到的資料，再拜託你們在這幾天提供給我，謝謝。,60,LCIDC01_1092101_00006
徐志榮,何次長，我每次都很不好意思講自己有在領連續處方箋，現在對於居家檢疫、居家隔離者的醫療服務，如果在居家檢疫的14天裡面，我個人又到了三個月需要回診的時間，因為沒有藥可吃了，這時候要怎麼辦？撥打「1922」嗎？還是看人家怎麼樣載我去醫院看醫生？,61,LCIDC01_1092101_00006
徐志榮,對，我講的是第三個月，第二個月還可以託人到藥局去領藥，我說的是第三個月，一定要回去給醫生看的那一次。,62,LCIDC01_1092101_00006
徐志榮,沒有辦法視訊呢？你也知道，拿連續處方箋的大部分都是年紀比較大一點的人，這方面有什麼服務嗎？今天我們討論的主題不就是對居家檢疫及居家隔離者的醫療服務嗎？這種醫療服務你們怎麼提供服務？,63,LCIDC01_1092101_00006
徐志榮,他願意啊，他不會不願意，而是你們要怎麼服務他啦！,64,LCIDC01_1092101_00006
徐志榮,你也知道，連續處方箋如果是高血壓的藥，有時候停個一天可能還可以，但停個幾天可能就會出事情了！,65,LCIDC01_1092101_00006
徐志榮,"另外，有關村里幹事的部分，內政部跟衛福部一樣，雖然編列的錢並不是很多，一個編列5,000萬元，一個編列3,880萬元，總共是8,000多萬元。我也聽了一下地方的村幹事要服務的居家隔離、居家檢疫者，有的是14天，期滿就退了，但一直有新的人進來，所以聽他們講，也是辛苦了兩個多月，我有問了一下政府對他們到底有沒有什麼津貼，他們說目前也沒有什麼啦，雖然他們是公僕，增加了他們的工作量，這也是應該做的，但是他們服務居家檢疫、居家隔離的人也是會有點風險存在，我們對那些人到底有沒有什麼津貼，在那600億元裡面有沒有對他們有一些什麼報酬？",66,LCIDC01_1092101_00006
徐志榮,有，但是都還沒有給下去？,67,LCIDC01_1092101_00006
徐志榮,先欠著？,68,LCIDC01_1092101_00006
徐志榮,縣市政府有時候自己的錢都不夠了啦，所以我在這邊建議，不管是村里幹事也好，基層警員也好，甚至有一點狀況的，可能也是打電話到消防隊，所以隨同救護車去的那些人也好，我們要給他應當的、適度的報酬啦。當然他們服務的人數，可能是這個村一、兩個，那個村、里可能一、二十個或幾十個，我們可能要有一種比較公平的計算方式，不要說人少跟人多的，結果大家都領一樣，我覺得這樣就不太公平了。甚至對於居家隔離、居家檢疫者提供的檢疫包，我也希望中央能夠統一一個大概的金額，你也可以標示一下主要內容要有什麼，包括口罩、消毒水等等，由各縣市政府去統一，不要每個縣市政府，你可以訂出一個大概的金額，300元或500元、200元都可以，但不要出現財政好的縣市拿到的防疫包就很「澎湃」，財政不好的縣市就很陽春、很寒酸，中央是不是可以統一一個金額給他們自己去辦，裡面要配置些什麼東西也大概規定一下，然後再從中央補助經費給縣市政府。你不要覺得可以由縣政府先代墊，因為有些縣政府是代墊不出來的，所以你們那個600億元，我剛剛還聽到有委員提到信保基金，我再重複一次，現在大家的錢都不夠，信保基金憑什麼在600億元裡面編列100億元，他們根本就還不會發生那些債權的風險，為什麼急的不先給？那100億元要等什麼？信保基金那些保證辦下來，可能光是手續就辦了一、兩個月或兩、三個月，貸款給他至少也要半年、一年的時間，甚至一年多，要產生的風險可能就超過明年6月30日了，所以在600億元裡面編列100億元給信保基金，我實在搞不清楚！謝謝。,69,LCIDC01_1092101_00006
王婉諭,（10時41分）主席、各位列席官員、各位同仁。在過去這段期間，海外疫情持續增加的情況下，我們知道從國外回來的人都應該要做居家檢疫或居家隔離等相對應的措施或處置。我們可以清楚的知道，因為居家檢疫人數的增加，所以造成一些前端的一線人員，比如說鄰里長，他們的工作量增加許多。以現在的狀況來看，臺北市各區的里幹事或是里長，一天至少應該要打兩通以上的電話去確認這些居家檢疫或居家隔離者是不是在家、有沒有確實執行這樣的措施與處置。如果找不到人，就會通知管區的派出所，然後基層員警就會來協助尋找這些暫時聯絡不到的人，又或者是有些鄰里長因為比較認真，會自己親自到府去確認。所以在這樣的情況下，我們可以看到這些基層員警及基層人員的負擔是越來越重，已經不太能夠負擔現在這樣的案量。在這樣的情況下，他們已經這麼認真了，但是我們還是時不時就可以看到有些新聞報導一些民眾根本不甩這樣的禁令，可能會有出去到處趴趴走的情況，又或者是說聚會，比較輕微的可能就是到樓下倒垃圾或是到附近買食物等等，這樣的情況我們一直陸續都有看到新聞有類似的報導出來，我們也一直有接到民眾的陳情。我們很感謝政府對此的積極作為，不但有強制安置、禁領補償等等，也同時增加開罰的行為，但是在基層員警、基層人員人力不足的情況下，有些家長、家人或是朋友們，如果還協助這些居家隔離者出去、載其外出等等的情況，其實都會增加防疫的困難度，也增加基層員警及鄰里長的負擔。本席想請教衛福部，是不是支持除了居家檢疫、居家隔離者之外，針對這些刻意協助或隱匿居家檢疫、居家隔離者離開隔離場所的人，是不是有可能進行開罰或是處置？,70,LCIDC01_1092101_00006
王婉諭,所以目前傳染病防治法已經有相對應的法源與罰則？,71,LCIDC01_1092101_00006
王婉諭,之前已經有針對居家隔離、居家檢疫者開罰，對於他們的家人或朋友載他們出去的這個部分，也已經有進行開罰了嗎？,72,LCIDC01_1092101_00006
王婉諭,我們現在清楚的是，針對居家隔離、居家檢疫者，他們已經有開罰了，但是對於這些協助的人，目前我們想要確認的是有沒有已經進行開罰的？如果沒有，是不是能夠考慮針對這個部分去嚴加處理？因為我們還是希望這個防疫漏洞不是只有當事人才需要處理，除了這些基層員警、基層鄰里幹事等等需要有這樣的責任，這些協助他們的人或是居家同住者應該也要有這樣的責任。,73,LCIDC01_1092101_00006
王婉諭,是，這也是我們所說的，除了協助隱匿之外，我們也想要提到的是，這些到家裡來開趴的行為能不能也更積極的去處理？因為目前居家檢疫隔離的通知書上面並沒有特別說明不能有訪客到家裡，我們希望對於這個部分，有沒有可能在通知書上再增訂這項說明，讓這些人更清楚的知道其實是不應該到家裡的。,74,LCIDC01_1092101_00006
王婉諭,是可以開罰的？,75,LCIDC01_1092101_00006
王婉諭,我知道開罰是已經有了，但我們有沒有可能在居家檢疫的通知書上再特別說明清楚、強調這一點及補充說明？因為有些人可能認為自己不能出去，但是並沒有說朋友不能來，因為說明書上並沒有寫到這一條，我覺得應該要更積極一點，讓這些收到通知書的人能夠清楚的知道，其實是不能讓他們來到家中的。,76,LCIDC01_1092101_00006
王婉諭,瞭解，但是我們還是希望能夠更積極一點，讓當事人知道這樣的行為其實是不合規定，也不合防疫措施的。接下來還有一個問題，我們有接到一些陳情，因為我們持續關心這些弱勢、需要幫助的家庭，有一些身心障礙者的家人會擔心，因為以目前所看到的情況，如果這些家庭照顧者需要被隔離或需要檢疫的情況下，他們的小孩或是這些需要被照護的人該怎麼處理？你們對這部分是不是曾經考慮過或是思考過，有沒有什麼樣的協助機制？以衛福部105年身心障礙者生活狀況與需求調查報告來說，絕大多數、百分之九十以上身心障礙者的居住地點，在家宅的比例是最高的，然後大約有超過百分之五十、半數以上的人是沒有辦法獨立照顧自己的，需要由家人來協助。所以我們持續有收到一些陳情，這些照顧者或是家人會擔心，當我如果要進行居家檢疫或居家隔離的時候，這些人該怎麼辦？他們所照顧的這些身心障礙者該怎麼辦？衛福部這邊是不是有可能提早考慮到，對於這樣的情況能夠有什麼樣的配套措施或是協助機制？,77,LCIDC01_1092101_00006
王婉諭,有關這部分的相關機制或措施，希望能夠讓這些家長們或照顧者們大概先知道一下可能的作法，因為這個東西可能不是立即、當下提供協助就能夠處理的，它還需要相關的專業及熟悉程度。,78,LCIDC01_1092101_00006
王婉諭,最後，目前可以看到國高中以下自殺案件數其實一直都持續增高，以衛福部的自殺防治中心所看到的通報案件數是826件，但是教育部的資訊卻是136件，想請教這兩者之間的落差是來自何處？,79,LCIDC01_1092101_00006
王婉諭,是，沒錯，這也是我們的懷疑，但是校安通報事件其實也包含這些小孩在家裡發生自殺行為的案件數。因為我們很希望孩子都有平安成長的機會，也讓他們能夠好好的成長。所以本席想請教，之後有沒有可能請衛福部與教育部協同來瞭解這兩者之間的落差，以及後續的處理、銜接機制是什麼，因為我們很希望不要有小孩是被漏掉的，也能夠積極的協助和處理。,80,LCIDC01_1092101_00006
王婉諭,因為看起來數字的落差其實是非常大的，也就是說，2019年的時候，自殺防治中心的報告已經提出自殺防治存在的問題，其中很多都跟校方有直接、間接的關聯性。因此，本席在此呼籲教育部和衛福部，在小孩自殺防治方面能夠更積極地橫向處理、溝通及落實，才不會受限於衛福部、教育部是不同單位，而有無法有效協助的情況。,81,LCIDC01_1092101_00006
王婉諭,針對2019年成果報告中的問題，本席希望能夠得到積極肯定的做法，還請你們來協助。,82,LCIDC01_1092101_00006
王婉諭,這部分如果有後續實際的行為和作法，再提供給本席，謝謝。,83,LCIDC01_1092101_00006
張育美,（11時1分）主席、各位列席官員、各位同仁。你知道目前有幾例確診病例，是在居家檢疫過程中因為近距離接觸而遭受感染的嗎？,84,LCIDC01_1092101_00006
張育美,對，是3例。也就第293傳染到第289；第228傳染到第247；第209傳染到第246。其實還有另外1例可能沒有算入─第344。次長知道第344的情況嗎？,85,LCIDC01_1092101_00006
張育美,沒關係，由本席來說。第344跟第182一起去美國自助旅行，回來之後，第182確診；但第344是陰性，所以沒有列入確診案例。後來第344有發燒症狀、收治住院採檢才確診，你們把第344當作境外移入的個案，是因為第182先被確診，第344才被確診。因此，除了你方才提到在居家檢疫中傳染的有3例外，本席再提供第344這個案例給你參考。雖然確診人數是3例，也是一種警訊，因為3月中旬以來，境外移入的個案大幅增加，3月19日開始執行入境者須居家檢疫14天。次長方才報告提到，現在有10萬多人次在居家檢疫中，管制中的也有2萬多人，這些人固然是受到居家檢疫的限制而不能移動，但是他的家人、照顧者、接觸者其實都是潛在的傳染源。我們的政府做得不錯，指揮中心對居家檢疫者有協助措施，在3月初就推動「地方政府居家檢疫及居家隔離關懷服務計畫」，包括對象關懷、就醫協助等；到3月27日又整合成生活面跟就醫面的協助，生活面是請家人、同住者的幫忙，另外透過網路購物與外送平台等管道滿足飲食、生活物品的需求；對於獨居者也有特別協助，亦可洽各縣市關懷中心；就醫面是針對慢性病患者的就醫、視訊問診、請家人代替領藥等。本席請教次長，長達14天的生活陪伴，這些居家檢疫、隔離者和家人同住，他們的家人面對隔離者是否確診的不確定性、無症狀感染者的猜疑，該如何確保自己的安全呢？,86,LCIDC01_1092101_00006
張育美,次長，我懂。如果大家都戰戰兢兢、把它當作一回事，就像作戰一樣，就可以保持健康。當初讓返國者居家檢疫的意義就是把感染限縮在可控制的範圍，讓比較高風險的返國者，至少不會在社區內一直移動，成為傳播的來源。但是家人、同住者因為有自身生活、工作，必須要外出維繫社會經濟的活動，如果遭受到居家檢疫者的家內感染，就可能成為傳染的破口嗎？如果他們已經戰戰兢兢但還是受到感染，就會形成防疫的破口嗎？,87,LCIDC01_1092101_00006
張育美,"謝謝次長。延續剛剛何次長提到的防疫旅館，認為居家隔離、檢疫如果有風險性，建議選擇防疫旅館。你知道家人設籍在臺北市，住宿防疫旅館14天可以領7,000元嗎？請問中央有沒有想到以行政院剛通過的特別預算，規劃將來以政策的方式擴及到所有的縣市呢？",88,LCIDC01_1092101_00006
張育美,所以是有規劃將來以中央政策的方式擴及到各縣市，對嗎？,89,LCIDC01_1092101_00006
張育美,那真的是有關心啦！有關入境居家檢疫者普篩的可能性部分，各縣市首長和指揮中心有不同的看法。次長，如果可以更早發現居家檢疫者的感染狀況，對於家屬、同住者絕對有更周延的保障，對嗎？,90,LCIDC01_1092101_00006
張育美,可是我們的部長說，其實普篩會增加風險，我想他講的應該是增加偽陰性的風險，因為我們知道所有檢查不可能百分之百，很可能一開始是陰性，讓家人會假設性的安心，可是如果你不檢查，就會有前面我講的3例，那3個case是居家檢疫所傳染的；如果我們擴大入境普檢的話，部長的意思是說可能會有偽陰性。可是我知道，只要是陰性，他也一定要14天檢疫，次長，對嗎？所以最重要是公權力要介入，如何讓居家檢疫的人不要趴趴走，成為帶原者才對嘛！次長，對不對？,91,LCIDC01_1092101_00006
