speaker,speech_text,speech_number,meeting_id
莊競程,行政訴訟法也規定，檢察官或司法警察在拘提犯罪嫌疑人時，必須在24小時之內移送法院審問，否則有違人身自由。但是面臨緊急監護這樣的狀況，也就是在增訂的「緊急監護」這一章中，24小時之內能不能寫出精神鑑定報告？這還沒有算上警方與檢方採證的時間，這樣的要求，精神科醫師有辦法配合嗎？衛福部有沒有表達過意見？,128,LCIDC01_1108601_00006
莊競程,不可能嘛！因為目前的精神鑑定其實都需要組成專業團隊，包括醫師、心理師、社工師、護理師等等，進行一定期間的檢測與觀察，蒐集到足夠的資料，期間甚至有可能長達數個月，即使認真開立鑑定報告，都還可能受到外界的質疑，對於精神科醫師來講，他的壓力也是非常大，這樣的做法是不是只會將所有的壓力轉移至精神鑑定的工作上面？,129,LCIDC01_1108601_00006
莊競程,按照剛剛部長的說法，我們對照精神衛生法的第四十二條強制住院的制度，其實都設有「緊急安置」5日和「強制鑑定」2日的法定期間，容許專業鑑定團隊利用這幾天儘速鑑定，但是這樣的時間夠不夠，其實值得討論，在刑事訴訟法第九十三條之一其實也應該適度調整，法務部這邊可能也要考量，這就必須要跨部會的溝通協調，精神衛生法和刑事訴訟法能不能沒有扞格，可能需要跨部會的討論和協調，再評估一下。實務上到底要如何操作，假設真的犯了類似殺人案之類，檢方在很短的時間其實根本無法取得必要的證據，卻要硬著頭皮去聲請緊急監護的話，院方和檢方可能會發生很多的爭議，又會將這個責任推回給精神鑑定沒有完成，犯人可能又放到外面。,130,LCIDC01_1108601_00006
莊競程,其實很多人民無法了解法律的複雜，只會看到一些殺人、現行犯可能法官都確認他殺人，但是他好像有時候還可以趴趴走，這是人民對法律的複雜沒有辦法去理解，像本席在10月2日參加故事工廠「我們與惡的距離」舞臺劇的演出，那個演出很特別，故事內容就是以精神病患犯罪為主題，像我們去演出會跟現場的觀眾互動，透過現場觀眾的公投來決定劇情的結果，我那一場觀眾投出來是犯人執行死刑，我的上一場是張廖萬堅委員參加演出，那一場就不是執行死刑。我去看了這個舞臺劇所有場次投票的結果，看起來對於精神疾病患者犯殺人罪，執行死刑和不執行死刑大概一半一半。我想社會大眾會很專注這樣的問題，尤其像這次屏東這個事件，常常在事件出來的時候，大家都會更關注這個議題，但是在關注的狀態下，其實沒有一定的共識，這個就要回歸到我們社會安全網的布建。我想社會安全網的布建必須要很多部門跨部會通力合作，包括司法、警政、社福和醫療，才有辦法把這張網子張開來。在社會安全網的前提，我們必須針對重大的案件予以研究，了解犯罪的根源，然後檢討相關的環境。在中期，我們要對高危險的族群給予協助，降低他犯罪的機率。在後期，如果真的發生犯罪後，我們要如何避免他再犯。所以整個社會安全網的布建就非常重要，回到今天的主題，我們在社區中的長照體系或專門是給精神疾病的身心障礙機構整體布建數量到底足不足夠？部長在之前的質詢也有提到我們現在長照的體系是希望融合式的。,131,LCIDC01_1108601_00006
莊競程,精神疾病的患者可以融合進去的時候，精神疾病患者老了之後，他失能達到一定程度的時候，他其實就可能跟一般長照的需求差不多，但是在這樣的情況之前，我們有什麼樣的機構可以去收容這樣的精神疾病患者？我知道現在長照機構可以設立，但是精神護理之家現在好像暫停設立，所以到底現在長照機構如何融合精神病患？到底要怎樣的條件才能進入這個長照機構？或者說，現在的精神護理之家，像我們臺中在高鐵附近就有一家建國護理之家，那是收精神疾病患者，那樣的復健點其實也少，據我所知，目前臺中有一個長照機構，上次也有跟部長提過，有個衡山基金會評估了之後要蓋，但他們不知道衛福部現在的補助狀況，他不知道分區，就像部長說的，我們在非常缺乏的區域才會補助、鼓勵布建，但是他們那個就是一般的長照機構，因為衡山基金會想要做的是類似比較專門給精神疾病患者的長照住宿型機構，但是他們又面臨到要選身心障礙機構設立，還是要用長照機構去設立。這兩個的條件又非常不一樣，業者在經營上也會碰到很多的困難，這方面要如何再去做一個評估，像臺中地區有拿到身心障礙證明的的精神疾病患者不少還沒有辦法安置，我們現在長照機構和身心障礙福利機構要怎樣做一些融合，我相信這很複雜，但是可能要去評估一下，因為一般的長照機構去融合精神障礙的患者，理論上在某一定的程度、達到一定的失能狀況之前，他可能會有問題，他可能進不了這個長照機構。,132,LCIDC01_1108601_00006
莊競程,這個可能要請部會再跟業者溝通，因為他們是有心要做這件事情的，而且他們是真正要幫助這些人，因為他們過去就有經驗，他們也做得很好，我覺得如果他們有心要幫忙，中央也要給予支持的力量。,133,LCIDC01_1108601_00006
莊競程,謝謝部長。,134,LCIDC01_1108601_00006
徐志榮,（11時5分）部長好，防疫工作辛苦了，但也快要熬出頭了，10月10日是我們的國慶日，那天也是世界心理健康日，今年WHO的宣傳口號也是「讓我們實現人人享有心理健康的照護」，所以跟召委今天排的議程有點關連，也很貼切。當然，我們要實現這個目標就要找出病人，然後看要怎麼去治療，我要講的主要是我們怎樣去發現、找出這些有精障的病人，照貴部的評估裡面有兩點，一個是從精神照護資訊管理系統，還有一個是從保護資訊系統列管的資訊，等於是這兩點要同時符合才符合我們的規定，我的意思是說，可能有一些曾於保護資訊系統中，就是社工體系那邊，他可能沒有經過醫院鑑定，可能還不符合這兩點。簡單講，第一點，例如有家暴、虐童，也就是說有一點症狀的，可能還沒有辦法在我們治療的範圍內，所以我的意思是說我們這兩點是不是其中有一點符合，就可以納到我們的服務裡面？主席（莊委員競程）：請衛福部陳部長說明。,135,LCIDC01_1108601_00006
徐志榮,對，當然，兩點下去勾稽會比較精確，我問這個問題，我自己也覺得有點矛盾，一方面大家都知道我們人力本來就不足，現在我講的又好像要擴大需求面，好像會讓人力更不足，我主要的用意是說在精神障礙前期、輕微有徵兆的時候，我們便能夠發覺他、關懷他、關心他，甚至於治療，就不用等他到很嚴重的時候、發生了事情，例如像屏東的案例，我的用意是在這裡。,136,LCIDC01_1108601_00006
徐志榮,所以就是要怎樣讓那些人可以接受治療，我們的規定就不要這麼嚴格。再來，人找出來以後，主要當然就是要治療，治療當然是一條漫長的路，政府也好，社會也好，家庭也好，在監察院之前的報告提到，我們領有重大傷病證明的慢性精神病人將近20萬人，但是列入社區關懷的不到14萬人，等於還有6萬人，這6萬人是已經痊癒了？或者是不在社區，回到家裡了？,137,LCIDC01_1108601_00006
徐志榮,所以他們就在家裡，可能自己去看病、拿些藥吃，還是怎樣？不需要我們這些社工去關心？,138,LCIDC01_1108601_00006
徐志榮,我們現在社工對精障患者的照護比大概是多少？1個人關心多少人？,139,LCIDC01_1108601_00006
徐志榮,部長，你有目標嗎？,140,LCIDC01_1108601_00006
徐志榮,到時候比例會變多少？,141,LCIDC01_1108601_00006
徐志榮,先進國家差不多也是這樣。,142,LCIDC01_1108601_00006
徐志榮,"但是你講的1,288人，我又想到衛生所的基層人員好像也講了好久，你是說有了，但是你這1,288也要確實、快點召募進來。",143,LCIDC01_1108601_00006
徐志榮,我們心口司推出的精障長照示範計畫裡面，去年在7個醫院試辦，今年是10個醫院，在心口司109年的時候，你們也很了解精神病患占100多萬人的10幾趴，大概有12.6萬人，目前精神病人接受長照服務及補助之機構提供精神病人失能服務量能為數不多，可以了解到目前我國的長期照顧計畫鮮少服務精神病患及其照顧者。在你們109年的時候，我看你們預期的效益是說109年7個縣市試辦，110推展至15個縣市，111年擴展到22個縣市，但是我早上聽了一下，今年就不到預期的15個縣市，只有10個縣市，甚至111年的22個縣市的目標也沒有了。當然，我覺得可能是不是成效不是那麼好，才會造成數量沒有預期的多。當然，也有委員質詢到，這又可能關係到照顧管理的評估量表會不會太嚴苛，或者評估的人比較不了解這些精神病患的需求，所以導致不如我們預期。本來去年7個，今年要15家，今年才10家。明年預定22家，現在也沒有寫出來要幾家。,144,LCIDC01_1108601_00006
徐志榮,部長知道困難的地方、有不符實際的地方，這樣很好，除了評估工具未符合精神長照需求以外，我們的困境還包括還沒有建立精神長照服務體制、精神長照人力的資源待培訓發展，還有早上好幾個人講到，部長也有講到，就是精神病人被污名化、家屬沒有辦法得到社會的支持與資源，還有入住機關個案的老化、家屬拒絕病人返家等等六個比較大的問題，都是有待政府、社會及家庭大家共同努力。最後我想請教部長的是，我們這幾天本土都是加零比較多，就是有確診也是1個，大部分的CT值也滿高的，可以說都是舊案，所以大家比較安心一點，但是我們看境外移入的，這兩天有4例，前幾天有7、8例，偶爾還有10例、11例，我個人的淺見是境外一定要嚴管，一定要好好的管好，境外移入包括飛機來的，也有包括港口來的嗎？,145,LCIDC01_1108601_00006
徐志榮,那裡面也包括本國人、外國人？,146,LCIDC01_1108601_00006
徐志榮,境外嚴管是必須的，但是現在有個問題，像家庭看護工、工廠的廠工，缺工缺得很厲害，那天也有委員質詢勞動部長這個問題，其實我們要好好的在安全的範圍內想一個辦法，讓這些看護工、移工可以入境，甚至我也在想是不是可以在他們那邊，人力仲介就可以先早期管理，然你要來臺灣，就弄一個像我們的檢疫旅館，先讓他在當地隔個2個禮拜，當然，篩檢、PCR還是要做，進來到臺灣就按照臺灣的規定，這樣是不是會比較安全的讓這些看護、廠工可以進來？,147,LCIDC01_1108601_00006
徐志榮,當然，先決條件一定是要顧到安全，不能讓確診的到我們社區裡面。,148,LCIDC01_1108601_00006
徐志榮,但是你也要知道很多看護、廠工的需求，部長也要放在心裡面。,149,LCIDC01_1108601_00006
陳瑩,（11時18分）部長好。上個禮拜三，我在這裡有質詢AZ特戰隊，也就是施打疫苗特權的問題，我當時有要求檢調還沒有調查的案件，指揮中心應該主動移送，所有施打特權疫苗的案件應該移請政風連同地方衛生局，一併進行行政的調查，部長上個禮拜回復說準備一個禮拜之後來向我報告，再看看這個要怎麼處理，現在剛好一個禮拜過去了，部長現在可以說明接下來要如何做嗎？,150,LCIDC01_1108601_00006
陳瑩,可否給一個比較明確的時間？因為我們也有提醒國會組，但是國會組就推給疾管署，我想移送檢調、移請政風調查應該不是疾管署就可以決定的，我相信整個指揮中心……,151,LCIDC01_1108601_00006
陳瑩,今天禮拜四，部長可否給我比較明確的時間，也讓國會組有個依據。,152,LCIDC01_1108601_00006
陳瑩,再一個禮拜？我們就不要再提醒國會組，你們就主動。,153,LCIDC01_1108601_00006
陳瑩,去年11月我有質詢一個新聞，一個聽了讓人很心酸的新聞，這個長照悲歌的事件，因為這對老夫妻沒有錢，老翁因為受傷而重度失能，所以老婦人在經濟困頓之下，也沒有能力照顧她的老公，再加上這位婦人身體也不好，所以老翁必須公費安置在機構裡面，但是他從嘉義安置到苗栗，去年11月我同時也質詢了另外一個個案，就是在我們臺東卑南鄉有一位75歲魯凱族的耆老，他也是沒有錢，所以被迫從臺東安置到花蓮，他非常不願意離開他住了一輩子的臺東，結果在他被安置之前就鬱鬱而終了，也是相當的遺憾。我今天再把這個議題搬出來，難道真的就是有錢才可以在地老化嗎？沒有錢的人，就必須任人擺佈嗎？我想請社家署署長唸一下老福法第十六條的規定。,154,LCIDC01_1108601_00006
陳瑩,謝謝副署長，我想在地老化就是最基本的照顧老人的精神，結果我從去年質詢到現在，我們看一下統計的數字，從678人增加到今年的695人，到底你們有沒有好好想辦法去解決這個問題，跨縣市安置的人不減反增，這些人其實都是弱勢，我們要這樣子處置這些弱勢的人嗎？難道我去年的質詢到現在，你們都當作空氣嗎？這狀況一點都沒有改善啊！,155,LCIDC01_1108601_00006
陳瑩,這群都是社會中最底層的、最基層的人，我在這裡替他們發聲，表達他們的需求和抗議，我在這裡也提出一個訴求，除非縣市所有的機構都滿床，不然可不可以不要跨縣市安置？,156,LCIDC01_1108601_00006
陳瑩,因為現在有床位租不起啊！公費床位價格就是比較低，很多私人機構不願意釋放他們的床位出來。,157,LCIDC01_1108601_00006
陳瑩,其實法源依據就是第十六條在地老化，就看我們有沒有決心做而已。再來，我請教一下長照司和社家署，因為長照2.0的年齡規定，原住民長者適用長照的年齡，你們知道幾歲嗎？,158,LCIDC01_1108601_00006
陳瑩,原住民的長照年齡。,159,LCIDC01_1108601_00006
陳瑩,我首先也謝謝部長、謝謝衛福部，之前的長照適用年齡和老人假牙補助，還有經濟弱勢長者的健保補助，謝謝你們都有同意我的建議，把原住民老人適用年齡降為55歲，雖然在這個過程當中有一些折騰，但是後來都有圓滿達成。我們看一下長照服務的項目，居家服務、喘息服務的部分，原住民的適用年齡都是55歲，可是偏偏針對低收入戶或中低收入戶的失能長者卻沒有寫，為什麼沒有寫？因為法定年齡就是65歲，我希望這個規定可以把它改成55歲，我不知道我提這個建議，你們在執行上有沒有什麼困難？,160,LCIDC01_1108601_00006
陳瑩,縮短到7歲多當然有進步，當然是恭喜、很開心，問題是仍然有這麼多年的差距，我聽到部長的回答其實有點含糊，我希望可以比較明確一點，因為老福法的原住民老人年齡不修，我們就必須要一個項目一個項目來滾動式做檢討，大家都很辛苦，所以這個部分麻煩你們兩個禮拜的時間研議，然後來跟本席報告。,161,LCIDC01_1108601_00006
陳瑩,兩個禮拜，不要再自己加一個禮拜。我利用一點時間關心一下花東的災情，這幾天花東豪雨成災，山區經過大雨沖刷之後，不僅路面出現坍塌，土石流更是灌進民宅，場景相當的驚險，消防人員緊急撤離了居民。請教原民會，這次的災情你們掌握了多少的資訊？有多少人撤離住所被安置？有多少民宅毀損？這些資訊裡面到底有多少人是原住民？,162,LCIDC01_1108601_00006
陳瑩,謝謝，你今天準備比較好，這場豪雨來得非常突然，農損的部分農委會已經公告相關的補助措施，所以我希望原民會也可以立即啟動關懷機制，只要確認身分，確定是這場災情的受災民眾，就請你們用最快的方式來發放急難救助金，希望不要讓急難救助金又變成喪葬補助，這次動作要快一點，可不可以？,163,LCIDC01_1108601_00006
陳瑩,這次因為豪雨土石流灌進民宅，也請你們立即啟動專案的房屋修繕補助，如果族人的家屋因為這場豪雨或土石流而毀損，請你們協助族人來重建家園，這個部分有沒有問題？,164,LCIDC01_1108601_00006
陳瑩,速度的部分要麻煩你們加快。,165,LCIDC01_1108601_00006
陳瑩,希望你們從現在開始可以每天跟我們回報進度，協助所有受災的族人能夠度過難關。謝謝。,166,LCIDC01_1108601_00006
張育美,（11時30分）部長好。去年衛福部預算審查的時候，我就有建議將心理、口腔分隸，獨立設置心理司，畢竟心理與口腔是不同的專業領域，將心理與口腔置在同一個主管機關，可說是舉世創見，更不用說在行政資源的布建上、人力的充實上，現行的心口司配置是不是能因應社會安全網擴大後的需求，乃至於能不能承擔起跨部會協調的重責大任，都是顯示設立心理健康專責機關的必要性。我們上個星期很高興聽到諶立中司長已經有正面回應，對於心理健康司的成立，請問部長，由於成立新的司署涉及到組織法的修法，目前法制的作業進度如何？行政院的支持度又如何？我們這個會期內會送到立法院審議嗎？是否樂觀呢？,167,LCIDC01_1108601_00006
張育美,新的司署涉及到組織法的修法啊！行政院支持嗎？,168,LCIDC01_1108601_00006
張育美,分開來就是心理司，對不對？支持嗎？,169,LCIDC01_1108601_00006
張育美,這個會期可以通過嗎？,170,LCIDC01_1108601_00006
張育美,"如果重視的話，其實我就有講到人力問題，我在上週質詢時，部長有提到強化社會安全網第二期的計畫中，精神疾病一、二級的個案負荷比，你說以1比30為目標，對不對？我說現在哪有達到1比30，我看了計畫書的內容，衛福部希望在114年合計聘請876位精神病人社區關訪員，對於這樣的雄心大志，我當然給予正面的肯定，但是我們有目標之後，執行才是重點，怎麼執行？首先我們來看心口司明年度健保總額新增的精神科病人出院急性後期照護服務的示範計畫，期待藉著獎勵費的給予，強化醫院與社區間的轉銜機制，以精神病人急性後期照護服務期間的關懷訪視次數作為醫院的品質指標，不過若以前的統計數據，衛福部109年補助地方政府衛生局聘用精神病人社區關訪員僅有108人，但需要訪視的一、二級的個案數為3萬4,861人，案量比高達1比323，倘若在健保端提供這種誘因，所謂增加獎勵費，進而增加了社區端的訪視需求，請問部長，所加重的訪視負荷在短時間內要如何解決？我們現在人力都不夠負荷啦！現階段品質要如何維繫呢？",171,LCIDC01_1108601_00006
張育美,你是一部的部長，現階段大家都這麼忙，1比323，如果你要增加人力是惡性循環，你知道嗎？就像一個公司某一個部門缺人力，但是那個部門的人力是非常吃緊的，反而會找不到人。這種高壓的工作環境，超過民眾預期的工作壓力，訪視員的人力問題用預算來簡化是不對的。我知道你明年度想找三百多人，可是有沒有人要來上班啊？找不找得到人比較重要。,172,LCIDC01_1108601_00006
張育美,我在講壓力耶！現在是一比三百多。,173,LCIDC01_1108601_00006
張育美,對嘛！部長，我知道現在的壓力是一比三百多，那關訪員的流動率是多少？我們要從源頭開始談，包括流動率多少。留院三年的薪水當然就要高一點，但是他壓力大。留任三年多的關訪員目前比例占多少？,174,LCIDC01_1108601_00006
張育美,大概多少？,175,LCIDC01_1108601_00006
張育美,所以，留任三年、也就是久任者會給獎金，對嗎？,176,LCIDC01_1108601_00006
張育美,往上升？還是請你們給我資料，說明流動率是多少。我幫你們看嘛！看看流動率是多少、任職超過三年的比例。當然你們也有四年留任計畫，包括做四年薪水高等等，我懂，但對於前面我所提問的，你們還是要給我資料，好嗎？,177,LCIDC01_1108601_00006
張育美,關訪員的服務是延續性的，他要到社區關懷，對不對？所以關訪員的訓練必須能多元連結。所謂的多元連結，我早上聽一些委員提到，可以併入一般長照，對不對？,178,LCIDC01_1108601_00006
張育美,對，是在一起的，對不對？,179,LCIDC01_1108601_00006
張育美,所以，關訪員也要能與多元資源結合，所以關訪員是需要訓練的。,180,LCIDC01_1108601_00006
張育美,"我很高興聽到明年應該會有三百多位關訪員進入，因為在社區支持方面，除了人力等資源缺乏，還有長照、日照等長者需求合併。我們知道，目前無法完全獨立自我照護的精神障礙者大概有4萬2,957人，盤點已經建置的社區型社會照顧資源，你剛才已經提到對出院後、急性後轉進社區者有獎勵，對不對？但對於這四萬多人仍有兩萬多人的缺口，也就是說有兩萬四千多名精障病人的缺口。我知道衛福部已做了一些改善，利用民間團體的力量，由社區家園、團康家屋等等增加服務據點，彌補社區支持度，而且預計在114年增加49處服務據點，增加提供2,000名服務量能，但是扣除增加這49個據點、2,000名服務量能之後，精障病患所需要的服務缺口仍有兩萬多人。對於這些需求，衛福部如何規劃，彌補不足？",181,LCIDC01_1108601_00006
張育美,但我在談的是無法完全獨立自我照顧的精神障礙者有四萬多人，經過盤點，已經建置的社區型精神照顧仍有兩萬四千人缺口喔！而且是新增49個服務據點以後，還是兩萬多個缺口。部長，你是專業，我認為從預防醫學到醫療照顧量能是衛福部最能對身障家庭與社區提供永久支持的部分，你認為對嗎？,182,LCIDC01_1108601_00006
張育美,從預防到剛才提到的人力增加，再到社區照顧補足，才真的是對身障者最好的照顧。,183,LCIDC01_1108601_00006
張育美,是精障，我講錯了。,184,LCIDC01_1108601_00006
張育美,好，謝謝部長。,185,LCIDC01_1108601_00006
黃秀芳,（11時40分）部長好。部長，我今天有幾個問題請教。現在受監護處分者每年大約兩百人，這兩百人中，有部分可能在養護中心等地點接受治療，治療完成之後又回到社區。但前一陣子，我們看到屏東的案件，造成社會很大的恐慌。衛福部提過很多監護處分相關法律修正案，109年左右提出司法精神病院，但提了之後好像也沒什麼進展。在111年預算中，衛福部已編列預算，針對司法精神病房編了1.14億元建置，但我想請教，司法精神病院現在改成司法精神病房，為什麼會有這樣的改變？,186,LCIDC01_1108601_00006
黃秀芳,所以目前司法精神病院也同時在進行當中？,187,LCIDC01_1108601_00006
黃秀芳,所以目前都在進行？,188,LCIDC01_1108601_00006
黃秀芳,那司法精神病房呢？,189,LCIDC01_1108601_00006
黃秀芳,所以可能是補助醫療院所直接設置司法精神病房？,190,LCIDC01_1108601_00006
黃秀芳,部長，無論要設立司法精神病院或病房，其實都可能遭遇一些鄰避問題。,191,LCIDC01_1108601_00006
黃秀芳,因為大家可能會擔心。我要讓部長看一下，在目前的精神復健機構中，包括日間型或住宿型，每一個專管人員要服務的人數在日間型機構可能是15人，住宿型機構是10人；在服務時間上，日間服務可能是8小時，住宿型就是24小時。未來在司法精神病房設置之後，人力配置與醫療等所有資源要怎麼分配？還有人員的安全問題，因為這類病患中有些會有攻擊性，那是不是還要有保全人員或警察人員在司法精神病房服務？,192,LCIDC01_1108601_00006
黃秀芳,所以未來司法精神病房也會有……,193,LCIDC01_1108601_00006
黃秀芳,會有戒護人員進駐？,194,LCIDC01_1108601_00006
黃秀芳,剛才張委員也特別提到，在這樣的機構或司法精神病房，人力流動率可能會很高，第一個原因是可能考慮內部工作人員的安全性，我相信流動率應該會滿高的。那你們未來要怎麼避免這個問題，為其中服務的醫療人員與戒護人員確保安全，讓這些人留任的時間能夠長一點，也就是流動率不要那麼高？因為這樣對患者來講，或對司法精神病房的整體體制來講其實不是那麼好。,195,LCIDC01_1108601_00006
