speaker,speech_text,speech_number,meeting_id
邱泰源,好，我再查一下好了。各位都知道發現敦睦艦隊第一個確診官兵的是一間診所，如果沒有他們守住的話，這些強壯的官兵如果在社會再繞個2天，我看情況可能就不一樣了。我的意思是，有沒有獎勵是一回事，還是要肯定、鼓勵他們一下。而你說責任的部分，請給我一個數據，就是哪些醫院不是急診責任醫院，但是有開病房。,54,LCIDC01_1094701_00006
邱泰源,我們應該面對實際狀況，因為法令裡面有提及醫療院所如果有投入「應」給予獎勵，是「應」哦！,55,LCIDC01_1094701_00006
邱泰源,診所每天帶著所有防護配備在那裡照顧病人，難道他們沒有參與嗎？,56,LCIDC01_1094701_00006
邱泰源,沒關係，首先我們還是要肯定他們的付出，因為疫情不是只有這一次而已，下次我們還是需要靠這些醫院、診所，要讓他們能有堅強的意志再繼續防疫每次的戰役，這是我們應該要做的事情，對不對？因為時間的關係，我就快速的談兩點，在COVID-19之後，我們要考慮的是在疫情中或疫情後，不管是大醫院、社區醫院、基層診所，如何解決他們的困境，讓他們能夠維持醫療的運作，維持民眾健康照護的品質，這部分一定要提出一套想法，讓他們可以繼續做下去。20年前，我看到臺大醫院從很多病人到SARS期間沒有什麼病人，我也在笑說，原來臺灣的醫療需求是這樣，但是最近這些年來我也在思考，包括這次疫情，你知道嗎，可能有很多爸爸、媽媽不敢帶小孩去打預防針，很多人跟我說，本來這幾天、這幾個月要去做體檢，結果也不敢去體檢，甚至要去拿藥都有很多困難。當然我也知道衛福部、健保署很努力在改善一些事情，但是其實不是說現在看到的就認為現在才是真正的醫療需求，我們真的要好好評估一下，否則會變成扭曲到真正的醫療需求，以為就是這樣子而已，我覺得這個部分要對社會大眾公開來處理，用evidence-based來處理，當然民眾真正的醫療需求很多元化，也很難去說一定是怎麼樣，這個不容易評估啦！我們努力讓未來繼續有好的醫療體系、防疫體系，好不好？拜託醫事司拚一下！另外，最近我們有開很多會，我們有請患者來並詢問他們，他們說其實他們很需要心理健康，我也曾跟蘇次長一起去拜會、考察過，所以拜託你們繼續注意心理健康的輔導，下次我們要做得更好，其實居家隔離、居家檢疫的人呈現出很多的壓力。最後這個主題是關於今天的主題，如果要改什麼的話，一定要把相關的專業請過來，這可能跟社家署比較有關係，希望能夠把他們請過來，不管是醫護、長照的人或者是各個醫事專業，然後很公正、很open的討論如何處理修法相關事宜，好不好？這部分一定要多元化來討論。次長，好嗎？,57,LCIDC01_1094701_00006
邱泰源,那就拜託了，謝謝。,58,LCIDC01_1094701_00006
莊競程,（10時7分）主席、各位列席官員、各位同仁。次長好，今天要跟貴部討論監察院糾正身心障礙鑑定與需求評估的部分，我們知道身心障礙者權益保障法是為了符合聯合國身心障礙者權利公約（CRPD），在民國97年有做過大修。另外，身心障礙鑑定及福利服務需求評估新制也在101年上路，看起來好像是往福利大國的方向邁進一大步，可是看到監察院提出的這份糾正案，發現其實有非常多實務上存在的問題，也算是間接戳破這個美好的遐想。身心障礙者權益是本席相當重視的議題，從選前到現在，本席也接獲、處理了相當多案件，這段時間也跟貴部交涉很多次，特別是關於各項資格認定的問題。有關資格認定的部分，我們來看監委的報告怎麼說，身心障礙鑑定新制自101年實施迄今，我們對身心障礙者資格認定及障礙等級判定的執行情況，仍然僅以醫師就身體功能及結構的鑑定結果為依據，並設有門檻，但是並未如修法預期納入第二類鑑定人員所做的活動參與及環境因素評量結果。我們都知道，之所以會有這個CRPD跟世界衛生組織的ICF，即國際健康功能與身心障礙分類，就是希望人們看身心障礙者的角度可以改變，不要只看他們身體的缺陷，而是專注在他們生活上可能遇到哪些不便。本席想請教一個問題，為何貴部不納入鑑定人員活動參與及環境因素的評量？是有執行的難處嗎？還是有其他考量？,59,LCIDC01_1094701_00006
莊競程,我們來看一個數據，臺灣的身心障礙者占我們的總人口大概5%，請問次長覺得這個數據高還是低？,60,LCIDC01_1094701_00006
莊競程,我們這裡有幾個參考值，歐盟大概是14%，美國、澳洲大概是20%，這個結果顯示出什麼？其實並不是因為這些國家的身障人口較多，而是因為先進國家政府在看這些比較弱勢民眾往往會採取比較寬的身心障礙認定標準。請問次長知道民國80年的時候臺灣身心障礙人口比例有多少嗎？我就直接講了，是1%！因為民眾對身心障礙認知提高，還有認定標準的調整，這個比例也在逐年提高，身權法大修前大概是4.5%，改為ICF認定之後，理論上好像應該會讓身障人口比例增加，但實際好像並非如此。所以本席要請問，為什麼臺灣的身障人口比其他先進國家大概少了百分之十幾，是因為臺灣人比較強壯嗎？還是有其他因素？請次長可不可以解釋這項差異？如果是認定上的標準出了問題，那有沒有改善的空間？,61,LCIDC01_1094701_00006
莊競程,好。,62,LCIDC01_1094701_00006
莊競程,今天我會討論這個議題，是因為我們發現在身障的認定上，中度和重度障礙比較沒有什麼爭議，問題多半出現在輕度身障的認定標準。本席曾多次為了單耳聽損的身心障礙者和衛福部、勞動部、教育部協調，希望可以讓單耳聽損的朋友們，尤其是小朋友，能夠獲得最起碼的助聽器輔具補助，但因為單耳聽損在身心障礙鑑定上是很困難的，可能連輕度障礙都不算，所以在補助和就學、就業上都遇到很多困難。為什麼會這麼困難？因為單耳聽損是以優耳來看，所以一耳正常、一耳全聾，也沒辦法列入這個標準，但是一個最大的問題是他們希望補助輔具和社會福利能夠脫鉤。因為拿到身心障礙者證明就能夠得到補助，並且享有身障服務，所以在審查上會變得非常嚴格，但是這樣子的話，以單耳聽損的小朋友來講，就會造成在小朋友的階段沒有辦法申請到助聽器的補助。若以優耳來看，我是學生醫工程的，我覺得這是一個很奇怪的認定，其實一隻耳朵聽不到會影響到聲音來源的判定，也會讓大腦被影響，甚至會影響認知，這些都有可能，所以如果能夠從小就透過輔具讓他可以正常生活的話，其實會避免這樣的情況發生。你們的規定是優耳至少也要半聾才有辦法達到輕度身障的標準，這對單側聽損的小朋友來講是非常非常不好的。他們在學校時老師可能不知道這種狀況，以為他應該要聽得見，因為他還有一隻耳朵，說到聲音的來源，你把一隻耳朵摀起來試試看，有時候老師在講話可能是沒有辦法聽得到，尤其他的注意力是不是會不集中？針對這個問題，貴部在評量標準上有沒有什麼樣的……陳簡任技正青梅：目前我們的評量基準還是一致性接軌國際標準，目前全世界都沒有把單耳聽損列在……,63,LCIDC01_1094701_00006
莊競程,監察院有提出兩個建議，一個是讓身心障礙者的補助跟福利服務脫鉤，身心障礙者很辛苦，很需要補助，社家署會做後續的福利脫鉤，如果有部分未達身心障礙認定標準，也應該尋求管道申請，就像單耳聽損需要助聽器之類的福利服務，我覺得這應該要脫鉤。有些單耳聽損的家長跟我說，其實他們並不需要那些福利，他們只需要有這個標準，小朋友才能拿到輔具的補助，還有申請。有些人不理解，會以為他們還有一隻耳朵是好的，但他們想要所有身障的福利，其實他們並不是要這個，他們只要這個輔具；所以我希望衛福部能夠再做評估。監察院還提出第二個建議，就是把活動參與及環境因素納入評鑑項目，我想問衛福部能不能做得到，修法之後已經十幾年，也開過這麼多次專家會議，什麼時候新的鑑定方法才會上路？一定要給本席一個具體的時間。,64,LCIDC01_1094701_00006
莊競程,以單耳聽損例子來看，我們應該要去了解那些小朋友的需求面，因為FM助聽器輔具的補助一定要有身心障礙者的資格才會有，這就很奇怪，之所以會這麼嚴格審查，當然是因為其中有很多福利，但其實他們最需要的是那個輔具，並不是其他福利。陳簡任技正青梅：應該說目前單耳聽損對於助聽器的需求，我們有很多次的協調，教育部也特別表示在學或學齡前的孩子都有相關的補助，只是可能地方縣市認定……,65,LCIDC01_1094701_00006
莊競程,其實沒有，真實狀況是到高中以上才有辦法拿到……陳簡任技正青梅：所以他們有允諾要修正……,66,LCIDC01_1094701_00006
莊競程,本席也協調了一些助聽器業者協助，但我覺得政府應該再做多一點事吧！陳簡任技正青梅：我們最近也將基準下修了。,67,LCIDC01_1094701_00006
莊競程,對，下修到45%，但還是一樣啊！你可以去算算看那個公式，還是一樣很難達到，所以我覺得有沒有下修其實沒差，這個問題之後我們再討論。,68,LCIDC01_1094701_00006
廖婉汝,（10時19分）主席、各位列席官員、各位同仁。剛剛前面一位委員所提有關身心障礙鑑定評估，既然監察院對你們提出糾正，但是你們的報告聽起來好像是糾正歸糾正，你們還是不想改，對不對？因為你的解釋是若將de碼納入評估的話，可能對身心障礙綜合判定的權重比缺乏科學證據，現在監察院都這樣講了，你們的方向還是你講你的、我做我的嗎？,69,LCIDC01_1094701_00006
廖婉汝,還有質疑就是了？,70,LCIDC01_1094701_00006
廖婉汝,如果模組推估確定的話，未來在制式評估可以比較完整納入的話……,71,LCIDC01_1094701_00006
廖婉汝,身心障礙者反而覺得……,72,LCIDC01_1094701_00006
廖婉汝,變輕所以你們反而不敢做？,73,LCIDC01_1094701_00006
廖婉汝,我是覺得把它建構一個模式出來。,74,LCIDC01_1094701_00006
廖婉汝,這個時間點你要給我們，不能說反正就是照你們的方式來做就好，我希望建構起來，好不好？因為有那麼多委員關心，今天召委也特別排這個議題。另外，我想請問一下次長，剛剛幾位委員也有提過，衛福部長提說要漲健保費，其實針對健保費要漲，我相信現在健保的給付當中有很多很多的問題，剛剛幾位委員提到包括整個健保提高健保費之後，未來不論是服務、給付或者是醫護人員的給付，都要全盤去考量，不然的話未來的健保費可能每一年都是短絀。,75,LCIDC01_1094701_00006
廖婉汝,我相信部長在這個時間點提出來當然也有其優勢，因為現在都在「順時中」，如果這個時候提出來，好像反對的意見會比較少。但是我也覺得很質疑，因為我們來自於基層，在整個疫情當中，我常常會覺得開玩笑，因為我們現在是忙著找病房，現在所有觀光旅遊業的飯店都沒有人住，但是醫院的病房是搶著要，對不對？也不可能因為有疫情就不生病，但是很多從過去到現在，從整個醫療體系來講，我覺得這個議題非常非常大，就像我們來自於基層，當立法委員最大的就是找病房或找病床，真的是現在最頭痛的，從基層的地區醫院或者是區域醫院到教學醫院，就是找不到病床，所以現在設醫院比開旅館還好，我也覺得很奇怪。未來召委也可以排案，就是如果整個健保費要提高，那醫療體系真的也要重新讓我們了解怎麼去檢討。我舉一個例子來講，我來自於屏東縣，我是車城人，是恆春半島的人，有時候從恆春的醫院要轉診，只能轉診到地區醫院像枋寮醫院，不能轉到高雄，然後還要層層轉，轉到最後都沒救了，所以這個轉診機制也很奇怪。包括救護車也很奇怪，不能跨縣市，只能在縣內繞，然後跨到高雄不行，除非簽一大堆文件，居然醫療還有限制我們只能在屏東醫，所以這是很奇怪的轉診機制。然後找病房也是一個問題，包括最近我去探望一些癌末三期的病人，他們因為身體不舒服到醫院，醫院還要幫他們做檢查，我說還要檢查什麼？可能是檢查有給付吧！所以有很多怪異的東西。我們也知道健保費要調漲，但真的要去控管，包括給付最高的洗腎，包括慢性病處方簽等等，看怎麼樣才能讓醫療建構得更好，我是覺得統統要全盤去思考。,76,LCIDC01_1094701_00006
廖婉汝,有啊！我們那裡就是轉到枋寮醫院，還是那是醫院彼此的合作關係？,77,LCIDC01_1094701_00006
廖婉汝,但問題是卡在不論轉到哪裡都沒有病床，從恆春醫院不管轉到哪一家醫院都沒有病床，那怎麼辦？不要轉了？這是一個非常奇怪的問題。另外一個問題是什麼？到大醫院永遠掛不到號，為什麼？我後來發覺現在醫院很方便，預約方便到變成很離譜的奇怪現象，為什麼？因為每次看完診後，醫生就會預約下一次，所以掛號的永遠掛得到號，因為醫生已經幫他預約下一次了，既然醫生已經預約了，那民眾就乖乖的再來看診，什麼時候要停也不知道，所以就繼續拿藥繼續吃，因此我就覺得這些醫療問題很奇怪。然後這個叫做服務很好嗎？還是怎麼樣？因為其實這個問題在幾年前我也問過，在臺北的幾家大醫院裡面，我就跟他們質疑說，奇怪！我去你們那裡健檢，醫院一檢查出來哪裡有問題，就會說已經幫民眾預約掛號了，而臺北榮總不會，檢查出來如果有紅字，他會說你要記得去掛門診喔！服務到家的是幫你約好，民眾就會乖乖去看診，如果是叫民眾自己去掛號檢查追蹤的，一忙就忘了，那到底是哪一家醫院的服務比較好，還是在醫療上做得比較落實，我們也搞不清楚。現在就回歸到我剛剛講的，我們好不容易掛到大醫院，之後就永遠不敢斷，為什麼？斷了之後就永遠掛不到了，所以醫師看完之後預約下一次門診，民眾就會乖乖地去。像我斷了一次就掛不上了，我還要找關係去掛號耶！因為是名醫啊！這個醫療體系到底該怎麼樣建構得更完善，我也覺得很奇怪。在調漲健保費的當中，說真的從2011年中研院社會所有辦過調查之外，好像到現在都沒有做過民調。在臺灣社會變遷基本調查計畫裡面，2011年所做的民調，有半數人都可以贊成調漲健保費，但是像你現在放出風聲要調漲，我是覺得可以適度的啦！現在因為疫情的關係，之前衛福部來跟我辦公室說，因為疫情的關係有些點數也增加了，門診的人數減少，也節省很多醫療的浪費，去逛醫院的也減少了，但是醫療給付還是把它點數提高還是什麼之類的……,78,LCIDC01_1094701_00006
廖婉汝,這些就要整體去考量，門診的患者少了，點數提高之後也讓他們可以平衡，因為現在的收入維持一定，是不是還要再增加，我是覺得這塊可能要重新來思考，因為我們的醫院層級分級制也那麼多，然後診所有診所的問題，大醫院有大醫院的問題，又要調漲健保費的情況之下，我是覺得應該把一些問題都做一個釐清。最重要的，我覺得醫療浪費這一塊應該重新做一個宣導，既然我們的部長現在有那麼高的人望，民意調查他真的是人氣最高的，那適時地去宣導不要做一些醫療浪費的事情，我相信現在很多醫療浪費包括藥品的浪費，很多人領藥根本沒有在吃啊！可是亂丟到垃圾場去都是污染，因此我覺得都是可以做的，甚至之前我有看到報告，未來在教育當中都要教小孩子正確的醫療觀念，你們的醫療體系也要教小孩子，現在我們鄉下地方都不曉得怎麼辦，只要看醫生就是一個頭兩個大，只能找民意代表喬病房，包括我們自己都要喬病房，不要說一般的民眾。我希望在講到提高健保費的當中，也能把整個醫療體系建構起來。另外，我要跟次長講一下急難紓困的問題，之前新聞也有出來，有人為了領1萬元，因為變成收入，可能害他明年的中低收入戶或者是身障補助就沒有了，這個會不會有影響？我想這一塊可能要把它排除，好不好？,79,LCIDC01_1094701_00006
廖婉汝,現在的新聞已經出來，有些承辦人員跟他們講說如果領了這1萬元，可能會影響身障補助……,80,LCIDC01_1094701_00006
廖婉汝,有主張工作能力的話，就會影響嗎？,81,LCIDC01_1094701_00006
廖婉汝,所以就會影響他未來……,82,LCIDC01_1094701_00006
廖婉汝,"因為我是覺得要講清楚，而且我是覺得這次因為時間的關係，以屏東來講，現在提出急難紓困大概只有15%申請核准，拿不拿得到還不知道，我詢問他們怎麼核定，他們說只要低於1.5倍的家戶所得，大概最高領2萬5,000元，我說不是1萬元至3萬元嗎？他們回答說他們哪裡敢簽3萬元，如果簽3萬元，他們會怕有危險，自己要負責任，所以最高是領2萬5,000元。我覺得這授權給基層的承辦人員，這也滿困擾的，所以針對這一塊，從1萬元至3萬元，怎麼去核？有時候對基層的承辦人員來講都是很辛苦的，他們不敢核，他們竟然跟我講他們最高只核2萬5,000元，為什麼不核3萬元？因為怕以後要負責，所以以急難紓困這一塊來講，真的我們要有一個統一的標準。",83,LCIDC01_1094701_00006
廖婉汝,直接帶公式嗎？,84,LCIDC01_1094701_00006
廖婉汝,不用他們自己核？,85,LCIDC01_1094701_00006
廖婉汝,好，謝謝。,86,LCIDC01_1094701_00006
黃秀芳,（10時44分）主席、各位列席官員、各位同仁。這次的疫情從今年的1月底到現在，其實疫情是有趨緩，我看到很多的產業、中小企業都受到疫情的影響，接下來，我想請教的就是，不只是中小企業及產業受疫情影響，其實所有的非營利組織或者是弱勢團體，很多也受到疫情影響，因為很多非營利組織或是弱勢團體的經費都是靠勸募來的，受到疫情的影響，很多的企業或是一般的捐助就減少了。我知道類似家扶，現在為了籌措他們原本每一年該有的預算，他們因為經費不足，所以現在他們到菜市場去賣一些農產品或者是人家捐的一些產品，直接在菜市場賣。我想請教的是，我們知道這一次因為疫情的影響，經濟部針對所有的中小企業的電費，台電有給予緩繳或者減免的部分，我想請教次長，衛福部針對這一些非營利組織或是弱勢團體的紓困方式，接下來6月份就是夏季電價，夏季電價對於非營利組織或弱勢團體來講，他們也會受到很大的影響。我舉彰化家扶為例，只要是在夏季電價，從6月到9月，各分會預計還要多支出將近15萬元左右的電費。所以我想請教次長，就這些非營利組織或弱勢團體，針對電價、電費補助或者是紓困方案，衛福部如何協助他們？,87,LCIDC01_1094701_00006
黃秀芳,是因為疫情的關係有折價，還是從以前就有做折價？,88,LCIDC01_1094701_00006
黃秀芳,是沒有還疫情之前？,89,LCIDC01_1094701_00006
黃秀芳,在疫情這段期間？,90,LCIDC01_1094701_00006
黃秀芳,所以你送給台電跟台水是希望台電跟台水去做減免，還是你們會去補助？,91,LCIDC01_1094701_00006
黃秀芳,台電跟台水會減免，減免多少？,92,LCIDC01_1094701_00006
黃秀芳,所以目前在疫情這段期間有減免，那麼針對夏季電費的部分呢？,93,LCIDC01_1094701_00006
黃秀芳,我講的是其他的單位，譬如家扶中心。,94,LCIDC01_1094701_00006
黃秀芳,我今天就是要請衛福部針對這部分，因為他們原本勸募的狀況確實是不好的。次長，我相信你在這段期間應該也有聽到我們所有非營利組織、團體可能受疫情影響，他們得到的捐款變少，所以他們自己也要想辦法看如何募得更多的資金。所以我今天要講的是，針對電費的部分，請衛福部這邊是不是可以補助？,95,LCIDC01_1094701_00006
黃秀芳,好，因為地方在反映這個問題，昨天地方很多的團體直接反映，真的需要衛福部來協助，因為經濟部針對這些中小企業，收入可能少了15%或是50%都有做這樣的補助，更何況所有的非營利組織以及弱勢團體，類似家扶這樣的團體，照顧的都是我們最基層的弱勢族群，所以我們希望衛福部在這一段期間，針對這些團體，應該要花更多時間去了解看看目前的狀況是怎樣，當然我知道衛福部這段期間是非常的辛苦，可是我希望你們也要花一些時間去了解他們目前碰到的狀況，我剛剛講的，最簡單的就是電費的減免，或者是你們電費的補助，雖然經費很少，可是對他們來講是不無小補，我希望次長針對這部分能夠去了解。,96,LCIDC01_1094701_00006
黃秀芳,直接跟你們申請補助？,97,LCIDC01_1094701_00006
黃秀芳,好。接下來再請教次長，針對醫院陪病的部分，其實我在5月初就特別針對這部分做質詢，在5月9日有看到宣布探病規定，放寬加護病房、安寧病房或者是呼吸照護病房，開放探病的人可能會增加兩人。我想請教的是，因為疫情已經趨緩，我們現在醫院陪病的部分，針對一般的病房，我現在不是在講安寧病房或者加護病房，若是一般病房的話，現在陪病還是限制一個人嘛，在住院方面，如果說全程都一個人照顧，其實是有他的困難，也許這個病人需要攙扶或者是這個照顧者要休息一下、上個廁所或吃個飯，既然目前疫情已經趨緩，針對類似這樣的狀況，這個部分是否應該要去考慮逐漸開放？,98,LCIDC01_1094701_00006
黃秀芳,我們希望能夠去做一個修正，因為有滿多人反映這一點。,99,LCIDC01_1094701_00006
黃秀芳,尤其是生病的人有時候真的是會有一些情緒，照顧的人也很辛苦，如果說家裡面的人數本來就比較少，然後又一直都是同一個人照顧或者是沒辦法再找一個人來協助的話，我覺得對這個陪病的人也是一個折磨。,100,LCIDC01_1094701_00006
黃秀芳,拜託請衛福部……,101,LCIDC01_1094701_00006
黃秀芳,好，謝謝。,102,LCIDC01_1094701_00006
王婉諭,（10時53分）主席、各位列席官員、各位同仁。次長和署長，兩位辛苦了，我們長期關心兒少相關的議題，其實有很多的責任都是在社家署，今天想要就這個CRC施行法及替代性照顧機構來跟兩位請教，我們知道臺灣簽署了這項所謂的兒童人權公約（CRC）之後，在國外和國內委員參與之下，我們提出了國家的報告，而且在2017年的時候也發表了這個結論的建議，我們也看到在結論裡面有非常多建議，本席今天想要就兒少安置及替代性的照顧來作討論。在替代性照顧方面有提到其實很希望說以家庭環境為主要照顧，但是臺灣目前的狀況大多是在機構作安置，機構安置比例過高，而且在非公立機構的人數持續增加，所以委員會這邊有建議，希望針對目前的這些設立許可、查核及評鑑制度、輔導、品質的部分都能夠加以提升。這部分我想兩位應該都很清楚。,103,LCIDC01_1094701_00006
