speaker,speech_text,speech_number,meeting_id
邱泰源,我認為衛福部宣導與防疫有關的知識很重要，過去我們在和相關部會討論時也曾提到，很多工作必須大家互相關心、互相提攜後才能互相促成，這樣做起來也會比較周全。那麼外包人員到底包括哪些？其實每家醫療院所的認定都不大一樣！不只醫院，很多產業、公司均如此。所以，我們必須關心其工作環境與自我照顧能力的提升和認知，而且會不會根本無管道可提升？還是看電視就好？當然，我們也都看電視來取得，但我覺得還是應該要關心他們怎麼自我提升。他們都是勞動部管的勞工，必須讓他們有管道可以提升自我照顧能力，以及必要的防疫知識與能力，這些都是我們應該要瞭解的。我們在醫療院所及診所，也一直在瞭解醫師及醫療同仁對這波疫情的認知到底到何種程度，我們覺得大家應該都知道，但事實上呢？有時候瞭解其實也是一種促成。,211,LCIDC01_1090901_00008
邱泰源,這部分部長需要關心一下。,212,LCIDC01_1090901_00008
邱泰源,我這幾天有去瞭解各醫院是如何照顧外包人員，或比較基層的清潔人員。有的大醫院說，清潔人員整天都在病房內外跑來跑去，當然要優先發給口罩。但是當人員多的時候，到底誰該優先給？是醫師？是護理人員？還是掛號人員？到最後，外包人員拿到的口罩會不會比較不足？我們不能只看大型醫院，畢竟醫院也有很多種，而且私人醫院、中小型醫院也很多，這是否也是問題之一？所以我們要去關心基層口罩夠不夠的問題，如此整個口罩數也會比較穩定。我們問過幾個醫療院所，他們說，站在醫者情懷，既然都照顧病人了，當然也會照顧到身旁的任何一個人。昨天我看到一則YouTube影片訪問幾個醫師，他們說，現在口罩數量已經慢慢比較好，以前比較不足時，腎臟科醫師就說，他們的優先順序是先給洗腎病人戴，因為洗腎病人情況比較嚴重，如果不戴口罩會非常危險。再來是給護理人員戴，第三個才是醫師。不過也有人說有些工會的口罩都被醫師拿走了，護理人員沒拿到。以我的瞭解，應該不至於如此！如果真有工會這樣做，那我希望部長能誠懇去瞭解一下，看看當口罩配送到醫療院所後，又怎麼分配的？絕對不能特別重視這個，而不重視那個！畢竟這種事每一個人都可能會中，每一個人都需要防疫！這是勞動部的職責，最好能建立平台，且平常就必須加強外包人員的自我照顧能力與防疫能力。,213,LCIDC01_1090901_00008
邱泰源,既然制訂指引，就代表具有重要性；至於指引是否落實，則是主管機關所該處理的，所以我希望主管機關能確實落實。唯有透過落實，始能得知到底缺少哪一部分，也才知道如何改善。這就好像在做社區防疫時，會把相關醫療院所該做哪些事一一列出來，待一切設計出來後就會發現哪部分的防疫裝備不夠，何種防疫物資太多，並朝那個方向去努力。因此，唯有透過落實來要求，才能把政策導向更落實且更正確的方向。,214,LCIDC01_1090901_00008
邱泰源,其次，有關外籍看護的防疫問題。醫療與健康是普世人權，我們向全世界說臺灣有顧及醫療與健康的普世人權，而臺灣的醫療水準也很高，理當也可以惠及其他國家國民。問題是，在我們身旁，幫我們照顧老人家的照顧者是否得到好的照顧？他們的健康醫療我們是不是也該關心？在SARS期間，死亡的73人中，有三名外籍看護，可見傳染病不分國籍。我想問的是，外籍看護如何取得口罩？他們有時間去排隊嗎？,215,LCIDC01_1090901_00008
邱泰源,我們就說已經在照顧的看護，也就是那些已經到國內一段時間了……,216,LCIDC01_1090901_00008
邱泰源,雖然可以用健保卡領，但他們可能有時間去排隊嗎？我家附近的藥局排隊的看起來都是老人家，似乎沒看到外籍看護去排隊，下次我會仔細看。有人反映說健保卡會被雇主扣留，有這種事嗎？,217,LCIDC01_1090901_00008
邱泰源,這部分問題可以再注意一下。另外，如果移工轉換工作，申請健保會不會有困難？會不會出現停留空窗期？,218,LCIDC01_1090901_00008
邱泰源,可以用居留證領？,219,LCIDC01_1090901_00008
邱泰源,我希望勞動部能注意外籍移工的口罩問題，再說，雖然有口罩卻隨便戴，這樣也不好。最後，對於無證移工，勞動部的政策為何？像南韓一樣開放嗎？,220,LCIDC01_1090901_00008
邱泰源,我關注的也是他們如何取得口罩。很多政策一旦過度放寬，也會影響到臺灣原有的……,221,LCIDC01_1090901_00008
邱泰源,以前在醫院開診斷書時，一年開不到兩、三張，可說非常嚴謹。我們尊重政策的考量，但我仍舊關心這些人該如何取得口罩。,222,LCIDC01_1090901_00008
邱泰源,所以你們有在處理？,223,LCIDC01_1090901_00008
邱泰源,那就希望一切都沒問題，也請勞動部多多注意。謝謝部長。,224,LCIDC01_1090901_00008
王婉諭,（11時14分）主席、各位列席官員、各位同仁。這段時間部長辛苦了。大家最近不斷提到防疫照顧假問題，之前在討論紓困條例時，也有很多委員提到防疫照顧假，也擔心最後就是看得到、吃不到，讓很多家長不敢請假！剛好昨天兒福聯盟有提出一份最新的調查報告，目前大概只有6.4%的家長敢請這個假，而且是以媽媽為主。我們調查家長為什麼不敢請防疫照顧假？並不是小孩不需要照顧，而是大家擔心防疫照顧假的薪資到底怎麼給？是無薪假、給全薪還是給半薪？因為當時是在各企業、各公司自己決定的情況下，很多企業的狀況不明、規則不明，所以不敢請假。他們主要是擔心會影響他們的經濟收入，所以在經濟與家庭這兩個部分，其實都落入一個困境。我們很清楚的知道，針對這個部分，其實黨團協商在討論防疫條例的時候，很多部會都有提出來，部長也很認真的跟大家討論過。當時部長有回應我們，我們也做了一些相關的修正，如果真的影響到生計，可以依照社會救助法等相關條例去做因應。剛剛提到很多家長其實不敢請假，因為他們可能不至於嚴重到真正影響生計或影響生計的認定標準，但確實還是會影響到收入，所以他們會不敢請假。所以在第四條第一項後段有規定，我們希望透過獎勵租稅的方式，讓企業能夠願意儘量的補貼員工因為這個事件而請假的薪資，當然也是希望可以給全薪。那時候也有提到，如果我們限定了一定的補償金額反而會影響到企業願意多做這個部分。我們看到很多企業其實非常有心，願意共體時艱，當經濟上也過得去的時候，他給員工是全薪的狀態，所以在這個部分我們其實都很肯定的。本席想再跟部長確認一下，針對防疫照顧假，是不是會用企業自主的方式去跟員工討論給薪的部分？是不是企業只要有給薪，就可以適用第四條第一款的規定，以此來申請租稅的鼓勵？,225,LCIDC01_1090901_00008
王婉諭,本席非常肯定，也非常感謝提供這樣的寬容和寬度，讓企業可以自主調整。昨天教育部有一份公函，之前針對開課之後停班停課的部分，家長要怎麼請假一直沒有明確規定。當時教育部長回覆說，這個部分已經確定，如果開學之後停班停課，還是可以請家庭防疫照顧假，但它在公文上就直接說明防疫照顧假是不支薪的，我不知道這個部分許部長清不清楚？這個看起來比較像是與勞工相關的權益，卻是由教育部發函說明，而且這部分好像跟之前我們提到紓困條例的定義與期待是有所衝突的。,226,LCIDC01_1090901_00008
王婉諭,是，所以對我們來說，不論是家長或是我們自己，現在看起來就會很衝突，因為本席當時也質詢過這個問題。,227,LCIDC01_1090901_00008
王婉諭,如果不給薪的話，當初第四條大家討論得這麼熱烈，大家這麼積極的想要照顧勞工的權益……,228,LCIDC01_1090901_00008
王婉諭,所以看起來各部會的條文或辦法其實是有所衝突的。對於這個部分，是不是能夠請部會之間，大家能夠多互相協調……,229,LCIDC01_1090901_00008
王婉諭,希望在政策制定出來之前能夠有明確的定義，要不然，我覺得包括我自己還有很多家長都會覺得很困惑，我們之前討論紓困條例時談了那麼多，討論這麼多，結果最後的結論是不能支薪，好像有點浪費了大家的時間，包括各部會首長的時間。,230,LCIDC01_1090901_00008
王婉諭,好，後續相關部分，可能要麻煩勞動部或是教育部在一起整合之後，再提供更新的資訊給家長，我想這樣會比較完整。,231,LCIDC01_1090901_00008
王婉諭,第二個，之前口罩有缺，但我們很快的建立產線，這些工作人員不眠不休趕工，我們覺得他們非常辛苦，也非常肯定大家為了疫情一起來努力。但是在投入生產的人不夠的情況下，導致這些勞工可能有些太過勞累，或是出現工時較長的情況。我們看到有人反映國軍已經投入口罩生產，對於這個部分，我們提出一個建議。根據主計總處預估，因為疫情的關係，比照之前SARS的經驗，2月的勞參率可能會下降，3月則因為有減班休息的狀況等等，也會影響到勞工上班的情況，甚至薪水的發放等等。所以我們想要建議的是，除了國軍協助支援口罩工廠之外，是不是能夠考慮媒合一些失業人力，創造更多的就業機會？因為原本失業的人口其實是有領失業補助金之類的，如果投入這個就業機會，經費是轉移的，可能不會有太多額外增加的情況，這部分是不是能夠請勞動部去研議？,232,LCIDC01_1090901_00008
王婉諭,瞭解，主要就是勞工朋友會很擔心，因為現在開始有減班的情況，甚至有些許類似無薪假的狀況產生，所以他們其實會擔心在家休息的狀況下導致家中經濟會受到影響，我們覺得這是一個兩全其美的辦法，所以再懇請勞動部來研議。以上，謝謝。,233,LCIDC01_1090901_00008
徐志榮,（11時22分）主席、各位列席官員、各位同仁。部長，現在都不講無薪假了，因為真的有領一點錢，用無薪假好像也不太符合，姑且就稱之為減班休息。請問減班休息跟減薪休息、減薪休假有差嗎？,234,LCIDC01_1090901_00008
徐志榮,比較好聽。,235,LCIDC01_1090901_00008
徐志榮,"根據我們現有的資料顯示，減班休息的人數差不多1,600人左右，是嗎？",236,LCIDC01_1090901_00008
徐志榮,但到底有多少黑數？應該也不少，這個應該也無法預知，就像部長所說的，這是由勞資雙方去協議……,237,LCIDC01_1090901_00008
徐志榮,如果老闆不給薪，叫員工不用上班，但沒有跟勞工協商，也沒有通報，你們也就不知道有真正在放無薪假的企業了，部長，你們有強制要通報嗎？,238,LCIDC01_1090901_00008
徐志榮,如果不通報的話，就是真的無薪休假了……,239,LCIDC01_1090901_00008
徐志榮,又沒有通報的話……,240,LCIDC01_1090901_00008
徐志榮,關心？但是沒有罰則啊！,241,LCIDC01_1090901_00008
徐志榮,"部長，你也知道，以勞資雙方來說，資方怎麼樣都是比較強勢一點，你說要勞工去檢舉還是怎麼樣，以後他在這個企業裡面就會變成黑名單，日子也不會很好過。所以要靠勞工檢舉的話，也不太可能，這個姑且我們就不論了。我覺得委員會開會有個好處，就是大家集思廣益，譬如早上我聽到蔣萬安委員有提到，雖然你講的可能是比較極端一點的例子，甚至可能有企業這樣去取巧，蔣委員講的是，有的企業可能本來就因為景氣不太好而想要放無薪假。現在趁著防疫的機會，以安心就業的方案來請無薪假，雖然你講的是一個極端的例子，但我現在又想到一個極端的例子，反正大家集思廣益，做個參考。譬如說，新冠肺炎對我這個企業其實並沒有影響，但說句難聽的話，我就以打秋風的心態跟員工講好了，其實我們都沒有放假，但是我去通報，為了怎麼樣、怎麼樣而要放假，然後就以最高的4萬5,800元來保勞保，再賺取其中的差價1萬1,000元，之後資方與勞分再來分這筆錢。如果有企業這樣做，請問有罰則嗎？如果他領了100萬元，可以叫他賠10倍回來還是怎麼樣，有這樣的罰則嗎？雖然這是極端的例子，但也不能排除有這樣的可能性。",242,LCIDC01_1090901_00008
徐志榮,我講的可能是極端裡面的極端也不一定，但是也不可以排除有這種情況，所以蔣萬安委員提到如何建立防弊的機制，不過你說這已經嚴重到涉及刑法的部分了，他們可能就會有所顧忌，但還是請你們注意一下要怎麼樣來防止這樣的情況，看是要去查訪還是怎麼樣。,243,LCIDC01_1090901_00008
徐志榮,"這種有錢可賺的事，也不能排除說都沒有。如果有10個人，1個人各分5,000元的話，以企業來講就多領5萬元，正所謂殺頭的生意是有人做的，也不得不防！",244,LCIDC01_1090901_00008
徐志榮,"部長，安心就業的部分，所謂依照比例是有怎麼樣的基準？譬如說領4萬5,800元，雇主支付超過2萬3,800元的基本工資，就補助……",245,LCIDC01_1090901_00008
徐志榮,"剛好一人1萬1,000元！",246,LCIDC01_1090901_00008
徐志榮,"你們說的是整個月，如果不是整個月都放無薪假，只是照你說的減班，本來扣掉週休二日，一個月要上班20天，現在還是要來上班10天，那是照比例，也就是1萬1,000元又再除以2嗎？",247,LCIDC01_1090901_00008
徐志榮,所以是照比例。部長，我們現在在爭論無薪假等於減班休息、等於減薪休假，大概意思都是一樣。但依照大家的共識就是我們要怎麼樣真正的幫助勞工，我在這邊有幾點想要請教部長，請問減班休息可不可以併入事假計算？,248,LCIDC01_1090901_00008
徐志榮,所以事假的14天還是另外有保留下來，不算事假？,249,LCIDC01_1090901_00008
徐志榮,在減班休息期間，勞退新制是否一樣照常提撥？,250,LCIDC01_1090901_00008
徐志榮,減班休息的期間有可能長達幾個月，不論是3個月還是6個月，如果剛好那個時候要資遣或退休，要計算基數的時候，減班休息當然是比平常的正常薪資領得少，如果剛好在那個期間要資遣或退休，那個基數算嗎？,251,LCIDC01_1090901_00008
徐志榮,不計入？就是只計入到正常的時候？,252,LCIDC01_1090901_00008
徐志榮,我沒有當勞工很久了，現在退休基數是往前推幾個月？,253,LCIDC01_1090901_00008
徐志榮,所以我這個企業如果減班休息3個月，這3個月就不算？要推算到9個月以前算半年，就是這3個月不算啦！,254,LCIDC01_1090901_00008
徐志榮,這樣講起來，對於勞工的退休或資遣是比較公平的。最後，是不是可以請部裡面去向指揮中心反映，因為我們的陳時中部長說他是管病毒不管人，之前第32例是外勞，我擔心的是合法的外勞可以領到，但非法的外勞呢？如果非法外勞有雇主，雇主可能還可以提供口罩給他，萬一他還沒找到雇主，但他又趴趴走，他的口罩來源呢？他要從哪裡取得口罩？,255,LCIDC01_1090901_00008
徐志榮,萬一不在醫院裡面呢？,256,LCIDC01_1090901_00008
徐志榮,他們怎麼會知道移工的所在？,257,LCIDC01_1090901_00008
徐志榮,知道？,258,LCIDC01_1090901_00008
徐志榮,那麼這個又牽涉到移民署？這不是移民署的業務嗎？他們如果知道，移民署不會透過這個管道去把那些移工抓起來嗎？當然這不是勞動部的事情啦，這個……,259,LCIDC01_1090901_00008
徐志榮,移民署也應該儘量去抓這4萬多人吧，對不對？,260,LCIDC01_1090901_00008
徐志榮,既然口罩都可以發到非法外勞的手裡面，那麼移民署可能要檢討一下，怎麼不利用這個管道去把他們抓起來呢？當然這不是勞動部的工作重點啦。謝謝部長。,261,LCIDC01_1090901_00008
蔣萬安,主席、各位列席官員、各位同仁。剛剛徐志榮委員在質詢時提及，現在放無薪假是否須強制通報地方政府？部長說並未強制，是這樣嗎？如果未強制通報，等於未通報卻實際上被放無薪假的勞工，未來可否向勞動部請領安心就業方案補助？,262,LCIDC01_1090901_00008
蔣萬安,不行？但他有權益受損的事實……,263,LCIDC01_1090901_00008
蔣萬安,我知道，必須有通報，勞動部始能掌握是否放無薪假或減班休息，並讓勞工得以請領安心就業方案。但我的問題是，既非強制要求雇主通報，如此就會出現黑數！也就是實際上員工被放了無薪假或減班休息，勞工權益確實受到損害，既然勞動部提出方案來照顧勞工，畢竟勞工薪資減少。針對應通報但未通報，其實不能說是應通報，因為勞動部未強制規定，可是雇主就是沒有通報，而勞工也確實被放了無薪假，勞動部確認這種勞工無法請領安心就業方案？這點是我想確定的。,264,LCIDC01_1090901_00008
蔣萬安,有罰則嗎？部長說這是行政指導？,265,LCIDC01_1090901_00008
蔣萬安,所以就是應通報而未通報，好不好？,266,LCIDC01_1090901_00008
蔣萬安,五人以下企業未強制投保，但有就保。如果出現應投保而未投保，也就是出現黑數，或應通報而未通報，致使勞工在這波疫情當下，勞動權益發生事實受損，請問到底能不能受到安心就業方案的照顧？,267,LCIDC01_1090901_00008
蔣萬安,這點我知道……,268,LCIDC01_1090901_00008
蔣萬安,想想其他辦法？也就是不適用現在安心就業方案？,269,LCIDC01_1090901_00008
蔣萬安,我在臨時提案中有提到通報黑數，應通報未通報，或者五人以下企業因未強制投保，或五人以上應投保勞保而未投保的企業。也許這些企業確實違法，勞工也讓違法雇主強迫放了無薪假而權益受損。既然你們針對疫情推出相關方案，那麼對於這些人是否適用安心就業方案的問題，請勞動部儘快研議，讓這些權益受損的勞工能在疫情影響之下，也能接受勞動部相關方案的補助，可以嗎？,270,LCIDC01_1090901_00008
徐志榮,主席、各位列席官員、各位同仁。聽到沒有強制通報，或應通報未通報，這到底……,271,LCIDC01_1090901_00008
徐志榮,我建議勞動部出個函釋或指引，讓大家都通報，否則「無薪假」這個詞就成立了！這樣就不能說沒有無薪假！因為雇主未通報，也不給勞工基本工資，就是直接休息沒薪水，這豈不是真正的無薪假？也就真的放無薪假了！,272,LCIDC01_1090901_00008
徐志榮,通報才有基本工資，才可領差額，並減班休息，可是你們並未強制通報啊？,273,LCIDC01_1090901_00008
徐志榮,但沒有通報就不能領錢，雇主也可以不發基本工資，說是勞資雙方協議好的！為了保住工作，勞工根本不敢檢舉，甚至沒領半毛錢，這樣不就是真正的無薪假了？,274,LCIDC01_1090901_00008
徐志榮,所以你們必須發函釋或指引，讓企業……,275,LCIDC01_1090901_00008
徐志榮,修法就會比較慢，但如果該修法的話還是要修法！謝謝。,276,LCIDC01_1090901_00008
蔣萬安,主席、各位列席官員、各位同仁。我幫部長說明一下。為了因應疫情，故而勞動部推出安心就業方案，至於無薪假通報與否這點，勞動部並未強制。只是勞動部係於疫情期間推出薪資差額補貼方案，因此，只要有放無薪假事實並通報者，即可提出申請，以避免發生道德風險，我想應該是這樣，對不對？,277,LCIDC01_1090901_00008
蔣萬安,對，這應該是你們的思考方向。,278,LCIDC01_1090901_00008
蔣萬安,另外，向地方政府勞工局通報放無薪假或減班休息的勞工人數與企業家數應該是每天都會變動，你們可否於網路公告？,279,LCIDC01_1090901_00008
蔣萬安,既然每天統計，是否每天公告？,280,LCIDC01_1090901_00008
蔣萬安,你們多久公告一次？,281,LCIDC01_1090901_00008
蔣萬安,現在屬於比較特殊的期間，加上紓困條例已經通過，各部會、包括勞動部在內，都推出很多紓困方案，因此公布的頻率可否提高？,282,LCIDC01_1090901_00008
蔣萬安,只要人數、家數有更新，你們也在網路上同時更新數字？,283,LCIDC01_1090901_00008
蔣萬安,讓大家知道勞動部的紓困方案是用在被放無薪假或減班休息的勞工身上？,284,LCIDC01_1090901_00008
黃秀芳,（11時48分）主席、各位列席官員、各位同仁。很多旅遊業、飯店、餐廳因為這波疫情而倒閉收店，請問到目前為止有多少人減班休息？勞動部是否有掌握？,285,LCIDC01_1090901_00008
黃秀芳,對此，勞動部有何因應？特別是當業者提報減班休息時。,286,LCIDC01_1090901_00008
黃秀芳,所以你們有分短中長期計畫？,287,LCIDC01_1090901_00008
黃秀芳,從媒體報導可知，一些餐飲業者因為疫情關係收店了，以致廚師、服務人員失業，其中有的還不是全職人員。如果你們知道類似情況的話，我希望你們能夠主動給予協助。,288,LCIDC01_1090901_00008
黃秀芳,主動關心？,289,LCIDC01_1090901_00008
黃秀芳,剛剛有幾位同仁提到，企業減班休息卻不一定通報，對不對？,290,LCIDC01_1090901_00008
黃秀芳,有的企業也許有通報，但會不會有人藉著疫情做通報，之後進行真資遣？有沒有可能發生這種事？,291,LCIDC01_1090901_00008
黃秀芳,其實就是直接資遣勞工！雇主可能原本就想……,292,LCIDC01_1090901_00008
黃秀芳,對此，勞動部也要關心才是。,293,LCIDC01_1090901_00008
黃秀芳,上禮拜在9樓開會時，我曾質詢過部長……,294,LCIDC01_1090901_00008
黃秀芳,移工在30個月內必須進行4次健康檢查，當時部長允諾會調整，請問目前調整狀況為何？,295,LCIDC01_1090901_00008
黃秀芳,變成九個月？,296,LCIDC01_1090901_00008
黃秀芳,如健檢期間適逢疫情……,297,LCIDC01_1090901_00008
黃秀芳,可能原本要健檢了，但疫情又不斷延燒，請問怎麼辦？還要繼續延嗎？,298,LCIDC01_1090901_00008
黃秀芳,這次武漢肺炎確診案例的第32例為非法外籍看護，剛剛部長提到，有人知道這些非法移工在哪裡。既然如此，我們的移工政策是不是應該檢討？為何會有這麼多移工找不到？勞動部不知道移工在哪裡，也無法掌握，為什麼他們會跑掉？為何不待在原雇主身邊，為何要跑掉？我想這不僅是一個黑數，還有人知道這些人跑去哪裡！剛剛有委員問，勞動部有沒有打算藉由這次疫情，讓這些非法外勞轉為合法？這固然是可以討論的一點，問題是，他們為何要自原雇主身邊逃跑到其他雇主那裡去？勞動部真的應該對此進行深入檢討，否則這個黑數會永遠存在！目前總共有5萬名非法移工……,299,LCIDC01_1090901_00008
黃秀芳,將近5萬人。對此，勞動部打算如何檢討？,300,LCIDC01_1090901_00008
黃秀芳,如果是因為薪資太低的話，又該如何改善？也許這個雇主身邊待不下去了，但能轉到其他地方去啊？這點是不是應該檢討？否則黑數就會永遠存在！,301,LCIDC01_1090901_00008
黃秀芳,我希望勞動部未來能對此進行檢討。職安署在每年3月都會進行當年度專案勞檢，既然現在有疫情，那麼年度的專案勞檢與職業安全衛生檢查是否會因為疫情而往後延？也就是除非有檢舉或申訴案件才會檢查，否則就是暫緩？,302,LCIDC01_1090901_00008
黃秀芳,我知道有縣市因此而對勞檢與職安做調整，但地方與中央理當同步，不能地方做地方的，至於中央定了一套規定，卻與地方完全不同，我認為中央與地方必須統一。,303,LCIDC01_1090901_00008
黃秀芳,針對口罩問題，有的工廠本來就需要使用口罩，譬如揮發性或會產生粉塵的工作，確實需要使用口罩！有業者抱怨說，原本他們有配合的口罩工廠，現在卻統統買不到！前幾次我拜託經濟部工業局做協調，但勞動部職安署也理當針對這些有口罩需求的產業，如活性炭口罩或產業用口罩來做統合，看哪幾個產業確實有此需要並做調配。畢竟現在徵收的是醫療用口罩，如此，活性炭與產業用口罩就不在限制內！問題是，口罩業者還是不敢賣！爰此，我希望職安署能與經濟部工業局進行溝通與協調，不要讓有需要的業者買不到，這畢竟與勞工身心健康有關。,304,LCIDC01_1090901_00008
