speaker,speech_text,speech_number,meeting_id
賴香伶,我們知道最後的結果了，但是我要跟移民署、勞動部講，不管是院長或者是陳時中部長，甚至勞動部許部長都知道不能讓防疫破口落在逾期停居留的人，包括失聯移工、包括沒有證件的外國人，我們都稱呼他們為逾期的人。這8萬人目前的接種率，我看勞動部的數字寫得很漂亮，但我想總體上來看，現在不管是合法移工或失聯移工的施打率本來就很低，低於全國，很多國家包括馬來西亞、歐盟等等，甚至採取了讓失聯移工在防疫期間就地合法的方式，鼓勵他們出來。勞動部你們自己看到現在為止的數字，你們有什麼方法？再加上昨天的事情可能造成更多人不敢出來，等於你是未盡其功之外還自己破功耶！,67,LCIDC01_1111201_00006
賴香伶,這是之前的數字，所以現在已經提高了嘛！,68,LCIDC01_1111201_00006
賴香伶,不能用資訊落差解釋問題。,69,LCIDC01_1111201_00006
賴香伶,剛剛已經講了，12月2日、12月6日、12月7日，全國最高的行政長官都已經發布命令，你們的專案報告到現在還不簽出來，我們國會委員要索資卻一張都拿不到，是什麼樣的機密文件？,70,LCIDC01_1111201_00006
賴香伶,如果再發生第二件呢？,71,LCIDC01_1111201_00006
賴香伶,所以你認為是施打地方造成這個問題嗎？如果到NGO、到宗教團體就不會發生這種狀況嗎？,72,LCIDC01_1111201_00006
賴香伶,目前有來接洽願意成為施打點的宗教團體或NGO，有統計了嗎？,73,LCIDC01_1111201_00006
賴香伶,分布在全省各個不同縣市？,74,LCIDC01_1111201_00006
賴香伶,新竹有嗎？像昨天新豐衛生所，你們應該下去輔導協助……,75,LCIDC01_1111201_00006
賴香伶,好，所以希望我們下次看到的數字就不是八成的失聯移工跟非法居留者沒有打，好不好？我們一再跟部長要大潭電廠移工引進的專案報告，我從11月19日索資到現在，當時蔣萬安召委也給我承諾，他說你們在12月6日（星期一）一定會給我專案報告，結果到現在已經20天了還是沒有拿到，部長，這是卡在勞動部還是卡在衛福部？,76,LCIDC01_1111201_00006
賴香伶,勞動部作為勞工引進的主管機關，他們不是早就應該發過相關的文請你們備查而有紀錄，怎麼會是重新要他們盤點資料給你？你們作為主責的機構怎麼會沒有資料呢？,77,LCIDC01_1111201_00006
賴香伶,從5月到現在到底有多少專案引進？現在總有資料了吧！我要感謝有一位府會聯絡人一早還給我資訊說勞動部會回文給我，已經20天了，到現在還沒有拿到耶！請問有多少？,78,LCIDC01_1111201_00006
賴香伶,才3案？有多少人？,79,LCIDC01_1111201_00006
賴香伶,今天會發文？,80,LCIDC01_1111201_00006
賴香伶,那你現在現場講嘛！3批有多少移工？,81,LCIDC01_1111201_00006
賴香伶,5月以前的嗎？,82,LCIDC01_1111201_00006
賴香伶,會展中心嗎？,83,LCIDC01_1111201_00006
賴香伶,5月19日前有一個專案，之後也有一個專案？,84,LCIDC01_1111201_00006
賴香伶,多少人？,85,LCIDC01_1111201_00006
賴香伶,所以5月到現在的專案就是經濟部這兩個……,86,LCIDC01_1111201_00006
賴香伶,一個是專案前、一個是專案後。,87,LCIDC01_1111201_00006
賴香伶,只有大潭，那是哪一國的？,88,LCIDC01_1111201_00006
賴香伶,我要跟部長講，我上次質詢的時候，你站在這裡信誓旦旦地講11月11日以後引進的以印尼籍為主，對吧？以印尼的移工為主。,89,LCIDC01_1111201_00006
賴香伶,為什麼沒有考慮泰國跟越南？是基於他們防疫跟疫情的狀況？,90,LCIDC01_1111201_00006
賴香伶,我之前質詢過指揮官陳時中部長，他竟然跟我講說勞動部從來沒有關過越南籍的，你說他是不是打臉你？,91,LCIDC01_1111201_00006
賴香伶,專案就可以放水嗎？專案就可以隨便引進不同國籍的嗎？不可能嘛！即使是5月前申請的，5月到11月中間的專案也是由您決定哪一個國家可以開放，為什麼他們可以開放？,92,LCIDC01_1111201_00006
賴香伶,你這裡有寫嘛！勞動部的專案只有印尼的，那為什麼其他國家可以？,93,LCIDC01_1111201_00006
賴香伶,我請教你是不是兩套標準？,94,LCIDC01_1111201_00006
賴香伶,我知道，所以前面為什麼只讓印尼籍進來？是不是基於他們國家疫情的考慮？,95,LCIDC01_1111201_00006
賴香伶,那為什麼經濟部的專案引進，指揮中心可以開放？你總要說個道理，你作為把關者，為什麼他們可以？,96,LCIDC01_1111201_00006
賴香伶,今天外交部沒有來嗎？,97,LCIDC01_1111201_00006
賴香伶,外交部講只有人道、緊急性，哪來公益性跟專案性？沒有寫到，自己的資料都不完備還在這邊說嘴！所以我希望你們面對……,98,LCIDC01_1111201_00006
賴香伶,你們的積分制跟國籍要重新調整，要加一個，不然人家以為你只為了經濟、為了資本，但是家庭看護、家庭的需要你們卻沒有引進，這是事實。,99,LCIDC01_1111201_00006
賴香伶,那個是11月11日才來，12月15日就要關了啊！是不是？,100,LCIDC01_1111201_00006
賴香伶,所以為什麼泰國可以，印尼……,101,LCIDC01_1111201_00006
賴香伶,我知道啊！,102,LCIDC01_1111201_00006
賴香伶,泰國不能配合防疫計畫，那專案引進是為什麼可以答應？是因為經濟上……,103,LCIDC01_1111201_00006
賴香伶,大潭電廠需要嘛！不像家庭要等很久才能引進。我希望你們重新檢視自己寫的積分制，以及專案本身是不是有哪裡未盡完備，包括你們講的公益性，因為指揮中心資料只有人道、緊急，沒有你講的這個。我希望勞動部自己檢視，勞動部作為勞工主管機關，本國的、外國的，甚至家庭看護的、公共建設的，我們不是說完全不能處理，但是自己的政策不要雙標，不要在作法上讓人家起疑心，認為你是為了部分的特殊性原因，像是大潭電廠，大家會質疑嘛！我不覺得政府在這部分可以有這麼多套標準。最後請教職安署署長，大潭電廠是不是在引進移工後沒多少天就發生重大工安事件？移工是不是就受傷了？還驚動高層，有嗎？,104,LCIDC01_1111201_00006
賴香伶,那你們接收到什麼通報？,105,LCIDC01_1111201_00006
賴香伶,有接收到通報嗎？,106,LCIDC01_1111201_00006
賴香伶,沒有嗎？沒有接收到通報？,107,LCIDC01_1111201_00006
賴香伶,請你們檢視一下，1週內把他們的檢查報告給我，好不好？第一個，是不是有職災沒通報？第二個是移工的工安訓練。剛剛蘇巧慧委員已經問得很細了，工安就是職業訓練跟安全訓練到不到位，他們有沒有證照去操作機具？針對丸紅引進多少移工、有沒有發生職災、有沒有通報，在1週內把檢查報告給我。,108,LCIDC01_1111201_00006
賴香伶,謝謝部長。,109,LCIDC01_1111201_00006
邱泰源,（10時16分）部長好。我們是防疫的生命共同體，但是要如何延伸到弱勢，也就是一般照顧不到的族群，今天主席非常用心、關心這個題目，我看大家也都很用心、關心，但是解決這個問題恐怕需要更多特別的想法，或是超越一些想法才能更好地解決。我稍微review一下京元電子這件事情，其實在座的徐志榮委員也付出很多心力去當地關心，整體來講算是控制得不錯，但不是控制下來就不需要檢討，一定要學習到更多的經驗，當時比較緊急的時候，尤其是當地的醫院，我覺得有一天應該要把這些歷史記下，例如為恭醫院、敏盛醫院都沒日沒夜拚了好幾天才完成所有的採檢，其實這是穩定下來的重要一步。就像我們在921大地震的時候，其實都是當地醫療院所的人去救援，後面的大型醫學中心再過去都是兩、三天以後，因為路也不好走，說難聽一點，死的死、重傷的早就送走了，輕傷也不需要你來看，所以我們覺得當地的防疫聯盟相當重要。我們很敬佩當時總統有指示成立一個竹竹苗防疫聯盟，所以醫師公會也立即召開會議找來3個縣市的衛生局長及醫療院所的院長，林智堅市長也有出席，當時大家是用視訊方式開會，有很多、很多的結論。我們來檢討其中一個部分，有關移工在「14+7」以後的情形，像這次臺中有幾位好像是檢疫期滿才驗出來，所以我們還是要謹慎一點，請問現在「14+7」以後的安排為何？有沒有更保險的安排方式？,110,LCIDC01_1111201_00006
邱泰源,我指的是後續。「14+7」沒問題，是7天以後的問題，7天以後他們到哪裡去？,111,LCIDC01_1111201_00006
邱泰源,有沒有安排一人一室？這部分做得怎麼樣？如果又回到集中居住還是有危險性。,112,LCIDC01_1111201_00006
邱泰源,我是說「14+7」以後呢？,113,LCIDC01_1111201_00006
邱泰源,如果PCR陰性的話，還是一人一室？,114,LCIDC01_1111201_00006
邱泰源,當然是陰性，不然怎麼可以出來？,115,LCIDC01_1111201_00006
邱泰源,不是要用廢棄廠房等等讓他們可以隔離嗎？,116,LCIDC01_1111201_00006
邱泰源,我覺得後續如果處理好，我們也會比較安心。,117,LCIDC01_1111201_00006
邱泰源,因為未來要應付各種變異的病毒，很難說我們的策略永遠趕得上進度。當然後續要小心一點，萬一有任何的閃失，恐怕就像京元電子一樣是個嚴酷的考驗。,118,LCIDC01_1111201_00006
邱泰源,這部分我後續會再關心。接著是大家今天關心的議題，我覺得我們要另類思考，你今天要一位私人移工到哪裡打疫苗？我實在想不通，就像剛剛講的新竹縣那件事情，我已經跑過一百多家診所，我不太相信有非法移工敢到診所打疫苗，而且這不可能，因為沒有剩下的疫苗，以前大家連殘劑都搶得要死要活，他又沒登記，政府也不會配給他，他要怎麼打？若是快打站也要看身分證件，我不曉得北車現在是怎麼施打，難道是來了就打、來了就發黃卡嗎？你怎麼查他之前有沒有打過？說不定他自己都搞不清楚之前有沒有打，現在基層出現的幾個狀況都是因為雇主沒帶移工去打，加上移工的語言溝通能力不好，他也搞不清楚是打流感還是什麼，結果就重複了。重複施打的醫師很衰，被檢討得要死，我覺得這部分要另類思考。我知道你們會去找NGO、慈善團體等單位幫忙，是不是可以把這些人叫到慈善團體，請醫療團隊默默到家裡或機構打針？可能有一點家庭醫師的觀念，這樣才有辦法解決。不然你叫他出來，來一個就抓一個，我不騙你！,119,LCIDC01_1111201_00006
邱泰源,我們的醫護人員是很願意的，請一個單位把現場弄好，我們去一次就打完，之後就像沒發生事情一樣，但其實他們都打到了，幾百個統統解決……,120,LCIDC01_1111201_00006
邱泰源,如果你叫他們一個、一個來，偏偏他們又長得跟我們不太一樣，他們來排隊一定東張西望，警察就過來了，警察最容易發現東張西望的人，就會跟他們要身分證來看，他們怕都怕死了，怎麼可能還叫他們出來？我實在想不通！所以這個方式要趕快進行思考。,121,LCIDC01_1111201_00006
邱泰源,可能要快一點，不然我們的針劑還有很多，要趕快處理，在人的身上打好打滿。最後補充一下，其實我們很需要關心移工，勞動部和移民署早就要設定如何跟醫療體系結合，讓他們在生病的時候獲得照顧，即使失能也是人嘛！有什麼辦法來照顧他們，不然要是發生一些淒慘的情況，像是生病發燒等等的情況，就把他們丟到急診室外面，然後被抓到之後可能就被遣送回國，我們不希望在臺灣發生這樣的事情。臺灣有優良的醫療體系，張育美總裁也在場，以我們優良的醫療體系，怎麼樣去approach這些人，用關懷的眼光、關懷的角度來處理？然我們希望給予人道的關懷，至少在防疫期間能夠有多一點的關懷作為，讓他們有問題都可以去就醫，這部分是要思考的，也請勞動部、移民署帶回去跟相關單位研究，好不好？,122,LCIDC01_1111201_00006
邱泰源,謝謝部長。,123,LCIDC01_1111201_00006
徐志榮,（10時26分）部長好，剛才聽說有兩萬多個移工有打疫苗，他們是逾期還是合法的移工？,124,LCIDC01_1111201_00006
徐志榮,剛才邱召委也講了，我也是將心比心的講，我也想像不出那兩萬多個移工敢出來打疫苗，尤其昨天新竹發生失聯女移工打疫苗遭逮，我相信更沒有人敢出來打。抓逾期居留移工是移民署的業務吧？,125,LCIDC01_1111201_00006
徐志榮,你們有說現場不收費、不查處、不通報，這個時間到底多久呢？現在移工出來打疫苗，你們是沒有抓、沒有查報，但這畢竟是移民署的業務，當這名移工打完疫苗離開的時候，移民署的人可以跟隨他回到非法工作的工廠、處所或住處，雖然現在不查處，但這是你們的業務，過多久你們可以查處？打疫苗的兩萬多名移工，到目前為止有沒有人被查處？,126,LCIDC01_1111201_00006
徐志榮,就只是檢測而已。,127,LCIDC01_1111201_00006
徐志榮,我簡單問你，他們是逾期居留，不管是做PCR檢測也好，打疫苗也好，要過多久你才可以抓他？有相關的規定嗎？,128,LCIDC01_1111201_00006
徐志榮,我問的重點是多久以後你們可以去執行業務啦！,129,LCIDC01_1111201_00006
徐志榮,就還是要查處嘛！所以他怎麼會安心……,130,LCIDC01_1111201_00006
徐志榮,我知道那個情況不會，你們說不收費、不查處、不通報，就是在施打疫苗的現場不會，但是怎麼保證他回去之後三、五天不會被你們抓呢？他會不會擔心呢？一定會嘛！那時候你們也可以查處他嘛！,131,LCIDC01_1111201_00006
徐志榮,對啦！但我講的意思是你們在他打完疫苗之後三、五天抓他，這就是正常的嘛！所以他去打的意願不會高啦！其實我也不跟你爭論什麼，因為這個豁免不是長達1年或半年時間不抓他，不是這樣子嘛！,132,LCIDC01_1111201_00006
徐志榮,部長，我主要說的是這些移工一定會擔心，所以各部會包括衛福部、移民署、勞動部，就讓他們安心的來打疫苗，然後是不是可以給予合法的延長居留一段時間，看是半年還是1年？他本來是非法居留，願意出來打疫苗，就給予合法延長一段時間，反正現在他也回不去啊！這樣他們才能夠安心的出來打疫苗。我們當然希望這些人能夠出來打，就是怕他們沒打會影響到國人啊！所以我的意思是給予合法的延長，你們各部會去研究一下，他們才會安心的出來打。不然照組長講的，當天他出來打是不會被抓，但是誰敢保證明天、後天不會被你們抓呢？部長聽得懂我講的意思嗎？就是讓這些人能夠安心的出來打疫苗，覆蓋率才會提高。另外，有關外送員保險的部分，我看你們有列出一個附表，請問那個時間是包含24小時嗎？其實應該要24小時，但有沒有包括非外送員工作的時間？就是當時他沒有在送餐，而是他自己在……,133,LCIDC01_1111201_00006
徐志榮,要在外送工作的時候？,134,LCIDC01_1111201_00006
徐志榮,這樣也是合理的，但是24小時都應該要涵蓋在內，有時候送餐時間是人家要吃宵夜，那個時間也要涵蓋。,135,LCIDC01_1111201_00006
徐志榮,瞭解。不過我是認為3萬元的保障金額不太夠，是不是可以跟平台溝通一下提高到5萬元，當然保額高，保費就會多一點，我是覺得5萬元可能比較有效果。實際上，包括交通部、警政署等等都有談及交通安全，我都很認同，但是比較沒有阻嚇作用，主要的預防之道是什麼？我們可以仿效外國的機制，你們跟警政署和各個平台等等，大家座談商討一下，就是只要有違規，不管超速、闖紅燈或者肇事，就是採記點制，譬如達到某一個點數，該外送員3天不准工作，或者更嚴重就5天或一個禮拜不能做外送工作，警政署要把相關的資訊給各個平台，不管是Uber Eats或foodpanda，所有平台業者都禁止用這個外送員，看是3天或者5天，這樣子才比較會有嚇阻作用，否則你怎麼強調交通安全，他當然知道，但是因為工作使然，他就是要搶時間，十次車禍九次快，這個大家都知道。所以我是建議用記點的方式，累積的點數越嚴重，停止他工作的權利就越多天，然後每個平台都適用，每個平台都要通報，這樣的作法可能會減少外送員發生意外的機率，這也是我的一種建議，請你們跟警政署等相關部會去研商。,136,LCIDC01_1111201_00006
徐志榮,謝謝。,137,LCIDC01_1111201_00006
張育美,（10時35分）部長好，最近變種病毒Omicron來勢洶洶，在中央流行疫情指揮中心所公布新增的COVID-19境外移入個案中，就有印尼移工染疫的案例。我首先要請教部長，你們針對變種病毒是否有和指揮中心討論加強移工專案入境檢疫的措施？如果移工來源國的疫情加劇，是否會考慮暫緩該國移工的入境？,138,LCIDC01_1111201_00006
張育美,明確的標準是什麼？,139,LCIDC01_1111201_00006
張育美,好。為了減輕失能者家庭的照顧負擔，還有保障外籍家庭看護工休假的權益，勞動部在107年12月補助衛福部來推動擴大外國人看護工家庭使用喘息服務，並持續放寬一些補助的標準。自109年12月1日也放寬適用的對象，就是會評估長照需要的等級，以前只有第8級可以申請，現在放寬為第2級到第8級，如其所聘用外籍看護工休假或因故請假無法協助照顧，即可申請喘息服務，就是不再受限30天以上空窗期的限制。就像部長所說的，滾動式的逐步放寬申請標準，讓更多家庭能夠使用喘息服務，我們都給予肯定。但是我們來檢討一個問題，請各位看這個擴大外國看護工家庭使用喘息服務的表格，在107年的時候是限於第8級，所以執行率只有1.38%；在108年有好一點，執行率是9.64%；109年放寬為第2級到第8級，所以執行率是18.54%。我要請問部長，今年的成效是怎麼樣？,140,LCIDC01_1111201_00006
張育美,我是要問執行率的百分比是多少。,141,LCIDC01_1111201_00006
張育美,對，要等到年底，去年的執行率是18.54%。,142,LCIDC01_1111201_00006
張育美,我希望你們在明年初告訴我們這個預算的執行率是多少。,143,LCIDC01_1111201_00006
張育美,擴大喘息服務的補助標準雖然有逐步放寬，但是從實務面來看現行的長照居家喘息服務，如果是最嚴重的第8級失能，就像在還沒有放寬的時候是限於第8級，一年的額度是四萬多元，一天最高可以使用10小時，第8級其實很嚴重，可是換算下來第8級卻只能使用12.6天，而且在目前還採預約制。雖然我們現在重新開放移工的專案，但是移工的數量仍然不夠，勞動部是否會與衛福部進行跨部會的研議，針對等待的家庭採取彈性的配套措施，以分擔這些家庭的照顧壓力？,144,LCIDC01_1111201_00006
張育美,一年最多只能使用12.6天。,145,LCIDC01_1111201_00006
張育美,部長，其實最重要的就是因為疫情未歇所以全臺大缺工，現在有這麼多的長照需求，很多護理之家沒辦法開床，老人家在家裡沒辦法照顧，所以我要求勞動部對於長照人力不足的問題要提出中長期的規劃，不能只仰賴移工，我覺得最重要的就是本國籍照服員的人力培訓，你們要與衛福部進行跨部會的研議，才能真正解決照顧人力不足的問題，所以我們應該要自己培訓本國籍照服員的人力，部長認為呢？,146,LCIDC01_1111201_00006
張育美,開班的速度要快一點，然後我們有那麼多的人力，可以來培訓他們的專業，所以我覺得這個要放寬，讓本國籍的人力可以快速的就業，加入長照這個市場，你覺得對不對？,147,LCIDC01_1111201_00006
張育美,我再問部長一個問題，最近桃園發生超商大夜班員工遭人刺死、屏東的挖眼案，還有臺中有店員被毆打而重傷的事件，都是超商店員因為勸導客人戴口罩而發生的重大刑案。剛剛邱委員有說本席也是來自醫療界，所以我就跟邱委員一起來關心醫療界，夜間的職場暴力並非只有發生在零售業及餐飲業，世界衛生組織衛生指出，醫療工作人員是遭受暴力風險最高的族群，在職場生涯中遭受不同程度的身體暴力者占8%到38%，就是身體被打的暴力，還有大多數人都遭受過言語的攻擊。像美國職業安全衛生署就將在「醫療保健與社會服務場所」以及「深夜零售場所」工作的勞工列為職場暴力高風險行業，針對這些勞工訂定職場安全指引。同樣的，英國的安全衛生執行署更早就於1987年發布「醫療服務業員工預防暴力與侵犯：風險評估與管理指引」。那我們來看臺灣，勞動部在2015年曾經進行研究，確認醫療保健與社會服務業的勞工處於職場暴力的高風險，你們承認他們是高風險，應由政府機關設計醫院職場暴力預防指引並提供給雇主參考。你一定會回答我衛福部有訂定，但是衛福部訂定的是「危害醫院醫療安全之應變流程指引」，這是著重在醫療暴力事件發生後的應變，就是萬一被打、被罵要如何應變，可是對於醫療職場的暴力預防是不足的。部長，你會跟我說衛福部已經有訂定，但是我要提醒部長，勞動部之前發布的「職場夜間工作安全衛生指引」是普遍性的針對所有類型的行業，但是針對高風險的行業、醫療保健社會服務的場所，勞動部應該比照我剛剛所講美國、英國的作法，特別訂定具體可行、符合醫療特性的職業場所暴力預防指引，我建議勞動部去邀請衛福部、醫事團體和工會代表，包括我們醫師公會的邱理事長，大家共同來討論可行的作法。請問部長是不是可以允諾在什麼時候展開討論？,148,LCIDC01_1111201_00006
張育美,什麼時候？因為這個問題這麼重要，你看有被打過的醫療人員占8%到38%，而大多數的人都曾受過言語暴力，所以不僅應該由衛福部、勞動部、醫師公會及醫事團體，還有公會代表共同參與，請問部長，大概什麼時候可以展開規劃？,149,LCIDC01_1111201_00006
張育美,好，謝謝部長關心夜間工作的團體、產業以及醫事人員的安全。,150,LCIDC01_1111201_00006
莊競程,（10時45分）部長好。指揮中心在12月5日（星期日）表示，考量目前國內持續提升COVID-19疫苗的接種能量，為了積極防範國際疫情嚴峻情形及新型變異株威脅，並降低社區傳播風險，從明（111）年1月1日起，教育部、經濟部、勞動部以及衛生福利部所有業管場所（域）的防疫指引，將強化COVID-19疫苗接種的規範，以嚴守社區防線。相關規範明定所有工作人員或從業人員皆應接種兩劑COVID-19疫苗且屆滿14天，復業及新進人員於首次服務前，應同時提供自費3日內抗原快篩（含家用快篩）或PCR檢驗陰性證明。請問部長，勞動部業管的單位應如何查核並落實這項制度？擴大來看，因應相關規定的實施，勞工的工作權益如何同時獲得保障？如果不願意出示接種證明或PCR檢驗陰性證明，工作權是不是會被限制？目前看起來，好像沒有相關的罰則，但相關規範曾與指揮中心作過哪些討論？會研擬哪些實施方向？,151,LCIDC01_1111201_00006
莊競程,有這樣的機制就對了。,152,LCIDC01_1111201_00006
莊競程,當然，勞動部也要跟雇主說明這樣的措施，對於雇主整體及整個工作環境的安全是有保障的。也希望他們可以配合政府的政策去推動，或勸導那些不願意配合的員工，思考要怎麼處理，同時要確保其工作權益。,153,LCIDC01_1111201_00006
莊競程,好，謝謝部長。今天就失聯移工的問題已經討論得很多了，勞動部知道有多少比例的失聯移工出來接受這項專案的疫苗接種嗎？,154,LCIDC01_1111201_00006
莊競程,一千六百多人。,155,LCIDC01_1111201_00006
莊競程,就像蘇委員講的，一千六百多人，但是發生了新竹縣的個案，施打疫苗時在衛生所就被帶走，可能會影響後續失聯移工出來的意願。今天很多委員已經提出很多方向，還是要請勞動部或移民署研擬一下，怎麼樣讓失聯移工可以安心地出來打疫苗。,156,LCIDC01_1111201_00006
