speaker,speech_text,speech_number,meeting_id
蔣萬安,所以次長剛才談的就是，你們會落實居家檢疫，儘量降低任何可能違反規定，出去趴趴走的風險，當然這部分要朝降低這樣的風險來做，所以現在我也知道你們說，如果回來做居家檢疫，他可能沒有適合的居家檢疫條件，你們說就請他們一律住到防疫旅館，我覺得很好。,169,LCIDC01_1092801_00002
蔣萬安,但是前提是，應該說，如果沒有在機場做第一次的全面普篩，回來不管是在居家或防疫旅館，都同樣會提高這樣子傳播的風險，我的意思是如此。,170,LCIDC01_1092801_00002
蔣萬安,"再怎麼樣，我們都應該採最嚴格、最高標的方式，尤其其他國家也在做。特別現在我們入境的旅客不到1,000人，在量能足夠的情況下，我認為是可以的。所以接下來談到檢測量能的問題，請教次長，當其他國家也都在核准快篩試劑的上市，我們臺灣的進度是什麼？",171,LCIDC01_1092801_00002
蔣萬安,好，簡單回答。,172,LCIDC01_1092801_00002
蔣萬安,我簡單問，請問什麼時候可以上市？,173,LCIDC01_1092801_00002
蔣萬安,所以最快什麼時候？幾月份？,174,LCIDC01_1092801_00002
蔣萬安,行政院4月13日有召開一個醫藥防疫科技研發的記者會，宣布預計投入21.6億元，進行醫藥的防疫科技研發，這當中有11.9億元，相當於12億元要做提升檢驗的能量，包括工研院、中研院、國衛院等等，預計的量產時間都要等到七、八月，這是我國的部分。次長，我整理了其他國家的研發情形，南韓一個月核准4種快篩試劑，美國3月27日就宣布可攜式的檢測工具，5分鐘就可以檢驗出是否感染新冠肺炎，德國的汽車零件大廠Bosch也研發快篩設備，會在4月就推出，準確率高達95%，兩個半小時可以得知檢測的結果。鄰近的新加坡，他們的一家Biolidics公司，也宣布其產品10分鐘可以檢測出來95%的COVID-19。我們防疫工作在前段做得很好，現在我們希望阻絕任何的可能性，這同樣連帶到我們的快篩檢測量能、試劑能不能量產上市，能不能那麼快的使用，當其他國家都做的這麼超前，我們的快篩呢？我在3月18日就提出質詢，到現在也一個月了，我還是沒有看到我們對於快篩這個部分有任何的進展或進度，或是預期可不可以馬上，像其他國家一個月就有4種試劑可以上市。,175,LCIDC01_1092801_00002
蔣萬安,如果加快，最快什麼時候？4月底？,176,LCIDC01_1092801_00002
蔣萬安,好，所以我希望儘快啦，如果現在有一個已經核准了，我不希望到4月底我又要再質詢一樣的問題，然後看到其他國家都陸陸續有快篩試劑上市，韓國因為他們研發出來後上市，有30多個國家跟韓國購買，這也是一個很大的商機。,177,LCIDC01_1092801_00002
蔣萬安,所以我希望衛福部在這一塊可以加速相關的進度。最後，這一次我們對於COVID-19給予相關人員的獎助金，當然包括第一線防疫的醫護人員，請問放射師有沒有包含在內？,178,LCIDC01_1092801_00002
蔣萬安,醫檢師呢？,179,LCIDC01_1092801_00002
蔣萬安,清潔人員呢？,180,LCIDC01_1092801_00002
蔣萬安,我也希望衛福部能將他們納入。,181,LCIDC01_1092801_00002
蔣萬安,現在藥師的部分，當然也有，因為是在第一線協助發放口罩，但是醫院的藥師也應該把他納入，雖然他不在第一線接觸病人，但是他們在這一次防疫整體的工作上，也是非常辛苦，能不能考慮放進去？,182,LCIDC01_1092801_00002
蔣萬安,好，還需要評估。最後，救護人員呢？所謂的EMT救護人員，因為現在他們被整個獎勵金的範圍忽略了。可是現在所有只要確診的人，都是靠他們去幫忙送到醫院，他們是實際近距接觸確診案例的人，風險其實是更高，我認為指揮中心也好，衛福部也好，應該也將他們納入獎勵的範圍內。,183,LCIDC01_1092801_00002
蔣萬安,這個當然要做區隔，但是我希望能夠將他們納入，因為他們是高風險待命，非常辛苦。,184,LCIDC01_1092801_00002
蔣萬安,好，謝謝次長。,185,LCIDC01_1092801_00002
張育美,（11時10分）主席、各位列席官員、各位同仁。次長，健保署最近公布了今年1月份各醫療院所服務點數申報的情形，請問次長，你有沒有掌握到各層級醫院醫療服務衰退的幅度？,186,LCIDC01_1092801_00002
張育美,請問健保署李署長，剛剛次長提到的數字其實只是1月份的部分，現在已經是4月，一季已經過去了，我們少了2月、3月的部分，這部分等一下再請署長回答一下。我知道1月份是疫情剛開始嘛，我們的醫學中心衰退的比例確實沒有區域醫院、地區醫院那麼多，醫學中心的衰退並沒有很高，但19家醫學中心裡面有9家也是衰退超過10%，中部的醫學中心則是更多，有超過16.5%的下降。區域醫院和地區醫院來講是比醫學中心慘，地區醫院單月就有86家衰退15%，區域醫院有6家衰退超過15%，您都知道嗎？這些醫學中心、區域醫院過去每天都是非常熱鬧的，好像市場一樣有那麼麼多病人，醫學中心降10%、15%是很不得了的事情，所以我要請教署長，2月、3月是不是衰退的更厲害呢？如果疫情這樣下去，我們過去的分級醫療、醫療網的分布和民眾就醫的可及性，是不是會被打破呢？,187,LCIDC01_1092801_00002
張育美,謝謝署長，署長的說診所沒下降那麼多，可是我得到的是有些診所下降更多，下降五成的也有，可能他的facilities沒有醫院這麼好，所以有些民眾覺得自己感冒，就懷疑自己有沒有COVID-19，然後就跑到醫院去。不管怎樣，都在下降對不對？所以我想請問署長，你敢不敢保證下降之後，他的點值還能確保一呢？,188,LCIDC01_1092801_00002
張育美,可是現在大家的服務量都下降啊！點值當然可以保一以上，怎麼會服務量下降，你還不保一，那不就是乘以零點幾？,189,LCIDC01_1092801_00002
張育美,對，現在我就要跟你討論一下，你說按照去年的錢來給付醫療院所跟診所，可是他的業務量有下降，我跟你講為什麼有下降，區域醫院和醫學中心主要在防疫，所以有投入非常多的人力，他們是面對病毒防疫的第一線尖兵，甚至有很多物資都上漲到3倍或4倍，包括隔離衣、防護衣等等，署長你知道嗎？,190,LCIDC01_1092801_00002
張育美,戰備物資都漲價了。再來，診所應該不會碰到這個問題，區域及醫學中心會碰到什麼問題呢？一位疑似確診的病人來檢查，就要經過篩檢，而篩檢花得時間滿多的，一堆人穿著防護衣去篩檢，然後你知道嗎？一個隔離病房通常要用3、4床的病房來做隔離病房，負壓病房更是如此，所以如果是300床的區域教學醫院，他可能只剩下二百多床，所以在防疫裡面，每個隔離病房都需要有一組人力來服務、診療病人。最近還聽說有人要做機器人去換床單什麼的，將來應該是會有幫助的。因此，花了那麼多人力，病床還減得那麼少，他的點數一定拿得低嘛！所以我希望署長能答應，點值有點低啦！會增加的是一般比較小型的醫院，他不設負壓病房、不設隔離病房，他的門診量還上升，因為現在的民眾是這樣，譬如某家醫院有收肺炎的病人，他就會害怕，可能就不去了，所以有些門診量還上升，請問署長知道嗎？因為他沒有隔離病房，也沒有負壓病房，所以可以做一般的醫療服務，我為什麼會問點值能否確保是一？因為如果是一的話，我覺得這些防疫尖兵會覺得你有照顧他們。,191,LCIDC01_1092801_00002
張育美,碰到他可以轉給區域醫院……,192,LCIDC01_1092801_00002
張育美,這需要宣導，對不對？,193,LCIDC01_1092801_00002
張育美,剛剛有聽莊委員提到公務預算，公務預算是用到像從美國回來的人身上嗎？他可能不是用健保，而是用公務預算，一個確診病人要花二百多萬元，署長講的是總額，可是你沒有給公務預算耶！,194,LCIDC01_1092801_00002
張育美,所以公務預算有給這些設有負壓病房及隔離病房的醫院，對不對？,195,LCIDC01_1092801_00002
張育美,好，那我再請教署長，有媒體報導，醫界也都一直在傳健保署有表示從3月起直接給予院所去年同期的申報點值，請問這消息是真的嗎？我再講一遍，直接給予院所去年同期的申報點值，有一個媒體有報導，所有醫界都在傳，你有看到這個新聞嗎？請次長解釋一下。,196,LCIDC01_1092801_00002
張育美,那就是直接給予，可是記者是寫暫定，還是記者寫錯？直接給予跟暫定不一樣，直接給予是給他就好，暫定是他今年申報的金額如果小於去年的話，他就要還你，是怎麼樣？,197,LCIDC01_1092801_00002
張育美,這不是我說的，是昨天媒體講的，署長也看到，所以直接給予要改成暫定嗎？,198,LCIDC01_1092801_00002
張育美,"所以這要改暫定。再來我要請教，如果暫定給醫療院所，譬如去年給1,000萬元，假設今年他只有700萬元，那少的300萬元該怎麼還啊？是每個月還、攤扣還是怎麼樣？請你說清楚。",199,LCIDC01_1092801_00002
張育美,用整個年度是嗎？,200,LCIDC01_1092801_00002
張育美,我聽到你說兩季，就是到6月，其實只出來一個月是不準的，要一季一季比較準，那如果他兩季是少於去年的，少的部分其差額要怎麼還？,201,LCIDC01_1092801_00002
張育美,好，我希望你們的好意醫界要能享受的到，這些錢跟費用或是補助及專案都應該要能讓所有的醫檢藥護、醫事人員，不是醫療機構而已、不是診所而已，所有的醫事人員都能夠享受到政府對他們的鼓勵，他們站在防疫的第一線，他們會非常感動的！,202,LCIDC01_1092801_00002
張育美,謝謝次長跟署長。,203,LCIDC01_1092801_00002
林淑芬,（11時22分）主席、各位列席官員、各位同仁。昨天本席的服務處接到很多陳情個案，他們說買不到兒童口罩，根據昨天指揮中心的調整，要取消大人可以購買兒童口罩的管理政策，現在的問題在於兒童口罩好像也是要求每個藥局只有20人份的配送額，是不是？,204,LCIDC01_1092801_00002
林淑芬,好。,205,LCIDC01_1092801_00002
林淑芬,可是網路的通路已經關閉，網路的通路只有3天購買期嘛？,206,LCIDC01_1092801_00002
林淑芬,就是這兩個星期的quota，3天的購買期已經關閉了，對不對？,207,LCIDC01_1092801_00002
林淑芬,那是買4月23日以後的。4月9日到4月22日口罩App的門已經關了。,208,LCIDC01_1092801_00002
林淑芬,哪裡還有一批？,209,LCIDC01_1092801_00002
林淑芬,現在不是兩週9片嗎？,210,LCIDC01_1092801_00002
林淑芬,現在預購的是4月23日以後的，對不對？,211,LCIDC01_1092801_00002
林淑芬,什麼時候可以開始預購？,212,LCIDC01_1092801_00002
林淑芬,現在可以繼續預購？我講的是4月9日至4月22日這兩個禮拜，現在還可以買嗎？,213,LCIDC01_1092801_00002
林淑芬,我為什麼要講這個，你知道嗎？因為我知道你今天開放的是預購幼兒口罩而已，只有小小孩、幼兒尺寸的，沒有開放預購大小孩，沒有嘛？,214,LCIDC01_1092801_00002
林淑芬,我現在講的是大小孩，我現在是講12歲以下、8歲以上的小孩，新的網路通路現在已經關門了，對不對？舊的實體通路藥局家數也在減少，對不對？,215,LCIDC01_1092801_00002
林淑芬,我現在問你藥局的家數是不是一直在減少？,216,LCIDC01_1092801_00002
林淑芬,退出，而且不只303家，303家是統計到昨天你們所收到的申請個案數而已，你第一次說140家，第二次說240家，到昨天登記結束是303家，未來可能還會再增加。但是我現在要告訴你的是每一家的兒童口罩是限20人份的配額，購買的配額是20人份。,217,LCIDC01_1092801_00002
林淑芬,限制每一家只有20人可以買兒童口罩，結果都被大人買光了，然後他要回頭用網路購買，那個門也因為行政作業而關起來了。還有另外一個問題是，大人也可以買小孩的口罩，買光光了。所以很多人陳情9歲到12歲、8歲以上至13歲以下的小孩口罩，他們都買不到。針對這兩個禮拜，你們有沒有其他方法可以購買？我知道下個禮拜大家都會到網路上去購買了，可是這兩個禮拜，到目前為止都還買不到的人該怎麼辦？你有何對策？,218,LCIDC01_1092801_00002
林淑芬,不是，是這個禮拜口罩的quota跟下禮拜口罩的quota，他都買不到。你說下禮拜再買，那麼這兩個禮拜的口罩，他要去哪裡拿？,219,LCIDC01_1092801_00002
林淑芬,明天是買4月23日以後的口罩，你聽不懂嗎？但是我講的是4月9日至4月22日這中間怎麼辦？你有何對策來處理這個問題？,220,LCIDC01_1092801_00002
林淑芬,明天大人還可不可以買小孩的口罩？,221,LCIDC01_1092801_00002
林淑芬,我現在問你，你們是4月23日以後禁止大人買小孩的口罩，那麼明天大人可不可以繼續買小孩的口罩？,222,LCIDC01_1092801_00002
林淑芬,我現在是講有大人買小孩的口罩，這樣被買光光的事情該怎麼解決？而且很多小孩自己都買不到小孩的口罩，通路又變少了，許多實體通路也都不再賣口罩了，很多藥局申請不再販售，通路變少，又被大人買走了，現在要4月23日才可以再買，那麼4月9日至4月22日這中間，他短缺的10片，該怎麼辦？我現在問你該怎麼辦？,223,LCIDC01_1092801_00002
林淑芬,如果大人又去買，該怎麼辦？所以我告訴你，這有必要，你們再多配送一點，因為現在藥局是限制20人份，通路變少、虛擬的通路又關門，然後每個藥局又限制20人份，所以當然有必要再增加，但是大人可以購買小孩口罩的這個門如果沒有關，很多人還繼續去搶，真正的小孩卻買不到。,224,LCIDC01_1092801_00002
林淑芬,你不要再講下個禮拜，你講的是4月23日以後的口罩，而我講的是現在進行式，4月23日之前這些小孩買不到自己口罩配額該怎麼辦？,225,LCIDC01_1092801_00002
林淑芬,你回去好好想，我現在就不跟你講太多，因為真的是一個問題。次長，我為什麼要先講這個問題，因為現在每個學校、每一班學生都必須戴口罩上課，所以每一個家長都不會放棄自己可以購買的配額，對不對？我有一個提案，希望中小學乾脆由教育體系交給地方政府，由地方政府各級學校自行配售，透過學校的系統，讓唸書的小孩在學校買自己的配額，這是不是實名制？,226,LCIDC01_1092801_00002
林淑芬,絕對是。這是不是一個節省這麼多人力成本的方法？也是。小孩子的身分證號碼及資料，導師都有；小孩也可以自己去簽名，即使要刷一下卡也沒關係，家長也統統不用排隊買小孩的口罩。所以我有一個提案，請你們去研議，透過地方政府各級學校把中小學學生的口罩統統透過學校系統去配售，這也是一個好方法。以前不足，我們就不敢講，現在每個小孩都會戴口罩，而且也需要戴口罩，我覺得這是一個機會，你們應該改變你們的方法，可不可以研究？,227,LCIDC01_1092801_00002
林淑芬,就只有中小學，這是很可以做的啊！,228,LCIDC01_1092801_00002
林淑芬,這兩個禮拜真的買不到。,229,LCIDC01_1092801_00002
林淑芬,請學校去分配、去收錢是最快的。,230,LCIDC01_1092801_00002
林淑芬,而且都是實名制，不會有人多買，也沒有管理的問題，唯一的風險是小孩如果當天生病請假，他的quota要怎麼拿？家長必須跟老師及學校聯繫拿口罩，但這也不是很困難的事。,231,LCIDC01_1092801_00002
林淑芬,另外，除了透過學校體系配送口罩之外，我上次跟你質詢時談到水電工到府修繕的問題，昨天真的發生了，媒體上的報導是，他的工人去看過一次、沒修理好，他本人才又再去一次，因此到居家檢疫者家裡是有兩次、兩個人。這位水電工表示，他過去的時候，居家檢疫者在吃早餐、沒有配戴口罩，他一邊做的時候，對方才告訴他自己是檢疫者，所以他嚇得要死。我之前就建議過，我覺得居家檢疫者的權利真的要顧及，但是到他家服務的人有知情權，也必須要有保護自己的裝備才能進去。上次我在這裡質詢的時候，這不是開罰、不開罰的問題，但是你說要研議，請問你們有研議出比較具體的配套嗎？,232,LCIDC01_1092801_00002
林淑芬,對，所以你們要好好地研議這個路徑要怎麼管理。,233,LCIDC01_1092801_00002
林淑芬,現今有很多基層診所，包括全臺灣兩萬多家的診所、兩百多家的小型醫院都在抱怨為了防疫而增加很多成本，包括消毒設備、酒精、防護衣、手套、加班費等等，所以他們也在想，在這種非常時期，社區醫療是防疫的第一線，當然他們也不是銅牆鐵壁都攻不破，必須要給他們好的防護設備，可是這些都是成本。在這種狀況之下，有這麼多的紓困措施，能不能多給他們一點幫忙，譬如免稅額要不要自80%再往上提高，你們可不可以也去研議一下？,234,LCIDC01_1092801_00002
林淑芬,如果不這樣做的話，那還有一種思考方式，防疫成本是不是應該要國家化？防疫設備你們就充分提供，包括酒精、防護衣、手套，以及多出來的加班工時，要有充裕的防疫設備，就列入國家公務防疫的體系裡面。,235,LCIDC01_1092801_00002
林淑芬,你去研究嘛！要嘛就是他們的防疫成本由整個社會共同分擔……,236,LCIDC01_1092801_00002
林淑芬,一種是國家給他們，另一種是如果你們不要、認為在管理上很不方便，那就想辦法在免稅額或是在其他方面設計一個機制嘛！你們去設計一下。,237,LCIDC01_1092801_00002
林淑芬,"最後我要講的是，健保資源有限，像第393案這種，都有症狀了，但可能涉及沒有坦誠告知，還坐飛機，讓其他人有感染的風險。此外，三十年來他是第二次回國，大家就覺得他是回來看病、治療還是怎麼樣，anyway，大家討論很多相關的議題。有一個議題就是我上次提出的停保、復保規定，其實逾越了母法，外交部、僑委會和行政部門大力反對，大家也看到僑胞有很多，真正拿到護照的有6萬多人，但有資格申請的有4,000萬，人數也不少，大家就這方面的議題有很多的討論，其中比較具體的是停復保部分，涉及到外交部、僑委會和其他部門的反對。可是我要跟你講，國軍、軍校生、受刑人也都百分之百地繳納保費，全部是由相關政府部門自己編列預算來繳保費，但外交部的外交人員長期旅外不在國內，要繳保費，你們不叫外交人員去承擔，外交部要編列預算出來啊！而不是叫全國的人民買單，因為這除了違反保險的平等性和公平性，對於整體健保收入、費基的流失其實影響滿大的，一年有17萬人申請停保，大概就有幾億元了；每年有6萬多人停保後又復保而去就醫，比例不低，他們回來復保其實要是為了要就醫、這個機率很大。再者，停保又復保者所使用的醫療項目又以牙科相關疾病的占比最高，達25%。有關停復保，違反了母法的授權，違反保險的平等和公平性，也流失了健保收入的基本費基。其實你們應該做的是叫各部會都編列公務預算，讓他們的外交人員用公務預算，不要慷健保之慨才對。前兩年也說要改，現在是改革的一個好時機，拜託你們加速腳步做。",238,LCIDC01_1092801_00002
陳椒華,（11時38分）主席、各位列席官員、各位同仁。次長，今天我們有幾個建議，我先全部講完，今天的報告裡面提到目前檢驗機構有34家，其中東區只有1家，是不是應該要再增加？東區的部分，我不知道是在花蓮還是臺東？,239,LCIDC01_1092801_00002
陳椒華,因為距離都很遠，希望在臺東也能夠增加一個檢驗機構。,240,LCIDC01_1092801_00002
陳椒華,我先全部講完。針對今天的資料，除了醫護人員要進行具高危險性的工作之外，在醫檢部分，每採檢一案獎勵500元，其中300元分配給相關執行採檢人員。我不知道這300元要怎麼分配，是給去採檢還是做分析的人？等一下請次長說明。另外，針對一些具高風險的照顧工作，怎麼去做比較公平性的分配？這個等一下也請次長說明。再來我要提到一些破口，對於這些可能的破口，是不是要做一些普測，包括可能來自於工廠產業、家庭看護的外籍移工，或者是境外聘僱與境內聘僱的外籍移工，由雇主安排居家檢疫場所，這些移工要怎麼樣自我保護？提供一人一房獨立衛浴顯然是有高度的困難，所以這個部分就可能有破口。今天我還要提到街友的部分，這是否也是一個可能的破口？因為這些街友大部分是沒有健保卡的，領取口罩有困難，目前僅有社會局訪視時發給口罩，但物力有限，且口罩以提供給社福工作者為主。針對此一可能的破口，是不是請衛福部納入考量？今天我的重點就是把所有可能的破口告訴衛福部，最後一個可能的破口就是特種營業部分，現在特種營業由地上轉為地下，也可能是防疫的破口。再來就是針對今天的報告，國內的失業率創8年來新高，可謂心靈風暴來臨。世界衛生組織統計，2016年全球標準化自殺率為每10萬人10.5例，但在臺灣就達12.3例，現在再加上失業率而有增加的趨勢。不知道衛福部怎麼樣去佈署社區性心理危機處遇系統，而能夠加以防範？最後要提到，目前社區藥局普遍反映，民眾對於替代藥物的信任度、接受度不高，衛福部是否掌握藥品供需與流向？應做一些宣傳，強化提供給民眾正確替代用藥資訊，或者再努力去補足藥物。上述問題，請次長回答。,241,LCIDC01_1092801_00002
陳椒華,再增加，好。,242,LCIDC01_1092801_00002
陳椒華,那邊會明定，今天沒有寫。,243,LCIDC01_1092801_00002
陳椒華,好。,244,LCIDC01_1092801_00002
陳椒華,牙醫師跟醫師一樣嗎？,245,LCIDC01_1092801_00002
陳椒華,歸類在醫師類？,246,LCIDC01_1092801_00002
陳椒華,但是牙醫生的風險好像也很高。,247,LCIDC01_1092801_00002
陳椒華,好。,248,LCIDC01_1092801_00002
陳椒華,那可不可以做一些小範圍的普測、做調查，瞭解這些破口可能存在的風險？,249,LCIDC01_1092801_00002
陳椒華,好。,250,LCIDC01_1092801_00002
陳椒華,就是防破口。,251,LCIDC01_1092801_00002
陳椒華,沒關係，給我書面報告好了。最後是藥品的部分。,252,LCIDC01_1092801_00002
陳椒華,好，相關的部分，如果可以的話，提供給我書面的報告。,253,LCIDC01_1092801_00002
蘇巧慧,主席、各位列席官員、各位同仁。我們剛剛說過，文字的部分，我同意衛福部這邊的調整，沒有問題，但我想要留做紀錄、再確認一下，大家都有聽到，包括主席也聽到了，他剛才說的重點，第一，他們一定會普查；第二，雖然改成適當配發這樣子的文字，但等同於是更多啦！,254,LCIDC01_1092801_00002
蘇巧慧,不是說只有一片等等的之類，而是按照其風險高低、工作狀況而有機會配發到更多，甚至3片、4片，如果他的風險是高的，甚至一天不只兩片，他的意思是這樣，所以才叫我不要寫得那麼死，由此可知是上修而不是下降。,255,LCIDC01_1092801_00002
蘇巧慧,第三，大家都有聽到，「照講照行」，到時候也不只是醫事人員，甚至清潔工等等也都包含在內，為了讓衛福部好處理，所以我們同意修正文字，就涵義上是有這樣的狀況。主席知道嘛？,256,LCIDC01_1092801_00002
蘇巧慧,你要加入嗎？,257,LCIDC01_1092801_00002
王婉諭,所以就可以直接……跟委員……,258,LCIDC01_1092801_00002
林淑芬,可以做得到嗎？,259,LCIDC01_1092801_00002
林淑芬,主席、各位列席官員、各位同仁。次長，這個有困難嗎？是不是就照這樣子做？,260,LCIDC01_1092801_00002
林淑芬,「研擬」，但是會有困難嗎？沒有困難就照做嘛！,261,LCIDC01_1092801_00002
林淑芬,你們是可以，那就看教育部願不願意、有沒有困難而已。,262,LCIDC01_1092801_00002
林淑芬,以前沒有討論過嗎？,263,LCIDC01_1092801_00002
林淑芬,當時教育部有意見嗎？,264,LCIDC01_1092801_00002
林淑芬,又不是叫老師天天做，是兩個禮拜才一次。,265,LCIDC01_1092801_00002
林淑芬,那是執行面的小細節。,266,LCIDC01_1092801_00002
林淑芬,好啦！那就建議至少中、小學。,267,LCIDC01_1092801_00002
