speaker,speech_text,speech_number,meeting_id
張育美,反正你知道，你回應一下。,127,LCIDC01_1124901_00009
張育美,剛剛我講到癌症篩檢，如果他篩檢到有癌症，國健署就希望追蹤管理費和診斷品質費給健保給付，你覺得這樣合理嗎？要不要用公務預算呢？,128,LCIDC01_1124901_00009
張育美,你說按照計畫的內容來檢討，我們知道全民健康癌症檢查是國健署對人民非常必要的重要政策，保護人民健康嘛！現在是費用由公務預算支出，或者由健保支出這樣的分際啦！,129,LCIDC01_1124901_00009
張育美,篩檢是，但是我提到追蹤管理，譬如篩檢出來還沒正式要到治療的時候，有追蹤管理及品質診斷是要誰出啦！就這一段，還沒進入治療的時候，對全民的健康照顧當然是必須要的支出嘛！保護人民健康，但是我現在釐清費用是誰出。,130,LCIDC01_1124901_00009
張育美,對，還沒進入治療的這一段，追蹤管理。,131,LCIDC01_1124901_00009
張育美,對，我認為有關係啊！所以我是覺得釐清費用怎麼支出讓健保局或醫療端也知道是怎麼樣給付。,132,LCIDC01_1124901_00009
張育美,我先非常感謝部長這樣說，在釐清方面不一定一刀切斷這個是公務預算、國健署或健保署出，請部長研究一下，為了全民的健康，癌症及早篩檢是對民眾是好的，至於後端請你多研究一下，對國健署、健保署、醫院端及人民端都是有利的，就是這樣，請再研議好嗎？謝謝。,133,LCIDC01_1124901_00009
徐志榮,（11時7分）石署長早。健保總額幾乎每年都成長，今年應該已經來到八千三百多億元，但是對於醫療體系來講可能還是覺得不足，不足的原因也很多，我在此主要講有關健保藥費部分，在健保總額裡面可能占28%或29%，不到30%。但是透過藥品給付協議，即所謂MEA，105年到114年藥費部分我們有回收，超過跟他談的價錢部分有差不多一百三十多億點，但是一點不到一塊錢，所以換算金額大概是120億，我不知道有沒有錯誤，110年即去年回收的更多，超過78億，如果6年平均120億，一年20億，去年為什麼會特別多？如果我的數字正確，為什麼去年一年就是七十、八十億？,134,LCIDC01_1124901_00009
徐志榮,我知道，我主要是說好像去年特別比那幾年的金額多出來，多出來也是好事，反正也是回到大水庫裡面。,135,LCIDC01_1124901_00009
徐志榮,大水庫裡面還有沒有其他的方式？我現在要講的是專利已經到期的部分，我們還把它列為有5年的保護期，為什麼一定還要給他們5年？,136,LCIDC01_1124901_00009
徐志榮,過了專利期以後，學名藥就可以出來啦！,137,LCIDC01_1124901_00009
徐志榮,可能是這樣，你講的好像也有道理，如果它到期以後，沒有學名藥出來，可能還保障它5年價格的話，我倒還覺得還合理，如果它已經有學名藥出來，甚至於我認為學名藥也不需要強制它打個八折，你就讓學名藥跟已經到期的原廠藥大家互相去競爭，對健保藥費總額多少也有幫助才對，一方面照你講的也可以鼓勵臺灣的學名藥廠，幾乎老實說有專利的那些藥可能臺灣的也比較少，如果照你講的到期了又沒有學名藥，這我就不敢說了，是不是可以稍微讓它區分一下，是有學名藥出來還是沒有學名藥出來？,138,LCIDC01_1124901_00009
徐志榮,總歸就是要怎樣來節省藥費，當然就是讓健保總額不要這麼快速減少的意思。好，謝謝署長。,139,LCIDC01_1124901_00009
徐志榮,接下來，因為食藥署今天沒有代表列席，所以有關A肝莓果的事情，本席只好請教部長。第一、只有高雄的好市多有嗎？其他地方的有驗出來嗎？第二、對這個公司有處分了什麼嗎？第三、可能也不是去買的客人追蹤得到，買的客人可能家裡的人吃，甚至於不是家裡人吃，可能是蛋糕業者或者是下午茶業者買回去做營業用，再散下去的客人是很難追蹤的。特別是A肝好像也就是法定的傳染病，對公共衛生的影響也滿大的，所以除了要特別追蹤高雄市，其他我知道好市多好像很多地方都有，當然我們苗栗落後地區是沒有，但是我記得臺中還是桃園都有。然後請教一個問題，像報紙講的它是4月10日驗出，但是4月28日才公告，我要請問的是為什麼這麼慢公告、有再說明？因為它驗出了以後，照我們的規定，有15天可以去申復，所以它到28日才公告，我現在請問的是第一天4月10日驗出的時候，有沒有叫它下架？不要你等它15天的期效，15天到了它才申復，申請再驗才有，它才肯下架，15天又不知道賣出了多少！,140,LCIDC01_1124901_00009
徐志榮,所以4月10日驗出來就下架了？,141,LCIDC01_1124901_00009
徐志榮,還沒有流入市場？,142,LCIDC01_1124901_00009
徐志榮,到現在還沒有對公司開罰？,143,LCIDC01_1124901_00009
徐志榮,那個range還滿大，6萬元到2億元，看資本額還有情節重不重的問題，總歸就是我們怕法定的傳染病，所以特別要重視，甚至於疾管署也要……,144,LCIDC01_1124901_00009
徐志榮,要觀察到下個月，再請部裡面多多關心，謝謝部長。,145,LCIDC01_1124901_00009
陳椒華,（11時18分）部長好。今天就要進行再生醫療法，還有再生醫療製劑條例的協商，在幾次的協商，我想針對自體、異體細胞部分是不是要放在異種，異體細胞是不是要放在說明欄部分，絕對也是很清楚的，衛生署曾公告「體細胞治療人體試驗申請與操作規範」，請問部長這個規範有廢掉了嗎？,146,LCIDC01_1124901_00009
陳椒華,廢掉了嗎？,147,LCIDC01_1124901_00009
陳椒華,沒有廢掉嘛！我們知道它裡面對於異體、異種寫得很清楚，這些細胞可能引發內源病毒基因體之表現，或直接或經由基因組合之機制，而產生會感染人類之病原，所以應事先防範嘛！根據它的附表，針對異體，必須提供有關安全性及療效性之臨床前研究的充分證據，才可以使用，異種的部分也是要提供充分臨床前研究的數據。它的例子寫得很清楚，就是剛剛說的可能發生基因重組，然後導致有病原性，就是動物的基因到人的染色體上面，然後發生致病性、傳染性嘛！部長知道有這個東西嗎？,148,LCIDC01_1124901_00009
陳椒華,對啊！這是你們前衛生署的公告啊！你知道有這個東西嗎？,149,LCIDC01_1124901_00009
陳椒華,你知道嘛！,150,LCIDC01_1124901_00009
陳椒華,所以沒有廢止？,151,LCIDC01_1124901_00009
陳椒華,那你認為這個東西要不要放在再生醫療法第三條的說明欄？,152,LCIDC01_1124901_00009
陳椒華,對啊！雖然經過20年，但是裡面的這些基因不會重組了嗎？不會發生有可能會導致高風險的致病性或有傳染性的因素？你認為沒有了嗎？,153,LCIDC01_1124901_00009
陳椒華,部長，你一定要瞭解實證跟倫理，這裡我們提到實證，假如你說動物細胞跟人的細胞不會重組，異體細胞之間不會重組，你有科學性的研究報告，我們當然就可以接受，而不是說經過20年就不會發生。我自己在做細菌基因實驗的時候，重組非常的嚴重，我一做基因實驗，我把DNA送進去，它馬上跑到染色體，所以我對基因重組的印象非常深刻。當然我不是做異體細胞，但我是用你們前衛生署公告提醒的規範來告訴你，這個規範如果沒有廢止，它還是你們衛生署公告的規範嘛，不然你就把它廢止啊！你說經過20年了，你有提出不會發生這種風險的證據，你就可以把這個規範廢止啊！我是先讓部長知道，我在第一次協商的時候，我說會有免疫排斥的問題、會有基因重組的問題，其實在衛生署公告的這個規範裡面都有，所以你們要做受試者、授予者的HLA相關組織相容性這些抗原的測試，我都沒講錯啊！那時候我還沒有看到這個規範，我沒有講錯啊！我沒有講錯啊！我只是請你們放在說明欄，你們剛開始答應了，為什麼受到壓力又不敢放？你們要固守實證跟倫理啊！你們不能因為誰施壓就不敢放啊！你們就說依委員會的決議、依多數表決，實則是依暴力的表決，你不能這樣啦！京都大學於今年2月公布「調查自由診療下再生醫療相關審查問題，今後制度修正之期待」研究成果，指出五大亂象，我想部長一定也看過嘛，有五大亂象啊！再者，第十六條的規定，是不是以後衛福部要讓家裡沒錢的人，就讓媽媽替出生的孩子答應將來願意提供幼兒的組織細胞來做治療服務？其實這都是風險啊，就是第十六條。部長如果能夠固守倫理實證，就像昨天醫改基金會邀請的消基會及很多相關學者專家都提出這些理由。下午就要協商了，我還是籲請衛福部要抓住你們該固守的，不要讓人民當白老鼠，避免大家被詐騙而無辜受害，我想這個法的重要是在這裡。我就先提出以上這些讓你參考，部長能夠認同這些嗎？請教你有沒有看過「姊姊的守護者」這部電影？,154,LCIDC01_1124901_00009
陳椒華,這部電影講的是一位媽媽為了拯救患病的女兒，而再生一個孩子，未來的妹妹就是要提供姊姊相關治療的血液細胞，而第十六條就是「姊姊的守護者」所符合的法規。,155,LCIDC01_1124901_00009
陳椒華,即使通過了，我們今天也可以提修正動議啊！,156,LCIDC01_1124901_00009
陳椒華,你要想一想，你要去看啦！你要去看啦！謝謝。,157,LCIDC01_1124901_00009
林靜儀,（11時26分）部長午安。今天我們討論國家關鍵基礎建設在一些緊急狀況下受到破壞等等的相關刑責，這個部分很重要，尤其我也要再提醒一下，前一段時間發生健保署內部有員工超過職權去對於一些個案資料做查察，請你們要謹慎的處理這個事情。針對今天的議題，全世界其他國家很多國會議員也一直問及臺灣有沒有在準備比方發生大型災難或甚至是受到戰爭攻擊的部分，因為這不是我們要不要怎麼樣，而是我們不知道哪天人家會不會突然按了一個什麼按鈕之類的。我們在做這個準備的時候，我自己一直在觀察一個事情，就是我們的緊急救援或是相關醫療系統的部分現在準備到什麼程度？以烏克蘭來講，事實上醫院會不會在大災難過程中遭到攻擊？,158,LCIDC01_1124901_00009
林靜儀,也是會嘛！在臺灣可能某一家醫院shut down了，還有其他醫院可以支援，但是假設發生系統性的受傷，或者真的遭受一些攻擊的狀況之下，原來的系統就沒有辦法運作。所以我要請問部長，這也是醫療人員在跟我們討論的，因為感控等等的問題，大概多數醫院開刀房等等重要的設備都在二樓以上的樓層，因為整個空調等等系統好處理。但是假設在緊急狀況之下，尤其是重要的手術，或者是重要人物的手術，需不需要規劃在某些醫院設置所謂地下室緊急手術室？,159,LCIDC01_1124901_00009
林靜儀,你說新設的醫院，但是目前已經幾乎是負擔重要救援業務的這些醫院，有機會去做一些設備上或者是評估上的處理嗎？,160,LCIDC01_1124901_00009
林靜儀,已經開始了嘛！,161,LCIDC01_1124901_00009
林靜儀,因為至少在海線有幾個醫院，如果發生什麼問題，緊急由直升機送進來，需要一些比較特殊的照顧跟手術，大概這個部分會先做一些評估。第二件事情，我在臺中市看他們的演習，演習通常都演練到一個程度，就是現在有災難，然後大家去救援，醫療單位也派了第一線的檢傷，檢傷完之後就後送，可是那是在原來後送醫院的系統還存在的狀況之下才有辦法做後送，假如原來的後送醫院的系統並沒有辦法維持現在所看到的這些支援跟準備，我們有沒有因應的人力調派、甚至是戰傷醫院的各層級的準備？,162,LCIDC01_1124901_00009
林靜儀,因為現在全民動員的這個部分，也會有地方衛生所或是地方政府在某些地方對民眾做第一線緊急的輕症照顧，這一塊你們現在的規劃是先由目前的基層診所來處理，對不對？,163,LCIDC01_1124901_00009
林靜儀,現在有開始規劃醫療人員所瞭解的訓練跟排班嗎？,164,LCIDC01_1124901_00009
林靜儀,對，醫療人員就在問這件事。,165,LCIDC01_1124901_00009
林靜儀,就是把可用的人力都用上。,166,LCIDC01_1124901_00009
林靜儀,再者，我們之前因應傳染病，尤其針對SARS這類傳染病，就我的瞭解，很多醫院有假設發生什麼情況的第一批支援人力及第二批支援人力的規劃，所以接下來會不會做這一類相關的訓練或是基本概念的準備？,167,LCIDC01_1124901_00009
林靜儀,因為我問國防部的全動署，他們都回答這部分是交給你們，所以我今天才直接問部長，希望能夠確實做這方面的因應。因為我自己看臺中市做的演習，前面都做得很好，但是他們每個部分都提到做後送，事實是可能當下那個時候並沒有辦法做那麼多的後送，而且後送那邊如果醫療人員沒有得到明確的資訊，一旦發生事情是要先到基層做支援，還是要回到原來的大醫院做原來業務？這個部分我覺得大家也需要知道。最後一件事情，現在腸病毒旺季又來了，對不對？,168,LCIDC01_1124901_00009
林靜儀,腸病毒疫苗是不是現在開始有了？,169,LCIDC01_1124901_00009
林靜儀,71型嘛！就我瞭解，腸病毒71型疫苗現在已經出來了。,170,LCIDC01_1124901_00009
林靜儀,我請問部長一個民眾問的問題，民眾看了仿單，理論上現在腸病毒71型疫苗的仿單上並沒有說打了疫苗之後可以終生免疫，為什麼我們在媒體報導上看到有說打了兩針之後就可以對腸病毒終生免疫？你有這樣的evidence-based嗎？,171,LCIDC01_1124901_00009
林靜儀,是啊！,172,LCIDC01_1124901_00009
林靜儀,比如HPV疫苗，我們也沒有說可以終生免疫啊！,173,LCIDC01_1124901_00009
林靜儀,對。,174,LCIDC01_1124901_00009
林靜儀,是啊！,175,LCIDC01_1124901_00009
林靜儀,是啊！,176,LCIDC01_1124901_00009
林靜儀,這些都是公開的資料，因為目前廠商也沒有很多，我建議衛福部還是要請他們依照仿單上的資訊對外做揭露，好不好？要說打了兩劑腸病毒疫苗之後會終生免疫，就如同你剛才說的，第一個會造成家屬的誤會，第二個會造成未來衛生主管機關的困擾跟第一線臨床醫師的困擾，好不好？,177,LCIDC01_1124901_00009
林靜儀,謝謝部長。,178,LCIDC01_1124901_00009
楊瓊瓔,（11時35分）部長好。今天審查的法案主要是針對全民健保核心的資通系統、傳染病監視跟預警系統，以及醫院及捐血中心、電子病歷資訊系統，或是其他重要系統的設施、設備，若是遭受到不法的侵害，目前為止刑法的部分就是依竊盜罪、毀損罪及妨害電腦使用罪等規定處理，所以必須要再加強，因此這次行政院總共送了22個增訂條文的法案過來，包括我們今天所要審的。當然我們也看到層級化的處理，以及要怎麼樣用法律去嚇阻不法之人的動機跟行為。請教部長，我們都知道醫療服務業務跟全國疾病蒐集分析的必要系統對國人生命和身體健康是非常的重要，除了加重刑責及罰鍰之外，如何保障也非常重要，要保障系統及關鍵設施，設備才能夠正常運用，這一點要怎麼做呢？,179,LCIDC01_1124901_00009
楊瓊瓔,對。,180,LCIDC01_1124901_00009
楊瓊瓔,部長，這個部分麻煩你提供書面資料給本席。,181,LCIDC01_1124901_00009
楊瓊瓔,除了這22個增訂條文的法案要怎麼樣提高刑責及增加罰鍰，另外還有一個重點，就是意圖。意圖對衛福部來講是最重要的，因為它包含了生命的問題，所以這個意圖未來法官要怎麼樣去判定，自由心證意圖要怎麼樣判定？我個人認為應該可以更明確的提出，讓未來執行者能夠更明確的執行，這是本席的第一點建議。第二點也是我一直強調的，我們既然提出增訂條文，重點就在於它是一個問題點，那它是一個問題點，我們要怎麼樣去保護？除了治標的處罰之外，我們要怎麼樣治本？這才是最重要的，所以請針對治本方面也提供書面資料給本席。,182,LCIDC01_1124901_00009
楊瓊瓔,謝謝。我們知道未來的防疫是走向與病毒共存，我們從清零到與病毒共存，所以指揮中心在5月1日開始解編，並將COVID-19降階為第四類法定傳染病，但是在剛開始的時候，立法院三讀通過嚴重特殊傳染性肺炎防治及紓困振興特別條例，賦予指揮中心、CDC包括採購疫苗、口罩、藥品及快篩等戰備物資，以支應醫療體系所需，這個條例也在6月30日會屆滿退場。在緊急的防疫法規層面，傳染病防治法要修法接棒，因為即將到了，目前修訂的內容是否與其他的部會有共識？,183,LCIDC01_1124901_00009
楊瓊瓔,要再做協調。部長談到這邊，我們知道你們是很負責的在討論這個議題，所以在整備上面，你們是不是會朝這個方向研議，讓母法適用在各種傳染病上，以符合快速的防疫需求？是不是朝這個方向？,184,LCIDC01_1124901_00009
楊瓊瓔,朝這個方向，讓民眾可以安心嘛。,185,LCIDC01_1124901_00009
楊瓊瓔,好，那就麻煩你們，辛苦你們繼續去討論。,186,LCIDC01_1124901_00009
楊瓊瓔,五一勞動節的時候，勞工大遊行，睽違一年，再次上街頭。我看，你在笑，可是我快笑不出來，因為連我們的醫護人員都提出「醫護要勞權、補償要確實、兌現防疫補償獎勵承諾、合理三班護病比」等訴求，你看到了吧？五一勞動節他們提出這些訴求，部長，你瞭解嗎？,187,LCIDC01_1124901_00009
楊瓊瓔,你知道要怎麼應對嗎？從疫情開始，到現在已經趨緩，他們還提出這樣的訴求，那表示沒有持續地在改善，所以請教部長，針對這些訴求，你要怎麼研議？醫護防疫津貼什麼時候可以完成撥付？,188,LCIDC01_1124901_00009
楊瓊瓔,對，什麼時候可以完成撥付？,189,LCIDC01_1124901_00009
楊瓊瓔,還要看多久？已經把指揮中心解編，特別條例都要退場了，5月1日起新冠肺炎改為第四級傳染病，你們還要多久？還要多久？我們結果論嘛。,190,LCIDC01_1124901_00009
楊瓊瓔,部長，難怪醫護要提出訴求，你們先預撥了八成，指揮中心你們自己5月1日都解編了，現在在做對接的工作了，可是這部分的津貼還沒有完成撥付，還要到年底！,191,LCIDC01_1124901_00009
楊瓊瓔,儘快好不好？,192,LCIDC01_1124901_00009
楊瓊瓔,你說可以再早，可以再早就對了。,193,LCIDC01_1124901_00009
楊瓊瓔,因為我們覺得醫護真的很辛苦，該給的就要給人家，對不對？,194,LCIDC01_1124901_00009
楊瓊瓔,請醫療體系趕快，可以早就趕快，好不好？不要再讓他們提出這些訴求，立法院通過的是全力支持，在執行面沒有辦法落實，我覺得要檢討，好不好？,195,LCIDC01_1124901_00009
楊瓊瓔,拜託，一定要趕快。針對三班護病比這個部分也趕快加油，好不好？,196,LCIDC01_1124901_00009
楊瓊瓔,加油。要有誘因，人力不夠，你要設法增加誘因，加人進來，不然一直喊要達到合理的三班護病比，根本是不可能的，對於現有的人員也不公平，對不對？趕快去想辦法增加人力，好不好？,197,LCIDC01_1124901_00009
楊瓊瓔,學校畢業的只有幾成進入本業，他們有專業，請他們回來做，看你怎麼樣增加誘因來吸引他們，好不好？,198,LCIDC01_1124901_00009
楊瓊瓔,加油。,199,LCIDC01_1124901_00009
溫玉霞,"（11時43分）薛部長，我接續剛才楊瓊瓔委員的話，五一勞動節這些人大反撲，上凱道遊行，他們抗議的就是三班護病比、染疫補償金和防疫津貼你們都做得不夠，現在醫院推給衛福部，衛福部推給醫院。你剛才回答說已經撥了八成，你說有八成，我才不信，哪有可能撥了八成這些人還要上凱道去遊行向你抗議？我覺得你們應該好好查一查，從去年12月份到今年1月份，已經有一千多人離職，如果你真的有撥到八成的話，我才不相信這些人如果有領到錢還會離職，所以說你這個答案我不相信，這是第一點。第二點，醫護類學校今年報考人數只有2,400人，如果再這樣下去，將來會找不到人來當醫護人員，護理人員不是那麼簡單就可以培養的，對不對？可是我們有沒有注重他們？他們上凱道，你們有沒有派人去跟他們或工會協調、溝通？有沒有？",200,LCIDC01_1124901_00009
溫玉霞,所以你們都坐在辦公室裡，不知道外面的事就對了？,201,LCIDC01_1124901_00009
溫玉霞,他們說你們的承諾全數跳票，你說你們已經撥了八成，我們老百姓在外面看醫護人員的心態，這個月你們就該把給醫護人員的錢付清，讓人家心服口服，對不對？,202,LCIDC01_1124901_00009
溫玉霞,這是第一點。第二點，陳時中陳部長之前有答應要好好檢討三班護病比，看看到底要達到的比例是一比幾，請問：現在部長已經換成你了，他有沒有交代你們的工作要銜接？他有沒有跟你說這部分要好好檢討？,203,LCIDC01_1124901_00009
溫玉霞,他有答應，你要承諾啊！,204,LCIDC01_1124901_00009
溫玉霞,就是沒有解決嘛，對不對？,205,LCIDC01_1124901_00009
溫玉霞,所以你沒有準備要檢討？,206,LCIDC01_1124901_00009
溫玉霞,不管你是要一塊一塊檢討還是通盤檢討，總是要有檢討，總是要有開會。,207,LCIDC01_1124901_00009
溫玉霞,你們錢也不給，還說要到年底或其他時間才要把錢撥下去，該給的錢早就要給，哪有叫人家工作做一做卻不讓人領薪水，又說要等多久又多久的道理？我看只有你們是這樣！,208,LCIDC01_1124901_00009
溫玉霞,如果你們是沒錢，也就沒有話講，可是你們明明就有錢，有錢就該撥給人家，對不對？我真的很不以為然。,209,LCIDC01_1124901_00009
溫玉霞,你們就推給醫院，醫院再推給衛福部，對不對？,210,LCIDC01_1124901_00009
溫玉霞,防疫指揮中心任務結束了，你到現在還沒有查？,211,LCIDC01_1124901_00009
溫玉霞,三年來，醫院非常忙，護理人員也是用性命來拚。,212,LCIDC01_1124901_00009
溫玉霞,就算是先發出去再來查，也是應該的，對不對？,213,LCIDC01_1124901_00009
溫玉霞,站在護理人員的立場來想，如果今天我是護理人員，我真的非常不平。,214,LCIDC01_1124901_00009
溫玉霞,多久？你現在告訴我多久要檢討、多久要發給人家。多久？,215,LCIDC01_1124901_00009
溫玉霞,可不可以快一點？,216,LCIDC01_1124901_00009
溫玉霞,那是人家的薪水，你每個月月初就領到薪水，為什麼他們做了好幾年還領不到錢？這實在很離譜，對不對？,217,LCIDC01_1124901_00009
溫玉霞,當然要越快越好，不能拖到年底。我對你們的工作沒有信心，就是因為這樣，前陣子我跟你說救護技術員管理辦法要修改，跟你說了好幾次，今天已經是第五次了，如果你們不解決，我每次都要問你，去年3月你們的人跟我說要6個月，接下來又說要到年底，接下來又說要到今年3月，現在又說4月，到現在都還沒有解決，我告訴你，我每次來都要問你，你何時要修改？,218,LCIDC01_1124901_00009
溫玉霞,什麼時候可以公告？,219,LCIDC01_1124901_00009
溫玉霞,什麼時候預告？預告了沒？,220,LCIDC01_1124901_00009
溫玉霞,還在編？什麼時候？我現在就是要你答什麼時候。,221,LCIDC01_1124901_00009
溫玉霞,好，多久？一個禮拜？兩個禮拜？一個月？兩個月？還是要再半年？,222,LCIDC01_1124901_00009
溫玉霞,好，你說在出國之前，你下個月要出國，那就一個月內解決。你下個月要出國參加WHA，我國有沒有收到邀請函？,223,LCIDC01_1124901_00009
溫玉霞,還沒有？那你出國要怎麼辦？,224,LCIDC01_1124901_00009
溫玉霞,要繼續努力啊？支持的人會越來越多還是越來越少？,225,LCIDC01_1124901_00009
溫玉霞,"好，祝福你，會有越來越多的國家支持我們，去年是3,700位各國國會議員支持我們，希望今年如你所言會有更多人。",226,LCIDC01_1124901_00009
溫玉霞,"加油。部長，好市多販售的冷凍三種綜合莓有1萬7,000公斤被驗出有A型肝炎病毒，也就是17噸，大約是一個20公噸貨櫃的量，請問：美國早就通知我國，為什麼我們這邊都沒發現，直到4月28日才通告所有的廠商下架？為什麼拖這麼久？",227,LCIDC01_1124901_00009
溫玉霞,一點都沒有拖到？3月17日美國就通知我們了，你說一點都沒有拖到？,228,LCIDC01_1124901_00009
溫玉霞,你們的網站4月28日才全部更新！,229,LCIDC01_1124901_00009
