speaker,speech_text,speech_number,meeting_id
洪申翰,當時這一篇報導引起了很多的討論，也間接地促成我們來修正職災保險及保護法，也就是這個新法有很多社會的期待。這篇報導裡面寫了幾件事情，臺灣直到2018年1月1日才加入「全面禁用石綿」的行列，若以過去石綿的消耗量與疾病的潛伏期來看，臺灣的石綿相關疾病可能在2020年到2030年左右才會達到高峰，但對於過去因工作而有石綿暴露的勞工來說，發病時恐怕已經離職退保，很難符合勞保給付的規則，獲得應有的權益。這個敘述其實我想寫得很清楚，石綿工人過去其實拿不到任何的職災給付，當然這跟所謂間皮細胞瘤的特性有關，部長，你知不知道這個疾病的特性是什麼？,95,LCIDC01_1119301_00004
洪申翰,部長，這個疾病的特性就是它的潛伏期非常長，可能長達數10年，數十年常常很多工人在已經離職退保了以後，退休才發現，但他一旦發病，很可能很快就會死亡，存活極可能只有8到14個月，很多的工人可能來不及走完職業病認定的程序就已經過世，所以他們拿不到任何的給付，這是我們過去其實就發現的問題。我們看下一張，這是其中一名工人，他在2018年的時候提出相關給付的申請，申請書裡面就講得很清楚，其實他被發現這是一個職業病，但是因為這位先生所患的是在保險效力終止後才診斷確定，已非屬勞保被保險人，所以他拿不到給付。這都是我們在過去看到的問題，也就是他已經離職退保了，但是他在退保以後才診斷確定，不在保險有效期間裡面，所以他拿不到給付。部長，問題來了，我們今天看到他們的狀況，認知到他們的情況，所以我們提出修法，對不對？,96,LCIDC01_1119301_00004
洪申翰,在修法裡面，我記得當時勞動部，包括保險司、職安署都來跟我們講過，以石綿工人來舉例，為什麼要修新法？就是為了這些石綿工人，當時我們都講過這樣的話，對不對？我們來看一下現在的第七十八條怎麼寫的？新法第七十八條寫「於退保後，經第七十三條第一項認可醫療機構之職業醫學科專科醫師診斷係因保險有效期間執行職務致罹患職業病者，得向保險人申請醫療補助、失能或死亡津貼。」也就是即便他已經退保了，但是經過認定他是在保險有效期間執行職務才得到職業病的，還是可以拿到醫療補助、失能或死亡的津貼。這個立法說明其實也說了「考量部分職業病之潛伏期長，為加強保障勞工於保險有效期間從事特定有害行業，於離職退保後，始診斷為職業病者」，所以他可以來適用第一項的規定。看起來沒有問題，我們解決這個問題了，對不對？在新法裡面我們處理這個問題，但是部長我跟你說，我們的新法在今年中的時候開始施行，施行以後，剛剛那個被拒絕的工人再次提出申請，結果提出申請以後，勞動部跟他說什麼？跟他說「對不起！這是以前的案子」。新法是要用5月1日來切，這些石綿工人不能適用於勞工職業災害保險及保護法，也就是新法，他們還是必須回去適用舊法。部長，你覺得這合理嗎？我們當時拿石綿工人的例子來說，所以我們要來修新法，來解決他們的問題，結果法通過了以後，對不起！跟他說「沒有辦法，你沒有辦法適用新法，你還是要回去適用舊法」，可是舊法明明就是有問題的，所以我們才修啊！所以這些石綿工人繞了一大圈以後，他們還是得不到給付。部長覺得合理嗎？,97,LCIDC01_1119301_00004
洪申翰,當時行政院或者是你們來我們的辦公室都是說「我們為了解決他們的問題，所以訂定第七十八條就可以解決問題」，但是現在他們還是拿不到啊！,98,LCIDC01_1119301_00004
洪申翰,保險司陳司長對不起，你講太長了！今天不管新法如何制定，現在的問題是，我們跟申請的職災工人說他們不適用新法，他們還是必須適用那些保障不到他們的有問題舊法，可是明明我們在制定新法時，是說要解決他們的問題啊！,99,LCIDC01_1119301_00004
洪申翰,那過去這麼多石綿工人怎麼辦？部長，請看這張圖，左邊是逐年診斷出跟石綿有關的間皮細胞瘤，每年數量都超過幾十件，但長期以來，能夠拿到給付的卻只有個位數，也就是說，過去累積了受石綿危害的這些大量職災工人，一直以來都因為勞動部在各種法令解釋上卡東卡西，讓他們拿不到給付，也得不到幫助，今天我要問的問題是，按照剛剛保險司的說法，只有未來的石綿受害工人才能夠拿到給付，而過去累積可能幾十件、上百件的石綿工人還是得不到勞動部的幫助，是不是？剛剛保險司的說法就是這樣的意思，部長，你覺得該怎麼辦？,100,LCIDC01_1119301_00004
洪申翰,部長，我就直接具體兩項建議，第一，針對剛剛討論的新法第七十八條，其實可以相對放寬適用解釋，因為第七十八條條文並沒有規定該法施行前不適用，所以我們其實可以透過放寬這個條文的解釋予以適用，這是第一個途徑。第二點，如果再退到第二個途徑，就是新法第六十二條規定「中央主管機關得於職業災害保險年度應收保險費百分之二十及歷年經費執行賸餘額度之範圍內編列經費，辦理下列事項：」其中第六款規定：「其他有關職業災害預防、職業病防治、職業災害勞工重建與協助職業災害勞工及其家屬之相關事項。」所以我們不是沒有工具可以使用，現在的問題是我們到底要不要做、要不要面對這個問題？我們原本把這些工人當作修法主體，表示要幫助他們解決問題，結果新法通過了，他們一樣不適用新法，然後要他們回去適用舊法，問題出在哪裡？新法解決了什麼？他們又得到什麼幫助？我們是不是能透過第六款的規定，訂定相關辦法予以協助？本席在此直接提供兩個具體建議，這兩個途徑是我們可以直接幫助他們的方式，部長，這些人數可能並不少，他們並不是少數一、兩個個案而已，剛剛看到歷年的數字，一直以來，能夠得到給付的幾乎都只是個位數，每年有幾十位被診斷出得到這個疾病的職災工人，都得不到幫助，也得不到給付，部長是不是可以在一個月內研究這幾個途徑，然後給我們一個答案，到底要怎麼幫助他們？現在的問題不是該不該幫，而是我們必須幫他們，但我們要用什麼方法才能夠給他們充足的保護，以符合我們當初修法的目的？當初行政院的網站上都有寫這是我們修法的目的喔！,101,LCIDC01_1119301_00004
洪申翰,請給我們一個答案，好不好？謝謝。,102,LCIDC01_1119301_00004
賴香伶,"（10時30分）部長好！面對整個四大基金的護盤以及國際股市的變動，確實是隱憂重重，我們看到勞金局10月4日發布勞動基金大虧3,204億這件事情，讓勞工朋友看了憂心忡忡，如果照這樣的情勢推估下去，請問局長跟部長，今年四大基金，尤其是勞動基金部分，虧損是不是已經是事實，而且是不可逆的？",103,LCIDC01_1119301_00004
賴香伶,我知道，報紙都有寫，所以我說今年應該是沒有辦法回轉，是不是？,104,LCIDC01_1119301_00004
賴香伶,很難轉正？,105,LCIDC01_1119301_00004
賴香伶,所以你認為這次純粹是因為國際因素所致？,106,LCIDC01_1119301_00004
賴香伶,"那現在要怎麼看這件事情？如果照這樣發展下去，你們每次的收益率都是負六點多，到年底會不會虧損超過1兆元？所謂虧損3,204億元，這是1到8月的數據，如果以1到12月計，總體上你們預估還會虧多少？會超過1兆元嗎？",107,LCIDC01_1119301_00004
賴香伶,悲觀的預估會不會超過1兆元？,108,LCIDC01_1119301_00004
賴香伶,所以今年年初我們也不知道會虧損嗎？,109,LCIDC01_1119301_00004
賴香伶,我懂，你講過很多次了，所以你認為還可以保有每年四點多百分比的報酬率，是嗎？,110,LCIDC01_1119301_00004
賴香伶,但今年很明顯看起來絕對是負的。,111,LCIDC01_1119301_00004
賴香伶,請勞工放心？今年年初蘇院長才說我們幫每位勞工多賺了1.4萬元，但明年這個紅利應該就沒有了，是不是？,112,LCIDC01_1119301_00004
賴香伶,這我懂啦！我要講的是，明年是雪上加霜，明年大概就看不到蘇院長說我們幫大家賺了多少錢吧？,113,LCIDC01_1119301_00004
賴香伶,當然，我不能直接在這裡說是你們投資失利或能力有問題……,114,LCIDC01_1119301_00004
賴香伶,這我也知道，所以……,115,LCIDC01_1119301_00004
賴香伶,所以法制上你們認為沒有問題，但我要講的是，針對勞動基金這麼大的虧損，我沒有看到勞動部有任何文宣做任何說明……,116,LCIDC01_1119301_00004
賴香伶,勞工朋友碰到我時，都會一直詢問未來是不是領不到錢……,117,LCIDC01_1119301_00004
賴香伶,專戶會不會不夠等等……,118,LCIDC01_1119301_00004
賴香伶,你們都搖頭表示不會，那我們就來看勞保好了。請教部長，勞保的修法到底要不要提？我想這才是真正見底的，這還跟投資無關，我們的水庫是不是沒有了？現在到底怎樣了？,119,LCIDC01_1119301_00004
賴香伶,所以勞保條例改革的版本現在到底在哪裡？,120,LCIDC01_1119301_00004
賴香伶,還要多久？你已經講3年了，從我來立法院的第一年講到現在……,121,LCIDC01_1119301_00004
賴香伶,我希望在你任內真的可以提出版本，請問部長，作為勞動部部長，你有沒有想要在你任內提一個版本出來？,122,LCIDC01_1119301_00004
賴香伶,只有這個答案啦！好不好？請問，還要等多久？其實我也在此質詢過好幾次了，不得不改的話，勞保年金改革委員會到底要不要召開？今天我們面對的是10年內整體不足金額達上兆的狀況，這是一定存在的問題，除了少子化問題，加上現在你們投資又失利，勞工都在問，勞保以後是不是年年都由國家撥補？好，那就來補，請問今年是不是補450億？,123,LCIDC01_1119301_00004
賴香伶,明年編列450億，後年準備編多少？600億嗎？,124,LCIDC01_1119301_00004
賴香伶,"最起碼要超過800億，3年的安全準備，每年跑不掉大概是1,000億，請教部長，你會不會推動行政院召開勞保年金改革委員會來討論這個問題？你來督促跟要求應該是合理正當的。",125,LCIDC01_1119301_00004
賴香伶,徵詢都聽很多遍了，我的意見也都給你了。,126,LCIDC01_1119301_00004
賴香伶,所以你還是不願意，即條例不提、年金改革委員會也不推，而2024年很快就到了……,127,LCIDC01_1119301_00004
賴香伶,要不要在你任內……,128,LCIDC01_1119301_00004
賴香伶,"撥補有考慮到近3年你們準備上限是到多少？有可能每年撥補到1,000億元嗎？",129,LCIDC01_1119301_00004
賴香伶,大家都懂，每一年撥補不及虧損嘛！,130,LCIDC01_1119301_00004
賴香伶,後年會不會到600億元？,131,LCIDC01_1119301_00004
賴香伶,水位都已經告訴你了，在第1頁的圖上，一個是往上漲，一個是往下跑，你們都看過一百多遍了，精算報告也是你們提的。你們用投資報酬率提高變成4%、CPI降低，然後達成延後到2028年，這件事情大家也看懂了。但精算總歸精算，沒有人想到今年一虧就是三千多億元，到年底可能到五千多億啊！這是你們要承擔的政治風險及投資上的一個風險。我期待部長還是在任內儘快把勞保年金──其實改革委員會的推動是整合共識最快的方法，麻煩你還是在這個會期前跟我說明，到底可不可能推動及組成行政院層級的勞保年金改革委員會，12月底前可以嗎？,132,LCIDC01_1119301_00004
賴香伶,努力一下！最後跟主席借1分鐘就好，就是外送條例的部分，請教鄒署長、王司長，王司長剛剛說可以協助工會來跟平臺業者簽訂團體協約，我在那邊看轉播，聽了實在太感動、太高興啊！所以趕快再過來追加這一題，請教王司長要如何讓平臺業者跟工會簽團體協約？,133,LCIDC01_1119301_00004
賴香伶,所以他有可能成為他的雇主之一去跟他簽團體協約嗎？,134,LCIDC01_1119301_00004
賴香伶,所以類似行業性的一個規範嗎？,135,LCIDC01_1119301_00004
賴香伶,有點像定型化的協議、契約？,136,LCIDC01_1119301_00004
賴香伶,好！去努力看看，好不好？,137,LCIDC01_1119301_00004
賴香伶,請教鄒署長，外送作業安全衛生指引已經在8月30日出來，通篇看到的都是雇主跟勞工的關係，如果回到剛剛王司長的說法上面，這個指引到底管到哪幾個平臺業者？哪些工作者及占比多少？,138,LCIDC01_1119301_00004
賴香伶,很少吧！平臺業者認為是僱傭的……,139,LCIDC01_1119301_00004
賴香伶,指定作業的人可以準用，所以相關的都可以被納進去……,140,LCIDC01_1119301_00004
賴香伶,第三人責任險寫得更明確，雇主使勞工從事要提供人身保險等等，所以這一條的窒礙難行應該是明確的。還是要請教及確認，部長、署長會不會訂定全國版外送的相關法制作業呢？,141,LCIDC01_1119301_00004
賴香伶,要社會共識嗎？其實共識很簡單，問我們王司長就知道了，如果他都願意推動定型化契約，這個法的立法就不難，我的版本也差不多出來了，到時候再請部裡面一起來推動，好不好？這攸關新興行業的勞工權益，以及新行業的引導。,142,LCIDC01_1119301_00004
賴香伶,麻煩你們也提出版本，好不好？謝謝。,143,LCIDC01_1119301_00004
張育美,（10時51分）部長好。今年5月的時候，我曾經質詢過勞動部的移工留才久用方案，社福移工申請轉換為中階技術人力，其中一項條件就是必須通過華語文測驗，以證明這樣才具有華語的能力。當時我以華語文測驗的量能來換算，1年200人，如果要達成勞動部設定留才8萬人的目標，那時候我就講大概要43年才能把報考的移工消化完畢，對不對？你還記得吧！這個方案無助於緩解國內中階技術人才的需求，事後勞動部就從善如流啦！對不對？採納本席的建議，在今年8月17日修法放寬移工語文能力的認定管道，對不對？但舊有法案仍然實施長達四個月，即4月到8月底實施了四個月。請問部長，在8月修法之前，通過語文能力測驗且獲得勞動部核發聘僱許可的社福移工人數有多少？,144,LCIDC01_1119301_00004
張育美,後來你從善如流。,145,LCIDC01_1119301_00004
張育美,是衛福部提的。,146,LCIDC01_1119301_00004
張育美,知道，部長要提的，我等一下會提，就是你已經有改善了。我剛剛講4月到8月的時候，你知道嗎？雇主提出中階技術看護工，申請的只有76個人，只有76個人！全國這麼缺，為什麼只有76個人提出申請，而且通過的只有4個人？我們看一下表格，只有76個人提出申請，為什麼呢？部長，是不是大家覺得好難喔！不要提出或者是好多門檻呢？我是講舊的啦！8月以前的。,147,LCIDC01_1119301_00004
張育美,可是你們8月又有一個新的留才方法。,148,LCIDC01_1119301_00004
張育美,差一點點就可以……,149,LCIDC01_1119301_00004
張育美,部長，我剛剛聽你提到，包含語文能力測驗、36小時訓練、雇主自評等等，這些都符合一定的標準，是嗎？這就符合你們的標準，對不對？或者符合一定的薪資，你說薪資2.6萬元的可以免除語言能力證明，這樣對不對？,150,LCIDC01_1119301_00004
張育美,我們再往下看，8月17日到10月13日為止，取得中階技術聘雇許可的看護工已經有107人，可喜可賀，不是只有4個人！,151,LCIDC01_1119301_00004
張育美,但是平均一個月還是不到55人，所以要如何提高呢？,152,LCIDC01_1119301_00004
張育美,部長，請看簡報的表格，已通過語言能力測驗的人數32人、36小時訓練的0個、雇主自評的32個、剛剛你說薪水2.6萬元的42個，所以總計106人，對不對？,153,LCIDC01_1119301_00004
張育美,"可是月薪要達2萬6,000元的話，有些雇主會不會有意見，因為我們臺灣的……",154,LCIDC01_1119301_00004
張育美,免繳就安基金費？,155,LCIDC01_1119301_00004
張育美,所以剛好補上去，負擔沒有增加？,156,LCIDC01_1119301_00004
張育美,知道，雖然薪資增加，但是就安基金不用繳，這個算是有考慮到民眾需求。,157,LCIDC01_1119301_00004
張育美,"你們的目標是8萬人，如果實際上1個月是55人的狀況，也要1,455個月，也就是需要122年才能達到留才8萬人的目標。部長，你對這樣的期許滿意嗎？還有什麼更快速的？",158,LCIDC01_1119301_00004
張育美,我的數據是8月到10月。,159,LCIDC01_1119301_00004
張育美,你希望2030年達到8萬人。,160,LCIDC01_1119301_00004
張育美,可是只有社福移工才需要語言能力啊！,161,LCIDC01_1119301_00004
張育美,產工加移工達8萬人……,162,LCIDC01_1119301_00004
張育美,我幫你算過這樣很難啦，所以你要如何宣導就很重要，很多人不知道啊！我們看到8月以前只有4個人，當然我知道你們現在已經從善如流去做，而且現在已經有一百多人、已經開始破百了，那如何讓破百到破千？你看這不難嘛！包含薪水2.6萬元、雇主自評，其中語言能力是比較難的，光是雇主自評好像就可以，對不對？所以要如何加強？部長，我覺得要好好宣導。,163,LCIDC01_1119301_00004
張育美,我再請教部長，中階技術家庭看護工要符合語言能力，或36小時訓練，或雇主自評，或月薪2.6萬元以上？是「或」還是「加」？,164,LCIDC01_1119301_00004
張育美,就是其中一項、四選一，比如說，雇主自評的話……,165,LCIDC01_1119301_00004
張育美,其實這樣不難啊，為什麼就這麼少人呢？,166,LCIDC01_1119301_00004
張育美,要多加宣導。,167,LCIDC01_1119301_00004
張育美,還要簡化流程啦，我剛剛看了一下，那個流程還滿難的。,168,LCIDC01_1119301_00004
張育美,我剛剛看了那個流程很難。我們還是回到那個金額……,169,LCIDC01_1119301_00004
張育美,我會提供給你，難的地方請你改一下。,170,LCIDC01_1119301_00004
張育美,既然有這麼好的政策，2030年要到8萬人是嗎？,171,LCIDC01_1119301_00004
張育美,如果到達8萬人，目前速度就要快一點，你要到各個協會、公協會、企業家協會去說明，所以你應該說下次來聽的，最好部長能夠出席，不要只有人資而已，要有決策能力的人去跟他說有這麼好的國家政策來支持外籍移工，對不對？,172,LCIDC01_1119301_00004
張育美,而且是「或」、「或」、「或」，這麼好！,173,LCIDC01_1119301_00004
張育美,要落實、要用出去啦，謝謝。,174,LCIDC01_1119301_00004
邱泰源,（11時3分）部長好。我們今天都在談保障勞工權益的相關事宜，包括法案，從5月1日正式施行以後，職災法也積極在進行，基本工資也一直在提升，我想這個部分都要給予最大的肯定。,175,LCIDC01_1119301_00004
邱泰源,我有幾個跟勞工健康、安全相關的議題要請教部長。第一，我們可以看到災保法擴大納保以後已經見成效，但是好像有40萬勞工可能還沒有進來，到底都是在哪個地方？是不是未滿五人的小公司會比較困難？將來如何提高納保人數？如何簡政便民？有時候我們覺得這個很簡單，這對大公司來講沒問題，但是對小單位來講，因為太忙，所以有時候他們有所疏忽，請問是否有辦法去輔導、協助，以保障所有勞工的安全？,176,LCIDC01_1119301_00004
邱泰源,可能要有具體的作法。,177,LCIDC01_1119301_00004
邱泰源,剛開始在討論這些法之前，都很擔心會增加這些小單位的負擔，可是經過大家討論以後，看起來是一個三贏的法。,178,LCIDC01_1119301_00004
邱泰源,那就要讓他們進來，很方便的來保障對不對？,179,LCIDC01_1119301_00004
邱泰源,這個我們很關心，因為很多健康服務單位都是小小的單位，所以要幫忙他們一下。第二個問題，本席要關心網絡醫院，我們有職災預防及重建中心，這個部分有兩點，第一，這個重建中心現在的改組或者處理的狀況是怎麼樣？不管是我們的法通過或是組織改變了，我都希望儘量不要讓第一線照護病人的一些團隊受到影響，讓他們感到擔憂，擔心之後執業狀況會有所改變，不要小看這個，這都會牽涉到，像最近要開始收住院醫師，職醫科現在很紅，在部長你們的努力之下，看起來大家在這個部分都工作得很有成就感，也真的可以照顧到很多需要的勞工、受到災害、復健的病人，所以還滿紅的，但是那些老師也會擔心整個政策有沒有改變，這是第一個問題；第二，我們原來有86家網絡醫院，上次我有跟部長討論過，是不是有需要再擴大到社區，特別是偏鄉、離島地區如何建構一個更好的職災重建服務？請部長對此作一答復。,180,LCIDC01_1119301_00004
邱泰源,我想這個部分要積極再……,181,LCIDC01_1119301_00004
邱泰源,如果您覺得可以擴展出去的時候，就要早一點來布置。,182,LCIDC01_1119301_00004
邱泰源,因為人員要訓練、溝通。,183,LCIDC01_1119301_00004
邱泰源,偏鄉、離島的資源本來就比較少，所以你在布置時要特別給予補助，要補充得夠一點。,184,LCIDC01_1119301_00004
邱泰源,這個就是我一直在關心的地方，請勞動部多多努力一下。接下來我們可以從整個比例來看，勞工失能傷害頻率還是有稍微增高，要如何持續精進？我也知道勞動部非常用心，特別在高風險行業別，如何改善職災風險？請部長對此做個回應。,185,LCIDC01_1119301_00004
邱泰源,謝謝署長的回答。因為通報率高當然就感覺發生頻率比較高，但這是好事情，尤其是嚴重度有降低就非常令人欣慰。只是還是有一些失能的員工，要怎麼樣改善他們生活的困境，這個部分也請多多追蹤，我相信醫療還是最重要的。,186,LCIDC01_1119301_00004
邱泰源,要照顧好。,187,LCIDC01_1119301_00004
邱泰源,成就他整個家庭的生活，我想很多家庭都是靠這個勞工在維繫生計，所以我們一定要從各方，包括預防到最後的重建，都要給他們完整的照顧。,188,LCIDC01_1119301_00004
邱泰源,最後一個問題，我們以前常常講在疫情當中可能有很多變化，現在覺得疫情比較穩定了，失聯移工的處理方式有沒有什麼改變？希望社會也不要因為這個部分影響到治安，在防疫當中可能也照顧不到，過去這2、3年，不管是勞動部、衛福部，都和立法院一起很努力關心這部分，第一個問題就是怎麼樣降低失聯移工？我想你們還是有注意到防疫的問題，要怎麼樣調整？,189,LCIDC01_1119301_00004
邱泰源,我想部長有掌握數據，這樣很好，你們也要關心這一塊。,190,LCIDC01_1119301_00004
邱泰源,防疫一鬆，他們也就鬆了。,191,LCIDC01_1119301_00004
邱泰源,如果到處都可能有破口，當然對臺灣也不好，你們再努力。,192,LCIDC01_1119301_00004
邱泰源,最後一句話就好了，勞動部對職業病認定參考指引一直在修正，我還是建議要一直和職醫科醫生精進，今天洪申翰委員也有提到，有些疾病的時間因果關係是值得我們來關心的，這部分可能需要專科醫療團隊繼續努力，好不好？,193,LCIDC01_1119301_00004
邱泰源,好，這部分再拜託一下，謝謝。,194,LCIDC01_1119301_00004
楊曜,（11時14分）部長好。我剛剛聽邱泰源委員講我們的十大傷病中心已建立82家網絡醫院。,195,LCIDC01_1119301_00004
楊曜,我非常感謝邱泰源委員提出這個問題，因為這個問題並不是我的質詢題目，可是我剛剛聽提到邱委員關心離島偏鄉網絡醫院的建置，你能不能再講具體一點？,196,LCIDC01_1119301_00004
楊曜,這個確實對於離島偏鄉來講是一個很……,197,LCIDC01_1119301_00004
楊曜,就是由高醫來負責資源？,198,LCIDC01_1119301_00004
楊曜,所以願意承擔的醫院也找到了。,199,LCIDC01_1119301_00004
楊曜,只有細節方面……,200,LCIDC01_1119301_00004
楊曜,剛剛署長講得沒有錯，大概離島偏鄉的給付通常都會高一點。,201,LCIDC01_1119301_00004
楊曜,就是高醫負責配合澎湖的惠民醫院開職業傷病門診。,202,LCIDC01_1119301_00004
楊曜,然後成立網絡醫院。,203,LCIDC01_1119301_00004
