speaker,speech_text,speech_number,meeting_id
王婉諭,（10時）主席、各位列席官員、各位同仁。今天提到疫情期間的精神相關問題，在週一的衛環委員會安排了請自殺防治中心來列席，衛福部有提到，除了前期的心理諮詢協助之外，長期來說，在後段也應該要做資訊的傳達，未來在衛福部的專區也會設置這樣子的內容，讓大家在心裡衛生方面能夠更健康，我在這裡要肯定衛福部有想到後段的協助。本席今天要針對母乳的問題和亂象來請教次長，上週有一則新聞，有一些網紅或YouTuber在戲謔母乳，我們撇開母乳不該被污名化的問題，先談網紅可以從網購平台就可以輕易買到母乳，我們簡單利用網路搜尋，光是一個平台，就有二、三十家賣家在網路上販售母乳，這樣子的資訊是不是對的？查詢相關法規及說明可知，從2011年起，衛生署表示應朝食品方向修法，將母乳納入食品衛生管理法，但是在同年的12月食藥署就函釋，母乳應該是體液，雖然是體液，但它是不是受疾病防治法的規範，食藥署並不確定，可以做的是按照消保法的規定來規範或要求下架。2016年也有立委在質詢這個問題，衛福部的回應是母乳應該兼具食品和體液兩種性質，次長，現在是2020年了，衛福部是不是能夠清楚定義母乳是哪種性質？,85,LCIDC01_1092801_00002
王婉諭,好。,86,LCIDC01_1092801_00002
王婉諭,既然是體液，是不是有一個相關的明確規範，規定它是不是可以販售？是不是能夠針對這一點來做一個說明和澄清？,87,LCIDC01_1092801_00002
王婉諭,食藥署的說明應該是針對100年的函釋，是一樣的角度，就是說它雖然是體液，但並不屬於特別限制販售的體液，所以應該是用消保法的方式來處理。我想確認一下，剛剛提到能不能販售，目前衛福部的說法是，這是在自由販售的許可之內。,88,LCIDC01_1092801_00002
王婉諭,我想確認一下，意思是母乳雖然是體液，但是是可以交易的，而且不會受到食品衛生相關法律的規範？,89,LCIDC01_1092801_00002
王婉諭,因為沒有製造商，所以規範是相當寬鬆的。,90,LCIDC01_1092801_00002
王婉諭,我想確認一下，衛福部認為食品是屬於可交易的商品嗎？,91,LCIDC01_1092801_00002
王婉諭,所以是可以交易的？,92,LCIDC01_1092801_00002
王婉諭,沒有禁止就是說可以嘛？沒錯嘛？我想提醒一下，奶粉已經有比較明確的規範，應該限定其安全性，如果母乳是可以交易的，是不是也應該用嚴謹的態度來面對？因為母乳也具有傳染病的風險，是不是能夠針對品質，更清楚地規範或定義？一歲以下嬰幼兒奶粉已經有這樣的定義了，理論上對母乳應該要更嚴格地規範，至少要等同辦理。,93,LCIDC01_1092801_00002
王婉諭,所以食品的安全有規範，但是體液的安全要求不需要規範？,94,LCIDC01_1092801_00002
王婉諭,是沒有辦法規範？,95,LCIDC01_1092801_00002
王婉諭,所以體液的販售不需要從來源來控管，而是販售之後有問題之後才用消保法來管？,96,LCIDC01_1092801_00002
王婉諭,了解。母乳可以販售這件事情，我覺得在醫界應該是普遍反對的，覺得是有風險的，所以這也是為什麼臺灣有母乳庫存在的原因，而且母乳庫……,97,LCIDC01_1092801_00002
王婉諭,我們希望衛福部能夠有文章可以說明清楚，在國外已經有明確的專區說明母乳買賣的風險，這部分至少要讓國人清楚知道母乳交易確實有這樣的風險，在購買時必須小心，這是我們希望你們能夠達到的最基本要求。,98,LCIDC01_1092801_00002
王婉諭,了解。我再來說明臺灣母乳庫的現狀，因為有很多需求，像是早產兒或先天異常的嬰兒有需要，所以臺灣是亞洲第一個成立的母乳庫的國家，目前已經知道有3個地方有母乳庫。剛才我提到母乳有傳播傳染病的風險，目前母乳庫的管理非常嚴謹，會經過一些篩檢的動作，確認母乳安全無虞，才會進到母乳庫。我想請教有關母乳庫的規範，未來會不會有母乳銀行的設置，讓有需要的家長或有需要的人能夠更安心地買到安全的母乳？,99,LCIDC01_1092801_00002
王婉諭,有沒有可能擴大？就是因為有這個需求在，所以在網路上才會有人販售，而且相當普遍。剛才我提到臺灣是亞洲第一個成立母乳庫的國家，日本已經預計要在2023年啟動母乳銀行，然而臺灣已經在2004年在公聽會上提出這樣的需求及相關問題，當時的回應是會儘快研擬，但是後來我們都沒有得到相關的研擬資料，所以我想請教次長，經過這麼多年之後，是不是有計畫擴大母乳庫或增加母乳銀行的設置？,100,LCIDC01_1092801_00002
王婉諭,是，當然。,101,LCIDC01_1092801_00002
王婉諭,因為目前從供需上看起來，不管是供給還是需求都有很多，所以網路上才有大量販售的情況出現，所以也要請衛福部清楚說明母乳是屬於體液，販售不受任何法規限制，只有在發生問題之後可以用消保法來處理，以及母乳會有什麼風險，都要清楚說明。剛剛提到母乳被認定是體液是在2010年，但是在2016年衛福部在回覆時又說它是體液和食品，衛福部傳遞資訊時一直都沒有很清楚、明確地定義，我們能不能藉這個機會，清楚定義下來，讓大家都清楚？,102,LCIDC01_1092801_00002
廖婉汝,（10時10分）主席、各位列席官員、各位同仁。剛剛有委員提到，臺灣民眾募款在紐約時報刊登廣告，WHO回應說跟我們交流非常密切，在你個人的觀點中，你覺得真的交流非常密切嗎？,103,LCIDC01_1092801_00002
廖婉汝,所謂不完整是什麼？,104,LCIDC01_1092801_00002
廖婉汝,重要會議還是其他會議？,105,LCIDC01_1092801_00002
廖婉汝,重要會議反而不讓我們參加，我們駐日內瓦辦事處表示對WHO這樣回應非常遺憾，其實WHO跟我們的衛福部往來是最直接的，你們有去就會直接有接觸，但不見得會跟駐日內瓦辦事處有聯繫吧？還是他們認知上有點距離？還是你們在醫療上有密切聯繫？從WHO的十幾點回應當中，他們說臺灣在癌症或製藥的研究上有很大的貢獻，包括一些對流感等流行病的防疫措施，我們臺灣都做了很大的貢獻，對於這些，他們有表達肯定的態度嗎？衛福部有沒有收到這些訊息？,106,LCIDC01_1092801_00002
廖婉汝,其實他們是空口說白話，根本就是亂講的就是了？,107,LCIDC01_1092801_00002
廖婉汝,不完整的比沒有更糟糕？,108,LCIDC01_1092801_00002
廖婉汝,好。WHO這次看到我們臺灣對武漢肺炎的疫情控制、付出和口罩外交的表現大家都非常肯定，我們也希望WHO未來也給我們一些正面的肯定，讓我們變成會員國是最好，本席也參加過WHA的會議，我們其實是旁聽，席次在最後面，名牌上寫「Chinese」。武漢肺炎疫情對全世界來講都是非常嚴重的衝擊，但是對臺灣來講，這是一個機會。針對今天的議題，我想請教一下，美國CDC認定奎寧治療武漢肺炎有效，但是美國把這項資訊從治療新冠肺炎的資料當中移除，代表他們認為證據不足或是臨床治療效果不夠明確，可是臺灣的疫情指揮中心3月26日的新型冠狀病毒感染臨床處置指引第5版中還把奎寧列為用藥之一，我想請問一下，這是冒險用藥，還是建議用藥？到底有沒有效？,109,LCIDC01_1092801_00002
廖婉汝,我們有沒有在用這種藥？,110,LCIDC01_1092801_00002
廖婉汝,所以嘗試用奎寧去治療？,111,LCIDC01_1092801_00002
廖婉汝,有效嗎？,112,LCIDC01_1092801_00002
廖婉汝,輕症的。,113,LCIDC01_1092801_00002
廖婉汝,所以還在實驗當中？,114,LCIDC01_1092801_00002
廖婉汝,可是奎寧的原料臺灣滿多的，屏東林管處那裡有一個奎寧試驗所，早期日本時代就設的，我們的總統也說要成立製藥國家隊，我們的製藥廠也提供3公噸的原料要製造奎寧，現在還在實驗當中，總統已經發布要成立製造奎寧的製藥國家隊，這樣好嗎？,115,LCIDC01_1092801_00002
廖婉汝,就像紐約這種患者比較多的地方去實驗就是了，我們變成製藥國家隊來賣藥？,116,LCIDC01_1092801_00002
廖婉汝,對。我是擔心，雖然現在還在實驗當中，但是媒體報導讓大家都知道奎寧好像有效，會不會有一些輕症患者或是擔心自己得病的患者先買這些藥來吃？雖然這些都要醫師處方才能購買，但是我們也知道有時候獸醫師也可以買得到奎寧，因為動物用藥也在用，所以會不會有民眾在可以取得奎寧時自己亂用，變成一個風險？,117,LCIDC01_1092801_00002
廖婉汝,有在監看奎寧的使用？,118,LCIDC01_1092801_00002
廖婉汝,我們很憂心有一些錯誤的訊息。第二個問題，我想請教一下，這幾天新聞很熱門的就是案393這對夫妻的事情，蘇院長叫我們不要太計較，可是我想請問一下次長，我上次質詢時，你回答我，如果是第三級警示區的國家，民眾因非必要因素卻前往旅遊後回國確診，所有醫療費用要自己付，而且還要追討、加徵，講得很嚴謹，這是衛福部對我的質詢所做的答復。國人在非必要的情況下去第三級警示區回來確診，所有醫療費用統統都要被計較，而這對從美國回來的夫妻，自己知道有徵兆，有可能確診，還二人分兩班飛機回來，這種情況院長還叫國人不要太計較，這樣對嗎？,119,LCIDC01_1092801_00002
廖婉汝,不是，你回給我的公文是說3月17日之前出國的民眾是已經警告不要出去還出去，所有醫療費用要自己付。這對夫妻旅居國外三十幾年都沒回來過，你們還去查，說2017年有回來過，我想查一下這對夫妻的背景，衛福部為何這麼緊張，還幫他們找理由？他們是4月10日、4月11日回來，雖然他們不是硬要去，是旅居國外三十幾年，回來確診，他們的醫療費用我們要全付，國人的觀感是非常差的。照規定，第三級警示區不能去，請民眾不要去，民眾還硬要去，回來確診的話，就要付所有的醫療費用，那麼這些旅居國外多年的人的醫療費用，我們還要幫他們付，不是很奇怪嗎？所以我認為這部分的醫療費用，衛福部還是可以去注意一下。,120,LCIDC01_1092801_00002
廖婉汝,對，要檢討一下，如果真的要修法或做其他事情，一定要處理。,121,LCIDC01_1092801_00002
廖婉汝,回來怎麼可能隱匿？他們就是要回來治療的，對不對？,122,LCIDC01_1092801_00002
廖婉汝,說真的，依照你們的規定，也可以請檢調單位來調查，他們要負刑事責任，依照疾管局的規定，他們若有隱匿，也要負刑事責任。這些你們都沒有提，只是說沒有關係，基於人道應予救治，醫療費用我們來付，這一塊你們要重新來整理。,123,LCIDC01_1092801_00002
廖婉汝,關於基層醫療，現在很多診所跟我反映他們診所門可羅雀，病人很少，以前人多的時候我們擔心醫療資源浪費，現在大家都怕去醫院和診所，所以人變少，這種情況會不會影響到疫情？現在大家都覺得要儘量不要去找醫生，比較安全，這些基層醫療的問題，衛福部也要考慮一下，最重要的是，對於大型醫院的醫護人員，現在你們都有獎勵，給他們一些補助，無論是護理人員或醫生，但是，每一家醫院都不一樣，可能有二班制或三班制，時數不一樣，因此，我們希望計算方式不要按日，是否能按時計算，提供給衛福部參考，謝謝。,124,LCIDC01_1092801_00002
莊競程,（10時22分）主席、各位列席官員、各位同仁。次長，之前4月13日的案393引發許多民眾的不滿，當然中間是有一些誤解存在，事實上他並沒有健保身分，而且這對夫婦上次從美國返臺是2017年。他們這次回來的隔離費用、治療費用都是由政府買單，大家認為他們用的是健保的醫療，其實這個應該與健保不一樣，況且就算是回國納保也要6個月後才能恢復健保身分。,125,LCIDC01_1092801_00002
莊競程,本席認為要向全民講清楚，政府幫他付的是隔離費用嗎？,126,LCIDC01_1092801_00002
莊競程,隔離與治療？,127,LCIDC01_1092801_00002
莊競程,隔離費用大概是多少，知道嗎？,128,LCIDC01_1092801_00002
莊競程,一天？,129,LCIDC01_1092801_00002
莊競程,隔離治療並不是分開的，這是在負壓隔離病房的費用？,130,LCIDC01_1092801_00002
莊競程,不是在防疫旅館的隔離，而是在負壓隔離病房的費用？,131,LCIDC01_1092801_00002
莊競程,之前對於H7N9流感也有相同的做法，其實，政府應該向全民解釋，不只是旅居海外的國人，甚至是在臺灣確診的外國人，政府也可能會出這筆隔離治療的費用，政府應該要講清楚我們為什麼要這樣做。,132,LCIDC01_1092801_00002
莊競程,本席是問，外國人在臺灣確診，為什麼我們要幫他付醫療費？這應該要向人民講清楚，本席相信一定有你們考慮的因素存在嘛！,133,LCIDC01_1092801_00002
莊競程,有些人認為他不會不就醫，只是他可能會拖到很嚴重很嚴重才就醫，但是，在症狀嚴重的過程中可能就會影響到我們其他的國人，因此為了讓他能放心接受篩檢，以這個例子來看，像日本也是幫確診者付治療費，美國呢？,134,LCIDC01_1092801_00002
莊競程,各州不一樣。,135,LCIDC01_1092801_00002
莊競程,政府應該把這個考量向人民講清楚，不然，人民會誤解為什麼要這樣做，因而造成納稅人內心的不滿，而且這件事又與健保無關，這個部分可能也要講清楚。,136,LCIDC01_1092801_00002
莊競程,以南韓的做法而言，之前有一位三十多歲的臺灣女性拒絕支付定點隔離的費用而遭驅逐出境，他們所謂的定點隔離應該是類似於我們居家隔離的旅館，因為她拒絕支付費用而遭南韓驅逐出境，未來我們會學習南韓這個做法嗎？本席主要是想釐清，這樣的隔離與負壓隔離治療應該不一樣，對不對？,137,LCIDC01_1092801_00002
莊競程,這個必須要講清楚，第一個就是人道考量，世界各國可能都要吸收這個費用。另外就是要確保他可以誠實面對疫調，比較不會等到非常嚴重才去就醫，造成這段時間有空窗期而影響到我們其他的國人。,138,LCIDC01_1092801_00002
莊競程,甚至這個做法與健保無關，也要向國人講清楚整個流程，我想不只是這對夫婦，旅居國外返臺的總共有13人，這個部分可能要講清楚，謝謝。另外，在補貼辦法方面，本席也曾質詢過，之前只提到對醫生及護士的補貼，但是，在SARS期間的補貼還包括其他的醫事人員，然而這次好像跟SARS時不太一樣，對其他醫事人員如何補貼就沒那麼詳細，剛剛蘇委員也質詢過，次長是說下午會有記者會嘛！,139,LCIDC01_1092801_00002
莊競程,因為本席接到許多的陳情，像是醫檢師、醫放師及呼吸治療師等等，對於他們的補貼都沒有相關的細則，甚至有醫院只給放射師一班100元的補貼，本席認為這樣實在是不對！如果下午的記者會宣布，依照醫事人員職責接觸病人的風險訂定津貼及獎勵，該如何確定這樣的獎勵金會落到醫事人員身上？有很多都是由醫院統籌分配，但是醫院可能從中扣了類似管理費之後，他們領到的就不是我們……,140,LCIDC01_1092801_00002
莊競程,"本席希望就這個配套措施，一定要補給這些醫事人員。另外，同樣的，除了醫事人員之外，我們也知道藥師在口罩實名制之後增加了工作量，可以說是一個吃力不討好的工作，甚至有人為了選口罩顏色而責罵藥師，才會有粉紅色的口罩出現，其實藥師也可以說是我們的口罩國家隊，很辛苦！至於補助方面，從2月24日開始有800元的補助，後來是每天可以拿到1,100元到1,200元，但是在口罩增量之後，是不是可以考慮再稍微加碼，甚至回溯到2月6日口罩實名制開始的時間點都可以補助？",141,LCIDC01_1092801_00002
莊競程,有回溯到2月6日嗎？,142,LCIDC01_1092801_00002
莊競程,有回溯到2月6日嗎？,143,LCIDC01_1092801_00002
莊競程,是2月6日嗎？是2月24日開始，有回溯到2月6日？,144,LCIDC01_1092801_00002
莊競程,"最後一個問題，我們在快篩試劑研發方面一直傳出捷報，國內一天的篩檢量大概是三千多例，大概可以到是5,000或8,000的量……",145,LCIDC01_1092801_00002
莊競程,現在很多像是中研院、工研院、國衛院、甚至是學術機構或廠商，大家都投入於快篩技術的發展。關於食藥署這邊的審查機制，根據藥事法第四十八之二條，因應公共衛生情勢之需要，可以開專案特准藥物製造及輸入，對不對？但是我們在3月26日才宣布啟動，本席認為過去有幾個研發團隊因為缺乏臨床的檢體，也沒有法令細節的依循，感覺上快篩試劑的開發在3月26日之前可能就有2個月的空窗期。請問食藥署，因應武漢肺炎如此嚴重的傳染性疾病，怎麼會到3月26日才啟動這個專案呢？,146,LCIDC01_1092801_00002
莊競程,正常的流程大概要多久可以上市？,147,LCIDC01_1092801_00002
莊競程,過去可能要7個月……,148,LCIDC01_1092801_00002
莊競程,請問，次長能否在此向本席保證，未來會全力支持，無論是工研院或其他研發單位，只要準確度到達一定的基準，一定要讓他們快速的量產。,149,LCIDC01_1092801_00002
莊競程,為了因應未來有任何疫情，我們希望食藥署的審查機制能夠讓他們快速通過審查。,150,LCIDC01_1092801_00002
莊競程,好，謝謝。,151,LCIDC01_1092801_00002
徐志榮,（10時34分）主席、各位列席官員、各位同仁。老實說，面對這次新冠肺炎的疫情，你們真的是比較辛苦。,152,LCIDC01_1092801_00002
徐志榮,真的是做得非常好、非常不錯，世界各國也都有好的口碑！請教次長，一般都是5月份召開WHA會議，這次我們的藥師公會全聯會也將於5月赴WHA報告臺灣口罩實名制的經驗，也就是說我們的防疫做得很好，不過所謂的「很好」包括很多種，其中一種就是藥師公會獲邀赴WHA報告。當然，到時候是否如期召開會議，或是改採視訊會議，還是有其他方式，這些都還不知道。包括我們的民間單位，譬如醫師公會是否已經收到邀請，這個也不知道。本席主要是想問，如果他們如期舉辦的話，我們政府單位收到邀請函的可能性並不大，或者是像往年一樣去參加，私下再與各個國家交流？,153,LCIDC01_1092801_00002
徐志榮,主席，去年我們醫師公會好像也有參加，今年你有接到邀請嗎？還沒有？,154,LCIDC01_1092801_00002
徐志榮,本席希望，這次我們做得這麼好，世界各國不要只是嘴巴講一講，讓我們讚聲一下而已，往後也要繼續在這類的會議中多多大力的幫我們發聲，所謂的發聲就是講講我們的好話啦！剛剛已經有委員提過的，本席就不再重複，而且次長也講過可能的一些細節，關於醫療照護及防治發給補助津貼及獎勵要點等等已經確定了，可能下午就會公布。主要就是大家都很辛苦，對於這些一線的醫療人員不是照顧夠不夠的問題，而是要積極一點。對於他們的所有鼓勵措施，本席相信政府不會食言而肥，不可能，只是要積極一點、快一點，既然答應了就要快點做到。,155,LCIDC01_1092801_00002
徐志榮,"本席建議，只要是在第一線，無論是醫護人員或是檢驗師、放射師、甚至是志工或保全等等，只要是具有風險的工作性質，多多少少都應該要有所鼓勵。我們好像也有團體績效獎勵的辦法，從100萬元到1,000萬元的金額，希望能視實際情況讓這些團體分配到獎勵，因為這場戰爭要持續到什麼時候也還不知道，如果我們能適時的給予一些鼓勵，至少能讓士氣提振一點。第二點，目前各部會都在盤點各自相關產業因疫情而遭受到的影響，並思考該如何紓困，本席在此要提的是對於長照的紓困方案，當然有一些條件，像是地方主管機關書面通知停業而中斷、或是6個月收入總額較前一年減少15%、或是3個月減少30%等等，本席認為，這些條件是否比其他部會更嚴苛一點？事實上，為了培養這些社工或照服員，以前都是建議將他們的薪水提高一點，才能將他們留住，如今因為疫情的關係，他們接的個案可能會因此而減少，我們擔心在這個時期會留不住這些人才，為了因應這些照服員及社工人員在這段期間接的case比較少、收入比較少，請部裡考慮如何適當的給予補助？",156,LCIDC01_1092801_00002
徐志榮,請次長留意就好，畢竟人才得來不易，不要因此次疫情而流失了人才。其餘還有幾個細節問題請教次長，那就是很多偏鄉、原鄉民眾表示他們有買口罩的煩惱，因為他們那裡沒有診所，只有衛生所，也只能在衛生所領，所以他們花一、兩個小時從山上跑到山下，再排隊排一、兩個小時，如果這樣花上三、四個小時買到了也還好，最後卻是沒買到，實在很糟糕！以苗栗來說，符合原鄉、偏鄉條件就有南庄鄉、獅潭鄉、泰安鄉等，所以我想請衛福部考慮一下，也已經向苗栗衛生局局長建議，可否在其他地方如農會、公所之類的多設一個點？或者增加衛生所的量？真的不要讓人家花兩、三個小時還買不到口罩，這點我向次長反映，應該會有改善吧？,157,LCIDC01_1092801_00002
徐志榮,雖然現在有口罩實名制2.0、3.0之類的，但畢竟有些人比較不方便使用，也不會使用，至於便利商店，其實很多時候一整個鄉就只有一家。最後，有藥師反映，因為疫情關係，導致大陸、印度原料無法進口，讓他們面臨部分藥品短缺的困難，偏偏處方箋上寫著不可替代。這些藥師建議，如同成分、同劑量的話，可否在此青黃不接之際，不做不可取代的硬性規定？,158,LCIDC01_1092801_00002
徐志榮,好，謝謝。,159,LCIDC01_1092801_00002
蔣萬安,（10時56分）主席、各位列席官員、各位同仁。這問題我之前曾提過，現在我仍要再次請教。現在確診案例大多是返臺境外移入，有鑑於此，能否對機場入境者進行全面普篩？,160,LCIDC01_1092801_00002
蔣萬安,指揮中心一再強調，可能出現偽陰性，或者陰性數量很多，導致大家鬆懈了防備之心。我想說明的一點是，其實也有其他國家對機場入境者全面普篩，目的就在於防堵任何可能的漏網之魚！只要普篩能篩出一個陽性，就能抓到一個確診。至於被檢測為陰性或偽陰性者，還是得進行居家檢疫14天，也就是並非檢測結果為陰性就沒事了，後續的防疫工作還是要做，並觀察這14天是否有症狀出現。簡單說，普篩的目的在於防堵漏網之魚，因此，即便檢測為陰性或偽陰性也不代表沒事了，該做的防疫工作還是得落實。爰此，我不認為這足以成為拒絕對機場入境旅客普篩的藉口！,161,LCIDC01_1092801_00002
蔣萬安,對。,162,LCIDC01_1092801_00002
蔣萬安,我覺得意思不一樣！,163,LCIDC01_1092801_00002
蔣萬安,我講一個實際的例子。華航3月30日從紐約直飛臺北班機確診人數不斷增加，這點次長應該知道。該航班三百多名旅客中已經有11人確診，確診率達0.3%，當初入境時，除5個出現症狀當場採檢外，其餘均未經採檢直接回家居家檢疫！後來該航班的確診人數不斷增加，結果如何？陳時中指揮官說，將對同班機所有旅客進行全面採檢！現在才在亡羊補牢！次長剛剛說自居家檢疫當中再來抓，既是如此，何以不在機場入境時就全面普篩？其他各國都這樣做啊！,164,LCIDC01_1092801_00002
蔣萬安,當然要做居家檢疫！,165,LCIDC01_1092801_00002
蔣萬安,是啊！第一階段普篩如能抓到一、兩個陽性確診者，就不會有該班機這種陸續出現確診案例的狀況了！,166,LCIDC01_1092801_00002
蔣萬安,再說，這些人入境後，根本不知道他們會接觸哪些人，從而提高傳播風險，我們並不希望有這樣的風險存在，必須於第一道防線時就阻絕任何的可能性，如果我們現在的檢測量能可以的話！請問次長是否知道現在一天入境旅客人數是多少？,167,LCIDC01_1092801_00002
蔣萬安,我調航班資料來看，昨（14）日歐美返國的航班只有4班，今（15）日一樣只有4班從歐美返國。如果我們的檢測量能足夠，其實是可以這樣做的！其他國家像日本，就在成田機場針對入境民眾進行全面普篩，他們也在機場採取這樣的方式。所以我真的認為，我們應該朝這個方向去思考、去評估。,168,LCIDC01_1092801_00002
