speaker,speech_text,speech_number,meeting_id
蔣萬安,好，他也要有這種觀念，知道要包好放著。如果他不清楚，可能就照一般廢棄物處理掉。,53,LCIDC01_1091501_00004
蔣萬安,你們怎麼通知？,54,LCIDC01_1091501_00004
蔣萬安,現在的確很多民眾是不知道的，照疫情指揮中心昨天預估，接下來受隔離檢疫人數會到6萬人次。,55,LCIDC01_1091501_00004
蔣萬安,但實際接受專業廢棄物清運的人很少很少，我相信大部分的民眾並不清楚跟誰聯繫，甚至也認為我是不是就當一般廢棄物處理就好了？在宣傳上面環保署要加強、再加強！,56,LCIDC01_1091501_00004
蔣萬安,可以預見，接下來會有非常大量的民眾受檢疫隔離，不要說是沒有傳染力的廢棄物，萬一隔離14天中，在後期突然發病，前期所存放的廢棄物是可能有傳染力的。我們不希望有任何破口。這部分希望環保署能更主動積極，宣導、宣傳也好，或不需被動等待民眾來申請，才要派甲級廢棄物清除業者處理。,57,LCIDC01_1091501_00004
蔣萬安,我不清楚目前整個清運的量能如何？有沒有可能這些受居家隔離或檢疫的民眾，都比照以甲級廢棄物清除業者來處理？有沒有辦法？是否目前仍無法？,58,LCIDC01_1091501_00004
蔣萬安,好，謝謝署長。,59,LCIDC01_1091501_00004
蘇巧慧,（10時48分）主席、各位列席官員、各位同仁。首先我想請教環保署張署長，我們都沒有發燒，今天站在這裡詢答，剛才在會議過程中是戴著口罩的，但站上來這裡，我跟會議室任何人都距離一公尺以上，所以我應該可以不用戴口罩。大家可以接受嗎？而且麥克風都有消毒。署長，今天真是一個很好的示範，早上這一齣讓大家看到，臺灣現在各行各業、各個角落都有可能會發生像今天早上立法院面對的狀況。一個可能接觸的人確診了，那接下來相關人的範圍到底到什麼程度？我們要做哪些事情？今天早上其實是一個很好的示範，第一，其實環保署你們知道有一個職工發生這樣的狀況時，內部一定做了相當多的處置，所以連剛才CDC來時都說，經過他們的風險評估，環保署內目前是風險度極低，所以署內可以正常運作上班，沒有錯吧？,60,LCIDC01_1091501_00004
蘇巧慧,這部分環保署做得好，這點要先給予各位肯定，未來也應該如此。但我剛剛有說，第二部分做得不夠精實的是，所有資訊要公開透明，其實已經開始有一件、二件走在你們前面，就像中研院一樣。所以我也認為環保署昨天知道有員工確診了，應該在第一時間就對社會大眾公布，也告知你們的處置做到哪些階段，讓社會大眾更安心。署長同意吧？,61,LCIDC01_1091501_00004
蘇巧慧,這個記者會應該要早點開嘛！但我覺得還有第三點可以繼續追問的，也跟環保署的業務相關，就是當這些處置都做完了，訊息也公開了之後，還有另一個部分就是那位員工星期一沒來上班，就已經開始消毒。大家會碰到的是，辦公室內有一個人發生這個狀況，接下來要做什麼？該隔離的去隔離了，那整個環境呢？我們看到新加坡的報導，就是如果有一個人確診，在這個空間中採驗時，15個人採驗中，有13個人是有危險的。可是經過消毒之後，全部都會變成陰性的，可見消毒是一件很專業的事情。署長也認為消毒是專業的吧？我想知道現在中研院或國家音樂廳的澳洲籍演奏家，甚至包括環保署，你們的消毒作業是怎麼做的？是專業人士來做的嗎？未來一般社會大眾遇到相同狀況時，清毒工作要怎麼做？要聯絡誰？,62,LCIDC01_1091501_00004
蘇巧慧,是找專業嗎？還是自己用漂白水？要打電話通知誰？,63,LCIDC01_1091501_00004
蘇巧慧,環保署這次發生的事件是怎麼消毒的？找誰？,64,LCIDC01_1091501_00004
蘇巧慧,專業清潔公司？,65,LCIDC01_1091501_00004
蘇巧慧,是找私人廠商來協助？,66,LCIDC01_1091501_00004
蘇巧慧,環保署目前沒有自己做，其他地方看起來是縣（市）環保局……,67,LCIDC01_1091501_00004
蘇巧慧,是啊！不可能我自己稀釋漂白水，抹布擦一擦就表示這裡消毒完畢，這是不可能的，也不合理，甚至後面也要有採樣的工作，確保這個消毒工作是完成的。,68,LCIDC01_1091501_00004
蘇巧慧,對，這樣大家才會安心。,69,LCIDC01_1091501_00004
蘇巧慧,是。所以今天透過這個詢答，我們確認了兩件事。不是只有大家討論的廢棄物而已，接下來是消毒的工作。第一，我們要有明確的指引。第二，我希望消毒的部分就如同廢棄物處理，需要有甲級廢棄物清理公司，這是一個經過國家、政府認證，是一個專業的廢棄物處理公司，由其處理廢棄物。那消毒是不是也有國家認證，民眾可以找這些人來做消毒工作，並且做完後可以認證，這裡已乾淨安全了？環保署是否可儘快公布指引、專業公司與認證等三個步驟？,70,LCIDC01_1091501_00004
蘇巧慧,當然。,71,LCIDC01_1091501_00004
蘇巧慧,署長，這是兩件事。一個是有確診案例出現在這個場域中後，要求應該要有專業的消毒公司來進行這個場域的消毒，讓這個場域重新變成安全，而且應該要認證。另一種是日常的消毒指引，這是兩回事。你不可能叫全國所有地方每天都用專業的消毒公司來做，這是不可能的事。今天早上環保署恰好也有一位這樣的案例，表示有確診的了。在這樣的狀況下，消毒工作應該是要跟其他的消毒工作是不同規格的，對不對？,72,LCIDC01_1091501_00004
蘇巧慧,這是兩種不同的狀況，尤其從今天的狀況看出來，所以我具體要求環保署要訂出，當有確診案例時應該如何消毒的指引。哪一些是專業的公司可以做的高風險消毒工作，以及消毒工作完成後的認證，讓這個場域重新恢復安全。我覺得應該要處理這些問題，而且要公布出來。,73,LCIDC01_1091501_00004
蘇巧慧,日常。,74,LCIDC01_1091501_00004
蘇巧慧,對，沒有錯，而且還牽涉到到底哪些是有效的消毒藥劑，現在坊間光是次氯酸水發現有這麼多種，每個售價開始一直往上漲，到底有沒有效？還有在垃圾車後面就噴次氯酸水，到底有沒有效？有效的話，全國就趕快去做。如果這個效果不大或有更好的方式，也應該要提供。主席（洪委員申翰代）：請莊委員競程發言。,75,LCIDC01_1091501_00004
莊競程,（10時56分）主席、各位列席官員、各位同仁。我想請問環保署張署長，經過今早的一場虛驚，未來可能大家都會面對到同樣的狀況。剛才署長說你們署裡開會時，人多會戴口罩。假設像委員會這個地方，早上的人多不多？會需要戴口罩嗎？,76,LCIDC01_1091501_00004
莊競程,其實我剛剛一直在想一個問題，其實每個署在委員會都有一個群組，貴署發生這樣的狀況，可以提前在群組跟我們溝通，看看是否要向CDC諮詢，在這次會議提高一些防疫的措施。貴署或其他部會也可以參考這樣的作法，這是未來每個部會有可能碰到的狀況。如果要開會的話，是不是在群組裡跟委員會做個說明，可以事先有個應變措施，我覺得未來可以思考一下這個方向。,77,LCIDC01_1091501_00004
莊競程,另外，針對疫情的增溫，未來進衛環委員會開會是否都要強制戴口罩？,78,LCIDC01_1091501_00004
莊競程,"我覺得衛環應該做個表率，畢竟是衛環，這是一個人多的地方，大家共處的時間也夠久。另外，我想請問署長，為了防堵武漢肺炎疫情，自3月19日起入境的本國人與外國人一律要檢疫14天。交通部預估，光是3月20日就有一萬多個國人緊急返國，加上指揮中心宣布要回溯到3月5日至3月14日有歐洲旅遊史的民眾，也必須居家檢疫。居家檢疫人數一夕暴增，剛才我看貴署資料寫累積至四萬多人次，昨天衛福部指揮中心表示目前檢疫人數大約是3萬5,000人，有可能增加到5萬人至6萬人。剛才談到廢棄物清運的問題，署長報告時有提到廢棄物清運方面會由地方環保局定期抽查，及主動關懷居家隔離或檢疫的垃圾清理需求的情形。我想請問目前地方環保局有多少人力在投入這樣的業務，即有多少人力主動去抽查和關懷的業務？另外，在目前凡入境都要居家檢疫的狀況下，環保局評估人力是否足以應付暴增的居家檢疫人數，如何因應？",79,LCIDC01_1091501_00004
莊競程,不是，我問你的是，定期抽查或主動關懷這部分……,80,LCIDC01_1091501_00004
莊競程,所以環保署也還不確定會投入多少人力去做主動關懷？,81,LCIDC01_1091501_00004
莊競程,有可能是里長或里幹事之類的？,82,LCIDC01_1091501_00004
莊競程,這樣里長的loading真的滿重的。,83,LCIDC01_1091501_00004
莊競程,好。剛剛說，如果量太大的話，會交由乙級廢棄物清理機構來執行，清運到一個定點，然後再由甲級的來處理。,84,LCIDC01_1091501_00004
莊競程,乙級在清運的過程當中，有沒有一個SOP給他？就是現在該怎麼做，因為他本來不是做甲級處理。剛剛署長一直強調居家檢疫或隔離不一定是醫療廢棄物的等級，但我們還是要視為可能是醫療廢棄物的等級來處理，那你交給乙級廢棄物清理機構，有沒有一個SOP給他們，說明怎麼樣處理這樣的垃圾？,85,LCIDC01_1091501_00004
莊競程,你們有沒有辦法評估居家檢疫人數達到多少時，環保局的人力會無法負荷？,86,LCIDC01_1091501_00004
莊競程,我最後一個問題是，目前環保清潔人員配送口罩的量有多少？一天是幾個？,87,LCIDC01_1091501_00004
莊競程,所謂的配足是一天可以領到一個，或是兩個？,88,LCIDC01_1091501_00004
莊競程,是。最後一個問題，假設清潔隊員發生群聚感染時，環保署有沒有因應的配套措施？,89,LCIDC01_1091501_00004
莊競程,好，謝謝。,90,LCIDC01_1091501_00004
廖婉汝,（11時04分）主席、各位列席官員、各位同仁。署長辛苦了！今天早上很多委員都質詢廢棄物的問題，因為今天議程是有關疫情時廢棄物的清理，大家非常關心。可是我聽好幾位委員的詢答我還是不太清楚。以環保署而言，所有檢疫或隔離的廢棄物現在是由甲級清運業者來處理嗎？,91,LCIDC01_1091501_00004
廖婉汝,分區？是臺北市一區……,92,LCIDC01_1091501_00004
廖婉汝,哪兩個大區？,93,LCIDC01_1091501_00004
廖婉汝,北和南都各到哪裡？,94,LCIDC01_1091501_00004
廖婉汝,以臺中劃線，分成北臺灣和南臺灣嗎？,95,LCIDC01_1091501_00004
廖婉汝,委託一家？,96,LCIDC01_1091501_00004
廖婉汝,你說現在量不多，我真的很擔心耶！今天報紙上最新的消息，現在居家檢疫和隔離人數有將近六萬人次，還影響到家庭，你說量還不多，北臺灣和南臺灣只有一家，它可以從臺中、臺北，同一家來分配收集清運嗎？,97,LCIDC01_1091501_00004
廖婉汝,會委託？,98,LCIDC01_1091501_00004
廖婉汝,沒錯。署長，每次我們在立法院或在臺北市提到這個問題，可能都只想到臺北市的結構而已。您提到分區及甲級清運，我就在想，墾丁那裡誰來收？3月21日屏東縣有一位確診了，我們擔心南臺灣的甲級業者願意到那個鄉去收嗎？而且一個人確診，所接觸的人可能是十位數或百位數之多，這些都需要檢疫和隔離，他們的廢棄物怎麼清理？我有一個意見，是不是檢疫者和隔離者使用不同顏色的垃圾袋？當然也要考慮，如果用不同顏色的專屬垃圾袋，隔壁鄰居看到是否會太敏感，猜他們是檢疫、隔離的確診，所以外面袋子的顏色是共同的。我為什麼提這個建議？因為鄉下地方有很多做資源回收的老人家或清潔人員會去找垃圾筒，翻來翻去的，萬一剛好是檢疫或隔離人員在使用的，也很麻煩。所以我覺得在關懷包當中，是不是讓他們把口罩等比較容易污染的包在一起，最後再用一個不透明的黑色大垃圾袋包著，讓清潔人員帶走？而且現在已經那麼多人確診了，很多境外移入的，環保局應該去修正規劃，可否建構到各縣市？其實也不一定是有確診的，只要是居家檢疫、居家隔離者領到關懷包時，都讓他們容易收集。大垃圾袋要拿出去很麻煩，有顏色的也麻煩，要打電話才能來收，而且要落實到各縣市。另外，各鄉鎮才是可怕，因為接觸的人可能更多，像屏東縣有33個鄉鎮，而且如果一個商家確診，聽說所接觸的人可能很多，如何去控管？所以我建議環保署想個辦法，是否在關懷包的垃圾袋有所區分？至少讓民眾知道，在丟的時候，清潔或資源回收人員，包括環保人員都能有一些警惕。不然，垃圾袋都一樣，多放幾個垃圾袋也不曉得啊！現在最重要的是，很多居家檢疫及居家隔離者在14天過後或許也有確診的，現在也有這些案例，這是可怕之處！,99,LCIDC01_1091501_00004
廖婉汝,好，另外也有委員問到消毒的問題，像雅加達現在確診的人太多，有二百多人，所以整個城市大消毒。環保署有沒有準備？我再舉一個例子，聽說環保署2月24日下令各縣（市）高中以下學校消毒，有沒有落實？,100,LCIDC01_1091501_00004
廖婉汝,有要求，但有沒有落實？我想你們要查一下。時隔1個月了，現在臺北市有一所學校確診2位，學校已經停課了，那相關的接觸者……其實你們聽到的消息和我們聽到的消息都不一樣，我們就擔心男女朋友的問題，鄰近哪一個學校？萬一擴散出去的後果，經過一個月後，各學校的大消毒，要不要再做一次？,101,LCIDC01_1091501_00004
廖婉汝,可是我覺得學校還是比較危險。,102,LCIDC01_1091501_00004
廖婉汝,我希望消毒工作落實一點，不然檢疫或確診的個案都讓人非常憂心。我的時間到了，最後一個問題是，很多人都用消毒酒精，現在酒精也都可以買得到，公賣局一天的產量大約20萬瓶，台糖一天也生產約3萬瓶，全國的酒精需求量也很大。請問酒精用到剩一點點就隨便倒，有沒有污染的問題？還是有消毒的功用？我看到很多人用到最後剩一點點，有時倒在洗手枱或水溝裡面，瓶子再回收，這樣有沒有問題？以你們環保的概念來講，會不會造成污染？,103,LCIDC01_1091501_00004
廖婉汝,大量的話呢？,104,LCIDC01_1091501_00004
廖婉汝,不會？,105,LCIDC01_1091501_00004
廖婉汝,依你們專業的來講，大量會有什麼問題？,106,LCIDC01_1091501_00004
廖婉汝,現在酒精也容易買到了，有時只剩一點點就倒掉，會不會因此造成另一種的污染，這些也請環保署宣傳。,107,LCIDC01_1091501_00004
邱泰源,（11時12分）主席、各位列席官員、各位同仁。署長現在的角色非常重要，我想請教你，現在每天回台的國人數可能都破萬，回來都要經過14天的居家檢疫。基本上他們是健康的，所以算是居家檢疫。回國人數變多，短期居家檢疫人數暴增，垃圾量也會增加很多。居家檢疫者所產生的垃圾及醫療廢棄物等，如何可以妥善處理？本席希望垃圾量不要一下子暴增，環保單位同仁能以較安全的方式來處理。署長，對居家檢疫者產生的垃圾，是以醫療廢棄物的方式處理嗎？,108,LCIDC01_1091501_00004
邱泰源,是。,109,LCIDC01_1091501_00004
邱泰源,對，這個要分清楚，因為在傳達的訊息中，是將其視為醫療廢棄物的方式來處理。,110,LCIDC01_1091501_00004
邱泰源,但現在感覺是有點超前或做多了一點，因為目前居家檢疫者的確診是零。,111,LCIDC01_1091501_00004
邱泰源,那你有要改變政策嗎？,112,LCIDC01_1091501_00004
邱泰源,這樣的工作量，同仁負荷得了嗎？,113,LCIDC01_1091501_00004
邱泰源,因為如果滿多人的，量的部分如何處理？的確需要更有效率。,114,LCIDC01_1091501_00004
邱泰源,處理的人也很累，太累的話，免疫力也會降低，也不太好。接下來，我還是要關心處理的方面，要將其界定在哪裡？如果真的是來自醫療院所的廢棄物，同仁有沒有標準的防疫配備？,115,LCIDC01_1091501_00004
邱泰源,所以原來就是這樣的規範？,116,LCIDC01_1091501_00004
邱泰源,原來就使用外科的口罩？,117,LCIDC01_1091501_00004
邱泰源,以前就這樣做了？,118,LCIDC01_1091501_00004
邱泰源,因為口罩有分醫用和外科兩種，我不知道你的定義是在醫用，還是外科？,119,LCIDC01_1091501_00004
邱泰源,那就比較高階一點了？,120,LCIDC01_1091501_00004
邱泰源,當時或許人員沒有那麼多，但現在需要的人員增多了，口罩和手套怎麼夠用？如何發放的問題？是不是你們有去掌握？,121,LCIDC01_1091501_00004
邱泰源,這個量是誰反應出來的？,122,LCIDC01_1091501_00004
邱泰源,是反應給誰？是環保署還是衛福部？,123,LCIDC01_1091501_00004
邱泰源,所以直接由環保署這個系統？,124,LCIDC01_1091501_00004
邱泰源,那是你們發放，還是由……,125,LCIDC01_1091501_00004
邱泰源,現在口罩如何發到相關的公司，這些公司拿到才能去發給同仁，這個流程都很順暢嗎？因為發放也需要人力。現在全國醫師公會的同仁都在做義工，每天都在分裝，要負責全國各縣市公會所有醫療院所的分配，這個分配的人力是一個很大的負擔。關於這個部分，因為時間的關係，請你們去關心一下，這到底是由環保署處理，還是衛福部？分配的人力夠不夠？因為儘量不要延遲發放。現在中央流行疫情指揮中心好不容易提供了物資，我們要如何確實的，很快的發放。還有，在醫療院所外面幫忙清理醫療廢棄物人員的安全也是很重要的。最後我要強調的是，教育很重要，將來接受防疫相關的教育，譬如有沒有教育居家檢疫的民眾怎麼分類，還是他們所產生的廢棄物，全部包一包就丟出來，這樣恐怕有非常可怕的量。,126,LCIDC01_1091501_00004
邱泰源,我相信現階段這樣做是OK的，但是提供居家檢疫者多一點防疫資料，可以幫國家提升量能，減少一些花費。你們可以特別注意下一個階段要如何教育民眾處理這些廢棄物，謝謝！,127,LCIDC01_1091501_00004
徐志榮,（11時22分）主席、各位列席官員、各位同仁。署長辛苦了，本席在3月9日曾請教署長，有關居家隔離及居家檢疫的生活廢棄物如何處理，貴署在3月13日以後，陸陸續續公告居家隔離或居家檢疫者垃圾收集應注意事項，以及處理的作業程序等等。請問縣市政府環保局都知道這些規定嗎？,128,LCIDC01_1091501_00004
徐志榮,好，他們知道就好。還有，我也要謝謝你，那天我在質詢時，手上的訊息是，地方上的清潔隊員一開始才拿到10片口罩，前兩天我再問了一下，現在他們一天有1片了。至於到底怎麼來的？不知道是環保署還是環保局提供的，那都沒有關係，至少這是一件很好的事情，他們現在一天都有1片了。再來我想請教署長，居家檢疫者會確診的可能性幾乎微乎其微。我們也有告知他們，居家檢疫期間如果有需要，我們會幫忙處理，如果不需要的話，放個14天，沒事的時候再丟出來。請問如果他們沒有遵守這個規定，在14天中間又丟出來，剛剛聽署長說好像有罰則是不是？,129,LCIDC01_1091501_00004
徐志榮,是怎麼個重法？好像最近又有說跨出家門一步就罰1萬還是2萬元。,130,LCIDC01_1091501_00004
徐志榮,衛福部是防疫的主戰部隊，跟防疫比較有關的第二個部會就是環保署，其他不論是經濟部或工業局，不過是處理口罩、防護衣提供數量的問題。至於消毒與廢棄物處理的部分，我認為要避免社區傳播感染，環保署占了一個重要的角色。何況時中部長在幾天前也說，未來兩個禮拜是非常危險的抗疫期，所以要仰仗環保署。當然，有關醫院的廢棄物，平常你們都處理得很好，應該沒有什麼問題。但是我在這邊也要提醒署長，從上週三開始，指揮官已經宣布，不管是外國人、本國人、一級、二級、三級，回來的全部都要居家檢疫。我的意思是，一下子居家檢疫的人數這麼多，自然而然產生的廢棄物一定會大量暴增。我們的因應、處理都沒有問題嗎？以前是人數比較少，講不好聽一點，像我們客家人比較省吃儉用，出國旅行的人也比較少一點，但是我們很注重下一代的教育，所以最近有很多國外回來的留學生，他們都要居家檢疫，一時之間有這麼多居家檢疫的對象回來，我們環保署處理這些廢棄物，可以應付得來嗎？,131,LCIDC01_1091501_00004
徐志榮,已經有了嗎？,132,LCIDC01_1091501_00004
徐志榮,甲級的不夠了就請乙級來，乙級再不夠才會拜託清潔隊。,133,LCIDC01_1091501_00004
徐志榮,因為時間不多，最後一個問題是，為了避免社區傳播感染，我們有沒有預定做全國環境大消毒？我舉一個例子，我的家鄉前幾天有做消毒工作，不知道是不是環保署下令所有縣市政府環保局做的？我聽鄉裡的人說，是環保局叫他們做的，環保局是不是受到環保署的指示，我也不知道，但是產生了一個問題，可能有居家檢疫的人期滿出來了，隔壁的鄰居認識他，他也搞不清楚是不是期滿了，結果在我們地方上傳LINE傳得風風雨雨，說在哪裡碰到哪裡。我們的清潔隊不是因為這件事去消毒，而是受環保局的指示去消毒，結果剛好碰上這件事，講得大家人心惶惶。我的結論是，希望為了避免社區傳播感染，是不是做一個全國的大消毒，如果有，請在防疫大作戰的宣導影片裡告知大家；如果沒有，只是地方縣市政府的環保局做的消毒工作，也請他們在地方的電視台講一下，不是因為有確診的病例在消毒，而是超前佈署，還沒有怎樣時就先消毒，請鄉親們不必緊張。不是發生什麼事情在消毒，而是為了避免發生什麼事情，事先消毒。,134,LCIDC01_1091501_00004
徐志榮,好，謝謝。,135,LCIDC01_1091501_00004
張育美,（11時36分）主席、各位列席官員、各位同仁。署長最近辛苦了，目前行政院已將防疫等級提升為第一級，有關新冠肺炎的隔離院所，以及相關隔離人員所產生的感染廢棄物數量暴增，問題的處理則急需環保署解決，但需要關注的不只是人去的醫院，還有動物的獸醫院，現在也成為防疫的缺口。因為到今日為止，我們知道過去香港有弱陽性的小狗死掉了，接著又有陽性的小狗，所以寵物會不會傳人，或者人會不會傳染寵物，目前沒有明確的證據，但還是有傳染的風險。我們環保署實在是應該蒐集這些廢棄物，也要防範於未然，審慎評估其與疫情傳染相關的可能性，所以我再次強調，我們關注的醫療廢棄物，人去的醫院最重要，但我們也不要對獸醫院的防疫掉以輕心，它會成為破口。我之所以這樣說，是因為接到民眾的陳情，他指出獸醫院的醫療廢棄物是隨著一般垃圾車丟棄，包含獸醫院的醫療廢水，也是直接排入一般家庭的廢水溝。署長，這個問題跟公共衛生高度相關，但目前似乎沒有人管，請問署長您是否知道獸醫院的醫療廢棄物是如何處理的？,136,LCIDC01_1091501_00004
張育美,謝謝署長，現在是以一般事業廢棄物來處理對不對？,137,LCIDC01_1091501_00004
張育美,但我一開始就開宗明義說，香港大約在3月4日有一隻弱陽性的小狗感染死掉了，接著上星期又有一隻陽性，不是弱陽性喔！牠的主人確診了，牠也是陽性的，如果這隻小狗去動物醫院洗澡或看病，廢水就排放在一般的家用水溝，事業廢棄物也當一般垃圾處理，這就有危險性存在。所以署長也覺得你們還沒做到，對不對？,138,LCIDC01_1091501_00004
張育美,對，我要提醒你們，這可能會有風險。最重要的是我們要為選民服務，有民眾打電話給環保署，環保署說他們只負責執行，不管制定規則。於是陳情人就打電話給衛福部，結果衛福部說他們只管人，不管動物。接著陳情人就打電話給農委會，結果農委會說他們只管獸醫師有沒有證照，關於獸醫院的管理及醫療廢棄物的問題請打給環保署。但陳情人的第一通電話就是打給環保署啊！3個機關互踢皮球，好像無法可管，請問署長該怎麼辦？,139,LCIDC01_1091501_00004
張育美,我建議你們去研擬，並參考其他國家的立法實例後向本席說明。,140,LCIDC01_1091501_00004
