speaker,speech_text,speech_number,meeting_id
張育美,我剛剛說不確定的風險是風險，所以我們還是要關注這件事情。接著我們來講醫療廢棄物，在SARS期間，環保署有就通報、消毒、收集、貯存、清運、焚化及防護等過程建立標準作業程序，請問現在有嗎？更重要的是，目前各縣市政府是如何辦理的？,141,LCIDC01_1091501_00004
張育美,地方只要聯繫執行，萬一地方人力不足，請問環保署如何支援？,142,LCIDC01_1091501_00004
張育美,你覺得不重嗎？,143,LCIDC01_1091501_00004
張育美,所以你有一些外包單位在支持？,144,LCIDC01_1091501_00004
張育美,有外包單位的幫助，所以人力應該是夠的。如果遇到抗爭怎麼辦？現在居家檢疫、居家隔離的醫療廢棄物這麼多。,145,LCIDC01_1091501_00004
張育美,目前是這樣，但萬一碰到抗爭，請環保署一定要支援當地的環保局。最後我再請教一個問題，你覺得環保局除了人力之外，他們的能力夠嗎？因為現在不是環保署而已，是環保加上防疫，你有沒有跟衛福部溝通？衛福部有沒有跟你們做環保加防疫的整合處理？我講的能力是指你們具備環保能力，但現在變複雜了，要跟防疫的環保結合。,146,LCIDC01_1091501_00004
張育美,我是建議你們要跟衛福部多溝通，因為他們有防疫的知識，你們也漸漸有了，但是一定要結合在一起。,147,LCIDC01_1091501_00004
黃秀芳,（11時46分）主席、各位列席官員、各位同仁。我記得上禮拜有詢問你們怎麼處理居家檢疫、居家隔離者製造出來的垃圾，如果不是由你們指定的清運公司去清運，就有可能直接被垃圾車載走。目前有幾個縣市直接在垃圾車上加裝次氯酸水，可能有消毒的作用，但我們擔心的是垃圾車在壓縮垃圾的時候，細菌或病毒會隨之飛出。有沒有可能因應這次的疫情補助所有縣市，直接在垃圾車上加裝次氯酸水消毒？,148,LCIDC01_1091501_00004
黃秀芳,好。另外，關於集中檢疫場的垃圾，也許你們有集中處理垃圾，但排放的污水呢？如果那個地區沒有污水下水道，是否會排到一般的區域排水？你們如何處理集中檢疫場排放的污水？,149,LCIDC01_1091501_00004
黃秀芳,檢疫旅館排出來的污水也是這樣做嗎？有些人直接從國外回來、或有的人找這樣的旅館進住，直接住14天，類似這樣的旅館你們有去處理污水問題嗎？,150,LCIDC01_1091501_00004
黃秀芳,所以，我是說……,151,LCIDC01_1091501_00004
黃秀芳,我希望環保署對於不論是集中檢疫所或檢疫旅館，也許本來就是旅館或是商旅，針對他們排出來的污水問題，你們應該要提供建議給地方政府。,152,LCIDC01_1091501_00004
黃秀芳,是。,153,LCIDC01_1091501_00004
黃秀芳,這一次大家都非常的辛苦，不論是衛福部還是環保署，大家真的很辛苦，我希望在前端就將其做好，無論是在官方或是民間，這個疫情在臺灣應該可以很快的讓它結束，我們希望是這個樣子。所以我剛剛講的污水處理，環保署應該特別重視集中檢疫所和檢疫旅館的部分，對於他們排出來的污水，一般民眾還是會擔心，在檢疫旅館附近，大家也都會怕對自身是不是有些影響，如果把它做到最好，也可減輕民眾的疑慮。,154,LCIDC01_1091501_00004
黃秀芳,我想再請教，如果未來整個疫情相對嚴重之後，關於垃圾的處理，我們是不是要超前去部署，目前是沒有社區感染？,155,LCIDC01_1091501_00004
黃秀芳,假設未來更加嚴重的話，環保署針對家戶垃圾或其他垃圾的處理，你們如何去因應？,156,LCIDC01_1091501_00004
黃秀芳,好，謝謝。,157,LCIDC01_1091501_00004
陳瑩,（11時53分）主席、各位列席官員、各位同仁。早上的事情，我就不再繼續問了。但是我要關心的是，現在坊間有各式各樣的消毒藥品，我們最常看到的是次氯酸和酒精，坊間還有很多宣稱不含酒精但可以消毒的，甚至是精油、奈米的，我們都不知道它們的成效如何？立法院的廁所內都會放置酒精，自從疫情比較嚴重之後，我在青島一館4樓女廁有看到原裝酒精的瓶子，但裡面換成是黃色的看不出是裝什麼？有時很黃、有時看起來不太黃就淡淡的顏色，到底這個比例要怎麼處理？那是什麼東西，對什麼有用？剛剛前面也有委員提到，你們是否有一套認證的制度，這些東西的效果如何？效期多久？用過量對人體是否有影響？目前環境檢驗所應該有這個技術能量來做認證？,158,LCIDC01_1091501_00004
陳瑩,署長剛講的是建立一個指引讓大家了解，我剛提到的是環境檢驗所認證部分，不管是指引或認證，應該是由環保署來做，剛有提案也通過了。,159,LCIDC01_1091501_00004
陳瑩,透過最有效的宣傳方式來讓民眾知道。,160,LCIDC01_1091501_00004
陳瑩,另外，現在很多官員的子女在國外求學，因歐美的疫情很嚴重，很多孩子都回來了，也都在家居家檢疫，我們呼籲官員子女自國外返回的，不管是對孩子的照顧或自身的處理，也請特別的謹慎，在此做提醒。接下來，我想請教署長一個很簡單的題目，是我們每天都會遇到的，我一直很想弄清楚的問題，因為每次在大樓內，我要去倒垃圾的時候，廚餘的部分現在都還有在回收，但是可不可以不要回收，一定要做廚餘的垃圾分類，我不能把它當作一般垃圾處理掉嗎？因為在我們的大樓裡面，會貼告示讓大家知道，哪位住戶沒有做這個分類，沒有做好分類的還要被罰款。,161,LCIDC01_1091501_00004
陳瑩,這是你們防疫的超前部署。,162,LCIDC01_1091501_00004
陳瑩,我也很贊成這樣處理，值得肯定。,163,LCIDC01_1091501_00004
陳瑩,關於廚餘的運用，我會提這樣的疑問，是因為非洲豬瘟的病毒是經由廚餘或運送的車輛等傳染途徑，因為這樣的原因，我每次在做廚餘分類都很掙扎，可能當天我有感冒了，我吃剩的東西不想做垃圾分類分到廚餘那邊，就當一般垃圾丟棄處理。所以如果未來就像署長說的會朝這個方向去做，請問廚餘的回收處理我們還要等多久？,164,LCIDC01_1091501_00004
陳瑩,所以現在就是必須繼續採取廚餘的這個分類嗎？,165,LCIDC01_1091501_00004
陳瑩,我的時間到了，下次再和你就此問題做細部的討論，謝謝。,166,LCIDC01_1091501_00004
楊曜,（12時1分）主席、各位列席官員、各位同仁。署長辛苦了，在防疫上有關環保署的部分，各地方政府清潔隊員的防疫物資，現在好像是由地方政府統籌規劃辦理的。,167,LCIDC01_1091501_00004
楊曜,各縣（市）政府的物資夠不夠你們……,168,LCIDC01_1091501_00004
楊曜,我這樣問好了，如果不夠的話，你們有辦法提供協助嗎？,169,LCIDC01_1091501_00004
楊曜,清潔隊員和民眾接觸的時間長，而且他們在清理垃圾的時候，與民眾接觸的距離也很短，所以必要的防疫物資就必須足夠。,170,LCIDC01_1091501_00004
楊曜,還有一個問題，各地方環保局在開學前會協助學校進行清潔和消毒的工作，之前清潔隊的消毒都是用蚊蟲使用的殺蟲劑，但這次比較需要的是漂白水，萬一必須針對大型公共區域消毒和清理的話，我們的漂白水夠不夠用？,171,LCIDC01_1091501_00004
楊曜,對，所需的相關物資還是要先備齊好嗎？,172,LCIDC01_1091501_00004
楊曜,"署長，我想問問關於一般廢棄物的問題，我知道環保署曾編列經費做了一個5年的計畫，希望讓一般廢棄物能夠減量，但一般廢棄物看樣子是不減反增，102年大概是七百多萬公噸，到了108年就已突破了1,000萬公噸，這到底是什麼因素造成的？為什麼我們一直在減量，但數量卻又一直攀升？",173,LCIDC01_1091501_00004
楊曜,是政策分類造成……,174,LCIDC01_1091501_00004
楊曜,縱使如此，環保署還是要努力減量。92年我們核定回收一般廢棄物的目標是，要在109年達到75%的目標，但現在的平均數只到57%，請問這與署長剛剛回答的因素有關嗎？這也是分類造成的嗎？,175,LCIDC01_1091501_00004
楊曜,好。如果回收率愈高，垃圾處理的部分……,176,LCIDC01_1091501_00004
楊曜,全臺灣現有的垃圾掩埋場共385處，已復育的有204處，封閉的有79處，另有32處停用，請問署長這些掩埋場為什麼會停用？是什麼原因造成停用的？停用就是還沒有到達封閉，但又沒在用……,177,LCIDC01_1091501_00004
楊曜,澎湖的部分我知道，像澎湖現在就是垃圾外運，所以必須留下來作為給巨大廢棄物使用。有些封閉的垃圾掩埋場已經復育了，但維持封閉的79處是不是尚未復育？署長對復育垃圾掩埋場的部分還是要做好。,178,LCIDC01_1091501_00004
楊曜,焚化再利用的部分要做好，因為一方面是土地的利用，另一方面也算是事後的回饋對不對？,179,LCIDC01_1091501_00004
楊曜,謝謝主席、謝謝署長。,180,LCIDC01_1091501_00004
劉建國,（12時8分）主席、各位列席官員、各位同仁。今天讓大家虛驚一場，我等一下接續的垂詢看能不能讓你多吃一些飯。今天很多人都提到第一線的清潔人員，我還是請署長要多加重視並未雨綢繆。我真的很不想以此去隱喻，不過你今天確實讓我們受驚了，所以我今天聽到很多委員都提到與疫情相關的清潔工作之後，現在真的是心有戚戚焉而有些想法。剛才大家講到第一線清潔人員人力不足的情況，署長到目前的答復都是「在掌握之中」，有足夠的人力（含委外）。假設某公所第一線的清潔隊，我相信清潔人員所做的相關業務應該都是很單純的，就是清潔垃圾和消毒等，現在可能還要再加重消毒的工作，但整個規範中，這些都還是相對單純的一項最基層的工作。然而，清潔人員現在曝露在比較有風險的環境下，若因清潔相關的垃圾而致貴署最基層的員工有確診的可能，雖說今天貴署的員工並非因公而確診，但清潔隊員卻有此可能。同時，清潔隊員也有可能像貴署的員工那樣要請假，我不知他送給直屬長官的請假單上會不會寫「出國」，如果對方不寫，坦白講你們也很難掌握，如果他寫了，他的直屬長官或許就會提醒他，這個時間我看就不要出國，硬是拚一場有什麼意思。今天這個事情發生了，也誠如署長所言，對方的工作算相對單純，位在1樓也不須搭乘公用電梯，接觸的人也少。經過防疫醫師瞭解，貴署的相關防護也達到了某個程度，能讓大家安心。雖然署裡的狀況是這樣沒錯，但是一般的清潔隊隊員若出現了類似事件而確診，又回到自己的清潔隊工作，與當班隊員有接觸，我們都可以看得很清楚，清潔隊員打掃和收集垃圾的過程，從出門工作，一直到把垃圾送到垃圾處置場，他與同仁接觸的密集度是很高的，之後他或許又會回到隊上與他的同仁有所接觸，這樣的密集度可能也是很高的。最後防疫醫師或是地方衛生局判定的，雖然只有一員確診，但其他同仁也全都必須居家隔離，那麼該清潔隊便無法再去執行相關的業務了，這時人力就會出問題。請問你們有這類的演練或因應作為嗎？當有這類突發狀況發生時該怎麼辦？,181,LCIDC01_1091501_00004
劉建國,要是乙級清理業進去支援……,182,LCIDC01_1091501_00004
劉建國,到時候如果是這樣，我們直接讓乙級清理業者去處理，但他們的人力在短時間內就可以彌補被居家隔離的整個隊嗎？,183,LCIDC01_1091501_00004
劉建國,當然，沒有錯。,184,LCIDC01_1091501_00004
劉建國,在這樣的風險之下……,185,LCIDC01_1091501_00004
劉建國,對，我覺得署長可能要未雨綢繆。接下來還是口罩的問題，我手邊的相關資料，相信署長那邊也都有，像高雄去年就傳出口罩不足，到了10月又傳出手套不足，於是就有清潔隊員投書媒體「原本我們出勤時，環保局每天都會發2個工作口罩，它們是4層防護的特殊材質，可讓我們抵禦惡臭、病菌等，沒想到疫情開始攀升後，大概2月起，我們就被強迫『砍半』，1天只能領1個。」，「我不知道作決策、坐辦公桌的長官，是真的因缺料迫於無奈，還是不了解第一線人員的危險性？」他們真的會緊張，對不對？「當初可領2個口罩，是因考量到我們在每天8小時的工作中，如果因穢物噴濺、沾到髒東西時，還有備品可替換，而且這種情況確實常發生。但現在只剩1個了，我們每天不管口罩已經多髒，都只能忍著不舒服與害怕撐下去。」今天環保署也特別提到，「地方政府實際協助執行嚴重特殊傳染性肺炎防治相關工作之民政、警消、環保、教育、交通運輸等相關單位人員，由各地方政府彙整提報至中央流行疫情指揮中心，指揮中心將依各該對象提報人數及工作事項之口罩耗用程度計算分配撥用。」以上是出自你們的報告對不對？,186,LCIDC01_1091501_00004
劉建國,但怪的是，報告上又指出「本署隨時向中央疫情指揮中心後勤物資組聯繫，請其提醒地方衛生局提供口罩予環保清潔人員，經確認口罩數已有增撥，後續將持續追蹤縣市清潔隊領用情形。」，不曉得你們要不要修正，因為就我瞭解並不是這樣，像警察的口罩是由警政署申請的，這就和你們寫的不一樣了，而且他們的口罩會由疾管署配發，不經過衛生局；消防口罩起先是由衛生局申請的，後來調整為由消防署統一向指揮中心申請，由疾管署配發，也不再經過衛生局；另外，教育口罩則由教育部向指揮中心申請，疾管署無償配發及向商業司購買；交通運輸口罩，也是由商業司統籌處理。和你們比較有關的是清潔隊口罩，會由衛生局分配給環保局，再由環保局配發，因此署長的報告是不是要再去確認一下？,187,LCIDC01_1091501_00004
劉建國,署長，我要跟你探討的是，你說的情形我也非常清楚，地方清潔隊或地方環保局在某種程度上會出現你所講的狀況，但消防口罩原本是衛生局申請，後來變成由消防署統一向指揮中心申請，再由疾管署配發，不再經過地方衛生局了。消防署底下也有各縣市的消防局，消防局下面也有各鄉、鎮的分隊，人家都可以這樣做，所以你要不要再思考一下？,188,LCIDC01_1091501_00004
劉建國,對，我知道。,189,LCIDC01_1091501_00004
劉建國,我只是認為不要讓第一線的清潔人員，連基本的口罩數量都無法達到一定程度的標準，再加上現在又是非常時期，真的沒辦法讓任何一個清潔隊隊員曝露在高風險的情境下，出現了類似確診的狀況，結果讓整隊都必須被居家隔離，後續要處理起來真的會相對困難。,190,LCIDC01_1091501_00004
劉建國,是啊！謝謝署長,191,LCIDC01_1091501_00004
吳玉琴,（12時44分）主席、各位列席官員、各位同仁。署長辛苦了！這陣子大家都非常辛苦，在質詢之前我想先稱讚一下環保署，最近聯合國「世界水日」官網上出現了臺灣，看得出來我們的環保署積極參與國際社會，而且這次在「世界水日」官網上獲得聯合國的肯定，他們特別在上面列出「Taiwan，EPA」，這是非常難得的，所以在此要對環保署說一聲讚！這真的很不容易，你們應該花了很多力氣吧！,192,LCIDC01_1091501_00004
吳玉琴,接下來本席要請教有關水資源的問題，就畜牧業的糞尿處理而言，從傳統的固液體分離到厭氧發酵再到流放，後面是比較新的做法，在固液體分離、厭氧發酵之後，會產生沼氣、沼渣和沼液，沼渣和沼液會排放到農地去，沼氣則用來發電或作為燃料，不僅能發展生質能源，也可以改善空氣品質。其實養豬最擔心的就是水污染和臭氣，這兩項是民眾最容易反彈的部分，針對這部分，農委會和環保署該如何一起努力，這是本席今天質詢的重點。據我所知，環保署也有針對養豬場的糞尿資源化在做一些努力，請問這是從哪一年開始推動的？,193,LCIDC01_1091501_00004
吳玉琴,現在成效如何？就目前的情況看起來，資源化的場數大概只占整體養豬場15%而已。,194,LCIDC01_1091501_00004
吳玉琴,所以還有將近八成的比例都還沒有加入資源化的政策？,195,LCIDC01_1091501_00004
吳玉琴,"就不同的養豬規模而言，根據你們的規劃，200頭以下是小規模，對於200頭以上的養豬場，環保署補助豬糞尿資源化；對於2,000頭以上的養豬場，則是由農委會補助沼氣發電設備。據本席所知，200頭以下的養豬場比率占39.2%，針對這種規模較小的養豬場，不知你們有沒有什麼計畫或輔導策略，避免讓它成為社區污染或臭氣產出的地方？",196,LCIDC01_1091501_00004
吳玉琴,就是由大的養豬場帶小的養豬場。,197,LCIDC01_1091501_00004
吳玉琴,這方面的執行成效如何？,198,LCIDC01_1091501_00004
吳玉琴,因為有他們的投入，所以未來會更系統化，養豬方面的糞尿處理會更專業化，包括小規模養豬場也會一起協助嗎？,199,LCIDC01_1091501_00004
吳玉琴,針對這部分，你們可能要再跟台糖好好討論一下，設法讓小型養豬場透過大帶小的政策變得更好。最近有一則新聞報導屏東地區大型養豬場偷偷排放的消息，請問這部分的罰則在哪裡？針對偷排的部分，究竟胡蘿蔔和棍子在哪裡？,200,LCIDC01_1091501_00004
吳玉琴,如果地方罰不怕怎麼辦？,201,LCIDC01_1091501_00004
吳玉琴,相關裁罰基準是由環保署來訂定是不是？,202,LCIDC01_1091501_00004
吳玉琴,我覺得胡蘿蔔和棍子應該同時兼具，你們應該制定相關政策予以引導。農戶一定會顧及利潤，因為啟動某些設備會耗電、成本高，所以他們就不啟動，用偷排的方式是最省錢的，如果這方面沒有罰則搭配的話，可以就會變成大家都用偷排的方式。,203,LCIDC01_1091501_00004
吳玉琴,那就請你們加強與地方政府之間的協調並加強相關輔導好不好？,204,LCIDC01_1091501_00004
廖國棟,（12時51分）主席、各位列席官員、各位同仁。現在疫情是不是已經到達高峰沒有人知道，偏偏國內最近的確診案例持續在增加，這方面有許多議題可以討論，本席今天想就環保署的業務和職掌提出幾個問題請大家來關注：第一個是口罩的問題，現在口罩已經變成防疫物資，關於亂丟使用過的口罩，請問你們如何管理？到底是以一般廢棄物的方式來管理？還是已經變成以傳染病防治法或特別條例在管理？本席聽說在火車站等地方到處都有人亂丟使用過的口罩，現在變成防不勝防，你們知不知道這個問題的嚴重性？這方面應該怎麼處理？,205,LCIDC01_1091501_00004
廖國棟,現在還是當作一般廢棄物嗎？,206,LCIDC01_1091501_00004
廖國棟,在疫情那麼嚴肅的時候，誰戴過的口罩含有病毒沒有人知道。,207,LCIDC01_1091501_00004
廖國棟,這恐怕會變成防疫的缺口。,208,LCIDC01_1091501_00004
廖國棟,問題就在於針對亂丟的部分，你們怎麼處理？,209,LCIDC01_1091501_00004
廖國棟,所謂料敵從寬，我們寧可把它當成是有毒廢棄物來處理，否則這會變成一個防疫的缺口。其次是有關感染性醫療廢棄物的處理，通常這都是派專人專車以密封的方式來處理，請問現在對於所有的醫療廢棄物是不是也依照這樣的方式來處理？包括一般診所都應該要料敵從寬，以最嚴肅的方式來進行廢棄物的處理。,210,LCIDC01_1091501_00004
廖國棟,對，要用這樣的標準來看，因為我們都看不到病毒，也不知道病毒在哪裡。,211,LCIDC01_1091501_00004
廖國棟,再者，依照國外的研究，病毒可以在被感染者的糞便當中存活五天，但我們現在都不知道在公廁、大型車站廁所的垃圾桶內到底有沒有含這些病毒，本席認為這方面應該也要高規格、高標準來檢視處理的方式，請問署長以為如何？,212,LCIDC01_1091501_00004
廖國棟,不只是加強管理，你們應該要管理他們，而不是讓他們自行管理，應該對他們提出更高的要求或規範才對。,213,LCIDC01_1091501_00004
廖國棟,環保人員和醫生一樣都是站在第一線，你們不能以為是醫生站在前面，你們站在後面，因為你們所處理的東西都可能含有病毒，所以你們要站在第一線一起來應對目前的疫情，比如環保局所屬的廁所門把是不是應該要隨時消毒？這部分你們有去做嗎？,214,LCIDC01_1091501_00004
廖國棟,有可能你們的人員都攜帶病毒……,215,LCIDC01_1091501_00004
廖國棟,因為你們就是在負責處理這些東西啊！,216,LCIDC01_1091501_00004
廖國棟,這是非常重要的，廁所也要加強防疫，尤其是偏鄉的公廁根本沒有人在管理，本席要求你們必須加強這部分的管理，包括防疫的觀念也全部要注入到這裡來好不好？,217,LCIDC01_1091501_00004
陳椒華,（12時57分）主席、各位列席官員、各位同仁。今天主要是討論檢疫者廢棄物清運的問題，針對媒體最近的報導，被感染者有三分之一可能都沒有症狀，所以他們也不知道自己有帶原，相關廢棄物的確存在一些問題。在此要先感謝環保署督察總隊的幫忙，在鳥嘴潭人工湖蓋好之前，協助進行廢棄物清運。首先本席要提出一個問題，因為目前並沒有掩埋場封場的相關規範，所以造成掩埋場雖已封場，但垃圾仍然進場的情況，雖然環保署將其稱為轉運站，但是個人覺得這樣並不妥，因為沒有相關法規可以規範封場的計畫，也沒有封場的監測機制，在此拜託署長趕快訂定相關法規可以嗎？,218,LCIDC01_1091501_00004
陳椒華,包括公、民營的掩埋場，都希望環保署能夠訂定完整的地下水監測規範，畢竟有法規才能有依據。,219,LCIDC01_1091501_00004
陳椒華,其次是有關環評的部分，感謝署長進行全程環評會議的直播。本席手上握有基金會的連署書，他們打算下午要發布。本席趁這個機會請教署長，因為疫情的關係，環保署好像規定列席發言者發言完畢之後就要離開，本席認為這項做法有一些瑕疵，以我自己的經驗來說，參加環評會議就是希望能夠在場全程參與，如果只是發言三分鐘之後就離開，可能會有一些審查上的瑕疵出現。現在環保團體連署，希望能夠停開環評大型會議兩個禮拜，不知署長是否能夠採納環團這樣的建議？,220,LCIDC01_1091501_00004
陳椒華,但這項措施是不被認同的。,221,LCIDC01_1091501_00004
陳椒華,如果大家在現場都戴口罩呢？這樣的話，可以留在現場嗎？,222,LCIDC01_1091501_00004
陳椒華,如果真正要顧及大家的安全，是不是可以如大家希望的停開環評大型會議兩個禮拜？,223,LCIDC01_1091501_00004
陳椒華,在SARS之後有提出一份報告，那就是在空氣污染比較嚴重的地區，死亡情形也會比較嚴重，其死亡率甚至是空氣比較乾淨處的兩倍。目前疫情也不知道要延燒多久，希望環保署能夠重視空品的問題，之前我們也曾建議空品不良的時候應該要降載，拜託環保署儘快去做。,224,LCIDC01_1091501_00004
陳椒華,謝謝。,225,LCIDC01_1091501_00004
林淑芬,（13時2分）主席、各位列席官員、各位同仁。早上聽到署長在回答邱泰源委員的質詢過程當中，曾經草率的講了一句話，你說居家檢疫確診機率幾乎是零，在今天的書面報告當中也提到3月18日以前居家檢疫的確診人數是零，可是你知道這份報告送到立法院來的時候是禮拜六，而禮拜六已經超過3月18日了。召委安排這項專案報告是在禮拜五排出來的，而你們的業務單位故意把3月18日界定為一個日期，我覺得這樣不太妙，其實後來居家檢疫確診的人數非常多，你知道嗎？3月20日有四個，3月21日有三個，3月22日有五個，所以你剛剛不負責任、草率地說居家檢疫確診機率幾乎是零，這句話講得太不負責任，而且也不符合事實，今天立委在這裡問你，你所說的要正經一點，要說正確，這裡是立法院，對於你們自己機關裡面有人確診，別人會煩惱，你就只說不用煩惱，可能性很低，但你應該要說你採取哪些預防措施啊！署長，我這樣說，對不對？你們做了哪些預防措施？,226,LCIDC01_1091501_00004
