speaker,speech_text,speech_number,meeting_id
邱顯智,這個處理原則第五點的規定，問題非常地嚴重，像中鋼集團企業工會的申訴案件，結果高雄市政府勞工局通知的是最基層的工會，導致本來申訴的關係企業工會沒辦法去，甚至他們去了也可能被拒絕。但根本不是基層工會去申訴的，結果是通知他們，通知他們要幹嘛？等於是說今天這個案件又不是你這個律師辦的，結果又叫這個律師去，當然就會變成鴨子聽雷的狀況。申訴的工會最清楚狀況，未通知該工會，甚至工會人員在場又被勞檢員拒絕陪檢，不但無助於發現事實，而且公親變事主，本來勞檢機關是要去那邊處理案件，卻造成工會跟勞檢機關的衝突。我們也非常清楚，不應該因為多了一個更基層的工會，原本關係企業工會的陪檢權就被剝奪，法源就是這個處理原則，它只是行政規則，不應剝奪或限制人民的權利。不知道部長支不支持這樣的說法？,314,LCIDC01_1119301_00004
邱顯智,部長，這個處理原則應該怎麼修，我都已經幫你寫好了，幫勞動部草擬，大家一起設法解決。第五條的部分，其實非常簡單，原則上要通知最基層、關係最密切的工會，這個OK，大家沒有意見，司長也在場，這個我沒有意見。但「其他企業工會申訴之案件」，是他們提出申訴的，「應併通知該工會」。另外，「未獲通知之企業工會」，既然人家都在場、已經來了，當然「亦得派員陪同」勞檢。所以我們就在處理原則的第四條特別明文規定。勞檢就是工會有參與、整個程序公開，爭議即降至最低。是不是勞動部把我的修正建議帶回去，請法規會研議？並且把研議結果送交衛環委員會。,315,LCIDC01_1119301_00004
邱顯智,好。最後，產業、職業工會陪檢權，這是老問題了。勞動部一直都認為陪檢的工會只限於企業工會。部長，我必須跟你說，法律並沒有這樣明文規定，這是增加法律所無的限制。一來，勞動檢查法根本沒有限制特定的工會才能陪檢喔！部長，你是律師，其實你很清楚。二來，很多事業單位根本就沒有工會，卻可能有超過一半的勞工去加入產業或職業工會，甚至具有團體協商法中的協商資格耶！他們都可以發動罷工、具有團體協商法中的協商資格，結果竟然連一個最起碼的陪檢權都沒有！部長，這是非常荒謬的事情！勞動部以前都說這是因為考量到雇主的營業秘密，所以不宜讓公司以外的人來勞檢。現在我把營業秘密的定義都列出來給大家看，根據營業秘密法第二條，大家一看就知道這個說法根本就是在胡扯，因為許多勞動檢查根本不會涉及雇主的營業秘密，特別是勞動條件的檢查，就算真的涉及營業秘密，因為公司員工是產業工會和職業工會的會員，也可以請受僱於該公司的勞工代表工會來陪檢嘛！所以這個部分也請部長帶回去研究，讓產業工會和職業工會有陪檢權。這在比較法上面是不是根本就有前例，所以實施起來完全沒有問題嘛！,316,LCIDC01_1119301_00004
邱顯智,沒關係，針對這兩題，我希望你們能把相關的意見帶回去研議，尤其是這個處理原則我已經幫你們擬出來了，並將會議紀錄和研議結果函覆本委員會和本席辦公室之外，請勞動部帶回去進行部內研究時，要請貴部法規會研究一下，並且把會議紀錄和研議結果向本委員會報告。我為什麼要這樣講……,317,LCIDC01_1119301_00004
邱顯智,部長，不是啦，你這樣就變成由公務員處理，然後又照從前的說法。我為什麼要叫法規會研究？是因為需要請專家學者，包括勞動法的學者大家看一下。,318,LCIDC01_1119301_00004
邱顯智,沒關係，你們既然可以邀請專家學者參加，會議紀錄和研議結果是不是能有一個報告？我現在的意思就是，針對這兩個題目，你應該聽一下大家在法律上的意見，這個處理原則只是一個行政規則而已，應該請一些外部專家，大家來看一下。,319,LCIDC01_1119301_00004
邱顯智,整個討論過程要有一個會議紀錄給我們。,320,LCIDC01_1119301_00004
楊瓊瓔,（12時13分）部長好，我們先來講錢的問題。我們看到中央最近撥補勞保基金中普通事故保險的經費遽增，112年度預計撥補450億元，比今年度增加150億元，近三分之一。對民眾來說，這到底是福，還是一個警訊？因為這筆預算增加，表示大家的壓力很大。我們當然不希望發生事情，但是發生事情要怎麼樣照顧勞工是非常重要的。勞保基金破產的年限一直令我們憂心，現在你們宣布會從2026年延後到2028年，但是最近不管股市或你們的投資效益，都受到全球股災的影響。在這樣的情況之下，你們一再說只要政府不會倒，勞保就不會倒，但其實這只是一個口號，如果沒有實際的應對方式和數字說明，我們還是會很憂心。所以本席首先要請教部長，政府撥補能讓勞保續命多久？這個答案是大家一直希望能聽到的。政府的改革方案一拖再拖，是要債留子孫嗎？到底要怎麼辦？你要怎麼保證勞保基金不會倒？因為我們明明看到最近的投資效益非常讓人憂心。所以本席的一個結論就是：部長同意修法明定政府每年對勞保基金的撥補金額不得低於800億元，這是你同意的嘛！是嗎？,321,LCIDC01_1119301_00004
楊瓊瓔,所以這是你同意的額度嘛！,322,LCIDC01_1119301_00004
楊瓊瓔,我是說你同意的額度，你聽清楚。,323,LCIDC01_1119301_00004
楊瓊瓔,就是大家討論，有人問你，然後你認為……,324,LCIDC01_1119301_00004
楊瓊瓔,因為最早我們聽到你說，你同意每年撥補金額不能低於800億元，這樣勞工聽了比較安心嘛！你應該講得讓人家安心，不要又反悔了啊！,325,LCIDC01_1119301_00004
楊瓊瓔,這是討論過的，本席是請教你，你原則同意明定這樣的修法額度以保障我們的勞工嘛！對不對？,326,LCIDC01_1119301_00004
楊瓊瓔,撥補啊！,327,LCIDC01_1119301_00004
楊瓊瓔,不得低於800億元啦！,328,LCIDC01_1119301_00004
楊瓊瓔,本席要請教你的立場，請做說明！,329,LCIDC01_1119301_00004
楊瓊瓔,那就是因為最近不管投資效益或股市都處在全球遭殃的情況之下，所以當然要趕快問你，是不是撥補的金額不能低於800億元，這樣人家才會安心啊！請做說明。,330,LCIDC01_1119301_00004
楊瓊瓔,你不要跟我轉圈圈啦！我是覺得你……,331,LCIDC01_1119301_00004
楊瓊瓔,你今天是一個部長，我們應該實質討論。,332,LCIDC01_1119301_00004
楊瓊瓔,你不把數字講出來，我就再問你一個原則：是否仍然要以勞工權益為第一優先？,333,LCIDC01_1119301_00004
楊瓊瓔,既然你說當然，剛剛那個數字你務必要去達到。接下來，10月13日起國門正式開放，觀光復甦，但是很多人已經離開原來的崗位，現在要怎麼樣讓他們可以再回來？針對這個部分，你們有一個為期3個月的缺工專案協助計畫，只要在北部地區達3萬元以上、中南東部地區達2.8萬元以上者，都會納入專案求才服務範圍。本席認為以3個月為期絕對是不夠的。因為政府就是要未雨綢繆，各種面向都要準備好，也就是要超前部署。看到你對本席的說法頻頻點頭，我也要謝謝你，請問如果3個月後業者仍有需求，你會不會延長這個計畫？,334,LCIDC01_1119301_00004
楊瓊瓔,好，非常好！也就是說，為了我們的經濟，如果人力缺口在3個月到期之後仍舊有需要的話……,335,LCIDC01_1119301_00004
楊瓊瓔,好，勞動部繼續辦！其實不只觀光產業有缺工的問題，所有經濟面向都缺工，所以本席要請你們研議具體的方案，並且把書面資料提供給本席。,336,LCIDC01_1119301_00004
楊瓊瓔,今天至少我們得到一個答案，就是這個專案如果3個月後仍有需求，你們同意繼續再辦。,337,LCIDC01_1119301_00004
楊瓊瓔,這個部分請你們好好地務實去做。,338,LCIDC01_1119301_00004
楊瓊瓔,接下來本席要跟你討論有關「新貧」的政策。30歲以下的低薪族群大概占三成二到三成三，政府若再不因應，這樣的青年貧窮惡性循環，將不只是世上苦人多，而且年輕人會形成「新貧」。請問這樣的薪資政策你們要如何去改善？有沒有什麼因應方案呢？,339,LCIDC01_1119301_00004
楊瓊瓔,對，這是一個大的面向，本席也請你提供具體的書面資料，因為我一聽到這個「新貧」，就替所有的年輕朋友感到很難過，他們努力讀了這麼好的書、這麼有能力，但是他就是一個新貧，誰創了這個名稱？讓年輕人真的很難過，所以我們應該要好好用方案來協助他，好不好？,340,LCIDC01_1119301_00004
楊瓊瓔,最後一個議題，上次我們講AB廠的問題，我也謝謝部長，在大院質詢的時候，你跟經濟部長在一個禮拜之後就達成A廠申請，B廠有臨登工廠的部分，員工就可以過去，但要同一個老闆。,341,LCIDC01_1119301_00004
楊瓊瓔,但是現在還有一個問題，本席上次也有請教你，但還沒給答案，假設這個外籍移工三年的時間到了，我的工廠有兩個，你們還要叫他重新去run那些程序，所以本席也具體建議，政府既然有臨登工廠，它也在政府納管的條件之內，且各縣市政府都有，既然你已經給他比如2個名額或5個名額不等，那是你已經核定的，在納管的時間未到之前，三年到了，你應該要繼續把名額給他，而不是叫他重新再run一次，結果每一個都不行。,342,LCIDC01_1119301_00004
楊瓊瓔,請說明。,343,LCIDC01_1119301_00004
楊瓊瓔,他沒有辦法完成，因為依照就服法的規定一大堆，所以你們根本沒有橫向聯繫，你告訴我都可以，其實都不可以！,344,LCIDC01_1119301_00004
楊瓊瓔,我只有一個原則，部長，我們兩個都是解決事情的人，我的意思是我們依法有據。,345,LCIDC01_1119301_00004
楊瓊瓔,對，因為你要叫他重新再走一次就業服務法，他一定認為你不可能會核准他。本席就建議，我們既然有臨登工廠，你也同意A廠申請可以到B廠來，我們還是有同一個老闆的條件，既然頭都過了，身體更要過，既有核定的移工，已經有了就一定要有，而不是重新再run，run了以後，每一個都沒有，現在他們最痛苦就是這部分。,346,LCIDC01_1119301_00004
楊瓊瓔,怎麼說？,347,LCIDC01_1119301_00004
楊瓊瓔,受理了，但是要解決問題啊！受理了但都不會過啊！,348,LCIDC01_1119301_00004
楊瓊瓔,依照就服法都不會過。,349,LCIDC01_1119301_00004
楊瓊瓔,我現在只有一個原則，部長，就是納管在臨登裡的廠家，你聽清楚！,350,LCIDC01_1119301_00004
楊瓊瓔,已經核定之後，你一樣可以接管、接受申請，你一樣要核准他原有的名額，好不好？這個原則是如此。,351,LCIDC01_1119301_00004
楊瓊瓔,好，謝謝，你把詳細資料給本席。,352,LCIDC01_1119301_00004
邱臣遠,（12時23分）部長午安。今天還是要討論缺工的問題，現在產業缺工不是只有臺灣的問題，全球各地現在都邁向大缺工時代，尤其少子化的狀況更嚴重。根據立法院預算中心統計，其實108年至今年上半年，產業長期缺工20萬人以上，其實我們知道勞動部也做了非常多的配套，不過這是大勢所趨，確實在整個疫情後，包含整個消費型態的改變、產業結構的調整、數位化的因應、外送員的增加，其實有一些勞力密集或用到人力產業比較多的相關服務業，他們現在的問題比較嚴重。尤其現在邊境開放，10月13日之後也要恢復正常，目前觀光、餐飲業大幅缺工，這個問題你也非常清楚，光是觀光業自行統計就缺工18萬人，請問現在針對觀光餐飲業者的需求，勞動部短中長期配套的因應措施，目前有沒有比較具體的方式？,353,LCIDC01_1119301_00004
邱臣遠,短期間的需求會暴增，尤其現在疫情期間……,354,LCIDC01_1119301_00004
邱臣遠,我想好的政策對症下藥和相關執行力還是重點，其實最近非常多觀光業者跟本席陳情，目前我們也知道勞動部針對促進觀光業招募國內人才的就業，你剛剛講在這三個月，你們有提供僱傭的獎勵，不過這個補助計畫目前只到年底，只有短短三個月，之後業者還是要自己去承擔，其實對業者來講，可能短期間有一些幫助，可是長期來講，到期的話有沒有要延長？,355,LCIDC01_1119301_00004
邱臣遠,你剛剛談到三個月的計畫，這部分……,356,LCIDC01_1119301_00004
邱臣遠,對，專案媒合，如果三個月後……,357,LCIDC01_1119301_00004
邱臣遠,對，如果到時候到期的話，有沒有辦法再延長？如果業者還有持續上的需求。,358,LCIDC01_1119301_00004
邱臣遠,再來，服務業其實有分非常多種，有餐飲服務業、流通服務業，其實我認為應該還要再跟業者做更細緻的盤點，這點你們可以跟經濟部去做橫向聯繫和配合。,359,LCIDC01_1119301_00004
邱臣遠,本席這邊有接到，目前像連鎖加盟觀光協會相關的產業，其實在這幾年疫情期間，每季都有辦新的加盟展，但是每一次的加盟展，創業的需求大概都有差不多10%左右的提升，所以對於這些連鎖加盟業者，相關人力需求在短期上是非常大的，因為現在疫情改變了很多消費的型態，很多餐廳都轉做外送，所以大型的婚宴或大型的連鎖餐廳，還有這些飯店，對他們來講，碰到經營上的轉型和人力短缺，這是非常實際的問題，我想你也非常瞭解，所以他們這邊也有提出幾個原則，比如引進移工、留住僑生和放寬公司這三個比較聚焦的大方向，包含聘用外籍員工應該照單店需求計算人力等等，提供國內外的外籍學生畢業後的就業輔導，這要更具體；再來，如果外籍生取得專業執照例如丙級的廚師證照，可以優先錄用，他們大概有提出一些比較具體的訴求，針對這個部分，尤其是餐飲、婚宴業者放寬外籍移工申請的限制，並比照實際的需求專案辦理，這部分勞動部現在有沒有得到相關業者的陳情或是有進一步的配套方案？,360,LCIDC01_1119301_00004
邱臣遠,但是我們國內的就業意願不一定很高，產業的需求和人力市場的缺口要怎樣去連結？,361,LCIDC01_1119301_00004
邱臣遠,保障我國勞工的權益當然是最高原則，大家不會有任何的質疑，但是實際上產業的需求跟我國的就業人口任職的意願，供需之間的媒合必須要達到一個基準點才有辦法有效。不然有的工作，我們的人不願意做，又不讓外面的人進來，變成圍城理論。,362,LCIDC01_1119301_00004
邱臣遠,尤其是中高階的，你說初階的可能還好，中高階都已經轉業，要臨時培養其實非常有困難。,363,LCIDC01_1119301_00004
邱臣遠,當然，譬如像一些技職專班配合的僑生已經在臺灣念完書之後，相關的輔導……,364,LCIDC01_1119301_00004
邱臣遠,如果他們有相關的證照可以優先取得，應該要優先……,365,LCIDC01_1119301_00004
邱臣遠,三個大方向，對於移工的部分，你們可以去評估。對於僑生的部分，你們能夠更精準去做媒合。相關工時的部分，你們要跟業者再做進一步的溝通，瞭解他們的需求，每個產業的需求還是會有所不同，產業的部分也很難一刀切，我們希望勞動部可以化被動為主動，與經濟部進行橫向聯繫，更瞭解這些業者的需求，我認為要打仗也要給他們兵馬，這個部分我希望部長可以帶回去研議，好不好？,366,LCIDC01_1119301_00004
陳瑩,（12時31分）署長好。我今天想針對就服法第五十六條的解釋跟署長請教一下，首先，請問曠職是不是就等於失聯？,367,LCIDC01_1119301_00004
陳瑩,我問你這個狀況好了，雇主或管理人員有外勞的LINE，他發現外勞曠職的第一天就發了一個LINE訊息給外勞，結果訊息被已讀不回，這樣算不算失聯？,368,LCIDC01_1119301_00004
陳瑩,依據你們的函釋，用LINE發訊息已讀不回就算失聯，但是全國各縣市勞工局負責外勞業務的承辦人員都說不算，有這樣的情形。再來，根據第五十六條規定，外勞已經曠職3日，但是發給他的LINE都有讀，而且外勞還發送早安圖給雇主，這個時候雇主是不是應該在3天內依法通報主管機關？,369,LCIDC01_1119301_00004
陳瑩,當雇主發現有曠職，但是無法判斷到底有沒有失去聯繫，沒有在3天內通報主管機關的話，算不算違法？,370,LCIDC01_1119301_00004
陳瑩,所以你認為這樣不算違法，沒關係！我們再繼續，剛剛講了那麼多，問題的關鍵就在於有沒有失去聯繫，對不對？,371,LCIDC01_1119301_00004
陳瑩,我們再看一下你們最近提供給外界的說明，這是你們的廣告，你們的說明裡面很明白地指出，如果外勞有失聯的情況，雇主可以立即通知移民署及警察機關執行查案，請問法源依據是不是就服法第五十六條第一項但書？,372,LCIDC01_1119301_00004
陳瑩,但是你仔細回想一下，但書上面寫的是「查察」，為什麼你們的宣導上面要寫「查案」？「查察」與「查案」在職權上是差很多的吧？,373,LCIDC01_1119301_00004
陳瑩,你承認這裡是很不精準的。,374,LCIDC01_1119301_00004
陳瑩,請問曠職第一天是根據雇主的判斷，外勞已經失去聯繫，雇主可以立即通知移民署及警察機關去查察嗎？,375,LCIDC01_1119301_00004
陳瑩,沒錯！但是實際上警察和移民署會理你嗎？我打個問號。,376,LCIDC01_1119301_00004
陳瑩,再來，根據你們的廣告，立即是一個很重要的條件，依據就服法，移民署及警察機關是不是應該要立即執行查察？,377,LCIDC01_1119301_00004
陳瑩,所以你只能希望啦！如果移民署及警察無法立即執行，不就是藐視法律嗎？你們平常都有確實協調移民署及警察機關嗎？,378,LCIDC01_1119301_00004
陳瑩,有跨部會平台，但是有沒有好好地協調，我就不知道了，不然你們要雇主立即通報不就是一個不實的欺騙嗎？接下來，本席認為最嚴重的漏洞其實是你們的宣導資料，其中提到外勞有向勞工諮詢申訴專線、地方主管機關、勞動部備案之安置單位、駐臺代表處求助，且有通報或安置紀錄者，就不算失去聯繫，請問這個解釋的依據是什麼？,379,LCIDC01_1119301_00004
陳瑩,你的依據是哪一條？,380,LCIDC01_1119301_00004
陳瑩,你們的依據應該是就服法第五十六條第二項吧？,381,LCIDC01_1119301_00004
陳瑩,雇主如果要引進外勞，他所負的法律責任，還有行政及財務的成本是非常高的，對不對？,382,LCIDC01_1119301_00004
陳瑩,但是反過來，他們今天要認定失聯卻相對困難，外勞只要向安置單位求助或打個電話申訴就不用承擔這個責任，而且很容易就可以留下通聯紀錄，他們這麼做就可以逃避移民署及警察機關執行查察，這樣你們的解釋效力不就高於法律嗎？你要好好想一想，你知道有多少案例因為所謂的紀錄，讓移民署及警察的調查根本就動彈不得？你知道有多少嗎？,383,LCIDC01_1119301_00004
陳瑩,我後面會讓你知道這個掌握有多困難。署長，在留下紀錄的這些單位，雇主找不到的外勞，你覺得這些單位可以找到嗎？像國外辦事處、勞動局、勞動部找得到嗎？你敢承諾嗎？這些留下紀錄的單位可以聯繫到這些失聯的外勞，可以讓移民署及警察找到他們？如果你敢發誓絕對找得到，本席絕對支持你們的解釋，如果做不到的話，這個解釋函就是牴觸法律的，我今天要很明白跟你點出你們的問題。這一張簡報你好好看清楚，因為發展署創造了一個外勞蟑螂，賺很大的產業鏈，我說外勞蟑螂是打不死的蟑螂，還把憲法搬出來，笑著對你們說：發展署，哈哈，你就是抓不到我，你沒辦法抓我。因為有一些地方勞工局裡面還有人裡應外合，還偷偷把資料外洩，提早通報給這些外勞蟑螂，這個是很嚴重的，整個犯罪結構非常縝密，難怪這些人有恃無恐，所以你們發展署創造了這個不算失聯的逃逸外勞的族群，這些族群黑數已經很嚴重地破壞了我們的法制，而且製造了很多社會問題，所以我今天質詢的議題其實是相當嚴重的，你一定要非常審慎地重視這個問題。我在這邊很沉痛地指出，因為有雇主向我們辦公室陳情，接到存證信函被誣告積欠工資還有加班費，經過勞檢確定沒有積欠，而且外勞說有仲介的LINE，但是仲介聯絡不到，外勞的臺灣代理人提供的地址也是假的，最後雇主還因為通報移民署被懷疑謊報使公務人員登載不實而做了筆錄，所以臺灣的這條法律保護也壯大了這些外勞蟑螂還有逃逸外勞，對於守法的雇主，失聯外勞不通報少則罰3萬元，但是通報了之後，卻有機會被罰到150萬元，還有刑責的問題。所以我在這邊要特別要求發展署，就今天提出的檢討，這件不算失聯的解釋是不是應該要廢止？你從一開始就承認在這份文宣上你們用字不精確了，查察跟查案差這麼多，這資料還要不要用？請發展署一個禮拜內提出書面報告送本委員會，有沒有辦法？,384,LCIDC01_1119301_00004
陳瑩,"好，我為什麼特別講一個禮拜？我們看一下失聯移工在臺人數的走勢圖，我口頭講一下，今年從1月到10月，逃逸外勞已經增加了2萬1,000人，短短10個月喔！平均是什麼呢？如果給你一個月的時間，等於每個月就要逃逸2,100人，一個禮拜就是525人，一天就是75人，我給你一個禮拜的時間，這一個禮拜的時間，光是我在這裡講話就不知道偷跑多少人了，所以我不給你很多時間來做這樣的檢討，就下個禮拜，OK？",385,LCIDC01_1119301_00004
陳瑩,好，謝謝。,386,LCIDC01_1119301_00004
