speaker,speech_text,speech_number,meeting_id
賴惠員,"（9時23分）部長、蔡署長早安，我今天戴的口罩是勞動力發展署的，格外地親切。部長，上周12日我們的國門、邊境開放，也就是說觀光客進來了，可是呈現出的最大困境就是飯店業，喊出他們有18萬人的大缺工，而缺工好像在北、中、南持續惡化，尤其是臺北觀光飯店的缺工情形更嚴重。我們有統計防疫前後的數據，以晶華酒店來講，防疫前的正常編制人數是1,200人，到目前的缺數為150人，最大的缺口是房務，幾乎超過三成以上。我們看到飯店業最缺的職務就是剛剛講的房務人員，缺工幾乎快超過七成，我是引用中華民國觀光旅館商業同業公會的統計。勞動部的因應作為是在5月份的時候，已經跟交通部觀光局合作啟動第一波的飯店業專案媒合計畫，這個媒合的成效非常好，達到99%。可是6月、7月、8月及9月，我不知道勞動部有沒有追蹤，等一下一併讓部長回應。到10月3日的時候，業者組成一個自救聯盟要自己救自己的產業，甚至在10月13日透過記者會提出一個產業缺工的專案協助計畫給勞動部。請問部長，有沒有實際掌握並且持續缺工的原因到底在哪裡？",1,LCIDC01_1119301_00004
賴惠員,所以部長其實在這幾個月，6至9月你都是持續在追蹤的？,2,LCIDC01_1119301_00004
賴惠員,你其實看得出來真正的問題在哪裡，在業者他其實沒有比較好的待遇。,3,LCIDC01_1119301_00004
賴惠員,對，薪資條件的部分。,4,LCIDC01_1119301_00004
賴惠員,不是很明確。,5,LCIDC01_1119301_00004
賴惠員,部長，我想針對……,6,LCIDC01_1119301_00004
賴惠員,時間拉長還有他薪資的不對等，與求職者的期待落差非常大，造成大缺工。所以他們自救聯盟提出了三個訴求，第一個，引進移工；第二個，留住僑生；第三個，放寬工時，放寬工時這是勞動部持續在努力的。但是引進移工的部分，當然我們也擔心會衝擊國內就業市場，包括年輕人，還有二度就業的人。另外我針對留住僑生這段跟部長做探討，現階段勞動部手上的資料，每年僑生約有多少人留下來？有沒有這樣一個數據？,7,LCIDC01_1119301_00004
賴惠員,好，五千多人。,8,LCIDC01_1119301_00004
賴惠員,90%？好。我想請教署長，有90%，為什麼會缺工缺得這麼嚴重？如果我們探討僑生的評點制度，這個是不是鎖定在管理人？至於基層的用工，顯然僑生是沒有辦法切入這一塊。在僑生的評點制度裡頭，你特別提到他必須要工作一年到一年半，這是不是會過於嚴苛？這個評點的標準，你說有90%的媒合率，問題是事實上缺工還是缺得厲害，甚至在觀光自救聯盟特別提出要求要僑生的專案，我們會不會試著去想一下，有沒有機會做什麼調整？你這個評點顯然都是用在管理人的評用的標準上面，是不是這個樣子？,9,LCIDC01_1119301_00004
賴惠員,沒有錯。,10,LCIDC01_1119301_00004
賴惠員,沒有。我現在講的，審核沒有問題。問題就是僑外生的評點制度會用到比較多白領階層的管理人才，但基本上缺的是藍領人才，這些藍領人才怎麼辦？有沒有機會請勞動部和教育部跨部會合作，研擬一個配套的措施，在保護外籍生的權益之下，除了鬆綁外籍生每週工作的時數，是不是可以比照像澳洲？我相信部長都知道，現在澳洲我們有很多親戚朋友的孩子都到那邊去打工，這個打工很熱門，也解決了澳洲百工百業短期的缺工。請署長回答。,11,LCIDC01_1119301_00004
賴惠員,署長知道我講的就是「Working Holiday」，像這樣一個專案，我們可不可以把這專案效能提升呢？,12,LCIDC01_1119301_00004
賴惠員,好。拜託部長和署長，我等你們的報告，謝謝。,13,LCIDC01_1119301_00004
蘇巧慧,（9時4分）部長好。請問昨天星期六、日，部長有外出吃飯嗎？有去餐廳吃飯嗎？有沒有機會到路上走走逛逛，或者車子有經過，有沒有看到最近餐廳的狀況如何？,14,LCIDC01_1119301_00004
蘇巧慧,對，很好。因為才剛剛發布，我們上個月餐飲的營收到達七百多億元是歷史的次高。有走進餐廳的話，不曉得你覺得服務生的態度怎麼樣？,15,LCIDC01_1119301_00004
蘇巧慧,還不錯。但是有時候上菜可能會等久一點，上菜久一點你覺得……,16,LCIDC01_1119301_00004
蘇巧慧,人數多，服務人員可能不見得那麼多，而且新手滿多的，這是我們的現況。部長，我想今天各位委員跟您探討的都會是在10月13日我們打開了國門之後，兩年多的防疫到了一個新的階段，開始了一個新的里程碑。勞動部要面對的也是一個疫後的新時代，很多人把這個新時代叫做大缺工時代來臨，各行各業過去兩年休息了一會的地方，現在突然間生意來了，就像我們餐飲業還有剛剛提到的旅宿觀光業。其實不管是從領隊、導遊、飯店基礎房務人員一直到主管等等，大家都有人手不夠的情形。所以我這一、兩天在選區走，看到很多餐廳外面都貼「徵外場人員」，其實這狀況是過去兩年少見的，但我們是樂見的，可是樂見之後要怎麼做呢？剛剛部長有提到，旅宿觀光業者，尤其是飯店業者籌組了所謂自救聯盟，剛剛聽起來你們是已經做了滿詳細的溝通了，痛點也都理解，而部長也提到了兩個他們沒有辦法對接好的地方，第一個是薪資待遇；第二個是工作內容不夠明確，甚至是招募時間太長，所以導致要進來媒合的人不順利，就這個部分，你可不可以再解釋多一點？,17,LCIDC01_1119301_00004
蘇巧慧,他們有說，如果是房務員，快手房務員一個人月薪可以到5萬元以上。,18,LCIDC01_1119301_00004
蘇巧慧,比較少嗎？,19,LCIDC01_1119301_00004
蘇巧慧,有另外一種是基礎房務員，月薪3萬多元，甚至在這個數字以下者高達41%，雖然這部分資訊要看你是從哪個角度來看。,20,LCIDC01_1119301_00004
蘇巧慧,自救聯盟其實說得很明確，即他們也照勞動部的要求把薪資調高了，但問題根本不在薪資，那到底在哪裡？你剛剛委婉地表達薪資其實還不夠的同時，另外你也提到了工作明確化，我想這個工作明確化是現在很多年輕人在找尋工作的時候，很清楚想要知道的一個條件，既然是大缺工時代，有這麼多工作可供選擇，當然是最快、最好、最可以得到的會優先選擇，可是在這個部分來講，我並沒有要批評旅宿業，相反的，我很想幫助他們，既然你看到他們的痛點是這樣，則你的協助又會是什麼？,21,LCIDC01_1119301_00004
蘇巧慧,你不能獨厚一家飯店，但你要用這個……,22,LCIDC01_1119301_00004
蘇巧慧,如果我是晶華的經營者，坦白講，晶華的品牌這麼大，在國際的知名度這麼高，我當然也要最好的，總不能讓進來的工作人員砸了我的招牌、砸了我的水準。,23,LCIDC01_1119301_00004
蘇巧慧,部長很負責地說了一句「供大於需」，目前的狀況是供大於需？,24,LCIDC01_1119301_00004
蘇巧慧,部長，我實在是對你很好，因為這個題目大家都關心，等一下大家也一定都會講，但是你把我的時間全部都占走了……,25,LCIDC01_1119301_00004
蘇巧慧,但是我覺得你剛剛講的非常的重要，所以我願意讓你有這個時間好好地講，至於後面細節的部分，就讓其他委員去追問，而且我在這裡要求部長，也要求勞動部，你們既然已經看到問題，而且已經有初步的解方，身為監督者，我會要求的是，第一，請告訴我們現在討論的狀況、細部的方案以及你預期解決的期程，也就是說，像你跟他們對接的下一場會議是什麼時候，不能有解方了卻停著慢慢做，時間不夠快的話，對問題的解決是沒有幫助的，所以這個部分是我現在要求的，請教部長，下一場會議會是什麼時候？,26,LCIDC01_1119301_00004
蘇巧慧,部長，因為今天就只有6分鐘發言的時間，所以請你把剛剛的資料，也就是說，現在供和需的狀況，以及你媒合的方案，以及你預期的工作進程，提交一份報告到本席辦公室，若其他委員也需要的話，也請提供給其他委員辦公室，讓我們可以繼續利用你這個基礎資料來做追蹤。,27,LCIDC01_1119301_00004
蘇巧慧,剛剛我為什麼願意讓部長繼續完整的陳述，因為我的建議其實跟您真的很像，我認為工作型態的改變和職缺的變化裡面，造成了這個缺工。而我也曾經說過，但我現在已經改變觀念了，即我們會說這個缺工就是年輕人觀念改變，大家都想跑外送、當網紅，不願意做辛苦的工作，但是在這段時間我們自己親身去瞭解這些所謂的外送員後發現，這真的也不是一件輕鬆的工作，其實非常辛苦，像昨天那樣的大雨，路上如果有看到騎摩托車的，其實很多都是外送員，一般人是不會在外面這樣騎摩托車的，尤其在昨天這種大雨之下，所以外送員並不是辛苦的工作嗎？這個我其實不同意，既然如此辛苦，為什麼有人會選擇外送員，而不是選擇剛剛提到的觀光餐旅，這個部分就有趣了，如同部長剛剛提出的，包括工作內容是否明確，這其實也是一個重點。所以在這樣的狀況下，我就要提出第二個點，就是彈性工時，其實現在很多年輕人最在意的是有沒有辦法掌握自己的時間，我認為在疫情時代後面，其實可以修的法至少就有兩個，一個是勞工在職的工作時間，即勞工在事業場所外工作時間指導原則，這跟彈性工時是有點關係的；另外一個就是部長剛剛提到的中高齡就業法的部分，像這些我們都可以再討論，但請你先把剛剛要求的這份報告提供給我們，我們會在這個基礎之上，在審預算的時候，我們再來繼續討論這個問題。謝謝部長。,28,LCIDC01_1119301_00004
莊競程,（9時45分）部長好。今年6月在臺中市有一名27歲陳姓準新娘，她下班回家在龍井區中山路被闖紅燈的休旅車撞倒，當場陷入昏迷，全身多處骨折，傷勢十分嚴重，經警方調查，肇事的駕駛是失聯移工，案發後他跟5名同鄉棄車逃逸，經過四個月的休養跟復健，我們很高興聽到這位陳小姐積極復健，並恢復健康，第一時間我有去他家裡拜訪過了。該案的逃跑移工在事發後被警方逮捕到案，日前也開了準備庭，肇事移工也當庭認罪，受害家屬陳女媽媽對外表示，整件事情他們覺得不應該只是這名肇事移工要負責，包含是誰借車給移工？借車的車主、逃逸移工的雇主、工頭等都應該負起連帶責任。部長，這個案子發生到現在，勞動部有沒有直接或間接去瞭解跟關心？對於逃逸移工的雇主，以現行法令來說，除了因僱用非法移工要罰款之外，對於這樣的肇事責任，家屬認為應該要有連帶責任的意見，部長，您的看法為何？有沒有什麼樣的救濟方式可以積極地提供類似的受害者協助？,29,LCIDC01_1119301_00004
莊競程,"部長，再擴大一點來看失聯移工的問題，截至今年8月統計，全臺灣超過7萬4,000名的失聯移工，根據內政部專案報告顯示，移工失聯的原因包括薪資待遇、勞雇關係、工作量與工作環境等基本勞動條件可能不如他們的預期，再加上失聯後可以自由轉換雇主，而且如果進行非法工作，薪水還可能比較高。最近有報導指出，在臺中梨山地區，幾年前外籍移工一天薪資大約是八、九百元，但是他們看準農民在採收期有時間性，加上現在缺工的問題，不得不僱用，今年日薪一口氣被喊到差不多1,500元起跳，不少都開價2,000元，資深移工還喜歡論件計酬，例如採茶、高麗菜、水果套袋、砍草等都採論件計酬，速度快且有經驗者一天可以領到2,500元的工資，這個薪資遠遠高於他們原本申請來臺的工作薪資。起先引進移工的目的是填補本國勞動力不足或是部分工作性質本國勞動力不願意投入的情況，現在變成移工也不太願意投入，失聯移工的問題日益嚴重，面對失聯移工人數節節攀升，勞動部是源頭管理的主管機關，勞動部的因應對策是什麼？就是部分勞動市場還在喊缺工，希望大量引進移工，但同時又擁有數量很龐大的失聯移工，勞動部有哪些計畫來改善這樣的問題？",30,LCIDC01_1119301_00004
莊競程,"部長，我們知道法有訂罰則，罰得其實也不算輕，但是多年來，查緝還是很困難，即便有罰則，但是也好像起不了太大的作用，除了加強查緝之外，勞動部在移工這方面，在強化合法移工的權益、改善勞動條件，以及聘僱的模式等等政策推行上，做了哪些努力？從數據上來看，該怎麼去強化？另外，從雇主來看，過去有移工利用怠工，用不認真做事的方式，強迫雇主同意讓他轉換雇主，光是去年1到8月就有2,400名的家事移工轉到廠工，跟前年的二百多人相比，多了10倍，從移工的勞動權益及雇主被移工這樣的怠工方式，怎麼取得平衡，勞動部有沒有什麼方法？",31,LCIDC01_1119301_00004
莊競程,過去移民署曾有擴大自行到案的專案，即鼓勵失聯移工自行投案的方案，如果將現有失聯移工以專案的方式，例如減輕處罰後，再次輔導回歸勞動市場，這樣的機制是否是可以考慮的方向？,32,LCIDC01_1119301_00004
莊競程,在大量引進移工及現在有龐大失聯移工的方面要怎麼取得平衡之外，剛剛也講到，雇主跟移工之間要怎麼取得平衡？失聯移工的問題相當複雜，我們直接想到的都是查緝逃逸移工來解決問題，但是對失聯逃跑的移工如果有效的話，他們就不會一直增加，如何輔以有效的政策推展，營造更完善的就業環境，我想才是解決各行各業缺工及移工問題的根本之道，我想勞動部這邊可能要再多費點心力。,33,LCIDC01_1119301_00004
莊競程,看看如何去取得雇主跟移工之間的平衡，讓這樣的狀態不會一直發生。,34,LCIDC01_1119301_00004
莊競程,好，謝謝。,35,LCIDC01_1119301_00004
黃秀芳,（9時56分）部長好。部長，美國因為通膨而升息，連帶全球經濟景氣非常差，以我所看到的，臺灣目前有放無薪假的，或是有一些廠商幾乎都沒有訂單，我想請教勞動部，目前有多少人在放無薪假？,36,LCIDC01_1119301_00004
黃秀芳,是這一季嗎？,37,LCIDC01_1119301_00004
黃秀芳,好。部長，你的資料跟我在第一線接觸到的真的有落差，我們可以看到在第四季，有很多廠商幾乎都是做兩天、休五天，這是目前我碰到的狀況。我也希望勞動部針對美國升息所造成國際經濟景氣變得非常差，勞動部應該有接收到這樣的訊息。,38,LCIDC01_1119301_00004
黃秀芳,尤其是在第四季或到明年第一季，要恢復的話，可能要到明年第二季或第三季。目前我碰到很多廠商是做兩天、休五天，這些勞工就放無薪假，也許就沒有通報，我希望勞動部針對這個部分應該要去瞭解。因為勞工放無薪假的情形在這一季滿嚴重的，跟上一季比起來，這一季真的非常嚴重，所以希望勞動部針對這個部分應該要去關心。,39,LCIDC01_1119301_00004
黃秀芳,好。接下來，其實今年的失業率及人力空缺都一直在增加、一直在上升中，我想請教的是，為什麼雖然都有職缺，但還是會有人力空缺的狀況？我覺得普遍存在的問題就是學用落差，我也知道勞動部這幾年有進行一些訓練，針對這個部分，你們可能還要再加強，因為你們既然辦了這麼多訓練或職訓，為什麼人力空缺、學用落差、缺人才及缺工的問題同時存在？,40,LCIDC01_1119301_00004
黃秀芳,是不是可以請勞動部要辦理職業訓練的話，應該也要跟第一線比如跟經濟部確認目前是缺什麼樣的人才，你們再開訓練班？,41,LCIDC01_1119301_00004
黃秀芳,我覺得這樣才真的可以讓你們訓練出來的人才到第一線工作。我不知道你們有沒有做這樣的調查？,42,LCIDC01_1119301_00004
黃秀芳,是。,43,LCIDC01_1119301_00004
黃秀芳,你們有沒有做過一個統計，即針對訓練完之後投入就業的比例是多少？,44,LCIDC01_1119301_00004
黃秀芳,是。我當然希望你們訓練出來的人才可以直接投入到產業，因為產業界一直都在喊缺工、缺人才，既然勞動部有在開辦這樣的訓練班，當然希望訓練出來的人才是可以真正投入到第一線的產業界。目前應該有跟經濟部討論業界需要怎麼樣的人才？,45,LCIDC01_1119301_00004
黃秀芳,另一方面，我希望未來勞動部或是經濟部、教育部，應該就學校教育的部分做一個調整，即針對產業需要怎麼樣的人才，在教育方面就要培訓相關人才，不然學用落差的問題其實滿嚴重的。,46,LCIDC01_1119301_00004
黃秀芳,好。最後一個題目，你們有一個產業新尖兵的計畫，該計畫的開班大部分是在六都，六都是最多的，六都以外的縣市就不是那麼多，為什麼會有這樣的落差？是因為地方沒有這樣的需求，抑或是參加的人沒有意願，不知道你們有沒有做過統計？,47,LCIDC01_1119301_00004
黃秀芳,我認為不要有城鄉差距。,48,LCIDC01_1119301_00004
黃秀芳,我看到這個……,49,LCIDC01_1119301_00004
黃秀芳,因為我看到全部都集中在六都，六都以外都很少，所以我希望能夠有一些和勞動部合作的單位，是不是你們自己本身就可以直接辦訓？,50,LCIDC01_1119301_00004
黃秀芳,沒辦法？,51,LCIDC01_1119301_00004
黃秀芳,是。,52,LCIDC01_1119301_00004
黃秀芳,我覺得這方面真的要再加強。,53,LCIDC01_1119301_00004
黃秀芳,要不然真的會有城鄉差距，我覺得這樣不好，麻煩勞動部在這方面要再用心一點。謝謝。,54,LCIDC01_1119301_00004
吳玉琴,"（10時7分）部長早。今天要就三個議題跟部長請教與討論，第一個先進入職災勞工個案主動服務這一項，針對這個計畫，你們的業務報告第25頁有提到，目前支持職災勞工個案主動服務有65名個管員，提供個別化深度服務。我要請教的是，這個服務應該是從97年就開辦了吧，你們的資料數據是累計的嗎？是從97年累計，還是只有111年截至9月底止你們1年服務了1,663件？因為我看你們的資料常常搞不太清楚。",55,LCIDC01_1119301_00004
吳玉琴,這是累計的嗎？,56,LCIDC01_1119301_00004
吳玉琴,是當年度？就是111年的？,57,LCIDC01_1119301_00004
吳玉琴,好。,58,LCIDC01_1119301_00004
吳玉琴,"今年就服務1,663件，累計有六萬多？那已經算不錯了，因為我看你們的資料是從97年累計到現在，大概八萬多。",59,LCIDC01_1119301_00004
吳玉琴,有時候會覺得混亂。,60,LCIDC01_1119301_00004
吳玉琴,我就要請教，像這樣的職災勞工個管員都做什麼服務？這部分可能署長會比較熟悉。,61,LCIDC01_1119301_00004
吳玉琴,OK！所以在22個縣市都會是一致的？,62,LCIDC01_1119301_00004
吳玉琴,這些個管員都是你們派下去的？,63,LCIDC01_1119301_00004
吳玉琴,好，請問職災勞工要具備哪些條件才能得到個管員的協助？只要是職災事件就可以嗎？因為這是針對家庭給予的主動積極協助，所以只要是判定為職災就可以嗎？有沒有需要是失能等級？只要認定是職災事件就可以？,64,LCIDC01_1119301_00004
吳玉琴,所以你們還是會分級？,65,LCIDC01_1119301_00004
吳玉琴,收案之後做分級，然後可能會再深入服務。,66,LCIDC01_1119301_00004
吳玉琴,鄒署長，現在65個人到底夠不夠？人力夠不夠？,67,LCIDC01_1119301_00004
吳玉琴,所以你們的計畫中有沒有人力增編計畫？,68,LCIDC01_1119301_00004
吳玉琴,你剛才講原本是四十幾個，現在到65個，這樣夠了嗎？因為今年推動了剛通過的職災保護法，我覺得業務應該是要更增加。,69,LCIDC01_1119301_00004
吳玉琴,所以這個部分……,70,LCIDC01_1119301_00004
吳玉琴,是。本席是很支持這樣一個主動的服務，因為只有主動才能深化及瞭解職災勞工的家庭可能面臨哪些問題，可能有一部分是我們主動協助，但有一部分是要連結資源，在這個部分其實是個管的角色。,71,LCIDC01_1119301_00004
吳玉琴,到9月底，1年就已經有六萬多人次，表示這個業務也不會很輕鬆，尤其是新的職保法通過，我覺得應該是有很多業務跟以往不同，不然我們立這個法幹嘛？就是希望更深化！所以我希望這部分可能請部長也斟酌未來人力的……,72,LCIDC01_1119301_00004
吳玉琴,好，謝謝部長。另外就是外送員的議題，外送員的部分也是職安署負責，有關外送員的作業安全指引，我知道鄒署長已經很關心了，8月30日又有第二次的修訂，這次在外送員的危害防止計畫中有把合理派單事項放進去了。在合理派單的部分，我一直在想到底要怎麼樣把合理派單落實，這個規定等於是政府指引業者來做，可是好像缺了一個勞資雙方怎麼樣有所謂的勞動契約或勞動團體協約，好像沒有這樣的約束力，變成是官方自己主動勸導。這不是職安署的業務嗎？,73,LCIDC01_1119301_00004
吳玉琴,要不要督促食品外送員和食品外送平台雙方簽訂團體協約，讓他們比較能夠落實？不然的話就只有一個指引而已。,74,LCIDC01_1119301_00004
吳玉琴,所以我想勞動部是鼓勵團體協約能夠推動。,75,LCIDC01_1119301_00004
吳玉琴,如果有需要協助，你們會給予相關技術的協助。,76,LCIDC01_1119301_00004
吳玉琴,因為時間的關係，我要進行到第三個題目來跟您請教。在休會期間，勞動部突然發布這個訊息，我想要釐清有關長照家庭喘息服務的問題，在新聞稿裡面，你們顯示原來移工長照的喘息服務1年有31天，未來在年底最高可以達52天。,77,LCIDC01_1119301_00004
吳玉琴,現就這個新聞稿的內容來跟部長或是蔡署長再釐清一下，所謂喘息會達到52天，對於二到六級的輕度及中度失能者的喘息服務是幾天？衛福部原來給的是14天，你們會增加嗎？這是二到六級。另外還有七到八級重度失能的部分，原來衛福部是給21天，所謂的52天是所有二到八級的統統給嗎？,78,LCIDC01_1119301_00004
吳玉琴,那是新聞稿。,79,LCIDC01_1119301_00004
吳玉琴,休息1天。,80,LCIDC01_1119301_00004
吳玉琴,你預估大概要多少經費、有多少人使用？因為這跟使用量有關。,81,LCIDC01_1119301_00004
吳玉琴,署長，你估算多少？,82,LCIDC01_1119301_00004
吳玉琴,"才8,500萬元？",83,LCIDC01_1119301_00004
吳玉琴,所以你剛剛其實不是增加31天而已，如果你是一個輕度二到六級的話，原來是14天，你可能要比照，天數不一樣啊……,84,LCIDC01_1119301_00004
吳玉琴,"可是你說的經費只有編列8,500萬元，我覺得這個經費是寫得少多了，是不是估算能夠使用的人不多？",85,LCIDC01_1119301_00004
吳玉琴,使用率可能不高……,86,LCIDC01_1119301_00004
吳玉琴,你們有沒有去檢討，到底擴大使用喘息服務為什麼使用率這麼低，是什麼原因？應該要知道那個原因，不然你剛剛提到的政策目標可能很難達到。,87,LCIDC01_1119301_00004
吳玉琴,都有可能？,88,LCIDC01_1119301_00004
吳玉琴,部裡面可能針對你的政策還是要做相關的宣導，因為如果使用率偏低的話，當然大家能來使用的就少，所以你估的錢我認為是偏低。但是這個部分，也是我們政策上本來就是要滾動式去檢視……,89,LCIDC01_1119301_00004
吳玉琴,有問題我們就來看，這些使用率低的原因，我們來加強……,90,LCIDC01_1119301_00004
吳玉琴,好，謝謝部長和署長！,91,LCIDC01_1119301_00004
洪申翰,（10時19分）部長好。我今天想要來跟您請教幾個關於職災給付的問題。,92,LCIDC01_1119301_00004
洪申翰,部長，這一篇報導「經濟起飛年代的陰影下，等不到正義的石綿職災勞工」是2018年的報導，我不知道部長有沒有看過這篇報導？,93,LCIDC01_1119301_00004
洪申翰,不太有印象，2018年？,94,LCIDC01_1119301_00004
