speaker,speech_text,speech_number,meeting_id
吳怡玎,謝謝主席今天召開這場很重要的公聽會！前幾天行政院召開記者會，漂漂亮亮發表如何邁向2050淨零碳排路徑圖，但當中其實存有許多遺漏，這點在法律面也展露無遺。首先，大家看到以2050年為淨零目標，但2030年、2040年又該怎麼辦？這點並沒有很明確寫清楚。國發會的圖表呈現的是直直的一直線，這其實有點不可思議，我還以為看錯了。和IEA路徑圖相較後可知，2030年的這一段是比較陡的，所以他們在報告裡也提到，目前開始到2030年，我們要認真地減碳，且所需要的工具有八、九成都是已經有技術。換句話說，到2030年我們該如何減碳？到底要運用現有科技來減多少碳？這些都是可以計算出來的，所以我們希望這些可以入法，不要像溫管法一樣，從發布到現在，我們仍然不知道到底減了多少溫室氣體？由此可知，淨零目標訂得太遙遠並不是很實際。其次，就各個產業來看，尤其是電力產業，剛剛也有專家學者提到這點，即電力產業占我們整個碳排的最大宗，且並非只有臺灣如此，而是全球皆然。IEA也認為電力產業的降幅是最陡的，從2020年到2030年大概是減半，到2040年為零。也就是說，如果預期要在2050年達到淨零碳排，那麼2040年時的發電就必須先達到淨零碳排！再來看碳費，現在是有碳費沒有碳稅，這是IEA所給的圖，從2025年開始，已開發國家所徵收的碳費每公噸為75塊美金，特定新興市場及開發國家每公噸45美金，其他新興市場及開發中國家為每公噸3美金。由此來看，臺灣是把自己擺在最後面的開發中國家！我常常問自己，我們到底是已開發國家、還是開發中國家，或者根本就是個未開發國家？現在看來，是擺在最下面的每公噸3塊美金。但重點在於，這不僅僅是碳費定價，還包含了到底是以直接排放課徵還是間接排放課徵？眾所皆知，直接排放課徵的話是課徵到誰？那就是電力產業！IEA明確標示，不管對電力製造或能源產業都要課徵碳費，所以不要逃避了，不要只准官家放火，不准百姓點燈，差不多就是這個概念！試想，如果碳費只收3塊美金，大概新臺幣100元，那是種什麼概念？對於中鋼來說，還真的是不痛不癢！以民國109年的直接排放量來試算，乘以100元（或300元）臺幣，那麼一年要繳的碳費是82億元。聽起來很多，卻只占其全年營收的0.87%到2.61%，真的是不痛不癢！中鋼、中油、台電是臺灣的排碳大戶，三個加起來目的就達成一半了！所以我們建議，碳費不能以最低標為準，且一定要cover電力產業。另外，大戶先行！其實不能只有大戶先行，我們的建議是公營先行，如果公家不做好榜樣，又怎能要求民間呢？我剛剛說了，把台電、中鋼、中油抓出來就占全臺灣排碳一半以上。謝謝。,1,LCIDC01_1116501_00004
蔡壁如,今天環保署的官員及各位專家學者都來了，我想這是一部非常重要的法律，不管它叫氣候變遷法或是叫氣候變遷因應法，這部法恐怕會影響未來我國二十、三十年的一些產業轉型，甚至老百姓一些行為的改變，所以這是一個很重要的法案。2020年是淨零轉型關鍵年，面對問題，才能夠解決問題。我知道這很困難，但我覺得再怎麼困難，我們都已經踏出第一步，應該要好好地來整合，如同剛剛邱教授講的。每次我都在這個委員會裡呼籲，我們做的第一步就是我們開始在衛環委員會裡從點、線、面做自己能做的，我要求環保署中午要叫便當就應該叫環保便當，我一直在呼籲，不過他們一直有很多的理由，但是他們還是有在做，就一步、一步來做。台灣民眾黨的氣候變遷法版本有四大特色，第一個就是行政院層級統籌機構，我們是把它設計在行政院的永續會裡，因為它已經有一個骨架，當然有很多民間團體覺得氣候變遷法要有一個獨立的、專屬的辦公室，但是它如果沒有拉高層級，事實上在各個部會的協調上非常困難，當它獨立之後，其他的部會恐怕也都叫不動，各部會的權責一定要入法，全國都要動起來，不管是哪個部會，交通部、教育部甚至是勞動部、經濟部全部都應該要動起來，不應該再踢皮球。第二個我們版本的特色就是淨零路徑要入法，我們是直接把路徑寫到法裡頭，2030年禁用四大類一次性塑膠性、新建築能耗證書，2035年碳排減半、禁售燃油機車，2040年禁售燃油汽車、禁用一次性塑膠及碳中和建築。第三個特色是先碳費後碳稅，這個我也開過很多公聽會，也參加了各式各樣的公聽會和座談會，像剛剛很多專家學者也提到，其實我國最主要還是以外銷為主，所以我們希望2023年能夠開徵碳費，至於起徵費率，大家可以再討論；然後2026年開徵碳稅，這樣就可以接軌歐盟的碳關稅。第四個很重要的是弱勢團體與產業的公正轉型，希望碳費和碳稅能夠用於公正轉型，以及政府應該要主動協調程序不正義的再生能源開發案。以上是我們的主張。在行政院層級方面，民眾黨要強化的是環境基本法已經有的永續會，氣候變遷法中有明定常設辦公室的人力和財務，因為去年8月永續會的幕僚單位已經改為國發會，這樣可以加強各部會落實的狀態。既然已經有骨架了，就應該去強化肌肉。再來就是淨零路徑入法，淨零路徑入法不應該走回頭路，其實賴清德在2017年當行政院長時就有宣示要補助電動機車，但蘇貞昌院長於2019年上任時又暫緩，導致整個電動車呈陡坡式的崩落，所以我們認為淨零路徑應該要入法，要能夠確實地去執行。其實環保署在2018年就規劃2030年全面禁用塑膠袋、免洗餐具、飲料杯、吸管四大類一次性塑膠，但在這兩年的疫情下，一次性餐具不減反增，根據民團的統計，尤其是六都大概就增加15%，所以民眾黨所提的氣候變遷法是主張2030年要禁用四大類一次性塑膠、2040年將全面淘汰一次性塑膠入法，減塑不可以再走回頭路。我們的主張就是先碳費後碳稅，碳費目前是預計針對每年碳排量超過2.5萬噸、大概兩百八十幾家的碳排大戶，他們每年的碳排就大概達2.27億噸，如果每一噸的碳費是100元的話，這樣小金庫就有高達227億元的經費，比環保署最大的空污基金45億元還高出很多，但環保署有沒有能力去運用？我覺得這部分也應該由社會共同去討論。民眾綠能而不是財團風光。政府要能夠主動協調很多不正義綠能的開發案，像屏東把整個山坡都剷平就為了種綠電，它真的是綠電嗎？或是把臺南的將軍溪出海口做得彎彎曲曲的，就為了幫財團量身訂作光電板，這真的是綠電正義嗎？城市是減碳的第一線。其實臺北市是去年唯一提出淨零路徑的城市，它已經把淨零路徑入法、明定各機關的權責並把氣候基金用於公正轉型。基本上氣候基金的三成應該留給地方使用，現行溫管法中有明定，碳交易所得至少三成要給地方，不過這一次碳交易變成碳費以後，好像那個法就被改掉了，這個大概也要跟環保署來做下一次的溝通。最後是短期關鍵戰略。3月30日國發會有提出淨零路徑，分為四個部分，但短期內我們能做的可能就是依賴節能減碳。過去二十幾年來，我們都用道德勸說叫大家要關燈、要節能減碳，或是多走路可以環保減碳救地球等，但經過20、30年的道德勸說後，現在應該要好好地去執行。其實剛剛邱教授也講得對，政策的核心就是執行力，如果你把法寫成這樣，但是卻沒有執行力，事實上都是枉然。像氫氣、CCUS到2030年以後才會開始慢慢起來，所以短期內我們必須要有一些短期作為。另外就是高耗能產業，像鋼鐵、水泥、石化、電子，這些都應該做政策環評，這部分我昨天在這裡也跟環保署有廣泛討論過，而不要用鼓勵、獎勵的，這樣的道德勸說事實上是行不通也走不遠的。以上，謝謝。,2,LCIDC01_1116501_00004
洪申翰,大家早。我想先謝謝賴惠員召委在上禮拜五行政院版的氣候變遷因應法出了院會送到立法院以後，就在最快的時間即這週於委員會召開公聽會。在我正式發言前，有個部分我想先跟環保署表達抗議。今天署長沒有來，但我相信你可能有在看直播，我必須說，環保署作為這部法的主責單位，今天只派了一位主秘坐在委員會裡，這是非常、非常不適當的。如果環保署可以這樣做，為什麼其他部會要派次長來？今天環保署還有其他的副署長，他還在其他非本委員會的委員會裡面，我覺得這是對衛環委員會很不尊重的行為。這件事情請環保署一定要帶回去，我覺得這是沒有辦法被接受的事情，這不是環保署個人怎麼樣的問題，而是你一併拉低了整個行政院與其他部會對衛環委員會的尊重，在這裡我一定要先嚴正地提出抗議，謝謝。我自己在2020年年底就針對溫管法提出了修法草案，我們的版本叫做氣候變遷行動法，是跟幾個民間團體一起共同來提出的。當時提出來的時候，其實大家就知道氣候變遷的風險大幅提升，全球也把淨零排放當作一個新的減碳目標。當然，這一、兩年的倡議下來，現在各部會包括行政院也同意把2025年淨零排放的目標入法，這是一件好事。如果回顧2015年當時通過的溫管法，就可以看到當時溫管法有很多地方都已經不合時宜，除了政策工具不足、減量的目標落後全球、組織跟權責的規範不明，讓各部會消極地應對氣候治理外，更重要的是，溫管法作為臺灣唯一因應氣候變遷的法律，但在法中卻幾乎沒有提到「調適」這麼重要的工作該怎麼執行。所以我覺得應該要把握這一次大修溫管法的機會，很重要地，今天為什麼要大修溫管法成氣候變遷因應法？我覺得有幾個最重要的目的：第一個，要讓我們的政策工具有清楚的法律授權，第二個，雖然我們接下來應該會把2050年的目標入法，但是我們要怎麼讓整個行政機器，包括中央、地方、各部會都能夠順利地運轉和運作，只有這部大的行政機器跟社會的力量，包括產業界能夠順利地運轉和運作，讓產業可以順利地減少排放，我們的目標才可能達成。所以我自己把這部法定位成是要為未來解決問題的一部氣候法，它是我們在淨零轉型關鍵的法制基礎。因為氣候政策在國際上進化的速度非常、非常快，但是我認為這次修法中有幾個問題一定要處理。第一個部分是針對各部會的減量和調適的權責，我認為還是必須要放入到法條的本文裡面，而且應該要明確地寫出哪個部會負責哪些事情、哪些任務是由哪些部會來負責。可能有些人會問：這樣做會不會太僵硬？其實如果你是瞭解氣候治理或是過去這麼長一段時間在我們行政部門做減量工作的人就會知道，假設你去問很多專家說：我們現在溫室氣體減量最大的問題是什麼？我跟你講，10個裡面有8個會跟大家說：該負責的部會推卸責任，推來推去。這個是所有參與減碳工作的人幾乎都遇過的事情。今天現場有很多部會的代表，其實大家心裡都有數，我們私底下也聽過很多部會抱怨，某某部會、某某部會都不願承擔該承擔的責任，明明國際上就是某些部會要去做某些事情，但是回到臺灣，某些部會就是不願做，還在推卸。這都是大家聽過的事情，我覺得也不用多說。就是因為這樣，所以我們才要求要把部會的權責清楚地入本文，不能只是放在立法說明中，為什麼要這樣？因為只有放在本文，才能讓應該要推動的事項變成長期的責任，而不只是短期的任務協調，變成長期的責任，各部會才會安排相關的行政能量、匡列資源、人力及專業來做長期累積性的工作，這是我們要求入本文、入法最重要的目的，也只有這樣才不會陷入過去不斷推卸責任的問題。今天現場有很多長期在執行氣候政策推動的各部門及民間代表，我想問一下，在場沒有遇過部會推卸責任的人，請舉手。今天在場的各部會代表、專家學者、民間團體、產業界代表沒有遇過部會推卸責任的，可以舉個手嗎？全部一定都遇過，也都很困擾、不知道該怎麼辦，這就是我們現在最大的困境。所以這就是為什麼要把調適減量的責任定為各部會長期的法定業務責任，這不僅是現在民間團體、環保團體的要求，同時也是產業團體的要求，以前我們常常說民間團體、環保團體跟產業界的意見不同，但現在不是，民間團體、環保團體、公民團體跟產業團體都希望各部會的權責入法，為什麼？因為大家都遇過部會推卸責任，大家都不希望再看到部會推卸責任，都希望整個政府能夠做到蔡總統說的，要總體的動員起來，所以這是為什麼大家都要求權責入法的原因。所以如果有哪個部會反對，請你站出來，告訴我你的理由；哪一個部會反對入法，請你站出來，清清楚楚地告訴我理由，來說服我為什麼你覺得不用？為什麼你覺得不用放在本文裡面？未來也不會再有任何行政單位推卸責任？請清清楚楚地來說服我，這是第一點。第二點，我認為要增加公正轉型的單獨條款，而且推動公正轉型必須要與民間協力並納入民間參與，為什麼？第一，因為我們研究了各國的公正轉型，相關的規劃跟推動都很清楚，這是一個跨部會的工作，第二，很強調的是，我們要提供較脆弱群體因應轉型所需要的韌性及幫助，這裡面有民間的能量及資源參與，才能讓整體的協助工作真的有韌性，所以這不只是政府編列資源、基金的問題，而是要提出一個跨部會、公私協力的計畫，所以很多國家都強調要跟產業的公協會合作，甚至和工會一起合作，訂定新的轉型目標，甚至帶動大家、勞工、弱勢群體一起度過轉型。所以我們很希望在這次的修法中，把公正轉型條款單獨入法，增加整個社會因應淨零轉型、氣候轉型的韌性能力。第三點是關於調適，我知道在剛剛這麼多的討論中，大家都比較少提到調適的部分，這一次很謝謝環保署訂出了調適的專章，但是我要強調，調適這個工作最重要是要以氣候的科學研究為重要基礎，而且要發展出臺灣自己的方法學。臺灣其實從十年前就開始做調適，102年到106年第一期的國家行動方案，當時是由國發會做的，溫管法通過以後，第二期的方案是從107年到現在，改成由環保署在做，我們翻開這兩期的方案跟成果就會發現，其實多數部會還是搞不清楚自己的計畫到底達成了什麼調適的目標、回應了什麼氣候的風險、提升了什麼地方的韌性，大家通常是把本來就在做的政策改個名字，就丟到大包的調適方案裡面，為什麼會這樣？因為調適的因應作為跟風險的辨識都沒有經過氣候科學嚴謹的檢視與提出，調適很需要氣候資料作為基礎，但我們長期缺少穩定投入氣候科學的資源，所以沒有辦法發展出更多元、全面的資料。我想現場很多科學家有把資料給各部會、地方政府、社區尤其是企業來使用，但是最關鍵的地方是，臺灣還沒有發展出能夠落實衝擊評估跟風險分析的方法學，我們去詢問很多在調適方面的國際專業者，他們都提出臺灣必須發展出自己的方法學，我今天的意思不是要把方法學寫在條文裡面，但方法學該由誰定、該由誰來把關？我覺得應該在氣候法裡面處理這個問題，大家才不會做了很多計畫，可是都不知道如何去評估，甚至不知道如何管考也不知道有沒有達到目標，這是最重要的事情。調適的工作一定要被管考，今天如果沒有明確的氣候科研、目標及指標，你根本就不知道要如何管考相關的工作。我想提一句話，這句話講得很好，有些人說減碳是救地球，調適是救臺灣，臺灣接下來面對氣候風險要如何因應，其實就是靠調適的工作，這是我們不可閃避的責任。最後一點，我想要延續剛剛談到科研在氣候中的角色，我自己很希望能在這次修法中，設置氣候變遷科研的專責機構，不管是減碳的工作還是調適的工作，都需要扎實的科學評估，這是氣候行動中最重要的基礎，我們過去相對缺乏國家整合科學研究的基礎，變成各部會自行其是，各自找各自的顧問公司，最後整合不起來，甚至目標之間還彼此衝突，導致無法動態修正決策機制。氣象局可能有一些預算、科技部有一些預算、NCDR也有一些計畫在進行，這些都是對的，可是沒有清楚地被整合，所以不容易互補，不容易形成一個大的、有效的、有力的綜效。我為什麼要一直強調科研的部分？大家可以看出，最近談到氣候變遷，最在意的幾份報告是由誰提出的？就是IPCC，為什麼大家這麼重視IPCC的報告？就是代表當你要研究氣候政策、氣候治理的時候，其最重要的基礎就是來自IPCC所提出的這些科學研究，有三個部分，包括物理性、調適及減碳，它都要有科學的基礎。這麼強調科學基礎的原因是希望讓氣候治理的每一份資源都是有效的，我們要讓投入的資源、預算、人力是有效的，它應該要基於科學，這是最重要的事情，所以我在這邊不斷地強調如何在這個法裡面，讓相關計畫的評估有更扎實的科學基礎，包括科學評估的方法論，這是最重要的原因。所以我們很希望其中還是有氣候變遷的科學研究專責機構來做相關研究資源的整合，不是代表所有的工作全部都由這個科研機構來做，但是它要有一定程度的整合功能，並在相關科研工作中，擔任長期穩定投入的綜整角色，我們很希望能把這些科學研究的成果落實在政策的擬定及推動上，把科學研究及調適列為臺灣行政部門長期推動的必要工具跟政策。以上，謝謝。,3,LCIDC01_1116501_00004
張育美,主席、與會的機關代表、專家，大家早安。在去年剛剛落幕的COP26大會當中，2050淨零碳排已經是全球的共識，超過130個國家宣示或規劃2050年達到淨零碳排，更有15個國家宣示將2050年淨零碳排入法，其中包括我們的鄰國日本和南韓。根據彭博新能源財經於2020年整理的G20零碳排政策評比報告，我們觀察到G20國家在六個領域當中，包括電力、化石燃料和脫碳、運輸、建築、工業以及循環經濟的穩健性，我們的鄰國南韓和日本表現非常亮眼，名次位於第三名和第五名。他們分別都在2021年將碳中和目標入法，並進一步提出相當具體的減碳政策。相較於日本、韓國由政府帶領產業力行減碳，反觀臺灣，我們卻是由產業界一再地呼籲政府加快腳步，儘快提出明確的減碳制度及做法。對於企業而言，未來10年將面臨三大永續法規的關卡，第一是2023年歐盟開徵碳關稅，有產品直接或間接銷往歐洲的企業將首先受到衝擊；第二是2027年金管會要求上市櫃企業完成碳盤查；第三，2030年許多國際品牌宣布要在當年達成碳中和，所有供應鏈廠商都必須提出相關報告以及做法。根據遠見雜誌最新的調查，在永續轉型的階段，高達53.1%的企業尚未實質啟動永續的轉型，有50%的企業認為ESG或者永續轉型最大的難題，就是環保的法規與ESG政策過於嚴謹，挑戰性太高了；另外有67.3%的企業表示，驅使他們邁向永續轉型的主因是為了配合政府的法規。所以從調查結果可以得知，企業亟需政府擬定明確的減碳政策和法規，以便提出相關的輔導措施，幫助企業達成永續發展的目標。接下來我們來檢視政府的作為，在法規面向，目前氣候變遷因應法修法版本雖然已經送到立法院，但本席對政院版本有兩個意見，第一，考量減碳工作分散在各部會，需要更高層次的跨部會整合協調機制，因此本席認為此次修法應該提高治理層級，在行政院設立氣候會報，由行政院長擔任召集人定期召集會議，以督促各部門落實相關決策。但是院版的草案卻是將因應氣候變遷法的基本方針、重大政策的跨部會會務，交由每年僅開一次會的行政院國家永續發展委員會，由它來分工整合，治理層級過低恐怕會讓將來政策的推展窒礙難行。第二，本席和政院版本不同的意見是，政院修法版本沒有明確規範各部會權責，所以部會的減碳政策可能流於形式。相較之下，本席提出的修法版本就針對各部會訂定清楚的權責分工，將來對於各部會的減碳效能能夠有效監督，對他們課責、給他們責任。在實務面上，金管會要求一千多家上市櫃公司在2027年前完成溫室氣體的盤查，但是國內的檢驗能量不足，目前符合環保許可，可以執行溫室氣體排放檢驗的機構，全國只有7家，約只有90名查驗人力，但是查驗時間需要3個月以上，根本難以滿足產業界的需求。減碳的政策不僅限於上市櫃公司，根據經濟部最新統計，全國約有155萬家中小企業，占全國企業的95%以上，全國中小企業總會指出，到今年2月只有一家中小企業因為身處於蘋果的供應鏈，所以才開始推動減碳，多數會員仍然因為政府未有明確規範而無所遵循。我們再來看，相較於日本、南韓，他們是由政府帶動產業界力行減碳，臺灣目前最大的困境是減碳政策以及法規進度落後，而且充滿不確定性。國發會日前公布2050淨零排放的路徑，包括綠電、電動車以及碳權市場等，但是各項關鍵性的政策不明，讓外界質疑可能是空中樓閣。在法制方面，即便氣候變遷因應法可能可以於本會期三讀通過，後續仍然有許多配套措施及細節需要討論，並非一蹴可幾，政府必須跨部會整合，加速相關法案以及政策的推動，才能幫助企業追趕上國際減碳的趨勢。謝謝。,4,LCIDC01_1116501_00004
