speaker,speech_text,speech_number,meeting_id
洪申翰,部長，我看到健保署在接受媒體訪問的時候有提到，他說會逐步來做，然後跟食藥署採用所謂雙證的用藥，來盤點包括同時是處方藥也是指示藥的數量以及認定跟歸類的方式；當然，他留下一句話說最後一定會留下一定指示藥來繼續給付，這是我們在媒體上看到的健保署的說法。當然我自己也同意這個大方向的作法，因為現在確實很多醫藥界的朋友都來跟我們表達關心，覺得也許不宜貿然的退出給付，但同時也希望可以在雙證的用藥機制之下，不要讓健保署落入違法的疑慮，但又能夠考量健保財務的永續，最重要的對一般人來說當然就是用藥安全。部長，我想請問，在盤點雙證用藥的過程裡面，我認為是不是應該從用藥的風險包括情境──我們真的應該把各個專科醫學會也包括藥師團體，一起找來好好的討論，而不是只有健保署或食藥署自己關起門來討論或決定。我自己也看到衛福部其實滿早就設立了指示藥品諮議小組，在衛福部裡面有一個指示藥品諮議小組，在這個諮議小組裡面本來就有針對不同科、不同領域的醫師，據我瞭解，這個小組平常就有定期開會評估各種處方藥、指示藥、成藥的各種不同的風險，但一直到現在，其實這個小組都還沒有針對我們剛才在講的這個問題進行討論，所以部長，有沒有可能我們可以讓這個小組擴大討論的參與，包括剛剛講的各專科醫學會、包括藥師團體，大家一起來把這個事情再做一輪的釐清跟幾個大方向跟大原則的確認？有沒有可能？,72,LCIDC01_1124901_00009
洪申翰,是，那當然包括藥師團體啊！,73,LCIDC01_1124901_00009
洪申翰,對，我覺得當然這裡面會有很多不同的利害相關方，這個我們心裡都清楚，但我覺得可以把大家納入討論，不要讓人家覺得我們只是關起門來，尤其現在包括署長都在媒體上面說會逐步地滾動檢討，那大家看了以後，當然覺得你有沒有找我來討論？有沒有把一些重要的意見放進去？我覺得這部分需要衛福部跟健保署把門打開，好不好？這應該沒有問題。,74,LCIDC01_1124901_00009
洪申翰,每一個專科的用藥其實坦白說都大有學問，這當然都是一門重要的專業，但不管今天健保署即使你要用科別，還是用不同的藥品，還是不同劑量的方式，到底哪些可以逐步退出，其實這個部分我說實話，這部分我還是希望，剛剛部長講說當然我們也希望能夠穩健，可是我們真的也不要讓大家覺得我們長期處在一種好像違法的狀態而自己覺得無所謂，我覺得在這裡面怎麼找到一條路，這部分真的希望衛福部跟健保署好好謹慎地來討論，尤其我覺得要擴大參與很重要，好不好？謝謝。,75,LCIDC01_1124901_00009
邱泰源,"（10時15分）部長好。今天早上大家的一些互動，把目前臺灣醫療、防疫、長照相關的一些議題都有勾勒出來，部長跟行政團隊也感受到大家的用心，重要的議題絕對沒有那麼容易解決，但是一定要全力，大家再努力啦。不過我補充一下，第一位賴委員質詢的時候有提到電費這件事情，我覺得這個部分我們要站在人民健康照顧的糧草的維護來思考、來爭取。剛剛大家沒有一個數目字，其實臺大醫院已經告訴我，他們大概會增加3,000萬的支出。各位也都知道，石署長也在這裡，健保署也常常有各醫院的醫務收入跟非醫務收入的統計資料，我看很多醫院，我想部長也很清楚，臨床上你也做過很多，很多醫院真的還是要靠非醫務收入，所以多的這部分恐怕真的會有一些負擔，不然他們不會哀哀叫啦。第二個就是過去你講總額的時候也沒有講到電費會漲價這一塊，不管是協商、非協商都沒有這個部分。還有我們隔壁的金鋒魯肉飯也是會漲價，不是不會漲價耶；還有鬍鬚張等等，大家一直漲，比較有良心的是說他們也漲得很難過，但實際上我們的醫療院所是不能漲的耶，問題是這個，所以可能要把這些點跟行政院或是相關的部會說明，要請他們多多來幫忙，畢竟它的性質不太一樣。部長，這部分就拜託你了。你也很用心了，因為時間的關係，我就直接進入今天的議題，我覺得有連貫到在醫療公衛界也非常重視的一個重要議題，也結合到國際的趨勢。2016年世界醫師會大會首度在臺灣舉行，那個時候我也剛當醫師公會全聯會的理事長，剛好迎接這個大會，也感謝行政部門的所有長官幾乎都過來了。當時的部長是林奏延部長；最中間那個圖可以看到一個帥哥坐在後面看手機的就是王必勝秘書長，那個時候還頗年輕，頭髮還沒有白，最近被疫情操得很白；當時我們的劉越萍司長也在醫事會幫忙很多工作。那個時候是首度有40個以上國家的300位各國醫師會領導人到臺灣來，我要提的重點是當時發表了一個臺灣宣言──不是，這邊寫錯了，是臺北宣言才對，不是臺灣宣言，臺灣宣言就太偉大了，是臺北宣言，針對健康資料庫跟生物資料庫，就是Health Database跟Biobank這部分。其實這個議題在世界醫師會已經討論過，世界醫師會對臺灣醫界、公衛界過去幾十年來有高水準的醫療品質，而且很願意良善的幫助很多國家進行良善的交流，他們其實非常感動。各位都知道，在上個禮拜，世界醫師會（WMA）寫了一封信給WHO的秘書長，這次是用Open The Door（請開門給臺灣來），用詞更加強烈。當然這是植基於一、兩年前，我們在世界醫師會大會有通過一個resolution決議文，就是WMA要全力支持臺灣參與WHO和IHR相關的會議，有一個法源在那裡。那時候拚鬥得很厲害，當時是91比16票通過，奠定這十年來應該都有這個法源。但是我們也不要小看中國醫師會，以前很多議題像器官捐贈或是維吾爾族等等，世界醫師會都會譴責中國，但是現在中國很厲害，直接叫那些專家去它那裡看，回去大家都說它的好話，所以國際局勢是越來越艱難了，但是我們要站在公平的立場，任何一個國家做得好、任何一個國家注重人權、有改善，我們都要鼓勵是沒有錯，但他們還是用政治在阻礙我們參與很多會議，這部分還是要大家一起來努力。我們回歸這個部分，後來我們覺得臺北宣言相當重要，這個跟赫爾辛基宣言其實是並列於醫療史上面，所以我們也很重視，於是請了很多專家包括蔡甫昌教授，由陳榮基教授當召集人，把它翻譯成中文。請看下一張資料，重點是這樣，我想這個部分大家一看就知道，其中第24條有提到，世界醫師會敦促相關權責機構，基於本宣言所載原則，制定保護健康資料和生物材料的政策和法律。我今天早上一直在研究「生物材料」這個翻譯，雖然我當理事長，但是我可能沒有注意到這個部分，我不喜歡把人的組織變成材料那種用詞，這個部分我再回去檢討一下，我還沒有仔細去看英文。看起來我們有定一些法來保護Biobank、Health Database，看起來是時代所趨，搞不好我們比世界潮流還慢，從2016年到現在已經有7年了，所以本席要請教部長，第一，關於健康資料庫、生物資料庫這個部分，衛福部有著墨在哪些地方？第二，有沒有受到法律的保護？這次的修法是否有幫助？請部長對此作一說明。",76,LCIDC01_1124901_00009
邱泰源,可否說明簡要一點？,77,LCIDC01_1124901_00009
邱泰源,謝謝。部長有法律背景，講得非常有水準，有這樣處理以後，我想是很安心，可以把這樣的世界潮流跟現在國內的需要做一個落實。最後請教一個小問題，基本上我都支持，今天修法的目標、原則以及未來可以達到怎麼樣的情形，我們都樂觀其成，最後本席想請教一下，因為現在在臨床上，其實這也是醫師公會請所有的委員、專家提一些意見，但是我只有拿這個問題來請教部長，你們有沒有定義法條中的「無故輸入」？關於「無故輸入」，我身為臺大的醫生，有時候也要去查資料，也會擔心這樣做會不會被登記、會不會被處罰？所以這變成是醫療的恐慌症，就會不太敢去查，這個部分不曉得可不可以界定清楚，讓醫療人員知道而有所為、有所不為？當然醫院裡面有規定，像查吳委員玉琴的資料就不行，或是查誰的資料就不行，可能要查你自己主治的病人，所謂「無故」，這個帽子會不會太大？,78,LCIDC01_1124901_00009
邱泰源,可是我們有未遂犯，我們有在處罰未遂哦！,79,LCIDC01_1124901_00009
邱泰源,未遂就是沒有結果，不是嗎？,80,LCIDC01_1124901_00009
邱泰源,這樣檢察官去處理這個部分就會很費心……,81,LCIDC01_1124901_00009
邱泰源,不用說得那麼複雜，簡單說明即可。,82,LCIDC01_1124901_00009
邱泰源,那就應該寫「未授權」，為什麼要寫「無故」？,83,LCIDC01_1124901_00009
邱泰源,範圍比較大，大家就會緊張啊！,84,LCIDC01_1124901_00009
邱泰源,不會？我們說真的哦！不然弄到最後，醫療院所都不知道該如何查資料哦！,85,LCIDC01_1124901_00009
邱泰源,因為對於這名患者，可能要照會其他醫師，我不一定是主治醫師，但是薛瑞元教授請我照顧一下這個case，我會去看這個case的資料，但我不是主治醫師，他照會我而已，我總是要看一下，我在家裡也要看一下才能夠回答他要不要開刀或是怎麼樣，假設你是內科醫師，我是外科醫師，我不是主治醫師，這算不算授權？這會不會在無故的範圍裡面？,86,LCIDC01_1124901_00009
邱泰源,沒關係，這個部分我都支持，只是說要定義清楚，臨床上有這樣的困境，這個部分應該要再思考一下。,87,LCIDC01_1124901_00009
邱泰源,這就是醫療幹部、資深的委員提出來的問題，不是我提出來的問題，我是覺得有道理，所以要跟你請教，他們提出三、四個問題，我覺得這個感覺上會影響到臨床現場的運作。不好意思，這個部分你們去研究一下，好嗎？,88,LCIDC01_1124901_00009
邱泰源,在討論法條時，你再解釋一下也沒關係。,89,LCIDC01_1124901_00009
邱泰源,可以請法界同仁來幫忙，希望讓臨床現場能夠做得更順暢，維護人民的健康，拜託、拜託，謝謝部長、謝謝主席。,90,LCIDC01_1124901_00009
王婉諭,"（10時30分）部長好。關於兒童早期發現早期療育的問題，其實從我們上任以來就非常關注，今天還是想就這個問題跟部長請教，並且希望能夠一起來協力。首先，針對早療的部分，我們都知道早療是兒童醫療非常重要的環節，能夠早期發現早期治療也是非常重要的，甚至我們最近在審查特教法時也再次提到早療資源以及早療的意義。但是我們卻看到因為幼兒園的特教資源有過載的情況，導致有許多特教生必須待在早療系統當中，也更進一步壓縮資源。同時又因為過去幾年在疫情壓力之下，缺乏社會互動，許多的研究統計顯示過去這兩年之間發展遲緩的狀況有更加嚴峻的趨勢。光是看去年數據，總通報人數就超過三萬人，比前年同期增加了四千多人，但是實際上接受早療服務的人數卻只有兩萬人，更何況還有四成兒童還沒有辦法完成評估，目前完成評估的孩童大約只有一萬八千人左右。所以光從衛福部的這些公開資料就可以知道，人數增長的同時，我們的相關資源卻沒有跟上，還有四成左右的兒童沒有辦法接受評估，我們希望不應該有任何一個兒童被遺漏掉，而錯失早療的機會。我們看到在這個系統裡面出現幾個問題，首先，如果家長或醫療院所發現有一些特殊情況，希望能夠找聯合評估中心的資源進行評估，因為各縣市的資源完全不足，許多縣市甚至是失衡的，比如彰化、新竹人口眾多，卻只有兩個聯合評估中心，所以家長等待評估可能一等就是半年以上。我剛剛也提到，以去年的數據來看，有接近四成的孩童是沒有辦法經過評估的，等到評估進行之後要找健保課程也是非常的額滿，所以等到能夠上早療的健保課程可能又要再等半年。我們都知道其實早療的時間是非常重要的，也希望能夠不要錯過這個黃金期，在黃金期就能夠及早接受早療服務。但是我們看到光是在尋求評估及登記健保課程可能就要等一年以上，當然有一些家長在經濟狀況比較許可的情況之下，就會轉而尋找一些自費的課程。目前針對自費課程是每個月3,000元補助，可是光是一堂早療自費課程可能就要2,000元，整個系統有非常多資源不夠到位的部分，我們希望能夠具體來做討論。首先，聯合評估中心的資源建置是不是能有一個比較具體的對策？又或者是如何補足各縣市之間的差異？",91,LCIDC01_1124901_00009
王婉諭,評估資源和早療課程是分開兩個部分，而有不同的資源。,92,LCIDC01_1124901_00009
王婉諭,可是剛才我也有提到，可能一等就是超過一年。,93,LCIDC01_1124901_00009
王婉諭,如何增加？鼓勵、獎勵補助嗎？,94,LCIDC01_1124901_00009
王婉諭,這有點像是等醫院端自己來申請，或是相關的機構自己來申請，但是其實這樣就沒有辦法衡平縣市的兒童人口數。,95,LCIDC01_1124901_00009
王婉諭,衛福部應該整體盤點各縣市需要多少間，如果是比較缺乏的部分，應該要更積極鼓勵媒合，希望這些院所能夠提供這樣的資源，而不是只有鼓勵、獎勵補助的方式，等待它主動來申請。,96,LCIDC01_1124901_00009
王婉諭,沒關係，我們先回來剛才談的聯合評估部分，我認為衛福部應該主動盤點各縣市的兒童人口數量，以及評估資源量能，也要讓它們能夠對接起來，不是在於全臺有多少間，或是我們預計增加幾間而已。因為有些縣市是相對普遍缺乏的，可能要等上更久，我們的立場是每個兒童都應該要有同等的機會，在能夠被評估以及得到相同資源的情況之下，衛福部應該要積極盤點各縣市的兒童人口數目，以及建置的資源是否能夠到位，除了透過補助或鼓勵的手段之外，也應該要積極地處理，讓建置的速度及數量是能夠符合需求的。,97,LCIDC01_1124901_00009
王婉諭,另外，課程也是相對非常難搶，甚至比黃牛票還難搶，所以課程的建置是不是也應該要正視，而這些資源如何建置以及比較具體的作為是不是能夠給我們具體的說明？,98,LCIDC01_1124901_00009
王婉諭,這個計畫預計什麼時候通過？你剛才提到即將通過，但是……,99,LCIDC01_1124901_00009
王婉諭,我希望在一個月內能夠看到比較清楚的方向和計畫內容，你剛剛提到已經有計畫，但是我們現在目前是得不到這樣的資訊，也希望衛福部這邊能夠給我們一個具體的說明。,100,LCIDC01_1124901_00009
王婉諭,謝謝部長，因為我們不希望看到這些孩子因為我們的資源不足而被漏接，甚至錯過黃金期的治療階段，所以這部分請部長再持續努力，我們也會一起來關注。,101,LCIDC01_1124901_00009
王婉諭,第二個部分想請教醫療法的部分，蔡總統在2016年時曾經講過，應該要把醫師納入勞基法，以保障醫生的勞動權益，雖然衛福部在2019年時曾表示要透過推動醫療法的修法來納入勞動專章，但是到現在我們還是沒有看到這個結果。今年3月13日我曾經在這邊提出質詢，當時次長和司長的回應是關於醫療法的勞動專章應該要跟勞基法做對照，預計在一、兩個月內提出，3月13日的一、兩個月後大概是5月13日左右，但我想要提的是，從我們發函到現在已經接近兩個月了，我們還是沒有收到任何回復。雖然精神長照的部分，你提到在你的辦公桌上，也很快地簽核了，但據我們瞭解，這個專章好像又躺在你的辦公桌上，請教什麼時候會有一個比較具體的共識，以及具體提出醫療專章的可能性，在這個會期到底會不會審議和排審？,102,LCIDC01_1124901_00009
王婉諭,司長可不可簡單說明一下，2019年的時候就說要納入，剛剛也提到文字已經確定了，現在在跟醫界討論，所以什麼時候會跟醫界討論以及預期什麼時候完成？在3月13日的承諾是一、兩個月內就能夠看得到這樣的文字，並且提進來。,103,LCIDC01_1124901_00009
王婉諭,還在持續溝通，所以不知道時間，要等幾年不知道，2019年到現在2023年還沒看到，所以你們會持續討論，還是不知道什麼時間，是這個意思嗎？,104,LCIDC01_1124901_00009
王婉諭,有沒有把握或目標什麼時候可以完成？因為這已經經過好幾年的討論，當然討論也不能無止境下去，我們應該要有一個目標，這件事情其實非常重要。我們也看到賴副總統在競選的時候表示勞動權益非常重要，這部分到底什麼時候會有具體的作為，不是一直說我們努力、我們持續溝通，但一晃眼又過了好幾年。,105,LCIDC01_1124901_00009
王婉諭,我們真的希望這個承諾能夠執行，不是每次質詢的時候，承諾的時間又再往後延、又再往後延，從2019年說要有勞動專章，到現在還沒看到它的出現，我覺得是非常遺憾，也非常不應該，我們希望儘快處理，我們希望6月前能夠看得到。,106,LCIDC01_1124901_00009
王婉諭,我們希望6月真的能夠落實，我覺得不是一直溝通下去，然後一直說儘快、儘快，但是一晃眼又過了好幾年了。最後，請教關於病友團體參與新藥的審查，過去在新藥審查的流程當中，衛福部的確提出了一些修正案，希望能夠有效地縮短新藥審查的時間，我們也很期待能夠看到成果。我要在此提出一個建議，依照共擬會相關辦法第四條規定，共擬會裡面病友團體只有兩個人能夠列席參與，而且是沒有表決權的，同時這兩個人雖然是病友團體，但不一定能夠在當下表達意見，必須是被指定發言的時候才能夠發言，像以最近來說，共擬會針對SMA藥物的審查，長期致力於SMA藥物的李怡潔理事長就表示當時是在衛福部的邀請之下列席而已，但是發言完就要求離開會議，相對來說，其他各國使用者及相關團體的參與非常嚴謹且占有非常重要的地位，像在法國和澳洲甚至可以擔任副主席，但是臺灣目前僅能列席，而且不能自主發言。想請教的是，部長您認為是不是應該檢討審查過程中這樣不合理的規範？或者是衛福部支不支持讓病友團體真正地參與新藥審查的過程？,107,LCIDC01_1124901_00009
王婉諭,我們希望能夠具體告訴我們到底是不是有態度支持朝這個方向來做努力？,108,LCIDC01_1124901_00009
王婉諭,但是讓病友可以參與、可以出席，同時可以發言，我想這應該是一個基本要努力的部分。,109,LCIDC01_1124901_00009
王婉諭,我們希望能夠積極討論，因為這部分其實落後各國非常多，而且我覺得這是病友的權益，他們必須要能夠自己參與過程，才能夠更加提出這件事情的重要性，也更能夠讓各界瞭解，希望部長能夠一起努力。,110,LCIDC01_1124901_00009
王婉諭,謝謝部長。主席（邱委員泰源）：休息10分鐘。休息（10時41分）繼續開會（10時53分）,111,LCIDC01_1124901_00009
張育美,（10時54分）部長好。今日審查強化關鍵基礎設施保護法案，是考量到醫療機構維持國人生命、身體健康的重要性，在法律上給予更周延的保護，對於危害關鍵基礎設施的行為，如捐血中心、健保資料庫等等，加重刑責提高嚇阻作用。但是除了這些硬體設施之外，我認為醫療人力的付出與貢獻同樣需要受到政府的肯定與回報，我們不能只看硬體而已，硬體是各國的軍備賽，我們有輸有贏，但是我們可以多加關心軟體的部分。我在過去質詢時就曾多次提到我國經常性醫療保健支出占GDP的比率，今天健保署長也有來，相較於國際主要國家顯得相對落後。根據4月26日健保會的會議資料，衛福部列舉了2001到2021年間，我國、日本、南韓、德國、法國、加拿大與澳大利亞等國21年來的數據，我們看20年好了，2020年的資料全都有，像日本就成長4%，我們是多少？只有0.7%，韓國一開始很少，2001年4.4%，現在已經8.4%到8.8%，成長百分之四點多，我們是0.7%喔！你看德國本來就高、法國也高，他們現在都是百分之十二點多，所以他們也再成長3%，我們本來就低，韓國比我們更低，它成長2倍，所以我們醫療保健支出的比率就是一路走來始終如一，非常吝於醫療的投資。現在隨著指揮中心的解編，疫情期間醫界的努力，我們很遺憾，好像就被封存、遺忘了，如何從醫療體系強化醫療的韌性，似乎只能靠醫療院所自力救濟、節衣縮食。我要提醒部長，巧婦難為無米之炊，健康的投資不應該淪為政治的算盤，請問部長，目前衛福部提出的2024年度健保總額成長率上限、下限各是多少？,112,LCIDC01_1124901_00009
張育美,上限是多少？,113,LCIDC01_1124901_00009
張育美,健保署石署長，是多少？我跟你說好了，上限4%、下限1.053%，是嗎？是吧！對不對？先問你對嗎？,114,LCIDC01_1124901_00009
張育美,對的，好，我有先查好資料，應該是你查好給我。根據往年的經驗，最後行政院核定的成長率上限是不是都會比衛福部提出的方案還低？為什麼行政院都要東折西扣？你看，都比你低啊！2021提出5%成長率，它給你4.5%；2022你提出4.746%，它給你4.4%；2023你5%，它4.5%，你2024提出上限4%，它會給你多少？看樣子按經驗行政院是會給百分之三點多……,115,LCIDC01_1124901_00009
張育美,謝謝部長說儘量爭取，明年度衛福部提出的健保總額，剛剛看到是4%，是2012年來的低點；下限1.053%更是2005年到現在的最低點，這就是政府回應醫療界在疫情後正要努力升級轉型，各個醫療科技要轉型亟需政府投資健康的方式嗎？,116,LCIDC01_1124901_00009
張育美,基數變大？,117,LCIDC01_1124901_00009
張育美,現在因為分母大，所以4%就覺得很大了對不對？,118,LCIDC01_1124901_00009
張育美,可是我剛剛講不管衛福部提出多少，行政院一定會東折西扣，所以就算分母變大、基數變大，看樣子，它會給你百分之三點多，對不對？,119,LCIDC01_1124901_00009
張育美,部長又是儘量爭取，積極一點嘛！應該提出更advanced的做法，對不對？所以部長，根據財務的試算，剛剛我又回應你了，明年度的成長率如果是達上限4%，我知道你們都精算過，安全準備金會剩餘相當幾個月的保險支出呢？,120,LCIDC01_1124901_00009
張育美,1.01是什麼意思，部長知道嗎？1.01，精算是什麼意思？,121,LCIDC01_1124901_00009
張育美,然後呢？,122,LCIDC01_1124901_00009
張育美,什麼？請再講一遍，太小聲。,123,LCIDC01_1124901_00009
張育美,對，你認為大於1，在未來一年內就不需要面對健保費的調漲，對不對？,124,LCIDC01_1124901_00009
張育美,部長和健保署長都好精算喔！剛剛好1.01，所以不調漲。部長，我希望健康投資能夠回到醫療發展的初衷啦！否則行政院接連兩年分別撥補健保基金240億元及200億元的美意，實際上無法重振醫療體系，強化醫療韌性，但隨著長新冠COVID-19流感化之後，照護費用是回到健保給付，倘若健保成長動能不足，就是在壓榨醫界，持續貶低醫療服務的價值，你認為是嗎？,125,LCIDC01_1124901_00009
張育美,答對了！部長講到公務預算，我認為在健保總額成長動能不足的困境之下，我們卻承擔著難以承受的國民健康的重擔，彷彿一切與健康有關的政策推動都要藉由健保來支援，以癌症篩檢為例，篩檢後疑似個案的追蹤，國健署在今年度健保總額中提出全民健康保險癌症治療品質改善計畫，規劃以健保給付他的追蹤管理費與診斷品質費，形同把國健署癌症篩檢追蹤業務甩鍋給健保署，應該國健署要支出癌症篩檢費用，結果現在追蹤管理費、診斷品質費就要健保給付，所以這是甩鍋嗎？因為我要讓部長認清，健保總額不是聚寶盆，不是取之不盡用之不竭的事實，在政策推動上是不是能釐清，剛剛你講的公務預算與健保總額的分際？我們務實來看總額成長率不足的現實，因為剛剛講公務預算，我就直接來講公務預算，剛剛我講太長對不對？要不要再講一下？,126,LCIDC01_1124901_00009
