speaker,speech_text,speech_number,meeting_id
徐志榮,到底是誰的作法比較有利也還不知道，但是不論怎麼樣，我們應該對於病友團體這幾年一再想要推的癌症新藥多元支持基金給予關注，我相信大家都是支持這個精神，支持這個用意啦，畢竟他們是弱勢中的弱勢，但是不是支持修法，可能還是一個問題啦，是不是這樣講？我們也知道CDF大概就是二個面向，一個就是審查的時間過長，一個就是他們希望能夠擴大給付，講來講去重點就是在經費方面，我們一般新藥給付審查的重點，主要評估有三大點，包括藥品的安全性、相對的療效，還有藥物的經濟評估，以及財務預算的衝擊，我們主要比較重視它對財務方面的衝擊，但是我們是不是也可以透過限縮給付跟MEA等制度來控管？我在這邊提供一個建議，要去修法可能大家會覺得比較難，但可能不用做到修法，就是利用這個MEA，也就是我們跟藥商談的金額超過的部分，超過的部分我們不讓它回到總額裡面，你說1年省個幾億元、回饋回來幾億元，或者10億元，甚至有時候到20億元，放到健保總額裡面，它的點值也不過增加那麼一點點，因為總額是七千、八千億元，10億元、20億元所占的比例，也是微乎其微。我的意思是說，是不是以MEA超過的部分，我們跟藥商約束的那個金額以外，他們要繳回來、回饋回來的那些錢，拿來當作CDF的基金？這樣可能也不用牽涉到修不修法的問題，也比較簡單一點，可能就在健保署裡面直接處理，也不用到國健署那邊，可能在健保署裡面就可以來處理了也不一定。,100,LCIDC01_1123101_00006
徐志榮,它不是說願意不願意，不是說一定都要……,101,LCIDC01_1123101_00006
徐志榮,我的意思是說，那個比例其實是微乎其微，當然壓縮到還是有壓縮到啦。,102,LCIDC01_1123101_00006
徐志榮,我只是說對這些癌症病人也發揮一下同情心，不要那麼計較啦。,103,LCIDC01_1123101_00006
徐志榮,總歸一句，我們也是多考慮一下這些弱勢中的弱勢啦，看看我們要怎樣來協助他們。,104,LCIDC01_1123101_00006
徐志榮,不然聽他們的報導可能還要有錢人才可以得到這個病，因為一個月可能要付個一十、二十萬元，或者二十、三十萬元，那是指付得起的人，至於付不起的人可能就需要我們大家共同努力來找基金來支持他們，這才是我們所希望的。,105,LCIDC01_1123101_00006
徐志榮,希望我們能夠找出英國的優點，也可以找出我們大家所提的優點，來共同達到能夠有這樣一個基金來支付癌症的新藥，好不好？大家一起努力。,106,LCIDC01_1123101_00006
徐志榮,謝謝部長，謝謝主席。,107,LCIDC01_1123101_00006
林靜儀,（11時3分）次長好。很多改革要麻煩次長。,108,LCIDC01_1123101_00006
林靜儀,有幾個事情，第一個，我想還是先反映一下，到現在還是有很多基層的醫療人員跟我反映還是有缺藥的問題，我有看到健保署有提到對於缺藥的部分會有一些處置，現在你們是列了81個藥品在缺藥的名單，是不是？,109,LCIDC01_1123101_00006
林靜儀,我想藥品的部分已經談了非常久，民間也都已經知道很多藥品長期以來，尤其幾個比較特殊的藥品像是抗生素，抗生素現在成本不高、藥價也不高，但已經有一些抗生素快要變成孤兒藥了，還需要拜託別人來生產。我看了一下，我們的健保署有強調低於地板價的藥品不調整，因為健保署一直以來的情況，藥價就是一直往下砍嘛！我先請問，你告訴我們說你不砍藥價，可是問題是現在不論是原物料成本，加上我們要做PIC/S GMP，還有很多的成本都是往上走的，你們維持樓地板這樣夠嗎？,110,LCIDC01_1123101_00006
林靜儀,指示用藥。,111,LCIDC01_1123101_00006
林靜儀,不是啊！問題是我們現在擔心的是處方藥不夠嘛！處方藥有樓地板，那指示用藥你這邊有樓地板。我現在要問的是，現在成本增加了，你有往上調藥價的可能嗎？有給付的可能嗎？,112,LCIDC01_1123101_00006
林靜儀,你們有沒有出現過這樣的狀況──就是因為已經不敷成本，所以調整健保給付的藥價，有沒有？,113,LCIDC01_1123101_00006
林靜儀,副署長在，請副署長來回答一下有沒有這樣的制度？,114,LCIDC01_1123101_00006
林靜儀,你可以跟我講最近5年內有沒有這樣的案子嗎？,115,LCIDC01_1123101_00006
林靜儀,理研上次差點出事嘛！你們一定要搞到都快要出事了，才有辦法調升嗎？,116,LCIDC01_1123101_00006
林靜儀,所以簡單講，結論就是過去我們都知道健保就是一直調降藥價、調降給付的價格，但是如果不敷成本，藥廠還有臨床的醫療界，是不是有機制可以跟你們說某些藥品不敷成本，要把價格往上拉？,117,LCIDC01_1123101_00006
林靜儀,好，那這樣我們來要求大家可以來做這樣的事情，有一些已經不敷成本，不能讓臺灣這樣三不五時就缺藥下去啦！這次缺的抗生素這個部分，在農曆年前，盤尼西林類抗生素就已經提到有缺藥的問題了，這個是會讓人很焦慮的，好不好？尤其是抗生素有些又有抗藥性的菌，替代的部分不多啊！可以嗎？,118,LCIDC01_1123101_00006
林靜儀,謝謝。我們臺灣都講少子女化，所以現在願意生孩子的，我們都很感謝他們。第一個我先感謝，就是之前陳時中部長的時候，決議把我們的產檢裡面納入了妊娠糖尿OGTT篩檢這一塊，國健署有給付進去了，對不對？,119,LCIDC01_1123101_00006
林靜儀,署長，那給付進去之後，我們在懷孕過程中發現他可能是妊娠併發糖尿病，而產後發生糖尿病的機會有多少？,120,LCIDC01_1123101_00006
林靜儀,對，沒關係，我是專業的，我跟你講，根據2023年糖尿病照護期刊Diabetes Care的最新資料，妊娠糖尿病的婦女產後變成第二型糖尿病的機會是10倍，很高啦！他如果本來就是妊娠糖尿病，產後10年，他有20%慢性糖尿病的發病率，接下來每10年再多10%，30年後有一半的妊娠糖尿病婦女都變成糖尿病了。次長，健保給付裡面的第一名是哪一個疾病？,121,LCIDC01_1123101_00006
林靜儀,沒關係，我記得前5名，其中有一個是洗腎，對不對？而洗腎的最主要原因是糖尿病控制不佳，所以這邊拜託一下，我們很謝謝，我們也很高興有把妊娠糖尿納入孕婦常規篩檢，但他不是生完小孩就沒事了，我們把重點放在他身體有小孩，我們覺得很重要，小孩很重要，所以這個媽媽不能生病，但生完小孩之後他就沒事了嗎？比方說我們國健署的孕婦手冊，資料很多，我自己以前當產科醫師，那個資料裡面一大堆，可是你們現在都叫人家掃QR Code進去看，我先講一件事情，很多人都沒有在看。第二個事情，舉例來講，我們都告訴孕產婦哺乳期的時候，碳水化合物的量要比平常多80克，請問多80克是多少？不知道啦！沒有營養師、沒有婦產科醫師、沒有糖尿病內科醫師在做所謂的生活品質調整，甚至提早用藥介入，因為主席已經站起來了，我直接告訴你們，如果是妊娠糖尿病的孕婦，尤其是產後又有肥胖的，他需要直接進入妊娠糖尿病的飲食控制、生活習慣控制，甚至開始吃降血糖藥，他可以在3年內明顯地降低他未來糖尿病的風險。拜託評估一下，把妊娠糖尿病的追蹤納到國健署的產後照護，甚至接下來納入糖尿病共照計畫，可以評估這件事情嗎？,122,LCIDC01_1123101_00006
林靜儀,好，拜託署長跟次長，謝謝。,123,LCIDC01_1123101_00006
林靜儀,好，謝謝。,124,LCIDC01_1123101_00006
王婉諭,（11時10分）次長好。今天想要就本會期一些法案的時程來跟您請教，首先我要強調的是已經進入了第7個會期，也代表著這屆的立法委員們即將走入尾聲，以立法院的議程來看，如果法案沒有辦法在這會期送入立法院並且排審，極有可能就沒有辦法在這一屆審議，然後下一屆又因為屆期不連續而要重來。我認為立法的工程絕對不能一拖再拖，希望能夠妥善地思考接下來剩下不到一年的時間，我們要如何把一些重要的相關法案來通過。首先想請教一下今天審查的重點─癌症防治法的修法，根據時代力量提出來的版本，基本上跟各委員是接近的，都希望國家能夠設置所謂癌症新藥的多元支持基金，一起來做努力，這樣的設計其實一開始主要是來自於英國的癌症藥品基金，當然我知道設立基金最困難的其中一個部分就是財務的來源，以英國來說，它完全是政府這邊來出資，在沒有共同負擔的情況之下，每年編列大約3.4億英鎊的預算來執行。當然我認為以臺灣現在來說，如果要由政府完全籌措經費恐怕是非常困難的，因此也有許多病友團體提出共同負擔這樣子的概念或是辦法，這樣的訴求其實從去年就已經提出來了，甚至當時在厚生會舉辦的時候，部長也曾經參加，所以想請教的是，衛福部對於這樣的基金，是否有經過一些財務的評估或是試算？因為如果修法通過之後，未來的基金預算來源，是否應該要有一些初期的規劃或是初期的想法？先請教這個部分，規劃到哪裡了？以及朝哪個部分來進行？,125,LCIDC01_1123101_00006
王婉諭,次長，所以意思是說從去年開始就已經提出，而且說會來評估，但是到現在還沒有一個明確的方向，要等到今年去完英國之後，才知道朝哪個方向來進行？,126,LCIDC01_1123101_00006
王婉諭,意思是說在我們這一屆立法委員的任期內，恐怕看不到基金的設立？,127,LCIDC01_1123101_00006
王婉諭,所以什麼時候會知道我們的財源來源、大概預算需要多少以及怎麼規劃？,128,LCIDC01_1123101_00006
王婉諭,可不可以給一個具體的時間，什麼時候？大約幾月的時候？我想不應該遙遙無期，因為屆期不連續的情況之下，我們很希望能夠在第10屆立法委員任期裡面能夠好好的來執行。,129,LCIDC01_1123101_00006
王婉諭,所以就還是遙遙無期，聽起來就是這樣，因為還不知道什麼時間，然後也不知道這屆會不會看得到？,130,LCIDC01_1123101_00006
王婉諭,次長，我理解這需要時間，但是這的確不是今年才提出來，其實至少從去年開始就有，甚至更早之前，民間就有這樣的聲音，但是現在聽起來我們恐怕沒有辦法在這一屆裡面完成這樣的設置，因為目前什麼時候去英國以及回來什麼時候來處理預算的規劃都還聽不到。好，沒關係，我繼續請教，第二個想提出來的是職能治療師法的修法，我們很高興在朝野各黨的支持之下，上個會期物理治療師修法，讓物理治療師的業務執行不再受到一些過去條文的限制，能夠與時俱進並跟得上時代的改變，更積極的提供國人的服務，讓全民的健康都能夠受惠，但是一樣的情況之下，物理治療師法修法完成之後，職能治療師法也有類似的狀況，原本都會寫到要經醫生開具的診斷照會或是醫囑之後才可以執行，但是我們希望能夠隨著物理治療師法的演進之後，職能治療師法也能夠與時俱進，所以想請教，職能治療師法的修法是否能夠比照物理治療師法，儘速修正這樣的內容？不知道次長的想法和意見如何？,131,LCIDC01_1123101_00006
王婉諭,次長，可不可以有個具體的時間？因為我知道這個「儘快」，就像我之前說的，每一次儘快就是4年、8年、10年、12年，這個儘快實在是太不快了！,132,LCIDC01_1123101_00006
王婉諭,這兩者之間有衝突嗎？或者為什麼要先處理物理治療師法？,133,LCIDC01_1123101_00006
王婉諭,我想母法的部分其實是可以先處理的，母法部分其實要行政院通過之後，才會送進立法院，所以我認為母法的處理其實可以同時進行，如果要在子法執行之後，確認物理治療師法如何能夠處理，再來進行職能治療師法的審議，我覺得是可以接受的。但是我還是希望母法的部分，既然物理治療師法的母法已經沒有爭議，而且修法通過，其實應該要同時來送出行政院，然後進到立法院來，我們希望在這個會期有機會可以來做排審。,134,LCIDC01_1123101_00006
王婉諭,好，麻煩朝著這個方向來做努力。接下來是社會救助法的部分，其實這也是一樣，從去年開始就陸陸續續有委員一起在呼籲，臺灣貧窮線的標準非常有問題，導致過低的法定貧窮率讓許多人需要協助，但是卻被排除在外，包括我們也看到李麗芬次長曾說衛福部已經開始進行修法工程。首先我們想請教，這三個訴求希望衛福部在修法過程中能夠納入考量，也想請教衛福部的態度，第一個是應該要調整並且放寬貧窮標準的認定，尤其是家戶所得、虛擬所得計算不合時宜的規範，不要讓實際有需求人卻被排除在外，因為我們知道以家戶來說其實並不完整，也並不符合實際上的需求，因為理論上家戶裡面的人應該互相協助，但是實際上不見得家戶裡面的每一個成員都願意互相協助，所以我們希望這個規範能夠具體做修正，讓更多社會上需要協助的人能夠得到協助，而避免導致更多社會困境的產生。第二個部分，我們看到2017年兩公約的國際審查，其實有針對無家者，有提出應該要設立專法這樣的意見，但是現在專法恐怕是比較遙遠一些些，有沒有可能在我們的社會救助法裡面增加所謂的無家者專章或者是條文？以預防性的思維來面對無家者的困境。第三個部分，我們現在的社會救助法比較像是一個斷崖式的作法來做處理，而不是一個逐漸式的階段性設計，反而可能會因為擔心失去社會救助，而停滯不前，其實應該是要有一個逐步的階段性作法，比如說他從貧窮盡可能回到原本生活的常規、生活常態，中間包括如何讓他能夠有地方可以住、能夠回歸到社會，然後有工作可以做等等，其實應該要有階段性的設置，而不是只有在於救助與否這樣兩條線式的設計。所以首先想請教，關於這三個訴求，不知道衛福部的態度如何？,135,LCIDC01_1123101_00006
王婉諭,所以這三個部分都是衛福部能夠朝向一起努力的方向，沒錯吧？,136,LCIDC01_1123101_00006
王婉諭,好，接著要請教的是，從去年我們就聽到已經展開修法工程，既然這幾個方向都已經是衛福部在評估和考慮的修法方向當中，想請教的是，我們的修法工程到底進行到哪裡了，未來的進程以及具體的規劃是什麼？,137,LCIDC01_1123101_00006
王婉諭,好，因為據我們所知，現在還沒有看到任何資訊，如何修法、法條如何修正，其實都還沒有一個具體的進展，因為政府的承諾不應該一再跳票，不應該告訴人民「我們儘快、我們努力」，但是卻遙遙無期，所以剛剛提到這個修法工程去年就開始展開了，但是去年一整年一直到現在都還沒看到，我們希望能夠具體告訴我們到底修法進行到哪邊、做了哪些方向的修定以及預期什麼時候可以完成和提出實際上的進程，希望都能夠提供給我們，是不是能夠在兩週內先給我們一個初步的報告？,138,LCIDC01_1123101_00006
王婉諭,因為其實已經在做了，照之前的說法是已經在做，而且很積極努力在做了，既然已經積極努力在做，應該要有一個說明吧？還是積極努力在做，然後什麼都沒有？,139,LCIDC01_1123101_00006
王婉諭,是嘛！所以其實就可以說明嘛！,140,LCIDC01_1123101_00006
王婉諭,其實我覺得這應該是主動要對大眾說明……,141,LCIDC01_1123101_00006
王婉諭,而不是我們質詢之後才開始要來做這個準備，因為既然這是政府本來既定的政策和既定的方向，其實就應該據實地來跟大家說明，而不是透過委員質詢之後，還來說還要再多久才會有一個方向，這有點奇怪。,142,LCIDC01_1123101_00006
王婉諭,好，我們還是希望兩週內有個初步說明，因為包括這是去年開始的，真的不是我們現在提出來才開始做的，而是本來就已經在做的部分，我們還是希望能夠維持兩周內給我們一個說明。,143,LCIDC01_1123101_00006
王婉諭,不好意思，再耽誤一點時間，最後是醫療法勞動專章的部分，包括蔡總統在2016年就說過要把醫生納入勞基法來保障醫生的勞動權益，但是時至今日，多數的醫生仍然沒有獲得這樣的保障，包括衛福部也在2019年時決定要來推動醫療法修法納入專章，並且提出具體的草案，但是2019提出的草案目前進度在哪裡？,144,LCIDC01_1123101_00006
王婉諭,但是勞動基準法現在好像也沒看到實際的進程，所以這部分又是要互相等待，持續看不到一個可能的期程？,145,LCIDC01_1123101_00006
王婉諭,所以是依照已經公告實施的這部分來做修訂？預計什麼時候可以完成？聽起來已經確定就是依照這個方向，所以應該還是回到衛福部這邊，其實已經沒有跨部會溝通的問題了？,146,LCIDC01_1123101_00006
王婉諭,所以還是會回到衛福部裡面，到底我們什麼時候可以送出相關的草案？,147,LCIDC01_1123101_00006
王婉諭,我們還是希望能夠盡快，因為兩個月就有可能到這個會期還是送不進立法院，其實非常遺憾，我們還是希望提出來的承諾，我們應該具體來做的，大家一起積極來做，希望能夠在一個月內看到草案的出現，謝謝。,148,LCIDC01_1123101_00006
林為洲,（11時23分）我們今天開始要來處理癌症防治法相關的修法，我看了一下幾位委員所提的版本內容，主要是針對癌症藥物很貴，到底要如何才能讓癌症防治有效率，癌症藥物的使用當然就是很重要的一環，但是它又很貴，而且目前健保給付很少，把它納入健保給付的速度也很慢，所以就推不動，以致防治癌症的死亡率碰到瓶頸，因此有委員提案設置癌症新藥多元支持基金，這個目的是什麼？現在很多基金，到處有基金，要多設一個基金到底是什麼目的？,149,LCIDC01_1123101_00006
林為洲,這跟癌症治療有什麼關係？你說明一下，為什麼要設置這個基金？跟我們的癌症治療有什麼關係？,150,LCIDC01_1123101_00006
林為洲,它是一個要來做癌症研究的基金，還是什麼？目的是什麼？,151,LCIDC01_1123101_00006
林為洲,對，這個是重點。因為癌症藥物很貴，但是又沒有健保給付，所以要降低罹癌死亡率、要用這些好的藥物其實是很困難的。這些藥物都要自費，又非常昂貴，不是一般人負擔得起，整個療程的花費動不動就以百萬元來計。我們常常碰到周邊的朋友因為要使用新藥治療癌症而傾家蕩產，甚至借錢來醫療。所以設置這樣的多元支持基金，目的就是在癌症藥物還沒有辦法獲得健保給付，不是人人都可以用、負擔得起的時候，有另外一個管道可以協助他們做銜接。請問這個基金到底會不會設立？你現在有沒有把握會不會設立？,152,LCIDC01_1123101_00006
林為洲,財源？財源應該是最沒有問題的。,153,LCIDC01_1123101_00006
林為洲,政府很有錢。,154,LCIDC01_1123101_00006
林為洲,你們不會爭取啦！,155,LCIDC01_1123101_00006
林為洲,"對啦！我舉幾個例子給你聽。對我們政府來講，錢最不是問題。你知道8,800億元的前瞻計畫做了哪些東西嗎？人行道就做了6次，可以做6次！一直翻，一直做。大車站計畫不是蓋火車站，也不是整個拆掉重建或是蓋一個新的火車站，只是把它修改、修改，修改之後，火車也不會變得比較準時，你知道花多少錢？修繕一個小的火車站，要花100億元！就編了100億元。車站沒有拆，也沒有購地，就只是修改火車站，要花100億元，這就是我們的前瞻計畫。車站做好以後，會不會變得比較準時一點？不會，跟火車、跟臺鐵一點關係都沒有，這是地方在做的。蓋一個球場花了12億元，不能打球，我們的錢太多了。講到這個基金，第一個，什麼時候可以設立？你們的期程預計是什麼時候？",156,LCIDC01_1123101_00006
林為洲,"怎麼會這樣？你要先有一個目標。我再講一下，錢最不是問題，最近超徵的稅收不是要重新編列預算再分配給各部會去用？你看動不動就4,500億元又進來了，然後各部會趕快提計畫來用，這4,500億元除了給地方的700億元，還有3,800億元。最近我們在審預算，各部會提新的計畫，除了公務預算之外，還有多一些錢可以花用，一年又多出3,800億元，其中500億元要拿去補貼台電的虧損，一拿就是500億元，所以我說對於政府來講，錢都不是問題。如果要用到真正民眾有感的地方、可以幫民眾救命的地方，成立癌症多元支持基金可以救助所有癌症的病患，在他們沒有辦法用新藥、必須自費新藥的時候，由這個多元支持基金協助他們，誰會反對？所以錢最不是問題。第一個，你們自己要訂出期程，希望在什麼時候可以讓癌症新藥多元支持基金成立。你們的期程是預計什麼時候？順利的話。",157,LCIDC01_1123101_00006
林為洲,你連這個都講不出來，我們不知道要怎麼支持你。,158,LCIDC01_1123101_00006
林為洲,是今年還是明年希望基金可以成立？因為有基金的成立，才有辦法解決剛剛我們講到的問題，就是癌症新藥太貴，一般民眾用不起，但又是救命的錢、救命的藥，我們要用這個基金來處理。對於期程，你們總要訂一個希望的期程，我們立法院才有辦法來協助你們。預計順利的話，希望什麼時候可以成立這個基金？,159,LCIDC01_1123101_00006
林為洲,你看，連你們自己都沒有期程、沒有目標。其實立法院各位委員的版本我都有看過，我很支持成立癌症新藥多元支持基金，來銜接癌症新藥太貴、又沒有辦法健保給付的時候，協助他們渡過難關，請你們訂出希望的期程。第二個問題，你們希望基金規模有多大？你看，連「希望」都講不出來，我不知道我們要怎麼做。50億元還是100億元？剛剛不是有英國的例子？王婉諭委員都有提供例子給你們。英國的例子是多少億元？,160,LCIDC01_1123101_00006
林為洲,那就是大概一百多億元。你用規模來算，從英國的人口規模、他們的癌症病患每年大概有多少，我們可以算得出來差不多同樣水準的基金規模，大概多少？三分之一大概是四十、五十億元，朝最少要50億元的目標來努力。,161,LCIDC01_1123101_00006
林為洲,我知道、我瞭解。當然，要放多少資金要先估，50億元是基本的部分，其他才是每年的來源。連這個基金的基礎都沒有，那就都不用講了，所以第一筆基本的基金要有。請你們大膽地提出計畫、訂出目標，我們都會支持。這個是救命錢，比起那些不該做人行道卻去做人行道的工程，我們又要蓋新的高鐵站，又要蓋新的捷運，不知道能不能營運的捷運，比起這些動不動就幾百億元、500億元、800億元在花，成立一個50億元的基金，每個人、每個家庭可能將來都會用得到，因為現在癌症占據國人十大死亡因素的排行榜幾年了？超過十年了？,162,LCIDC01_1123101_00006
林為洲,四十年都是國人最大的死亡原因，意思就是每個家庭可能都用得到這個基金來治療將來罹患癌症的家人、國人，這個部分只需要50億，大新竹車站100億根本做不起來，也沒有辦法執行，如果100億拿來這邊用，我想大家都會支持，我是新竹人，我也支持。請你們訂出基金規模的目標、期程，讓我們先知道這個計畫，你光訂出這些目標、計畫到底要花多少時間？給你們一個禮拜，好不好？你們訂出一個目標，譬如希望什麼時候可以成立，預算規模大概多少，當然你還要做評估，我知道，你要評估多久？,163,LCIDC01_1123101_00006
林為洲,剛剛好像有講三個月內，我希望你們訂出一個比較明確的目標。,164,LCIDC01_1123101_00006
林為洲,你看這麼保守！各部會在爭取預算的時候，超徵稅收三千八百多億元，有的部會少、有的部會多，你要說服行政院，你在行政院要好好地講，這是委員會支持、立法院支持、國人都支持的計畫，請你們把握這樣的機會，謝謝。,165,LCIDC01_1123101_00006
