speaker,speech_text,speech_number,meeting_id
蘇巧慧,（9時18分）主席、各位列席官員、各位同仁。昨天全體國人都很高興，暌違36天以後我們終於出現零確診，陳時中部長也說，雖然我們還是不能掉以輕心，但這確實是一個小確幸。次長，本席想先問你，現在是脫下口罩的時候了嗎？,1,LCIDC01_1092801_00002
蘇巧慧,我看接著這幾天，一直到週末天氣都很好，現在是可以春遊踏青的時候嗎？,2,LCIDC01_1092801_00002
蘇巧慧,"還是要維持社交距離嘛！所以大家雖然很高興，疫情看起來好像趨緩，甚至昨天出現零確診了，但我想所有神經還是要緊繃住，就像衛福部、CDC一樣，全體國人還是要一起守住。當全體國人有這個決心守住的時候，從昨天到現在我們辦公室就一直接到電話，所以還是想再次詢問次長、衛福部，既然我們都守住了，你剛剛也說我們現在檢驗的量能已經增加到一天可以有3,800例，我們是不是就趁現在趕快做一次大普檢、大普篩，讓國人更安心，既然國家的量能這麼好都可以抓到病毒，趁現在有空了，我們趕快抓一抓，好不好？我們辦公室接到電話反映最多的就是要求普篩。",3,LCIDC01_1092801_00002
蘇巧慧,是啊。,4,LCIDC01_1092801_00002
蘇巧慧,現在是大海中可能……,5,LCIDC01_1092801_00002
蘇巧慧,反而降低他的警覺心？,6,LCIDC01_1092801_00002
蘇巧慧,從頭到尾經過兩個月也讓我們可以信任您堅持的方向，臺灣因為沒有大規模的社區感染，所以現在不需要進行民眾的一般性普篩，但昨天衛福部提出有可能會擴大高風險地區、高風險群體的篩檢量能。我們想知道所謂的「高風險」是指何者？衛福部所說的「可能會擴大」大概是從什麼時候開始？請簡要回答。,7,LCIDC01_1092801_00002
蘇巧慧,是，上一次我也特別跟你講，境外回來的有沒有機會做普篩？,8,LCIDC01_1092801_00002
蘇巧慧,好，我還是再次跟衛福部建議，本席至始至終都在講兩件事情。第一件事情是面對武漢肺炎，其中有兩點，第一點，我們要控制疫情；第二點，穩定民心。從口罩當時的生產來看，最開始口罩保護的並不是病毒的傳播，薄薄的一片口罩在最最開始的時候的保護作用是安定民心，現在普篩也已經有這麼一點味道了，所以我們到底要針對哪一些群體、什麼時候開始增加檢驗的量，衛福部真的要慎重考慮，也儘快讓國人知道這個方向，這是第一個部分，是針對確診跟普篩之間的關係，謝謝次長再次回答。另外，我想跟次長、衛福部做個討論，對於醫事人員的照護，上次全體衛環委員會所有委員，包括本席，對於3月20日公告「執行嚴重特殊傳染性肺炎醫療照護及防治發給補助津貼及獎勵要點」的部分，我們希望依據醫事人員實際執行業務的辛勞及風險程度，予以納入津貼、補助或獎勵對象，我想再次正式地詢問次長，上一次你們也說敬表支持，會參酌、討論、納入、改正等，請問現在進行到哪裡？什麼時候？誰會納入？,9,LCIDC01_1092801_00002
蘇巧慧,昨天公告，但還沒有上網，所以大家還看不到，包括我們，是因為這樣嗎？,10,LCIDC01_1092801_00002
蘇巧慧,都會納入，是津貼、補助、獎勵的哪一種？,11,LCIDC01_1092801_00002
蘇巧慧,但我們都已經明確地把這幾類相關的人納入，這些是列舉而不是例示的，對不對？,12,LCIDC01_1092801_00002
蘇巧慧,我們的提案也是一樣，是依據他有沒有實際參與、風險高低，希望衛福部斟酌考量納入並告訴社會大眾。這個部分已經公告了，今天可以放上網站嗎？,13,LCIDC01_1092801_00002
蘇巧慧,非常好，感謝衛福部。我們今天就要看看新的版本是不是更符合社會的需要，這是第一個照顧醫事人員的部分。第二個部分，我覺得衛福部疾管署也很冤枉，其實你們一開始分配給所有醫事人員的就是每天兩片口罩的量，從中央疾管署發給地方縣市政府的衛生局，然後再配到各縣市、地區的診所、院所，流程是這樣沒錯吧？,14,LCIDC01_1092801_00002
蘇巧慧,標準是每個醫事人員一天兩片嗎？,15,LCIDC01_1092801_00002
蘇巧慧,現在更高了。可是次長，我要告訴你，莊委員競程坐在這裡，我們有討論過，我們真的都接到陳情，你去調查一下，很多院所真的不是這樣，到現在還給他們1天1片，更不要說之前更為苛刻，這個流程到底是哪一個部分出了問題，是不是因為一開始是說醫院也要有戰備量等，我們不清楚，但現在都已經過2個多月了，還給他們一天1片，這個部分你們要去查一下，不然你們都不知道我們接到很多電話。,16,LCIDC01_1092801_00002
蘇巧慧,就是有！北部的也有，尤其是私立醫院，其實你也應該去調查一下中、南部的醫院，我們在此不直接說出名稱，但我們都接獲了具體個案，希望衛福部能夠去調查，照這個方向來保護醫事人員，可以嘛！,17,LCIDC01_1092801_00002
蘇巧慧,我們今天都有共同提出臨時提案，希望衛福部做到這一點。第三個部分，你們對於醫事人員的保護還有一個很好的照護方案，你在3月31日提到醫療照護工作人員COVID-19擴大採檢及個案處理流程，醫院裡面如果有人生病、有點症狀了，就算不符合武漢肺炎的採檢流程，但因為是醫療院所，我們也特別讓他們可以擴大採檢對嗎？沒有問題吧？,18,LCIDC01_1092801_00002
蘇巧慧,可是一採到二採之間其實有一個時間差，所以衛福部甚至還要求我們對醫事人員是有薪假，對嗎？,19,LCIDC01_1092801_00002
蘇巧慧,從剛剛的口罩片數一直到現在的擴大採檢，甚至要求給予有薪假，其實你們都有做到，都有替醫事人員想到，沒有錯！但實際上我也要再跟你說，就像剛剛的口罩片數一樣，有薪假的部分也沒有全面落實，我們都有接獲個案，立法委員存在的目的大概就是要設辦公室專線讓人家打進來陳情。,20,LCIDC01_1092801_00002
蘇巧慧,真的！如果你要知道這個個案，我等一下也可以提供給你，但我還是希望衛福部站在主管機關的立場去普查一下，不要上有政策，下有對策。,21,LCIDC01_1092801_00002
蘇巧慧,我現在跟你講的正是一採跟二採之間至少也有24小時時間差，甚至是3天到5天。隨著我們的技術而有不一樣的狀況；但anyway，反正這個空窗期也應該屬於你要給他有薪假的一部分嘛！但事實上有的狀況就不是這樣啊！,22,LCIDC01_1092801_00002
蘇巧慧,連大醫院還不知道，我覺得這實在有點太離譜了。,23,LCIDC01_1092801_00002
蘇巧慧,我認為你要了解，才能讓衛福部的美意貫徹最底層、最為大家打拼的基層醫事人員。我今天問題先到這裡，我們等一下的臨提也麻煩衛福部可以支持，你們就是去進行普查啦！謝謝次長。,24,LCIDC01_1092801_00002
洪申翰,（9時29分）主席、各位列席官員、各位同仁。最近陳副總統在自己的臉書頁面上做了很多關於防疫科普的教育跟評論，其實滿受到好評的。我有很多朋友都是透過陳副總統的臉書進一步地學習跟防疫有關的知識，不過最近有一個新加坡的媒體特別寫了一篇文章點名陳副總統做批評，原因是陳副總統說WHO的秘書長譚德塞成事不足、敗事有餘，次長知道這件事情嗎？,25,LCIDC01_1092801_00002
洪申翰,我依時間的序列列出來，我們看一下副總統到底有沒有冤枉譚德塞。在1月的時候，中國在訓誡公開疫情的李文亮醫師，隨後就發生武漢封城的事件，結果當時譚德塞秘書長反對各國對中國進行旅遊跟貿易的限制；後來中國明明已經有7萬多快8萬的確診病例，譚德塞卻說中國疫情持續在減少，還沒有擴大；之後全球確診人數到9萬多例時，WHO又說全球尚未開始大流行。所以很清楚，他當然沒有讓世人提高警覺啊！我們從這張表看得出來，副總統並沒有冤枉他，我們也沒有冤枉他。但後來最糟糕的事情是譚德塞作為一個國際公衛專業組織的負責人，面對專業上的批評，他沒有辦法拿出專業來回應，就只能轉移焦點說臺灣用種族問題批評他，我覺得這是非常糟糕的事情。我們今天為什麼把譚德塞跟WHO再拿出來講，因為這段時間我們遇到滿多媒體，包括國外的媒體，他們說我們目前防疫的成果不差，是不是因為我們沒有照著WHO給的這些建議在做，我們憑藉自身在科學上面的瞭解跟經驗來進行相關的措施，相比其他國家，目前我們的成果可能是比其他國家好一些。我想請教衛福部，針對這些媒體這樣的看法，你有什麼看法？,26,LCIDC01_1092801_00002
洪申翰,是。,27,LCIDC01_1092801_00002
洪申翰,是。,28,LCIDC01_1092801_00002
洪申翰,我剛才說很多國外的媒體報導，臺灣現在之所以做的比別的國家的好……,29,LCIDC01_1092801_00002
洪申翰,是。,30,LCIDC01_1092801_00002
洪申翰,目前看起來是更超前。,31,LCIDC01_1092801_00002
洪申翰,今天早上，當然很多媒體都看到最新的新聞，美國宣布了接下來要停止給WHO相關的贊助，過去我們其實一直都很希望能參加WHO，也希望加入WHA大會，可是這段時間下來，恐怕國際上公衛的資源網絡會出現一些變化，包括像今天美國這樣的宣布，接下來，衛福部對於WHO和WHA的政策或者是期望，有沒有替代的方案或是應變的做法？,32,LCIDC01_1092801_00002
洪申翰,是。,33,LCIDC01_1092801_00002
洪申翰,好，我可以理解次長說的這個部分，可能涉及到一些外交的部分。下一個問題，我比較想跟次長討論，關於一些急難紓困的問題，這個社會上其實有一群很基層的朋友，比方他在車流中賣玉蘭花、他受僱於房地產公司在發傳單、甚至在街頭當人形廣告，雖然他們這些人看起來有份工作，但通常是很不穩定的，非正式的聘僱，甚至沒有勞保且是按件計酬、按時計酬的工作。次長，你應該可以理解這些人工作的狀態吧？,34,LCIDC01_1092801_00002
洪申翰,我們辦公室有收到一些團體的相關陳情跟討論，因為疫情的關係，所以現在大家都不太敢再開窗買玉蘭花，甚至像發傳單這些業務也嚴重縮減或是裁撤，所以這些最弱勢的基層朋友們，有非常多人的收入可能突然大幅銳減或是失業，以致家庭都陷入很困頓的狀況。次長，我想問一下，他的這種狀況是否符合衛福部為了強化社會安全網設計的急難紓困方案要求的要件？就是遇到重大變故，導致生活陷入困頓。,35,LCIDC01_1092801_00002
洪申翰,是。,36,LCIDC01_1092801_00002
洪申翰,我們跟勞動部確認，他們基本上是比較針對有勞保的勞工，所以上面提到的這些群體，依他們的工作類型，有非常、非常大的機率是沒有勞保的一群勞工，很可能不是其他部會可以協助的對象，所以我們和一些專家討論，基本上都認為這些弱勢的基層由於突然的變故，確實應該要依剛剛提到的急難紓困方式先行處理，先把他們放到社會福利的體系裡面處理，後續也許再請勞動部來協助他們就業的問題。可是，本席現在要說，當這些基層朋友遇到這些變故而有困難，他必須去公所申請急難紓困時，我們發現有幾件事情，直轄市急難紓困方案要求的相關應備文件大多要求要提出非自願的失業證明，這時候就出現了問題，這些很弱勢的基層勞工，其實他們要拿出這些所謂非自願性的失業證明是非常、非常困難，他們又沒勞保可以申請請勞動部相關的補助方案。所以我這邊想要問的事情是，他們明明就是衛福部原本規劃要幫助的對象，可是卻因為這些行政程序而卡關，很多地方政府可能都是依據衛福部的指引要求來訂定應備文件，所以我們有沒有可能可以開一扇程序的門，讓地方的基層的公務員適程序時能夠顧及這些最脆弱的底層勞工的？狀態包括剛才說的從寬認定，可是如何從寬的方法，衛福部可以幫這些基層公務員擬訂得更清楚，讓他們有可以遵循的方式。,37,LCIDC01_1092801_00002
洪申翰,針對這個部分的方法，我們剛才說開一扇程序上的門，可不可以請衛福部大概在1個禮拜內到我們辦公室討論一下，報告你們所想出來的辦法是什麼？,38,LCIDC01_1092801_00002
洪申翰,是，好不好？,39,LCIDC01_1092801_00002
洪申翰,針對這個方案，讓我們知道到底是怎麼樣的做法。最後，還是請次長多多體諒他們的處境，也替他們著想，不要讓這些弱勢被遺忘，我相信這大概是政府存在的最大目的。,40,LCIDC01_1092801_00002
洪申翰,是，謝謝。,41,LCIDC01_1092801_00002
吳斯懷,（9時40分）主席、各位列席官員、各位同仁。次長，辛苦了。首先，我想問的剛才蘇委員也問到了，有關醫事人員的津貼或者直接跟第一線有關的，除了醫跟護、X光檢驗師、清潔人員等這些人員的獎勵辦法，我知道衛福部已經在修正相關獎勵辦法，我想請問一個確認的時間，什麼時候可以完成？,42,LCIDC01_1092801_00002
吳斯懷,好，謝謝大家的辛苦。第二個問題，我今天本來預期如果陳時中部長、陳指揮官有來，我要問他一個整體性的問題，現在陳部長非常的辛苦，是一級開設防疫中心的指揮官，我想針對防疫中心做一個整體性的質詢，請次長回去轉告。,43,LCIDC01_1092801_00002
吳斯懷,"第一個問題，現在口罩的產能是足夠的，而且從這個禮拜起超商都開始配發，我們有能力做援外1,000萬個口罩，後續南向地區的國家以100萬、100萬的數量往外援贈，成功地讓臺灣成為一個亮點。但我要問的是，既然我們產能夠，有能力做口罩外交，就要滿足國內的需求，第一個是國軍，原來披露分配給國軍的口罩是1.7萬片，大家都在質詢中指出這對國軍是不公平的，然後很快就調整為4.75萬片，我要問的是18萬國軍到底需不需要每天每人配發一片，我們看看美軍，4艘航母有人感染，影響整個亞太地區的戰力，至少形成一個月的間隙，這一點我等一下會回外交及國防委員會質詢國防部，我只想從國家安全的角度來看這件事，什麼時候可以讓國軍供需平衡？現在有這個產能，為什麼不做這件事？這是第一個問題。第二個問題，可不可以跟內政部協調？你是防疫中心指揮官，就要做整合。警消現在的防護能量，每天配發的口罩數量符不符合他們的需求？根據我們目前所掌握的資料，還是有很多地區值勤的警消人員沒有足夠的口罩，尤其是今天新聞披露新北市長準備做封城演練，在做兵棋推演，第一線值勤的人是誰？警消人員。他們的口罩夠不夠？目前配發的數量相關數據，是不是可以儘快提供本席辦公室？我們要比照和追蹤。這是第二個問題。第三個問題，上禮拜一本席在這裡提出，請衛福部和教育部站在防疫指揮中心的高度來協調，既然我們產能夠，教育部所有學級老師學生的資料電子檔都沒有問題，在網路操作上不是問題，現在網路買口罩我都會操作，如果衛福部和教育部能夠把資料電子檔整合起來，就不要讓學生放學以後還要去排隊買口罩，針對高中以下的學生來做這件事，就可以減少學生到藥局排隊買口罩、減少爺爺奶奶帶孩子到藥局排隊買口罩、減輕App爆量的問題，這些都可以減輕，為什麼不做？從我上禮拜質詢到現在，媒體也刊登過新聞，衛福部要給我一個具體的回答，有沒有在推動這件事？請陳時中指揮官站在這個高度，跟教育部給我一個回應，否則你們怎麼對人民負責？這三個問題，請簡短回答我一下。",44,LCIDC01_1092801_00002
吳斯懷,已經開始實施了嗎？,45,LCIDC01_1092801_00002
吳斯懷,什麼時候開始？請給我一個具體的書面資料，好不好？,46,LCIDC01_1092801_00002
吳斯懷,我的辦公室接到很多電話，上個禮拜一我提出來之後，有很多學校家長會長打電話來我辦公室，說委員提的這個建議很好，問題是他們沒有接到這個訊息，譬如說，某某國小由校務人員集中全校的資料，就可以直接跟地方衛生單位申購，繳完錢就可以拿回來，這也是實名制，因為教育部有所有老師和學生的資料，在網路操作上一點都不困難。我希望兩個部會給本席一個具體的答案，好讓人民放心，讓學生放心，讓家長放心。什麼時候能夠給我一個具體的回應？,47,LCIDC01_1092801_00002
吳斯懷,大概什麼時候可以給我一個回應？因為學生和家長非常關心這個問題，你們給我一個時間。,48,LCIDC01_1092801_00002
吳斯懷,好。下禮拜以前，媒體都記得了，希望這個問題能夠解決，既然量能夠，網路也沒有問題，為什麼不做？做了以後，讓這些孩子多安心，家長多放心，藥局負擔減少一大半，為什麼不做？,49,LCIDC01_1092801_00002
吳斯懷,好，謝謝，希望大家扮演好政府解決問題的角色，而不是應付，其實對立法委員負責是一個重點，真正要做的是對人民負責，看看媒體的報導，就知道人民現在很辛苦。我的辦公室還接到很多回應，我們現在大數據的分析能量是很強的，但是我自己上網去查，發現有很多分配不公的情形，都會區的藥局有很多人排隊排半天也買不到口罩，花蓮、宜蘭、鄉村地區人少，人口不是那麼密集，口罩多出來很多，宏觀調控應該要更落實，這種情形在網路上都看得到，請你們站在公部門為民服務的立場，好好調控，適時公布，否則會用app的民眾上網買口罩沒有問題，中老年人不會用網路，他們怎麼去查到哪裡排隊才可以買得到？最後一點時間，我想問一下，WHO針對臺灣回應了13點，說數十年來跟臺灣都有技術性的交流，交換資訊。媒體也報導，臺灣駐日內瓦辦事處表示，那是片面的、不完整的資料。我想請衛福部在下午的記者會中，正確、明確地告訴國人，我們這幾十年到底跟WHO有沒有做技術性的資訊交流，做了哪些技術性的資訊交流，讓國人釋疑，也讓WHO說正確的話。站在政府的立場，你們應該要做到這一步，可不可以下午一起公告？,50,LCIDC01_1092801_00002
吳斯懷,好，我希望下午能夠正式地跟國人公告。謝謝次長。,51,LCIDC01_1092801_00002
劉建國,（9時50分）主席、各位列席官員、各位同仁。謝謝主席，今天排的議題非常重要，一個是武漢肺炎對健保體系的影響和如何因應，一個是疫情對國人的心理影響與如何促進心理健康及因應策略，這絕對很重要，次長，我在3月18日就特別請教你，也拜託你回去趕快訂公務機關上下班的分流指引，到今天已經過了半個多月，我的心理有點受創，這是第一點。第二點，你要不要趁這個機會回應一下？今天聯合報報導，中華民國防疫學會榮譽理事長王理事長說臺灣防疫是佛系奇葩，針對這一點，你要不要簡單回應一下？什麼理由？因為我要等你回應，後面我有幾個問題要就教於你。,52,LCIDC01_1092801_00002
劉建國,當然。,53,LCIDC01_1092801_00002
劉建國,照次長的回應，外界感覺我們的防疫是比較軟一點，但是我們是急劇地降低對人民的干擾。,54,LCIDC01_1092801_00002
劉建國,所以次長是這樣來回應。,55,LCIDC01_1092801_00002
劉建國,那我就要請教幾個問題。第一個問題，疫情指揮中心都有公布，確診病患一個人的健保支出好像是兩百多萬元，如果是普篩結果為陰性的人，一個人是多少錢？,56,LCIDC01_1092801_00002
劉建國,要降低感染的機率，指揮中心有沒有想過要用普篩的方式去處理？,57,LCIDC01_1092801_00002
劉建國,所以簡單講，疫情指揮中心目前的評估就是並不需要普篩？,58,LCIDC01_1092801_00002
劉建國,我們沒有大量的社區感染？那我簡單問一下，我們是超前部署嘛？,59,LCIDC01_1092801_00002
劉建國,那麼指揮中心有沒有針對未來的社區防疫有一個全國性的超前規劃？這個規劃出來了沒有？,60,LCIDC01_1092801_00002
劉建國,初步的規劃都已經有了？,61,LCIDC01_1092801_00002
劉建國,上下班分流呢？,62,LCIDC01_1092801_00002
劉建國,依你掌握的狀況，在二十幾個部分中，有幾個部會有在推動？,63,LCIDC01_1092801_00002
劉建國,內政部，就一個？,64,LCIDC01_1092801_00002
劉建國,沒關係，越多當然是越好，降低感染機會。第二，安養院等長照機構的感染防治訓練有沒有落實？,65,LCIDC01_1092801_00002
劉建國,這又牽涉到長照與其他人口密集的機構一旦發生武漢肺炎群聚感染時有沒有疏散分流計畫的問題。,66,LCIDC01_1092801_00002
劉建國,都有？,67,LCIDC01_1092801_00002
劉建國,有沒有針對不同層級醫院間的雙向轉診來管控？,68,LCIDC01_1092801_00002
劉建國,都有？,69,LCIDC01_1092801_00002
劉建國,報告裡有嗎？,70,LCIDC01_1092801_00002
劉建國,我看了好像不是很精細。,71,LCIDC01_1092801_00002
劉建國,請次長把這些相關資料給我，我看一看之後覺得不是很清楚，所以我再度提醒，從3月18日一直提醒到現在。,72,LCIDC01_1092801_00002
劉建國,我再提一個比較重點性的問題，大家都知道，疫情剛開始時對我們臺灣威脅最嚴重的國家是哪一個國家？,73,LCIDC01_1092801_00002
劉建國,好。當時我們對中國有接國人回來的武漢包機，鑽石公主號也有橫濱模式，當時我們對中國是這樣處置，現在有國人從海外回來，對我們威脅最大的是哪一個國家？,74,LCIDC01_1092801_00002
劉建國,從美國回來的確診人數是多少？91個。現在確診總人數是多少？,75,LCIDC01_1092801_00002
劉建國,美國回來的已經占了四分之一強，高達25%。,76,LCIDC01_1092801_00002
劉建國,為什麼可以有武漢包機，可以針對鑽石公主號訂出橫濱模式，為什麼對美國回來的人沒有辦法這樣處理？我有點不清楚。,77,LCIDC01_1092801_00002
劉建國,那我可能就要細究了，從美國回來的91例確診病患，到底從哪一州回來的比例最高？,78,LCIDC01_1092801_00002
劉建國,對嘛，是紐約，到目前為止，紐約已經有十三萬多人確診，那我們要不要採包機的方式，把紐約的國人接回來？之前為什麼不做？未來要不要做？,79,LCIDC01_1092801_00002
劉建國,怎麼說？你說武漢是一個城市，紐約也是一個城市。,80,LCIDC01_1092801_00002
劉建國,我為什麼會這麼講？因為我有根據和理由。案384、案393在返國前就已經出現症狀，強行抱病返鄉，案209自美國返臺之後，在居家檢疫過程中因體溫過高，帶著媳婦和孫子違規外出搭計程車就醫，且該名婦人的丈夫也確診，就是案246，也就是說，居家檢疫期間自行外出，造成防疫有某種程度的破口，這是不容爭論的。我們知道，海外歸來的國民當然有返鄉就醫的權利，我們政府沒有理由拒絕，這個我們之前都有討論過了，但是我們能不能做更專業、更合理的安排？我們知道紐約確診人數已經高達13萬，對於從紐約回來的國人，為什麼不能比照武漢包機或鑽石公主號的處理方式？這是會被挑戰的問題。,81,LCIDC01_1092801_00002
劉建國,次長，我不曉得疫情指揮中心到底如何去評估，既然要超前部署，從過去的武漢包機和鑽石公主號的處理過程，我方都準備了將近一個多月，甚至於上飛機後要穿隔離衣，要做隔離，一大堆事情我們都可以做得到，非常慎重和嚴謹，但是當我們知道美國紐約疫情爆發，確診人數暴增，我們怎麼會沒有去做這樣的處置？我不曉得有什麼難言之隱，但是我覺得應該要跟國人說明清楚，畢竟發生這麼多案例，大家會擔心。,82,LCIDC01_1092801_00002
劉建國,我當然也有看到歐洲回來的人到防疫旅館去，這算是有進步一點點，但是如果可以集中做防疫，就不會有人再趴趴走，還帶媳婦、孫子去看診，產生更高的感染風險。,83,LCIDC01_1092801_00002
劉建國,好，謝謝次長。,84,LCIDC01_1092801_00002
