speaker,speech_text,speech_number,meeting_id
張育美,所以我建議，對居家檢疫應該從一入境就開始，為什麼呢？我再舉一個例子，你知道第343的例子，他沒有出國史，她的老公3月17日回來，她老公沒有經過入境的篩檢，所以他的太太不知道，可是最近檢查她確診，她去過很多地方看三、四家診所，也去菜市場買菜，你不覺得這是潛在的風險嗎？,92,LCIDC01_1092101_00006
張育美,好，謝謝次長！我知道你有補強啦！我還是覺得疫情變化萬千、科技日益進步，我們國衛院的快篩要出來了，我請問次長，會不會考慮在快篩成熟後搭配X-ray診斷雙重的確定，讓入境的進行普篩呢？,93,LCIDC01_1092101_00006
張育美,雙重搭配？,94,LCIDC01_1092101_00006
張育美,我是說國衛院的快篩試劑，加上X-ray雙重的檢查，對入境者檢查是雙重的檢查。,95,LCIDC01_1092101_00006
張育美,好，謝謝你！其實疫情指揮中心有你們的專業，我是提出我的意見交流，OK，謝謝！,96,LCIDC01_1092101_00006
陳瑩,（11時13分）主席、各位列席官員、各位同仁。我想先請教次長，今天各位委員在這邊質詢、建議的事項都會如實反映到疫情指揮中心那裡去嗎？,97,LCIDC01_1092101_00006
陳瑩,因為有兩件事我還沒有得到太具體的回應，一個已經過去了，一個當然就是之前環保署那個事情，雖然我沒有點名哪個部會，但是你們也沒有很警覺地要趕快去查一下，也沒有私下來問我說我是在講哪裡。那一天我剛好應該是質詢你，不是另外一位次長，是你沒錯啦！,98,LCIDC01_1092101_00006
陳瑩,對，但是我說衛環的部會。,99,LCIDC01_1092101_00006
陳瑩,是薛次長嗎？,100,LCIDC01_1092101_00006
陳瑩,不好意思，因為現在大家都蒙著嘴巴。另外一件事應該也不是你，是另外一位次長，我就印象很深刻了，就是有關於檢驗所的問題，我不曉得如果快篩已經研發成功，量產的時候，接下來檢驗所目前也只有30家，是30家沒有錯？,101,LCIDC01_1092101_00006
陳瑩,你可以告訴我哪些縣市沒有嗎？,102,LCIDC01_1092101_00006
陳瑩,我知道，但是有路途上的問題。,103,LCIDC01_1092101_00006
陳瑩,對啊！你也知道我臺東人，我一定會關心臺東的問題，我剛剛問你哪幾個縣市沒有檢驗所？你不知道？,104,LCIDC01_1092101_00006
陳瑩,我們都在跟時間賽跑，我已經講了，沒有關係，我今天在這裡再講一次，我不管在質詢台上，或私底下打電話，這個問題我講很多次！澎湖有檢驗所嗎？因為楊曜委員在這邊，我看到他想到澎湖。如果你們認為是沒有必要的，那你就跟我們講沒有必要，我們就不用每天擔心這個問題，我們只是覺得澎湖、臺東會不會檢驗出來的時間就比較慢？,105,LCIDC01_1092101_00006
陳瑩,這個我都理解，我只是問你這樣子的分配夠不夠、合不合理？OK不OK？如果都沒有關係，你就跟大家講，說臺東沒有沒有關係，澎湖沒有沒有關係。,106,LCIDC01_1092101_00006
陳瑩,我講這個事情講了很久，你們從來沒有認真的回覆我嘛！你要認真去考慮這個事情，因為現在大家對於疫情的回應都很快，這件事情你們要怎麼做、怎麼去補強，我希望你們可以立即回覆本席以及楊曜委員。,107,LCIDC01_1092101_00006
陳瑩,我跟各位分享連假這幾天我觀察到的一個狀況，其實還值得滿慶幸的，這個連假很多餐廳的生意有真的變好了，有幾家平常就很多客人了，當然這個連假也不例外，也是非常多客人，但是我發現這餐廳還滿大的，從廚師到服務人員沒有一個人戴口罩耶！還包括一些攤販等等也是很多沒有戴口罩，這個部分我們需不需要比照搭乘大眾運輸交通工具時戴口罩呢？你的看法如何？,108,LCIDC01_1092101_00006
陳瑩,不好意思，我去的是一家滿大的餐廳，是在室內的，它不是夜市。,109,LCIDC01_1092101_00006
陳瑩,已經納進來了嗎？,110,LCIDC01_1092101_00006
陳瑩,新的指引你什麼時候會公布？,111,LCIDC01_1092101_00006
陳瑩,因為連假已經很多人去消費了，應該是要在連假前就做這樣的處置喔！再來，有關於電鍋蒸口罩的問題，因為現在的電鍋很多是新型的，它沒有辦法乾蒸，如果裡面沒有水，它就會跳上來，這是一個問題，我是反映給大家。再來就是，本席想幫很多人請教，我們的口罩是不是也可以放在紫外線下面消毒？用紫外線燈管照射的話，大概要照多久？,112,LCIDC01_1092101_00006
陳瑩,現在有很多周邊產品，而且全都冠上可以殺冠狀病毒之名。因為產品很多，衛福部可以適時讓大家了解一下，對於想省著用口罩的人來說，舊型電鍋不太好找，那麼，除了新型電鍋以外，還有什麼其他方式。再來，我要反映目前口罩的品質問題。有一些民眾透過臉書留言向我反映，他的口罩同樣是到藥局領取的，但拿回來之後，用了沒幾次，鬆緊帶就斷了。這部分應該事關約定廠商，請衛福部特別嚴格控管。,113,LCIDC01_1092101_00006
陳瑩,關於瑕疵品，我想，民眾也沒有這樣的訊息，不知道口罩拉沒幾次就壞掉算是瑕疵品，希望你們也能同步公布這類訊息。另外，目前居家檢疫人數有多少？,114,LCIDC01_1092101_00006
陳瑩,集中檢疫場所有幾個？總共有幾個房間？,115,LCIDC01_1092101_00006
陳瑩,現在剩下幾床？,116,LCIDC01_1092101_00006
陳瑩,"我想提出一個概念，因為剛才你在回覆張委員育美時講得不很清楚。1,000元是補助給居家檢疫民眾嗎？",117,LCIDC01_1092101_00006
陳瑩,"我不是要與你討論1,000元的事，而是剛才有三位委員提到，現在連同自主管理或居家檢疫在內，人數其實相當多，如果居家檢疫與居家隔離者全都要送到集中檢疫所，其實房間數與床位數是不夠的。",118,LCIDC01_1092101_00006
陳瑩,對，但未來防疫旅館可能也無法容納所有人，所以我再提供你一個選擇，請你參考一下。當這些防疫旅館無法再容納這麼多人時，既然一般人平常可以住宿一般旅館，那麼，對於家中有居家檢疫中成員，又無法住進防疫旅館的民眾，你們是否可以比照臺北市，讓這些不想與家人接觸、沒有狀況、健康的家人到一般旅館入住，政府也補助這些想到外面避一下的民眾？,119,LCIDC01_1092101_00006
陳瑩,是。,120,LCIDC01_1092101_00006
陳瑩,什麼稽？,121,LCIDC01_1092101_00006
陳瑩,你們大概需要多少時間研究這個問題？,122,LCIDC01_1092101_00006
陳瑩,我可以理解，但也許可以雙管齊下。請你們評估之後，再給本席答復，好不好？,123,LCIDC01_1092101_00006
陳瑩,當然不一樣，所以你們要計算、評估，因為嚴格來講，要是居家檢疫者真的都入住，防疫旅館是不夠的，我只是做出這樣的提醒。,124,LCIDC01_1092101_00006
陳瑩,連假才剛結束，雖然我們都很努力，但誰知道兩個禮拜以後會怎麼樣？,125,LCIDC01_1092101_00006
陳瑩,我都明白，我也只是提出這樣的建議，你何必一直抗拒？我只是要求研議啊！,126,LCIDC01_1092101_00006
陳瑩,那就麻煩一下。我也要提醒衛福部一項我在3月26日就做出的要求，由於居家隔離、居家檢疫、防疫人員等對象在防疫期間都不能外出，也要盡量少與人群接觸，對心理的影響層面很大，但是，在他們收到的通知書裡，並沒有特別宣導心理輔導部分，「1925」專線通知單上也沒寫，針對這個部分，請你們補強。,127,LCIDC01_1092101_00006
楊曜,（11時27分）主席、各位列席官員、各位同仁。請問衛福部何次長，臺灣藥品中，目前大概有幾成可以自主供應？,128,LCIDC01_1092101_00006
楊曜,健保用藥有百分之七、八十是所有原料都可以由臺灣自主供應？,129,LCIDC01_1092101_00006
楊曜,現在中國廠停工，那麼，中國占的比例大概是多少？,130,LCIDC01_1092101_00006
楊曜,十幾個百分點？,131,LCIDC01_1092101_00006
楊曜,40%？那我們自己可以製造七、八成，合起來達到120%了。,132,LCIDC01_1092101_00006
楊曜,對，我剛才問的也是原料藥。,133,LCIDC01_1092101_00006
楊曜,對。現在中國停工，那我國原料藥中有多少是從中國進口？,134,LCIDC01_1092101_00006
楊曜,40%至60%？所以，中國這樣停工，是否對臺灣藥物供應造成影響？,135,LCIDC01_1092101_00006
楊曜,"可是根據我手上的資料，3月份藥品缺貨通報超過1,000件。雖然其中重複通報、也就是同類藥品的缺貨通報比例也非常高，但這就表示確實有短缺現象啊！",136,LCIDC01_1092101_00006
楊曜,如果像次長剛才講的，有人囤積奎寧這類藥物，那是誰會囤積？,137,LCIDC01_1092101_00006
楊曜,所以，你現在也不知道有無囤積現象？,138,LCIDC01_1092101_00006
楊曜,好，這點要很密切地注意，萬一社區藥局缺藥，大家就會不得已轉往大醫院，而大醫院的感染風險相對高。,139,LCIDC01_1092101_00006
楊曜,對。一般來說，以部立醫院來講，如果單純為了領藥，是否還是要到醫院領？有沒有可能分流？,140,LCIDC01_1092101_00006
楊曜,對，這點也要密切注意，而且要很迅速地反應。畢竟，若是單純為了領藥前往大醫院，反而造成感染就不好。,141,LCIDC01_1092101_00006
楊曜,對。請教次長，剛才陳委員提到了，我也要向次長說明一項事實。衛環委員會除了不分區立委以外，多數區域立委其實都來自離島與偏鄉。這絕對不是因為離島與偏鄉在勞動或環保方面有特別的問題，我認為多數委員是針對醫療分配不均情況，才會選擇來衛環委員會。所以，衛福部必須想辦法把資源分配得平均一點。雖然，要做到完全平均，短期之內不可能完成，可是，你們必須盡可能讓離島偏鄉資源分配平均。我這樣問好了，離島與偏鄉的醫療資源相對不足，萬一爆發社區感染，有重症病患需要後送，衛福部是否有防疫期間的後送SOP？,142,LCIDC01_1092101_00006
楊曜,沒有錯，但問題是「萬一必須」，因為病患有可能感染武漢肺炎，又加上其他疾病。,143,LCIDC01_1092101_00006
楊曜,與一般情況一樣嗎？,144,LCIDC01_1092101_00006
楊曜,運送還是一樣？也就是該用軍機就用軍機，該用直升機就用直升機？,145,LCIDC01_1092101_00006
楊曜,好。假如離島真的爆發社區型感染，衛福部到時還是必須有相對應的醫護人力支援。,146,LCIDC01_1092101_00006
楊曜,好。請教交通部祁次長，交通部規劃在9月提出觀光振興方案，是否代表從這段時間到9月，交通部大概都是先紓困，再做振興？,147,LCIDC01_1092101_00006
楊曜,196.67億元與472億多元都是振興部分，還是紓困含振興？,148,LCIDC01_1092101_00006
楊曜,經費增加是因為疫情對經濟的影響、特別是對觀光業的衝擊比我們一開始的想像嚴重很多。,149,LCIDC01_1092101_00006
楊曜,好。我要再講一句話。紓困也好、振興也好，都會隨著疫情發展隨時變動，所以行政部門必須做的因應還是要快速。,150,LCIDC01_1092101_00006
楊曜,唯一比較不會改變的就是離島產業受到的衝擊一定比臺灣本島嚴重得多，所以，關於離島振興，請次長回去研究。光是這次清明連假，全臺遊樂區大概都擠爆了人，可是，離島大概就比較沒人去，因為必須搭飛機的關係。,151,LCIDC01_1092101_00006
楊曜,請次長回去之後，一定要把這一點列入，列為很重要的一項思考，好不好？,152,LCIDC01_1092101_00006
林德福,（11時38分）主席、各位列席官員、各位同仁。最近居家檢疫人數可說爆量，講實在話，第一線負責追蹤管理人員的壓力也大到破表，其中最辛苦的當然就是里長、里幹事，尤其有幾個里，光是居家檢疫的就超過百人，打關懷電話、送物資等工作就讓他們忙翻了；如果有突發狀況，還要馬上處理，幾乎24小時都在待命。請教內政部民政司林司長，這些里幹事、里長是否另外有津貼？,153,LCIDC01_1092101_00006
林德福,但最起碼要很明確，哪時能夠核定？,154,LCIDC01_1092101_00006
林德福,還在報院？第一期不是通過了600億元預算嗎？,155,LCIDC01_1092101_00006
林德福,那是杯水車薪。,156,LCIDC01_1092101_00006
林德福,你們是否規劃在未來投入人力協助？,157,LCIDC01_1092101_00006
林德福,里長和里幹事還有很多業務，總不能讓他們業務做半套，這也不是好事。,158,LCIDC01_1092101_00006
林德福,要是真的沒有其他人力可以協助，是否可以參考臺鐵防疫天使概念，聘僱相關人力，由既熟悉社區，也具醫護背景的人優先，透過訓練，成立防疫輔導團，讓民政、警政與衛生單位減輕人力負擔？,159,LCIDC01_1092101_00006
林德福,好。我要請教衛福部何次長，其實，媒體社論也一直提倡，這段時間，從歐美等地回國者很多，社區也有很多本土案例被一個一個凸顯出來，其實，這就是一個破口，因為這些人入境之後，你們沒有執行比較嚴謹的處置方式，導致本土案例相繼出現，而且找不到感染源，這些都是很嚴重的問題，將來會不會成為破口？,160,LCIDC01_1092101_00006
林德福,次長，之前傳出國外留學生回臺之後，在居家檢疫期間遭到管委會為難的狀況。本席認為，在居家隔離、檢疫者愈來愈多的情況下，管委會與社區保全人員應該是管理與協助生活起居的好幫手，怎麼反而發生這種歧視狀況？,161,LCIDC01_1092101_00006
林德福,對啊！是不是內政部對社區中這些居家隔離、檢疫者缺乏明確指引，才讓管委會手足無措？本席認為，內政部應好好利用管委會，追蹤這些管理系統，針對有居家隔離、檢疫住戶的社區給予明確管理準備指引，如此才能減少歧視，也更有方向，才能更有秩序地讓社區內住戶相互協助。,162,LCIDC01_1092101_00006
林德福,好，我希望你們把這些該做的工作做好。若居家檢疫者平時有慢性病用藥需求，又剛好在隔離期間必須回到門診，重開新的處方箋，應該如何維持民眾用藥不中斷？,163,LCIDC01_1092101_00006
林德福,有這樣的方式？,164,LCIDC01_1092101_00006
林德福,我認為需要宣導，因為據本席所知，過去，遠距醫療比較常使用在偏鄉院所，由醫師即時給予診療上的建議。目前遠距醫療的普及狀況如何？,165,LCIDC01_1092101_00006
林德福,針對這些有遠距醫療需求的居家檢疫者，服務模式如何執行？,166,LCIDC01_1092101_00006
林德福,有些年長者未與子女同住，又不會使用電腦，像這種狀況要怎麼辦？,167,LCIDC01_1092101_00006
林德福,我仍認為應該多宣導。,168,LCIDC01_1092101_00006
林淑芬,（在席位上）是我的提案？,169,LCIDC01_1092101_00006
林淑芬,主席、各位列席官員、各位同仁。我加兩句話，在第3行在「內政部」之後加上「依社區防疫人力指引」，因為它的法源就是這項指引。另第5行「盤點……公寓大廈管理委員會等人力」之後應加上「成立社區防疫團隊」這幾個字。我之所以不用「研議提供」，是因為提案就是根據防疫中心自己發布的指引，該指引第六點就提到防護設備提供要納入公務防疫需求，而且要求地方政府盤點，盤點之後應納入公務防疫需求回報。所以，我所持的理由就是根據防疫中心自己訂的指引，而指引就是這樣規定。而且，在新北市、臺北市，這些居家隔離與居家檢疫人口這麼多的里很多，每個里大概至少有二、三十人居家檢疫，人數也很多，里長要一一送防疫物資，大概也不是那麼容易，畢竟他們不只有防疫物資要送，通知要送，關懷也要做。此外，居家檢疫民眾住在大樓裡，如果有清潔用品要丟棄，不可能由里長進入大樓幫他們把垃圾拿出來，隔離者也不能自行從樓上拿下來，顯然就要交由物業公司處理，在這種狀況下，社區管委會就要處理。此時，該社區管委會與物業公司當然就是社區防疫團隊之一員啊！這也是指引第三點規定社區防疫人力要納入公寓大廈管委會的原因。所以，本案到底屬於研議提供還是必要提供，我覺得要想清楚。如果該大樓內真的有隔離與檢疫居民在，難道不需充分提供物資嗎？所以，我認為，既然根據指引成立了社區防疫隊，有居家隔離或居家檢疫者的大樓管委會就應納入相關人力，衛福部也應提供公務防疫資源啊！怎麼會是研議？這是你們的指引規定的，還要研議什麼？根據就是你們的指引耶！,170,LCIDC01_1092101_00006
林淑芬,再加上我講的那兩句話，也就是內政部、衛福部等機關應依社區防疫人力工作指引成立社區防疫團隊，協助執行社區防疫作為。謝謝。,171,LCIDC01_1092101_00006
廖婉汝,前面是寫「研議」？,172,LCIDC01_1092101_00006
廖婉汝,研議可行或不可行？,173,LCIDC01_1092101_00006
廖婉汝,國人有包機嗎？,174,LCIDC01_1092101_00006
廖婉汝,我是建議，你們要「研議」就寫「研議」。,175,LCIDC01_1092101_00006
廖婉汝,決定怎麼樣，你們自己決定，責任你們負。,176,LCIDC01_1092101_00006
蔣萬安,（12時1分）主席、各位列席官員、各位同仁。我先向何次長反映一件事，目前基層藥局反映有缺藥的問題，我先請教次長，衛福部有沒有了解這個狀況？,177,LCIDC01_1092101_00006
蔣萬安,如果疫情持續下去，當然很有可能發生缺藥的問題，民眾拿到慢性處方箋到藥局卻拿不到藥，這樣的問題會越來越嚴重，所以很多民眾以及基層藥局都反映，在疫情指揮中心宣導希望民眾儘量避免去醫院拿藥，所以當醫師開了慢性處方箋，他們建議到藥局取藥，希望透過這樣的方式避免感染的風險。當然立意很好，但是現在問題發生了，基層藥局表示他們比較2月及3月與去年同期，慢性處方箋的數量的確有增加大概20%左右，但是量增加之後，事實上他們很常需要退單，也就是10人來領，可能會有3人領不到藥，真正權益受損的就是有這樣需求的民眾。我知道剛才次長有提到問題到底出在哪裡，前面也有委員問到是不是因為現在原料短缺、分配不均，這會造成一個結果，當民眾到藥局，藥師告知他現在沒有處方箋上面開的這個廠牌的藥，民眾只能回到醫院去，這又跟疫情指揮中心的宣導政策背道而馳，這是一個問題。我要請教次長，目前有沒有具體的解決方案？或是何時可以解決？,178,LCIDC01_1092101_00006
蔣萬安,次長剛才大概提到三點，第一個是說有一個平台，就是食藥署有一個藥品資訊供應平台，次長講的是這個，但是藥局已經登入這個平台去反映目前某一款藥缺藥，但是平台都告知沒有這樣的情形，我不知道是沒有即時更新，還是沒有反映，還是認為目前沒有缺藥的狀況？這個部分要怎麼解決？第二個，剛才次長也談到所謂三同的藥，亦即同成分、同品質以及同價格，藥師可以告訴民眾、病患藥品可以替換，但是現實面就是民眾看到醫師在處方箋開的藥品是某款藥，舉普拿疼為例，民眾當然信任，因為這是醫師開的處方箋，即便藥師告訴他可以替換，但是實際上同樣寫普拿疼，同成分的學名藥就有上百種，民眾願不願意接受又是一個問題。所以衛福部在這邊怎麼解決民眾的認知跟信任這些問題，即便是三同，依法可以替換，但是民眾是否可以接受？第三個，剛才次長也談到目前可能分配不均，醫院當然是跟藥廠、藥商有訂定合約，有沒有辦法跟醫院協調，做重新分配，這一點尊重衛福部的作法，不過藥局會覺得到底有沒有什麼方式可以解決，面對三大問題，第一，資訊平台；第二，剛才提到藥品替換如何跟民眾做好溝通、宣導；第三，有沒有過度集中庫存的問題，如何做調配。衛福部是否針對這三個問題來解決？,179,LCIDC01_1092101_00006
蔣萬安,好。次長，這樣好了，目前你們認為是物流的問題，還是……,180,LCIDC01_1092101_00006
蔣萬安,兩個都有？,181,LCIDC01_1092101_00006
蔣萬安,我現在就是問有沒有具體解決方法？譬如物流的問題或是原物料短缺的問題，如果這兩個問題都有，那麼到底要怎麼解決？,182,LCIDC01_1092101_00006
蔣萬安,所以如果國內的廠沒辦法或來不及生產，這就要宣導民眾接受，是不是？,183,LCIDC01_1092101_00006
蔣萬安,另外關於物流的部分呢？,184,LCIDC01_1092101_00006
蔣萬安,"好。最後我問一下，現在很多民眾或專家都指出，針對疫情，未來有沒有可能進行擴大的篩檢，因為現在機場的入境人數，實際上一天已經不到1,000人了，大約900多人，請教次長，目前我們的篩檢量能夠不夠做擴大篩檢？",185,LCIDC01_1092101_00006
蔣萬安,有在評估？,186,LCIDC01_1092101_00006
蔣萬安,"因為國外已經有這樣做，而且已經做了一陣子，對於入境的民眾做普篩。所以我先問次長，考量我們的篩檢量能，在足以因應目前對於有症狀或是需要優先檢測的民眾以外，針對現在入境者，因為一天入境人數已經不到1,000人，甚至未來可能會慢慢降低，在我們量能逐漸增加足以因應現有的檢測民眾之外，再擴大篩檢或是做普篩，有這樣的評估跟考慮嗎？",187,LCIDC01_1092101_00006
蔣萬安,當然我尊重疫情指揮中心最後的評估、決定以及專業的意見，但是我提出來是因為國外的作法，目前對入境的民眾做普篩……,188,LCIDC01_1092101_00006
蔣萬安,對，避免任何漏網之魚，即便沒有症狀，全部都先做一次篩檢，或許就像指揮中心所擔心可能有偽陰性的狀況，但是他還是要做其他的防疫，比如居家檢疫或居家隔離，這些還是要做，不是測出來陰性就不做。,189,LCIDC01_1092101_00006
蔣萬安,但是只要測到有一位陽性，馬上就可以做防疫的積極作為，我想是朝這個方向進行，在量能允許的情況下，我認為應該要這樣做。當然，我很高興聽到疫情指揮中心說在評估，我希望這樣的決定能夠儘快做出來，因為時間會一直往前走，我們不希望有任何漏網之魚，能確定一個就是一個。謝謝次長。,190,LCIDC01_1092101_00006
邱顯智,（12時14分）主席、各位列席官員、各位同仁。首先我要請教內政部民政司司長、衛福部何次長以及疾管署副署長。,191,LCIDC01_1092101_00006
邱顯智,好。我先請問民政司林司長，現在居家檢疫14天，各地里長必須要去追蹤嘛？,192,LCIDC01_1092101_00006
邱顯智,一個里只會有一個里幹事，早上立法院也召開相關的記者會，事實上這會造成里長跟里幹事的壓力非常大，因為居家檢疫的人數越來越多，這個分配上是由內政部負責嗎？,193,LCIDC01_1092101_00006
邱顯智,你看傳染病防治法第六條規定內政主管機關必須要協助地方政府辦理居家隔離民眾之服務事項，在內政委員會全體委員會議裡，你們似乎有提到建置一個24小時的關懷專線，即時提供居家檢疫跟居家隔離的生活及就業之協助，你看前幾天桃園市也發生居家檢疫的人已經在家裡面死亡的狀況，請問這個24小時關懷專線有做嗎？,194,LCIDC01_1092101_00006
邱顯智,對啊！但是到底有沒有去做這件事情？,195,LCIDC01_1092101_00006
邱顯智,應該說這個24小時關懷專線的設立就是讓居家檢疫人可以打進來，方便跟我們這邊聯絡嘛？,196,LCIDC01_1092101_00006
邱顯智,問題來了，因為都是里幹事跟里長去打，依照3月24日的統計，我相信現在人數又更多了，司長知道現在居家檢疫的人大概有多少嗎？,197,LCIDC01_1092101_00006
邱顯智,OK！在3月24日時，新北市就有1萬人，臺北市是1萬多人，根據副指揮官的說法，如果一個村里長負責5人以下，可能比較沒有壓力，若是5至10人，他的壓力就很大，假使是10人以上，我的天啊！他可能就不知道該怎麼辦了，因為他們只有兩個人。,198,LCIDC01_1092101_00006
邱顯智,所以應該有更多人？,199,LCIDC01_1092101_00006
邱顯智,陳宗彥副指揮官的說法是希望能夠設立一個call center，六都研議設置呼叫中心。這個部分有做嗎？我的意思是有專門的人來打電話，它是一個call center的概念，也就是六都研議設置呼叫中心，這個有做嗎？,200,LCIDC01_1092101_00006
邱顯智,對啊！,201,LCIDC01_1092101_00006
