speaker,speech_text,speech_number,meeting_id
吳玉琴,下午的過程中，我們再一併討論營養師法。謝謝。下一個，我要跟部長澄清一個資訊，有關癌症藥品基金的部分，3月2日委員詢問部長的時候，你有提到參考英國CDF的經驗，經費短期內就會增加十倍，所以需要再討論。我要跟部長釐清資訊，這個部分可能有一些跟實際狀況不符，所以我先跟部長分享。2011年英國成立第一代癌症藥品基金，確實可能有一些財務膨脹的情形，您提的可能就是第一代癌症藥品基金的情況，可是它在2016年就推出第二代癌症藥品基金，規模大概是3.4億英鎊，這個新藥基金採用很完善的還款機制，類似我們健保的MEA，有一點總額的概念，確保它的財務不會超支，目前也造福七萬多位病患，有91項藥品、204個不同的適應症，因此在2021年也擴大成為創新藥品基金，再增加3.4億元，這是經過檢討及不斷修正，且我認為是某種程度的穩定。我知道部長最近好像有規劃要去參訪英國的CDF，相關計畫內容是如何？,54,LCIDC01_1123101_00006
吳玉琴,雖然你之前提到過去英國有些制度上有所失控，可是它在2016年就修正、再調整了，所以有這樣的總額概念，我想英國這樣的制度值得我們再深入瞭解。,55,LCIDC01_1123101_00006
吳玉琴,我今天排審癌症防治法的修法，因為劉建國委員不能出席，所以他請我一定要問部長跟署長，這是我們去年在審今（112）年預算時，他的重要提案，希望衛福部在第10屆第7會期即這個會期能夠提出對案，對於我們好幾位委員所提出的癌症新藥多元支持基金的訴求，希望能夠有明確答復。請看一下簡報的部分，衛福部提供給我們4頁對於癌症新藥多元支持基金的答復，我覺得對於進度並沒有答復，你還是要回到財政紀律及中央特種基金的準則。部長，整體來講，我看完你們這份報告之後，其實最主要還是在癌症新藥可近性的精進作為，這是健保署要做的事，要核定流程及跟廠商議價進度，以及新藥預算的預估模式，這些本來就是健保署或健保運作過程中應該要去精進的。甚至你們還說要加速HTA以縮短病友取得新藥時間，連人才荒你們也提出來，這不是你們內部就該處理的嗎？,56,LCIDC01_1123101_00006
吳玉琴,而且要加速，這個部分大家已經談了好久了。,57,LCIDC01_1123101_00006
吳玉琴,所以你剛才報告有關先鬆後緊的策略就是現在所啟動的機制？,58,LCIDC01_1123101_00006
吳玉琴,是，所以預估模式可以先做就是了？,59,LCIDC01_1123101_00006
吳玉琴,我們剛才都在抱怨癌症新藥取得需要七百八十幾天，兩年的時間真的是太久了。,60,LCIDC01_1123101_00006
吳玉琴,所以真的能夠縮短取得新藥的時間嗎？,61,LCIDC01_1123101_00006
吳玉琴,你們連人員增加都列為重點耶。,62,LCIDC01_1123101_00006
吳玉琴,是。,63,LCIDC01_1123101_00006
吳玉琴,接下來就是要跟您討論這個基金，上次問您法源依據在哪，你提到唯一可能就是放在癌症防治法，所以我們好幾位委員都提出在第十六條要設置癌症基金的部分。財源的部分又受制主計總處所提到的財政紀律法，難道完全沒有機會嗎？好像財政紀律法通過後什麼基金都不能設置，國家的發展難道就卡住了嗎？我們難道沒有其他財源嗎？行政部門有可能嗎？因為我們大家都想過各種可能，如公務預算、菸品健康捐，甚至有人提到空污費、商業保險，有提出各種可能。部長，你有沒有什麼想像？,64,LCIDC01_1123101_00006
吳玉琴,它一定打槍的啊！,65,LCIDC01_1123101_00006
吳玉琴,對啊！它一定會打槍，今天沒有邀請主計總處來列席。,66,LCIDC01_1123101_00006
吳玉琴,好。所以有關基金的設立，在主計總處不是很支持的情況下，大概有一定的難度，就是我們立委要來努力的部分，因為我認為國家的政策也要更有前瞻性。因為剛才提到新藥的部分占健保總額大概20億元左右而已，所以有關該基金的規模，有幾位專家學者很努力地將英國第一代、第二代的3.4億元英鎊的規模換算為臺灣人口規模，估算結果約為30億元至40億元，如果有這樣的經費可以來協助癌症病友，不是只有健保而已，從另外一個管道來協助的話，短期的是兩年，幾個團體所提出來的意見是，在取得藥證但健保無法馬上支應的情況下，先由該基金協助兩年，如果符合健保資格就納入健保，不符合的話，就要有退場的機制，這個部分必須跟廠商、藥商來協調，金額不能超支。我想這也是另外一個讓病友能夠及早拿到新藥的機會，所以大家在過程中一直不斷在討論。我也希望衛福部這次在參訪英國時能夠互相交流，更深入瞭解相關制度，在操作問題上可以瞭解清楚的話，我覺得對於臺灣在該部分的推動發展上應該是有幫助的。,67,LCIDC01_1123101_00006
吳玉琴,出訪的有哪些單位？國健署及健保署都會去吧？,68,LCIDC01_1123101_00006
吳玉琴,你們內部的相關人員應該要去，但應該也要帶主計總處去，讓他們看看國外是怎麼樣來推動制度，不能老是用財政紀律法把大家都卡死。好，謝謝部長。,69,LCIDC01_1123101_00006
蘇巧慧,（10時18分）部長早。今天要跟部長就教癌症防治法的部分，就如同我剛才在提案說明所提到的，我們是在2003年實施癌症防治法，迄今剛好滿20年，坦白講這20年來都沒有大修過，按照今天多數委員的共識，大概是會討論第十六條有關基金的部分要如何處置。但我想跟部長討論，你覺得現在的癌症防治法真的不用大修嗎？已經很不錯了嗎？部長知道日本也有癌症防治的相關法律嗎？,70,LCIDC01_1123101_00006
蘇巧慧,日本叫做癌症對策基本法，比較我們跟日本的法律，日本是在2006年提出的，比我們還晚。而提出之後有沒有做過相關研究，即法制化後是否有影響癌症的比率？,71,LCIDC01_1123101_00006
蘇巧慧,對，日本跟臺灣都推行新法，2003年跟2006年，時間很近，兩國都推動癌症防治的法制化，而在法制化後癌症比率是否有下降？,72,LCIDC01_1123101_00006
蘇巧慧,你沒有看過？,73,LCIDC01_1123101_00006
蘇巧慧,來，我讓你看一下！這條綠線是日本的癌症死亡占整體死亡人數之比率，從2006年也就是他們開始推動法制之後，你看這條綠線一路下滑；而我們從2003年有癌症防治法，在立法之後，你看我們這條紅線的癌症死亡占整體死亡人數之比率好像都持平，這有什麼差別？,74,LCIDC01_1123101_00006
蘇巧慧,所以你覺得不能這樣做比較。,75,LCIDC01_1123101_00006
蘇巧慧,還有其他的因素！那日本的癌症對策基本法和我們的癌症防治法最大的差別是什麼呢？我看過以及我們辦公室研究之後，我想最大的差距其實是你把癌症當成一種病症，用衛福系統去支持它、去防治它，還是用整個國家社會經濟的概念去防治它，我覺得這兩個有很大的差別，這也就是為什麼今天我提出的版本是全文修正，因為我們參考了日本的癌症對策基本法來跟您討論這整個的修正。既然剛剛你說這個比率不太好的話，那我再給你看另外一個數據，部長，2017年臺大公衛學院團隊透過全國癌症登記檔案資料庫分析健保開辦以後的癌症病人自殺風險，結果你知道嘛，根據這個團隊的研究，我們的癌症病人自殺率其實是全球第一名，因為癌症病人的自殺率比一般人高2.47倍，尤其是在他被告知的第一年，可能覺得心情特別不好或者是經濟狀況特別難以負擔，很清楚的是，他覺得沒有辦法在這個社會上繼續生活下去；如果用全球數據做比較的話，2022年的全球癌症患者自殺風險比一般人高0.85倍而已，怎麼樣，部長覺得我這個數據又引用的不太適當嗎？,76,LCIDC01_1123101_00006
蘇巧慧,確實是這樣！我今天不是跟你討論自殺率，而是用這個自殺率來講，我可以看到的絕對不是我們的醫療狀況不夠好，而很有可能是他的支持系統不夠好。所以剛剛日本的癌症對策基本法是用整個社會的經濟社會力量來支持，而我們目前只有用衛政系統來做支持，以至於現在我看到的狀況，我拿的這個是臺大公衛學院團隊做出來的調查報告，確確實實就有這樣的狀況發生，不是因病死亡，而是自殺率！因此我覺得這個題目的嚴重性是在這裡。我跟你討論一下，我的版本當中的幾個條文為什麼會這樣修，比如說我認為要解決癌症高自殺率有三個關鍵，第一個是資訊明確；第二個是健保合理給付；第三個是身心支持。舉個例來講，我認為當醫生碰到癌症病患，剛剛提到第1年的自殺率最高，甚至是一般人的五倍多，這是為什麼？因為一般人知道得癌症的時候一定很shock，認為我怎麼會得到！尤其現在有越來越多年輕朋友，甚至在我這個年紀，身邊朋友已經有很多是這樣的狀況。那他要怎麼面對這樣的狀況？而醫生如何告知其實差很多，醫生如果說「你現在的狀況不樂觀」跟「你現在處於第三期，接下來我們會做哪些治療」，部長，你覺得這兩個聽起來不太一樣吧！,77,LCIDC01_1123101_00006
蘇巧慧,那醫護有沒有受到這樣的訓練呢？坦白講我們其實有一個訓練，台灣心理腫瘤醫學學會在2010年引進了日本的溝通技巧，可是後來就因為沒有經費、沒有資源可以繼續下去，所以現在停辦了。你又要醫護能夠好好地跟病人溝通，但凡其他的支援系統常常礙於種種因素沒有給醫院、沒有給醫師足夠的資源，我們不是也應該要協助他們嗎？更進一步來說，我相信醫護他們不是不願意做到，事實上他的病患患者就這麼多，我講得更實際一點，在這麼多病患的情況下，看一個病人30秒以及跟一個病人解釋10分鐘的健保給付還是完全一樣，那怎麼有辦法能每一個人都給他10分鐘，從他的病症講解起，到最後心理治療、心理支持、甚至家屬的支持等等都能夠做到，你要求醫生做聖人也不可能啊，除非他後面有更多的資源可以做。我這個說法是，對醫護友善就是對癌症病友友善，部長，你認同這個觀念嗎？,78,LCIDC01_1123101_00006
蘇巧慧,不只醫護吧？,79,LCIDC01_1123101_00006
蘇巧慧,對！,80,LCIDC01_1123101_00006
蘇巧慧,對，那他有沒有足夠的知識知道自己要去找second opinion，這又是另外一個問題了。,81,LCIDC01_1123101_00006
蘇巧慧,對啊，從剛剛講到現在，其實你的方向已經跟我是一致的，這個可能不是只有衛政系統可以做，如果現在癌症是這麼接近的一種疾病、十大死因之首，而且罹患人數這麼多的話，我們到底有沒有足夠的知識，甚至從年輕的時候、從小的時候就開始知道，面對這樣子的疾病時，我有什麼樣的知識；我被告知有這個疾病的時候，我要怎麼面對。像三高可能大家都知道，主席，今天給我多一點點時間，我是全文修正！第一個，我覺得要整合更多資源來支持是非常重要的，我再舉另外一個例子，你看現行的癌症防治法裡面有哪一些是對癌友的身心健康特別照護的？我看來看去只有現在的第四條第一項第四款，總共只有這一條有對癌症病人的心理支持，而且是什麼呢？是末期的安寧療護！這就已經是最尾端了，跟我們剛剛前面說的不一樣！難道這樣子的法律不應該修嗎？而在我自己新版本裡面的第八條，我認為政府應該補助醫院去做這樣的支持系統，如果要結合民間資源進來的話、甚至適用我提出的第十七條，這個支援系統也等同於是癌症防治的一部分，所以在稅賦的部分也一樣可以減免，因為我們從剛剛到現在已經都同意支持系統實在是癌症防治的重要一環嘛！這就是我的概念，這是第一個想跟你分享的。第二個，當然是癌症的用藥平權部分，也就是等一下大家會討論的第十六條，對於癌症用藥平權的部分，我也給部長看一個數據，因為每個人的整理方式不一樣，有時候呈現出來的意象跟印象就會不太一樣！我覺得平心而論，健保已經很努力在照顧大家的健康了，但也確實很明顯出現瓶頸。用2021年為例子，健保用在癌症的藥物支出已經到了健保總額的5%，5%看起來不太多，可是你看2017年到2020年健保總額的年平均成長率是4.8%，但是癌藥支出的年平均成長率是10%。所以就是癌症的患者越來越多，用藥越來越多、越來越大，它的需求量已經遠遠超過，就算你們說：有啊，我有多補健保！可是癌藥的需求量就多很多啊，所以這就是為什麼健保會越來越困難給癌症新藥，但是癌症病友也越來越多人在等待新藥。我知道政府難做，這個沒有問題，但我覺得這就是一個困境、它要被解決，我的立場其實是甲案也好、乙案也好，能夠解決最好！所以我曾經提過包括健保加值服務或者是癌症新藥多元支持基金，我都同意、我覺得都可以討論，因為真的就是哪一案都好，能夠解決困境的最好啦！部長，今天讓您回答的部分可能不太多，等一下最後給你總結，但我要再說一次，為什麼我提出了全文的修正？其實是認為癌症防治絕對不是只有衛政需要處理的面向，這已經是一個需要跨部會討論的議題，涉及社會、經濟、教育，我甚至認為應該納入國民教育裡，讓年輕人知道應該如何預防！因此，從第一條的立法宗旨來整合資源、用藥平權；第四條的癌症防治範圍則加入支持服務；第五條納入國民教育，作為防治癌症的知識等等面向，讓全社會資源可以進來。至於第二部分就是基金部分，第三部分就是本席所提的稅賦部分，不管是研發、支持系統等，凡是有幫助的，都可以因此得到鼓勵。我認為這樣一部癌症防治法的全面翻修，可以讓臺灣社會在面對如此嚴重的癌症病症時，得到比較有效的防治，這是我的意見。接下來給部長一點點時間說明。,82,LCIDC01_1123101_00006
蘇巧慧,沒錯，癌症不可怕，要早期篩檢。,83,LCIDC01_1123101_00006
蘇巧慧,是。,84,LCIDC01_1123101_00006
蘇巧慧,所以衛福部要結合，要宣導更多啊！,85,LCIDC01_1123101_00006
蘇巧慧,今天不太可能採用是我的全文修正，所以在這裡先做討論，謝謝部長。,86,LCIDC01_1123101_00006
邱泰源,（10時32分）我非常敬佩蘇巧慧委員提出與防治癌症有關之事宜，我全部都非常支持，也希望未來能落實，相信對於癌症防治會有很大幫助。接下來請教部長幾個與防疫有關的問題。3月20日將會有比較令人振奮的措施，也就是防疫鬆綁，並進入另外一個階段，相信全民及相關專業團體都會全力配合政府政策。但在鬆綁之後，很多服務項目也會有所變化，而在這些變化當中，是否考慮到相關配套措施？我當然支持鬆綁，但鬆綁後的醫療體系、所有第一線的醫療院所恐將面臨更大的挑戰，畢竟不是我們認為流感化後就真的變成流感了，中間仍必須有所轉接，而且所用的藥物不一樣！譬如Paxlovid，是一種EUA用藥，跟Tamiflu是不一樣的，除解釋上需要更清楚外，也與很多藥物相衝突，如血壓藥、抗血脂藥、抗生素等，都需要有醫療專業配合。去年5月中獎時，我也吃Paxlovid，因為年紀也差不多了。站在視病猶親的立場上，我相信所有病人、家屬對於如何用藥一定很擔心。由於必須隔離，所以採視訊問診，畢竟當時只有這樣做才能穩定社會。有鑑於此，當我們要走到下一個階段時，該如何維持這樣一個力量以照顧社會安定？我相信這是政府、團體及人民所期待的。舉個例子來說，之後抗病毒藥物的使用幾乎就自由了，只有在病人到醫院並發現其確診時，醫師才會評估是否用藥。但對於用藥，衛福部好像也沒有特別鼓勵醫師多花點時間解釋抗病毒藥物所可能產生的衝突作用，如此一來，是否會增加很多醫療壓力？從而減少給病人解釋、安定的時間，這樣會不會對人民健康安全造成影響？這是第一個問題。我這幾個問題都是醫療界非常在意的問題，部長多年來在防疫相關工作上跟醫療團體合作無間，也把防疫做到最好，相信後續的處理上會使其更圓滿，相信這是國家之福。第二，以基層為例，這次防疫官員提到將節省多少錢，這固然讓我們很期待，但我有個疑問。在編列今年度預算時有八百多億用來處理防疫相關事宜，所以需要急著省下這沒有幾億的錢嗎？正好今天周次長志浩也在場。在討論預算時，我有特別注意預算是否能cover到整年的防疫需求，當時大家都覺得沒問題，何以現在會如此在意？是否真的沒錢了？這點要向社會講清楚，跟醫界講清楚，其實沒錢有沒錢的作法，但品質一定要顧好。以輕症醫療費用來說，一個月可以省下8.79億元，一年105億元，問題是，輕症病人仍舊會到門診就醫！這些人原本只在家裡視訊，現在則會直接去門診，如此所消耗的醫療資源就會比較多。若原封不動將這105億元搬到健保去，那麼對西醫、中醫會產生排擠作用，甚至影響到其他一般醫療，這是我的第二個問題。第三，視訊確診判定與照顧取消後，如果有人覺得喉嚨痛、鼻塞、微微發燒就跑到診所就醫，甚至有人會不知道該去哪裡，那麼將造成民眾惶恐，且診所壓力會很大！以前都在家裡採視訊診斷，現在直接到診所去，如此診所是否要另外找地方篩檢？但有地方嗎？所以我們一定要考慮醫療現場的狀況，否則不僅大醫院急診嚴陣以待，診所更是「掣咧等」！畢竟原本還屏障於外，隔離在家裡，現在卻必須到診所處理，請問這要如何維護醫療量能？有無相關配套措施？今天如果沒有時間回答，請衛福部針對本席這幾個問題回去研議一下，給社會和醫界一個答復，可以嗎？,87,LCIDC01_1123101_00006
邱泰源,對，今年是正常預算。,88,LCIDC01_1123101_00006
邱泰源,因為我後面還有幾個題目要問……,89,LCIDC01_1123101_00006
邱泰源,雖然經費上會有一些問題，但是否考慮將項目留著，然後費用降低？有沒有考慮這樣子做來鼓勵？,90,LCIDC01_1123101_00006
邱泰源,因為我們這個社會不一定都要公益嘛，只要提供勞力，就要提供經費來鼓勵、照顧人民，即使你說國家經費、預算有問題，我們降低是沒關係，但是你完全把它取消，就表示不願意做這件事情嘛，否則天底下有吃麵不需要付錢的道理嗎？,91,LCIDC01_1123101_00006
邱泰源,這件事就拜託部長了，不然馬上會引起很多的反應啦，好不好？我希望大家共同來解決這個困難，讓我們順利鬆綁，你看疫情指揮中心宣布鬆綁後，大家多快樂，所以一定要朝這方面來努力，也特別感謝我們疫情指揮中心跟醫療界、所有全國醫護同仁、防疫團隊，以及所有全民的努力，再度在這邊站在一個國民的立場感謝大家。這個部分，請儘量給我答復，可能馬上就要去研議、回應，拜託部長。,92,LCIDC01_1123101_00006
邱泰源,另外，針對今天其他相關的主題裡面，我有提出一個建議，而且這是要小心的事情，就是我們在通訊診察這個部分，雖然現在我們AI相關的科技發展得非常好，可是永遠不要忘記，醫病關係其實是築基於當面診療，遠距醫療不應該視為與面對面診療相等，我這個資料是來自於世界醫師會。過去3年來，在防疫的過程當中，很多國家的確希望把通訊診療也列為在世界醫師會的一個條文裡面，但是很多先進國家其實是反對的，所以非常具爭議，爭議到最後就是這樣的結果。我們當然可以來支持通訊診療，但是絕對不能取代，因為它是非常態，絕對不能取代醫病，醫病當然不只是醫而已，包括今天的營養師，包括所有的護理，儘量不要說一說就算了，最好是能夠當面診察，這才是常規啦，所以我們在相關的法案當中是不是要注意到這個部分？必須一併納入考量，而不是醫事司在這個部分花很多心思，可是在這種條文的修正裡面，是不是不要走得太快、要小心一點？因為做得太快，恐怕它的品質怎麼維護？這個就是我們未來、這幾天在審查的時候，必須要有的觀念，我希望這個觀念能夠keep住，保持這樣的觀念來處理應該會比較好。,93,LCIDC01_1123101_00006
邱泰源,瞭解。,94,LCIDC01_1123101_00006
邱泰源,我想支持部長所提的，也不只在醫療、醫師而已啦，其他專業同仁的部分，將來在借用科技的時候，也要小心這樣的情況。剛剛部長提的，我非常的敬佩跟支持。最後，我們再看一下，不好意思，癌症的部分，我覺得今天也討論滿多的，我覺得我還是希望，你看我們上個會期去看那麼多的癌症醫院，充分地展示衛福部以及立法院對癌症病人及其家屬的關懷。關於他的整個歷程，剛剛蘇巧慧委員提到，整個歷程都需要照顧，不是到最後或怎麼樣，包括心理、家庭的照顧，所以如何建立，讓有癌症的病人就有一個好的家庭醫師，加上配合醫院的癌症醫師，才能給我們癌症的病人cancer family，給他一個溫暖、專業的支持，這個我還是要一直呼籲啦。我引用癌症希望基金會的話，就是在基金方面，當然要審慎的來照顧，這幾年吳玉琴召委也是一直在努力，希望給這些罕見疾病及癌症的病人，真的給他們一個好的照顧，但是健保資源又是有限，所以政府真的要看看在哪一些程度上面，想盡辦法給這些人照顧，讓他們趕快得到一個好的醫療。這當中有很多學問，就是未來這幾天可能要去討論的，我想我這個部分只是提出來，因為癌症基金會他們也很關心，希望能夠多跟民間做結合，這個部分在蘇巧慧委員所提的修正條文裡面也有提到，我覺得他很用心，這也符合未來如何給予癌症病人整個照顧的整體性，我想未來這幾天以及未來我們可以繼續來努力。好，感謝召委，感謝部長，謝謝。,95,LCIDC01_1123101_00006
徐志榮,（10時45分）部長好。部長，不好意思，耽誤你超過10時30分的時間，所以我會盡量、盡早結束我的詢答。我國第四期國家癌症防治計畫是從108年到112年，而112年就是今年了嘛，請教一下，我國第五期國家癌症防治計畫什麼時候可以出爐呢？,96,LCIDC01_1123101_00006
徐志榮,今年之內提出？所以就可以接續113年的計畫？,97,LCIDC01_1123101_00006
徐志榮,總質詢的時候，我也有跟部長提過一下，因為我們部苗那邊也很重視這個，當時蘇院長也有到現場去考察過，那時候我記得是和王必勝執行長一起去的，到底需要幾年那些硬體才會完成，我也不知道，可能那時候我們也都不在這個委員會了，也不一定啦。他只是擔心這個癌症腫瘤中心，還有急重症的擴大整建計畫，有了硬體、軟體等等之後，人力部分也要幫他考慮進去，到時候不要說有了這些建築物、有了這些既有的軟體，卻沒有人去做這些事情啦。,98,LCIDC01_1123101_00006
徐志榮,所以要拜託部長去多關心一下。早上講的有一些是有關CDF的部分，也有講說是不是要到英國去考察，主要是不是針對臨床證據不足，但是又有合理潛力的新藥，要提供一個暫時性的資金管道，讓病患有機會使用這個新藥？大概是不是去參考、考察他們這些制度？,99,LCIDC01_1123101_00006
