speaker,speech_text,speech_number,meeting_id
楊曜,制度面怎麼調整？,86,LCIDC01_1090901_00008
楊曜,好，假如是做制度面的調整，會怎麼調整？這個才是方向啦！,87,LCIDC01_1090901_00008
楊曜,部長，你們沒招了！其實就是我常說的多繳、少領、延後退，就是這樣嘛！制度內大概是這樣子。至於你說的制度外，制度外你們有什麼新的點子？,88,LCIDC01_1090901_00008
楊曜,對嘛！你既然有提出方向，你有想法才會有……,89,LCIDC01_1090901_00008
楊曜,所以你們內部只討論是要從目前的制度來修改，還是要加入新的制度？目前進行到這裡就對了？,90,LCIDC01_1090901_00008
楊曜,部長，勞保年金是未來4年非常重大的課題，也有一點急迫性，其實這一題我原本不是今天要問，不過我這樣子問、你這樣子回答，我不相信社會大眾會滿意！,91,LCIDC01_1090901_00008
楊曜,對，所以我才一直問你。,92,LCIDC01_1090901_00008
楊曜,部長，7分鐘時間過去，我就是沒有聽到你講到一點點方向啊！,93,LCIDC01_1090901_00008
楊曜,沒有，那個不是方向，那個是目標啦！那個不是你的政策方向。,94,LCIDC01_1090901_00008
楊曜,再問下去，你會以為我在為難你，其實不是！我覺得像勞保年金改革這麼重大的問題，應該是問題一提出來部長就可以很完整的答復，不管內容好壞，應該是可以很完整的答復，不過很明顯的，沒有。部長，有關紓困的部分，我丟一個問題讓你回去解決，目前有很多年輕的打工族及自營勞工者在這一場武漢肺炎的疫情之中受到衝擊，勞動部應該要設法真正的去幫助他們，年輕打工族有的是在賺取學費，有的是在賺取生活費，很苦啦！這個你不用回答，我要求你們回去一定要做到，必須要到位。最後我要問一個問題，部長，在臺灣是這樣子，事情過了就沒有人討論，但本席還是要跟你討論一下在你任內就發生了兩次空運界大罷工，特別是第一次華航的罷工，因為華航和華信所有的員工都是獨立的，所以沒有問題。在第二次長榮罷工的時候，因為立榮負責國內航空，有一些機師跟長榮是流用的，我當初要求國內航空罷工必須要預告，但部長不敢做政策決定，結果罷工的長榮工會在政策判斷上比部長還強，長榮工會一開始罷工就宣布國內線不罷工，而且要求公司在有限的人力裡面先支援國內線，部長知道是為什麼嗎？,95,LCIDC01_1090901_00008
楊曜,沒有關係，你慢慢回答，我還有一點時間。,96,LCIDC01_1090901_00008
楊曜,為什麼部長必須要工會來教你，你才知道離島居民行的權益的重要性？,97,LCIDC01_1090901_00008
楊曜,我就說我們把制度建立起來！你看，工會第一件事情就先宣布了國內航線不罷工，因為他們很清楚的瞭解罷工權和離島居民出入臺灣本島就醫、就學、就業的權益，兩個權益的衝突，他們做了選擇，但是部長你不敢做判斷啊！,98,LCIDC01_1090901_00008
楊曜,你在罷工預告不敢做政策決定，在勞保年金沒有能力做決定，這樣到底要怎麼辦？,99,LCIDC01_1090901_00008
楊曜,我沒有時間了。,100,LCIDC01_1090901_00008
楊曜,不是啊！制度弄得好……,101,LCIDC01_1090901_00008
楊曜,部長，你現在是又拉回來勞保年金，我今天不是叫你鉅細靡遺的報告，我只是要求你的方向而已，所以你現在就不要再拉回主戰場，知道嗎？部長，我現在問你一個問題，歷經長榮這一次的罷工和工會的表現，你贊不贊成國內航空的罷工預告制度？,102,LCIDC01_1090901_00008
楊曜,罷工門檻不容易，我就說國內航空是比較特殊的嘛！,103,LCIDC01_1090901_00008
楊曜,我跟你講，部長……,104,LCIDC01_1090901_00008
楊曜,國內的航空班機，其實有時候是類似救護車的概念，光是這個概念就值得部長很勇敢的說你是支持的。,105,LCIDC01_1090901_00008
楊曜,好，謝謝部長，謝謝主席。,106,LCIDC01_1090901_00008
張育美,（10時1分）主席、各位列席官員、各位同仁。部長，你長得很像我們隔壁家的姐姐、妹妹，所以我覺得跟你在這邊問政很輕鬆。今天是勞動部的業務報告，因為本席之前都在醫院工作，所以我對醫院的情況是比較瞭解的。在這次的疫情當中，第32例的印尼無證勞工是在醫院裡面被所照顧的第27例確診病患傳染，然後這個印尼無證勞工就趴趴走，回到宿舍，還搭捷運，大家都很害怕。針對這件事情，我想請問勞動部，照理說，不管是行蹤不明的移工或是外籍移工，都是勞動部主轄業務，對不對？據我所知是管理不同調啦！在印尼看護工確診之後是管理不同調，怎樣不同調呢？中央跟CDC指揮中心的說法都不一樣，如果因此造成防疫破口怎麼辦？2月27日勞動部說要查緝非法看護移工，將提供身分勾稽系統，並發文給新北市要對雇主進行裁罰等等。2月28日我們的總指揮陳時中部長說他不贊成在COVID-19期間來通報，因為已經確診了！而且有些人不知道有沒有感染，所以就暫時不要動，以不動來制動。2月29日部長非常支持政府政策，我們應該是一級管理，一級管理就是平行單位都要服從，所以部長說配合指揮中心，暫時沒有對雇主進行裁罰。3月3日新北市又覺得在疫情期間不要亂動，先以靜制動，所以中央地方不同調。當然，勞動部的說法是因為要配合政府的政策，可是站在勞動部的立場，知道有非法移工就要馬上處理，所以本席想請教部長，在防疫期間，醫療院所算是一個危險的場所，非法外籍勞工就是一個管理的黑數，針對非法看護的移工，勞動部要如何配合疫情指揮中心？,107,LCIDC01_1090901_00008
張育美,對不起，部長，行蹤不明的外勞管理是內政部的事，是嗎？,108,LCIDC01_1090901_00008
張育美,所以外勞失聯是他們的事？,109,LCIDC01_1090901_00008
張育美,部長，我的時間不多了。,110,LCIDC01_1090901_00008
張育美,反正對外籍勞工都會發口罩，不管他是合法、非法？,111,LCIDC01_1090901_00008
張育美,再來，3月4日勞團記者會提出訴求，政府對無證移工應該給予更多積極的政策作為，建議不驅離、不處分、重新給予合法身分，勞動部的回應剛才已經說了，你說不管合法、非法都是……,112,LCIDC01_1090901_00008
張育美,對，發放口罩和這個不是很有關係，但是我可以把它併案來講。,113,LCIDC01_1090901_00008
張育美,"好，目前產業及社福外勞行蹤不明人數高達1萬7,776人，非法看護移工問題你要怎麼解決？現在來講解決。",114,LCIDC01_1090901_00008
張育美,好，謝謝部長。我的第二個問題是，防疫隔離假不給薪，那家長照顧的壓力如何解？據我所知，請防疫隔離假的病人是不給薪，可是有補助費。,115,LCIDC01_1090901_00008
張育美,但是企業是不給薪，給的是租稅優惠，最重要是我們沒有設隔離照顧假，對不對？,116,LCIDC01_1090901_00008
張育美,有給薪嗎？沒給薪啦！,117,LCIDC01_1090901_00008
張育美,就是不給你記曠職，也不給你績效。,118,LCIDC01_1090901_00008
張育美,那就有照顧假，幾天？7天？,119,LCIDC01_1090901_00008
張育美,"14天？我們要不要學學日本？只要家中有上小學的小孩子，監護人請假期間就給工資，這是日本厚生勞動省的作法。只要企業於2月27日到3月31日提供全薪的家庭照顧假給員工，以每天8,330日圓（約2,300元臺幣）為上限，全額補償企業。我要請教部長，我們是否有掌握其他國家針對隔離照顧假相關制度的設計？",120,LCIDC01_1090901_00008
張育美,對不起，日本厚生勞動省的作法是小學才給哦！小學的監護人才給。,121,LCIDC01_1090901_00008
張育美,就是要100億元？,122,LCIDC01_1090901_00008
張育美,那個是防疫隔離假？,123,LCIDC01_1090901_00008
張育美,"部長，小孩子是國家未來的主人翁，在防疫期間，如果可以參考其他國家對防疫照顧假有給薪，有給錢的話，是不是家長會更願意來照顧小孩子？就像日本從2月27日到3月31日全額補助，每天大概是2,300元臺幣，那我們現在請防疫照顧假的人只有6.4%，表示只有6.4%的家長去照顧小孩子，其實我覺得對小孩子應該要有更多的照顧才是，好嗎？",124,LCIDC01_1090901_00008
張育美,建議部長，謝謝。,125,LCIDC01_1090901_00008
蔣萬安,（10時15分）主席、各位列席官員、各位同仁。勞動部針對這次的疫情提出很多的紓困方案，現在大家很關心的就是無薪假。這些員工被放無薪假之後，勞動部推出安心就業計畫來做薪資差額的補貼，所以現在勞動部改口叫「減班休息」，我想請教部長，無薪假與減班休息，兩者的差別在哪裡？,126,LCIDC01_1090901_00008
蔣萬安,部長，你說混淆視聽，有混淆視聽嗎？,127,LCIDC01_1090901_00008
蔣萬安,如果你認為混淆視聽，那到底有什麼不一樣？,128,LCIDC01_1090901_00008
蔣萬安,所以勞動部到底是要稱呼它為「無薪假」，還是「減班休息」？,129,LCIDC01_1090901_00008
蔣萬安,你們認為是減班休息？請教部長，勞動部有任何關於減班休息的函釋嗎？,130,LCIDC01_1090901_00008
蔣萬安,這個是根據你們什麼函釋？,131,LCIDC01_1090901_00008
蔣萬安,勞動部沒有關於減班休息的函釋，你們現在有的函釋，我show給部長看。你們是有關於無薪假的函釋，就誠如部長剛才講的，需要經過勞資會議，而且必須要勞工同意，必須要給付最低工資。沒有關係，部長……,132,LCIDC01_1090901_00008
蔣萬安,不管你認為是混淆視聽，還是你認為實質上沒有差別，甚至你引用的相關函釋勞動部也都有，名詞很確定是無薪假。本席以及廣大勞工朋友關心的，在此時此刻並不是糾結在名詞上面的解釋，大家關心的是，不管叫無薪假或是減班休息，背後所代表的都是勞動權益的受損。勞工朋友在意的是，在現階段防疫的時刻我被放無薪假，我的權益受損，政府能夠怎麼樣帶領我共度難關？能不能夠給我相關的扶助？這才是重點。,133,LCIDC01_1090901_00008
蔣萬安,那勞動部現在為什麼一直說混淆視聽，要改口叫「減班休息」？這不是大家關心的。,134,LCIDC01_1090901_00008
蔣萬安,外界有誤解嗎？,135,LCIDC01_1090901_00008
蔣萬安,部長，這是在你們勞動部可以查到的。,136,LCIDC01_1090901_00008
蔣萬安,你們也沒有關於減班休息的函釋！今天大家關心的是勞動權益能夠怎麼樣受到照顧……,137,LCIDC01_1090901_00008
蔣萬安,勞動部要不要發一個減班休息的函釋？,138,LCIDC01_1090901_00008
蔣萬安,就是無薪假的函釋啊！,139,LCIDC01_1090901_00008
蔣萬安,對！就是這裡講的，要勞工同意，要給付不低於基本工資啊！要縮減工時，而且依比例減少工資。,140,LCIDC01_1090901_00008
蔣萬安,部長，暫時縮減工作時間及依比例減少工資，以共度難關，惟對支領月薪資者，仍不得低於基本工資，就是仍要給付基本工資，就是部長你講的啊！那這個函釋是什麼？「無薪休假」，這是目前在勞動部可以找到的函釋！既然有無薪休假的函釋，沒有減班休息的函釋，因此引用的就是這個嘛！,141,LCIDC01_1090901_00008
蔣萬安,你們不是做這樣的名詞定義？你們如果要改口，如果要修正……,142,LCIDC01_1090901_00008
蔣萬安,部長，你們現在的方案推出之後，在防疫期間，對於這些放無薪假或是減班休息的勞工有做薪資差額的補貼，對不對？,143,LCIDC01_1090901_00008
蔣萬安,如果有一些雇主，即便沒有疫情，他的公司也因為體質不善即將倒閉，或者是一些人頭公司，或者是根本沒有這樣的需求，可能目前是處於淡季，但是因為政府有這樣的方案，他就以防疫為藉口放員工無薪假，讓員工可以去請領薪資差額的5成補貼，對於這部分勞動部要怎麼處理？,144,LCIDC01_1090901_00008
蔣萬安,簡單來講，就是他以防疫為藉口放員工無薪假，你們有沒有相關的機制？所謂的防弊機制？,145,LCIDC01_1090901_00008
蔣萬安,各地方的勞政主管機關有沒有一個統一的指引或標準？因為這個方案是你們推出的！,146,LCIDC01_1090901_00008
蔣萬安,基本上這些企業只要申報放無薪假，之後你們有掌握，這些放無薪假的勞工就可以向你們申請安心就業方案？,147,LCIDC01_1090901_00008
蔣萬安,部長，你是推給勞工，讓勞工判斷？,148,LCIDC01_1090901_00008
蔣萬安,部長，如果雇主今天以景氣不好，訂單減少為由跟員工說：因為這波疫情太嚴重了，快撐不下去了，拜託開始放無薪假，而勞工同意了。但事實上，雇主並不是因為疫情的影響，卻依然要求員工放無薪假。在這種情況下，勞工也同意了，只是他們並不清楚公司營運是否真受到疫情影響，也同意雇主的要求，之後向政府請領津貼，因為政府可以補助。我要提醒勞動部的是，很多公司可能不是受疫情影響，是本身體質不好就要倒閉的，或是人頭公司，或根本沒有這樣的需求，只是剛好因為這段期間是淡季，於是抓住政府有薪資補貼的機會慷政府之慨，讓政府來包養員工放無薪假，讓勞工去請領。為此，我必須提醒勞動部，更希望建立防弊機制。請問勞動部有沒有針對這些企業主的相關因應機制？還是全部只要放無薪假，不論什麼狀況，不管是不是受疫情影響，有沒有這樣的需求，全部都可以用你們的安心就業方案請領嗎？勞動部有沒有思考這一點？,149,LCIDC01_1090901_00008
蔣萬安,部長，在疫情期間提出這個方案的確照顧到勞工，你們是針對領月薪的嗎？,150,LCIDC01_1090901_00008
蔣萬安,時薪、月薪都有？,151,LCIDC01_1090901_00008
蔣萬安,對於弱勢的部分工時者，例如手搖杯、飲料店或便利店的打工朋友呢？他們是否也可請領安心就業方案津貼？,152,LCIDC01_1090901_00008
蔣萬安,可以？,153,LCIDC01_1090901_00008
蔣萬安,安心就業計畫預計何時可正式上路？,154,LCIDC01_1090901_00008
蔣萬安,3月底？現在還在等行政院拍板？,155,LCIDC01_1090901_00008
蔣萬安,3月下旬正式上路的安心就業計畫，係針對受疫情影響的勞工，如果被放無薪假，可以有薪資差額的補貼。請問這個方案能不能溯及既往？,156,LCIDC01_1090901_00008
蔣萬安,但從1月底、2月起就受影響的，尤其是最近通報的，你們有掌握，對嗎？,157,LCIDC01_1090901_00008
蔣萬安,有多少家數？,158,LCIDC01_1090901_00008
蔣萬安,受影響的勞工有多少？,159,LCIDC01_1090901_00008
蔣萬安,我想請教勞動部，你們3月底才開始實施，如果不溯及既往，他們受的損失怎麼辦？,160,LCIDC01_1090901_00008
蔣萬安,我要提醒勞動部，希望你們可以訂一個溯及的標準，也許到1月31日或2月，或是紓困條例正式三讀通過的時間。這段期間受疫情影響的勞工，已被放無薪假一段期間了，他們已受有損失。勞動部的安心就業方案很好，可以照顧到勞工，但應該所有勞工一體適用，而不應有差別待遇。所以我希望勞動部的安心就業方案能訂一個溯及基準。,161,LCIDC01_1090901_00008
蔣萬安,都可以適用嗎？即便在3月底以前，都可以來申請安心就業方案？,162,LCIDC01_1090901_00008
蔣萬安,都可以來申請？,163,LCIDC01_1090901_00008
蔣萬安,所以有溯及效果？,164,LCIDC01_1090901_00008
蔣萬安,確定？,165,LCIDC01_1090901_00008
蔣萬安,應該可以？,166,LCIDC01_1090901_00008
蔣萬安,往後生效，還是可以溯及往前？這很簡單。,167,LCIDC01_1090901_00008
蔣萬安,紓困特別條例是從1月15日開始哦！,168,LCIDC01_1090901_00008
蔣萬安,確定？,169,LCIDC01_1090901_00008
蔣萬安,"民國在92年SARS期間勞動部有編了3億元，除了薪資補貼，也做了勞動場所專案檢查。這次勞動部推出安心就業方案及在職訓練等，但有關勞動場所的專案檢查，特別是衛生安全檢查，當時有對1,091家基層醫療院所、878家高科技產業、大型事業針對預防的專案檢查，這次你們會不會做？",170,LCIDC01_1090901_00008
蔣萬安,會做？,171,LCIDC01_1090901_00008
蔣萬安,經費從哪裡來？,172,LCIDC01_1090901_00008
蔣萬安,你們的勞檢經費是夠的？,173,LCIDC01_1090901_00008
蔣萬安,所以你們去年編列預算時，有預期今年會有疫情發生？,174,LCIDC01_1090901_00008
蔣萬安,不會排除掉原本要做的安全衛生檢查？,175,LCIDC01_1090901_00008
蔣萬安,所以你們去年編預算是有稍微浮編？,176,LCIDC01_1090901_00008
蔣萬安,還是你們有預期今年會發生疫情，然後需要做專案的勞動操作檢查？,177,LCIDC01_1090901_00008
蔣萬安,去年有規劃到今年會有新冠肺炎的疫情發生？,178,LCIDC01_1090901_00008
蔣萬安,加強，所以你們要撥預算出來。,179,LCIDC01_1090901_00008
蔣萬安,我知道你們預算夠，也會去做，我當然認同。只是如果疫情持續發展下去，或如果又更嚴峻，我擔心的是你們現在的經費，是用原本編列的一般公務預算裡撥出來，到時候如果你們還需要增加怎麼辦？我提醒勞動部，你們要開始思考。,180,LCIDC01_1090901_00008
莊競程,（10時35分）主席、各位列席官員、各位同仁。首先我想請教勞動部許部長，前幾天我有跟台中一些工會的理事長開一個座談會，他們反應現在又到了開代表大會的時間，有提出一個問題，面對現在的疫情，開會期間也擔心會有防疫的問題產生，請問依法是否可延期？,181,LCIDC01_1090901_00008
莊競程,依法可以延多久？,182,LCIDC01_1090901_00008
莊競程,沒有一個月或兩個月的限制？,183,LCIDC01_1090901_00008
莊競程,另外，如果總工會或該工會屆臨改選時，你們會建議他們怎麼做？在防疫期間建議他們延期，還是照辦、繼續開會？,184,LCIDC01_1090901_00008
莊競程,還是要辦？因為是任期的問題？,185,LCIDC01_1090901_00008
莊競程,如果有競爭，問題會更大，對嗎？,186,LCIDC01_1090901_00008
莊競程,所以建議他們在任期結束之前還是要辦。,187,LCIDC01_1090901_00008
莊競程,但他們擔心的是，有些勞工代表可能粗心忘記戴口罩，或認為戴布口罩就可以等等情形，他們希望勞動部是否可以會同衛福部，責成地方政府衛生局或勞工局，在不得已的情況下仍必須開會時，提供幾位專家協助施行防疫措施？本來他們在問政府可否現場提供備用口罩，我跟他們說直接給口罩可能會有問題，但如果是由政府機關派遣專業人員……,188,LCIDC01_1090901_00008
莊競程,是的，這個要指引。,189,LCIDC01_1090901_00008
莊競程,他們當然會建議進來開會全部都要戴口罩，或可能會準備酒精等措施，但萬一有勞工代表忘了戴口罩，不可能叫他不要進去開會。遇到這種狀況時，要如何處理？你們會有專人準備一些備用口罩讓他們……,190,LCIDC01_1090901_00008
莊競程,問題是他們沒有備用的口罩，因為現在口罩是實名制，都要自己去買。,191,LCIDC01_1090901_00008
莊競程,我建議責成衛生局或地方主管機關派專人……因為屆期開會的可能不會有那麼多場，可以派專人過去幫他們做防疫措施。,192,LCIDC01_1090901_00008
莊競程,另外，剛才也有委員提到，貴部勞保局在前年度委託辦理勞工保險普通事故保險費率之精算及評估，按照現在的勞保費率與給付制度，可能會在2026年面臨破產的危機。但這幾年看起來勞動基金操作得還是不錯，例如去年賺了898.1億元，多少能挹注勞保支出。但今年全球經濟受到武漢疫情的影響，今年1月勞動基金評價後的報酬是負312億元，收益率為負0.75%。目前在疫情的疑慮下，金融市場可能也是不看好的，不僅投資人的心驚驚，本席站在關心勞工及勞動基金盈虧的立場，也是有點感到憂心。請問勞動部，今年勞保基金是否能維持收益與彌補勞保的虧損？,193,LCIDC01_1090901_00008
莊競程,因為今年第1月已經虧損這麼多了……,194,LCIDC01_1090901_00008
莊競程,對於基金缺口可能擴大，有沒有因應措施？,195,LCIDC01_1090901_00008
莊競程,未來勞保基金可能還有一些改革要做，還需要擴大或深入探討。我在和勞工界座談時，他們表示這樣的制度也可能影響到退休金的權益，之後我可能會再與部長或勞動部做些溝通或探討，有哪些好的改革是對勞工有益的作法。,196,LCIDC01_1090901_00008
莊競程,"口罩現在是採實名制的購買方式，剛剛也有委員提到失聯移工的問題。根據移民署統計，今年全臺失聯移工人數高達1,171人，累計至今已有48,545人。剛才部長說勞動部是管合法移工，那失聯、非法的部分就是移民署或內政部……",197,LCIDC01_1090901_00008
莊競程,從合法到失聯中間，可能會造成防疫破口，畢竟失聯移工無法買到口罩。部長在報告中提到目前有用四國語言宣導，要推廣讓移工認知防疫，但在違法移工的工作場所當中，可能不會有這樣的措施。面對這樣的防疫破口，部長有什麼樣的因應措施？,198,LCIDC01_1090901_00008
莊競程,其實可以針對這樣的情況，看有什麼方法讓這些失聯移工或雇主願意配合。因為這個疫情狀況可能造成破口，雇主會擔心，移工自己也會擔心。,199,LCIDC01_1090901_00008
莊競程,之前有一位旅館業雇主向本席反映，願意配合防治中心及勞動部有關勞工請防疫假的規定，但他們發生狀況。他有員工於上個禮拜前往日本旅遊，行前他希望該員不要去，如果去了回國之後，則必須在家自主健康管理14天，無薪。該員答應了，但回國後該員說不要，因為自主健康管理無須待在家，如果雇主要求他待在家則必須給薪。這有幾個問題：其一，雇主為此感到困擾，也擔心其他員工安危；其二，該員是廚房工作人員，以致他非常擔心整個旅館與其他員工的安危。由於他與員工曾做口頭約定，故詢問了勞動部相關單位，結果勞動部說不行，要給薪；但如雙方曾簽訂契約，載明希望該員不要去，若一定要去，則必須自行負擔14天的無薪自主健康管理假。我想知道有任何法令可以幫忙該名業者嗎？畢竟日本目前仍為二級警示。,200,LCIDC01_1090901_00008
莊競程,是啊！,201,LCIDC01_1090901_00008
莊競程,業者的癥結點在於，該名員工如果是被派去工作，那也就算了，但他是自己跑去玩。出國前雇主既然已經告知，那麼契約上是否……,202,LCIDC01_1090901_00008
莊競程,口頭承諾可能不算數，畢竟沒有證據，但如果有書面，能否……畢竟雇主必須顧及其他員工與旅館的安危。,203,LCIDC01_1090901_00008
莊競程,對，畢竟出國前已經告知了。,204,LCIDC01_1090901_00008
莊競程,好，謝謝部長。,205,LCIDC01_1090901_00008
邱泰源,（11時2分）主席、各位列席官員、各位同仁。部長辛苦了。,206,LCIDC01_1090901_00008
邱泰源,我有幾個主題與勞動部相關。在這次疫情中，由於第35例為醫院清潔人員，也讓大家重視起醫院外包人員是否有得到保護的問題，也記起2003年SARS發生時，由洗衣工所引起大型院內感染。外包人員並非醫事人員，卻在醫院出生入死，因此本席想知道醫院是否提供足夠的口罩給他們？或者外包人員得自行處理？這問題部長是否瞭解？,207,LCIDC01_1090901_00008
邱泰源,指揮中心瞭解這問題？,208,LCIDC01_1090901_00008
邱泰源,我相信有考量，但重點在於落實，相信勞動部也很關心外包人員的權益與工作環境。在這一波疫情中，外包人員必須保持健康，如果外包人員不健康的話，那麼醫院也會跟著危險。,209,LCIDC01_1090901_00008
邱泰源,請勞動部必須瞭解這件事。,210,LCIDC01_1090901_00008
