speaker,speech_text,speech_number,meeting_id
邱泰源,現在來討論再生醫療的問題，個人站在立法委員的立場，我還是會守護行政院版本，基本上我們會用這樣的方式儘量讓它能夠快速走下去，但我還是要講一些醫學的專業，以及過去臺灣許多值得尊敬的醫療專業人才的努力。我們都知道國際間在發展先進醫療有四個pillars（支柱），第一個是藥物的發展，過去藥界前輩不斷的努力，我在藥界的好朋友非常多，從大學時代到現在已經幾十年了，就是跟藥界的朋友一起成長，我深切瞭解他們對國家的貢獻，這是一條可以再繼續發揮照顧人民功效的路。其次，現在一直在積極推動biologics，也就是生物製劑產品，各位可以查一下Google就很容易瞭解它的相關內容，包括疫苗等等都是在這個部分。第三根柱子就是醫療器材，這也發展得非常好，所以我們在幾年前也通過了醫療器材的管理專法，專法通過之後，這些老師、學生就開始有一個專業領域可以去教學、研究或發展，對國家進行專業的貢獻，所以設立專法是非常重要的。第四個是細胞的治療，我想這部分就是再生醫療的主軸，當然有部分結合生物製劑產品。其實這四個方面都是獨立在做，然後共同合作來照顧人民的健康及需要，所以政府應該要瞭解這樣的方向，對每一個專業予以個別輔導，促進他們個別專業的尊嚴，共同提供民眾安全有品質的治療。部長你今天會很輕鬆，因為我不會讓你回答太多，主要都是由我來講。我們上禮拜開了一場FISS，這在三年前召開的時候，有幾位得諾貝爾獎的國際級免疫專家到臺灣來，今年3月26日要在長庚醫院召開，屆時也會有很多國際級的專家參與，賴副總統也要我代表他去現場關心、致詞、鼓勵。各位看到這張照片可能會嚇到，當時大概有500位唸生命科學系、微生物、免疫學的研究生都來參加，這幾年來針對細胞治療的部分，他們是真正一生投入在這個部分，我們有沒有給他們專業的領域？他們才是專家，他們絕對比醫師還專門。我認為一定要給生命科學一個專業的領域，不然現在大學聯考要開始填志願了，你看哪一個系是名聲不錯但前途很差？那就是生命科學系，生命科學系以前在臺大就是動物系，我們的陳院長正是出身於此，當然他把生命科學發展到醫療衛生領域、貢獻極大、令人敬佩。這每一個將來都是可能會得諾貝爾獎的學生，我們在訂定相關法案時有沒有尊重他們，讓他們有相關的發展？這是我們這幾年念茲在茲、永遠不敢放棄的目標。醫界絕對沒有延宕法案，醫界只是希望讓這些人能夠真正發揮，讓法案更周全，讓我們的人民得到更有品質、安全的治療，今天我們還是要走下去，但是我們不要忘記該堅持的還是要堅持。我們可以看到106年臺灣醫界聯盟由55名最令人尊敬的前輩領導，同時也在林世嘉團隊的努力之下，找了很多專家提出先進醫療產品條例。他們當時的立法相當完整，它是針對再生醫療產品、細胞治療產品、基因治療產品的方式，其實後來醫界有很多人都是用這個版本一直在研擬其他版本。107年11月因為衛福部提出再生醫療製劑管理條例，所以我們就召開公聽會，後來當然也開過不少會。108年醫師公會全聯會經過一段時間的研議之後，在2月26日提出再生醫療製品管理條例，希望讓它更周全，而且希望它是一個專法，以合乎我剛剛在提案說明時所提到的原則。後來三法提出來的時候，也不曉得為什麼前面的部分不見了，anyway當時對三法的原則我就不重複了。即使後來發現不走下去不行，醫界也勉強同意後來行政院所提的公告並提出許多建議，但是並沒有被採納，雖然醫界頗為遺憾，但我們還是要感謝針對幾個必要的重點行政院高層非常有見識還是予以堅持，在此要特別向行政院高層致上最大的感謝。我現在已經不是醫師公會全聯會理事長，醫師公會的團隊過去多年來無私無我，雖然我們都沒有在做再生醫療，但我們可能有一天需要施打也不一定。我們一直都支持相關法案能夠早日通過，我們更希望藉由三讀通過的法案，未來大家能夠攜手致力於讓病人的健康及生命權利得以回復；針對再生醫療的專業，讓一生投入的老師和學生們能夠有其專業領域，給他們好的發展；就人民的健康維護而言，我們希望能夠讓國內很辛苦在發展的生技產業優先予以保護，讓他們能夠發展，同時也讓國家能夠正常發展，變成三贏的局面。天佑臺灣人民，感謝大家！,45,LCIDC01_1123101_00004
莊競程,（10時20分）我先請教經濟部，貴部在今天的報告內容提到，為了鼓勵產業界投入再生醫療產業之研究發展，提升我國生技醫藥產業之技術能量與國際競爭力，加速我國再生醫療產業之發展，因此「生技醫藥產業發展條例」將再生醫療業者納入租稅優惠之適用對象，以鼓勵業界投入再生醫療產業發展。因為今天審查的再生醫療雙法不涉及新租稅的減免，所以不須提稅式支出的評估，但是經濟部有沒有掌握相關的租稅優惠或減免的規模目前是多少？如果再生醫療法雙法通過之後，以相關的租稅規模，是不是會重新計算及評估？預期的經濟規模與租稅減免的規模分別是如何地分布？,46,LCIDC01_1123101_00004
莊競程,好。,47,LCIDC01_1123101_00004
莊競程,前面談到經濟部對於租稅規模掌握的問題，最主要的原因是經濟部未來在兩部法案通過之後，應該會協同衛福部提供科技專案的補足、研發、產業缺口及加速產品上市的布局，謝謝兩位。再請教衛福部部長。部長好！再生醫療相關的製劑及療程其實價格都不便宜，一般民眾可能目前看起來都是難以負擔的，如果相關的誘因不夠明確，民眾很難真正地相信因為立了這些法、做了這些措施而能真正受惠。今天我們立了相關的法，有沒有辦法確認因為這兩部法而讓再生醫療的技術或製劑可以走向產品量產，嘉惠所有國人的使用？此外，我們如何讓業者相信政府會支持相關產業的發展，而不是空有口號及法規的架構？,48,LCIDC01_1123101_00004
莊競程,我們都希望可以在修法確立之後可以有更親民的製劑來嘉惠國人，只是目前我們還看不太出來如何支持業界走向產品的量產，而不只是願意導向醫療技術而已。例如製劑的開發其實有時候是很耗時間的事情，像剛剛溫委員提到的，製劑可以用附款的許可，在第2期臨床研究的時候就可以使用。剛剛講到這個附款的許可到底是不是會泛濫，現在規定是5年，不得再展延嘛？,49,LCIDC01_1123101_00004
莊競程,我看過說明，規定不得再展延的立意是希望它趕快可以去上市。,50,LCIDC01_1123101_00004
莊競程,但是如果在5年內它還是沒有辦法走向正常人體試驗的期程時，基於不得展延的規定，這次的技術或製劑要再申請一次嗎？,51,LCIDC01_1123101_00004
莊競程,是，如果做不完呢？,52,LCIDC01_1123101_00004
莊競程,所以如果它在做第2期的時候，可能有一些罕病的case比較少，做不到第3期的部分……,53,LCIDC01_1123101_00004
莊競程,有評估過大部分可行？,54,LCIDC01_1123101_00004
莊競程,所以目前的附款許可大概就是得5年，已經確立是這樣了？,55,LCIDC01_1123101_00004
莊競程,OK，謝謝。我想臺灣的生醫產業在過去3年的疫情期間其實很加速地發展，而且我們在國際市場展現了實力，所以總統也宣示政府會持續投入相關的資源，讓制度面更加完整，包括衛福部已在去年成立智慧醫材辦公室，協助醫療產業與資通訊產業進行跨領域的合作；另外，總統也宣示政府會持續地投入資源在生技醫療研發及人才的培育上面。衛福部與經濟部都在報告中提到會相互配合，協助產業的發展，但是我們看到衛福部或其他委員所提的法案意見，衛福部回答相關的意見只說，有關編列經費、人才資源發展及提供產業發展配套措施等等相關內容，已經在經濟部的產業創新條例、生技醫藥產業發展條例有所規定，為了避免相同的事項重複立法，所以建議不予參酌，但是衛福部還是沒有具體說明要如何協助產業發展及如何培育這些人才，例如人才的培育還涉及教育，衛福部及經濟部預計會怎麼做？,56,LCIDC01_1123101_00004
莊競程,是。我想再生醫療其實涉及非常跨領域的人才整合，所以我也同意部長所說的，即未來是否要有一個考試制度，或是必須受過什麼樣的訓練，抑或是修過什麼樣的課程，他才有辦法執行這些業務？我同意這個方向的進行，這樣才能夠讓跨領域人才因為這個法而進到該行業，讓這行業的發展可以更好。,57,LCIDC01_1123101_00004
莊競程,好，謝謝部長。,58,LCIDC01_1123101_00004
王婉諭,（10時32分）部長，今天要再來跟您討論精神長照的計畫，現在我所show出的這張表格其實在去年質詢您時就已經呈現過了，當時有跟您報告兩件事情，第一個，為什麼我們需要精神長照計畫？原因在於長照計畫2.0開跑後，就一再地被指出，長照服務計畫鮮少照顧到精神病人及其照顧者之需求，因此當時衛福部希望透過該計畫瞭解未來到底要如何整合納入長照2.0。第二個，2020年心健司開始辦理試辦計畫後，希望經由具體作為及試辦後瞭解該如何整合，但當時的計畫一直到2020年中才上路，並且2021年因為受疫情影響而停擺了，直到2022年還沒有完整進行過一整年的計畫；並且直到2022年8月才公告第三期計畫。所以可以看到在過去的執行期間，其實並沒有一個完整原定2年的試辦計畫成果，能夠讓我們瞭解如何整合納入長照2.0。因此當時就詢問2023年是否會繼續試辦，以及下一期的公告何時能夠儘快執行，您去年承諾在今年1月之前就會提出具體試辦計畫讓大家來申請，但時至今日已是3月下旬，我們還沒有看到該計畫的呈現。請教為什麼承諾又再次跳票？,59,LCIDC01_1123101_00004
王婉諭,我們希望能夠有具體的作為，而不是說一再地跳票，又再承諾一次。,60,LCIDC01_1123101_00004
王婉諭,部長，這就是問題啊！部長及司長的交替等等讓我們的計畫一再地延宕，但人事的變革其實不應該影響到整體國家政策的發展……,61,LCIDC01_1123101_00004
王婉諭,再次跟您說明2022年到8月才有這樣的計畫，其所造成的影響為何？就是原本在計畫內的人員到底是否要繼續留用、繼續聘任，以及經費是否會從2022年初起算，這就造成很大的影響，我們也看到現在已經3月了，你們的相關計畫還沒有出現，其實很多過去的試辦機構就面臨到人才無法繼續留用的問題，這樣的情況對於整體的規劃都非常不好，包括如果繼續承攬的話，會面臨到財務上受影響，以及人才到底是重新聘用抑或是繼續留用，這些都是非常不利的。因此我想請部長認真思考，下個月真的可以看見計畫嗎？我不希望下個月因為承諾又再度跳票而再質詢一次。,62,LCIDC01_1123101_00004
王婉諭,好，我們希望下個月一定要看到，因為具體的方案包括人員是否能夠從1月起來起聘，這部分我覺得應該要來努力，這樣才有辦法讓試辦計畫真的能夠達成目標，並且未來整合納入長照系統中。非常謝謝部長承諾4月會公告，且4月要真的能夠執行，不要再次來這裡做同樣的質詢了。,63,LCIDC01_1123101_00004
王婉諭,另外，想跟部長請教身障者自立生活支持服務的辦理情況，在上個月底我們有召開公聽會，邀請包含障礙者團體、服務使用者及個人助理參與，從他們的發言內容可以瞭解，我國在身障者的自立生活支持上還有許多方面必須要來努力。今天想先就時數部分跟您請教及說明，去年審查身權法時有提到，自立生活的個助時數應該要以服務需求者使用評估為準，當時也提到部分縣市仍墨守每個月60小時上限的規定，衛福部會再次向縣市政府強調並協調希望能夠落實以需求評估為準。實際上，我們看到各縣市似乎仍訂有上限，比如新北市的計畫內容雖然從每個月60小時提升到每個月80小時，如果用專案的方式，每個月最高可達上限100小時，但即便是這樣，仍然與我們希望及衛福部所說以需求評估為準來提供服務的作法有相當大的落差。請教部長，衛福部對於各地方政府訂定時數上限的相關規則是否有進行通盤瞭解？,64,LCIDC01_1123101_00004
王婉諭,請問目前各縣市政府是否有訂定上限、有幾個縣市有訂定上限以及上限是多少？,65,LCIDC01_1123101_00004
王婉諭,應該不是說時數的放寬，而是時數不應該有上限的這件事情必須要去強調……,66,LCIDC01_1123101_00004
王婉諭,應該要回到您所說的以需求評估為準。,67,LCIDC01_1123101_00004
王婉諭,沒關係，我們先就剛才的題目討論，各縣市訂定範圍是否有上限的部分如果有相關資料，是否能夠在會後提供給我們辦公室，讓我們一併來做瞭解？,68,LCIDC01_1123101_00004
王婉諭,接下來，有關時數上限的部分，在上週四我國出現首件障礙者透過行政訴訟爭取時數增加的勝訴，我想部長應該也有關注到這項議題。,69,LCIDC01_1123101_00004
王婉諭,案件當事人是一位肌肉萎縮症障礙者「玉姐」，在申請自立生活支持時，遭新北市政府以年度上限60小時為由拒絕增加時數，因而提起訴訟，經過兩年多的努力，終於在上週一審判決新北市社會局敗訴。判決理由包括：未能夠真正落實以障礙者需求評估為依據、以預算規模決定時數上限涉及裁量怠惰等等；另外，判決中也指出，社會局應該要以障礙者為主體及決策中心，進而盤整、協調各項福利資源，來評估擴大提供個人助理的可行性。我們也看到在判決後，新北市政府表示各地方政府都面臨到類似的瓶頸，不訂定時數上限會有執行上的困難，中央也很焦慮未來該如何運作。在這項判決之後，中央及地方要如何來因應，其實是我們必須要來面對的。並且在上次的公聽會也有提到，我們得到的數據是，即便是無上限、以需求者為主體的情況下，每人每週使用的時數大約是4.22小時，而部長也在公聽會表示，該服務不是只有生活助理員而已，還有居家服務員等等。但以玉姐的案例來看，獨居的他，即便是居服加上個助每個月大約有210小時的人力協助，但換算下來每天大概是7個小時而已，這樣能夠滿足他們的需求嗎？其實並不然，我們看到在這些時數以外，他們有正常的睡覺、吃飯、喝水及上廁所等基本需求，這是人的生活基本需求，但對他們來說卻像是一種奢侈。甚至曾經發生半夜遭到電暖器燙傷卻只能等待警察來協助的狀況。以數據來看，目前自立生活所需要的人力支持，平均下來每個人只有4個小時，加上剛才所提到3個小時的居服，除此之外，障礙者團體也多次分享到，為了減少在這些沒有人服務、協助時段裡面的需求，他可能會長年睡在輪椅上或是一天只吃一餐、減少喝水、減少上廁所，甚至月經來時全天包著一個紙尿布，在這樣的情況下度過沒有人力協助的時間。剛剛提到我們希望用使用者的需求為主體來做評估，但是中央和地方顯然在很多面向上都還沒有具體作為與討論，所以想請教未來要如何因應？是不是衛福部已經有一個明確的計畫了？,70,LCIDC01_1123101_00004
王婉諭,但這不是只有時數的調整而已。,71,LCIDC01_1123101_00004
王婉諭,其實應該是其中相對的資源如何能夠來因應及努力。,72,LCIDC01_1123101_00004
王婉諭,是，不過這個部分我們在公聽會已經具體呈現，現在個人助理的服務時數其實也是偏低的，所以完全符合勞基法。但如何能夠讓提供的服務跟需求對接，就如同公聽會上提到的，可能都很集中在中間的用餐時間又或者是下班下課之後的使用時段，所以這部分其實必須做整體的盤點，以及從個助、生活助理員然後到居家服務員的部分不應該有斷鏈的情況，而是能夠持續提供協助。,73,LCIDC01_1123101_00004
王婉諭,沒錯，不同系統如何介接也是一個很大的問題。,74,LCIDC01_1123101_00004
王婉諭,衛福部是否能夠在三個月內針對我國的障礙者在各項人力支持服務普遍不足的情況下，邀集相關部會包含地方政府以及障礙者代表一起來通盤研商？,75,LCIDC01_1123101_00004
王婉諭,所以未來可以解決這個問題，然後朝著依個人需求，我們可以看到未來不會只有四個多小時加三個多小時、一天只有七個多小時的狀況，並能夠具體做提升？,76,LCIDC01_1123101_00004
王婉諭,好，所以我們什麼時候能夠看到具體的方案？,77,LCIDC01_1123101_00004
王婉諭,除了時數之外，資源的整合與資源的協調都應該在裡面？,78,LCIDC01_1123101_00004
王婉諭,好，我們希望在4月的時候可以看到這樣子的方案。,79,LCIDC01_1123101_00004
王婉諭,謝謝部長。,80,LCIDC01_1123101_00004
蘇巧慧,（10時43分）謝謝主席。部長好！今天要就再生醫療法以及再生醫療製劑條例這兩個草案來跟您就教，我們下個禮拜就要正式進入到法條審查，社會期待這兩個法案或者說這一件事務的相關法案其實很久了，我想部長應該也肯認這件事情的急迫性，不管是從產業面還是從醫療面的狀況來講。部長，我們回顧一下，其實上一次第9屆的時候，這個再生醫療我們就已經提過了，但是很可惜功虧一簣，現在第10屆再一次提出，部長你可不可以跟我們再次分析一下，你覺得第9屆行政院的版本和現在這一屆的版本有什麼樣的差別？你覺得有什麼比較好的部分？,81,LCIDC01_1123101_00004
蘇巧慧,上位的概念。,82,LCIDC01_1123101_00004
蘇巧慧,對，沒有錯。,83,LCIDC01_1123101_00004
蘇巧慧,所以等於是變成雙法，這次你們提出的再生醫療相關法規等於是用雙法的概念來處理，第一個是再生醫療法的部分，把體系架構建構起來了之後，就是您剛剛說的，相關的執行部分其實都屬於醫療行為，它會處於醫療機構的體系下面，所以到底是誰來執行這個部分？當然就有其專業，以我們現在的認知其實是醫師最適合執行，這個部分是這樣。那等到它可以變成大量生產的話，我們再用再生醫療製劑的部分去做商品性，它可以做商品化、無差異性管理時，用這樣的製劑條例來做處置，差不多是用這樣的架構下去處理。,84,LCIDC01_1123101_00004
蘇巧慧,所以你們等於是用這樣雙法的概念去回應了上一屆最大的一個問題，就是到底哪一些專業可以來從事再生醫療這個領域？我肯定衛福部現在雙法的概念，誠如剛剛您說的，我們肯認了各方有專業，所以第一個，針對醫師的專業，我們用再生醫療法這個最大的部分去完成、建構了體系；但是我們也認為藥師有專業，所以用再生醫療製劑條例來處理，這兩部分應該就是從此開始建構，所以兩邊的意見都納入，這是第一個。但是我們其實還看到了，這次在製劑條例的部分還有另外一個新的領域，本席也認為不只是醫師跟藥師要參與這個再生醫療的領域，甚至還有其他的專業人士。我們看簡報下一頁，關於創造專業不專屬的部分其實還有很多，例如細胞操作人員不限定特定醫事人員，甚至是不限定特定醫事人員可駐場參與製造，這兩個部分是不是也請部長解釋一下概念是什麼？,85,LCIDC01_1123101_00004
蘇巧慧,坦白講，像這一次的疫苗製造等等也有非常多年輕優秀學者，甚至是第一線人員都下去投入了嘛。,86,LCIDC01_1123101_00004
蘇巧慧,我為什麼特別先從這裡開始？我們回到第9屆的爭端，其實就是這一個新的領域這麼大一塊，到底誰應該來？一方面是權利，我有沒有權利參與？另一方面其實是社會需要他們的專業，這兩邊其實是互相的，一個是他有專業、他應該要被參與、他主動，另外一個是社會需要他們。我們用雙法回應了醫和藥兩個大專業領域之虞，我現在必須說，我也認為在這麼大的一個領域當中，其實還有更多的專業人士應該被參與、也值得被參與，甚至我們需要他參與。所以依這樣的層次下來以後，我認為在這次的修法當中，衛福部版本的再生醫療法第十一條和製劑條例第五條有不特定醫事人員，我是支持的。但是我希望到時候行政院再提出版本，我們下個禮拜真的進入修法的時候，這個層次感可以出來，我們還是肯定醫師是醫療行為的根本，所以我們需要他們的專業，因此他放在最上面，有非常多的限定專業只有醫師才能夠執行，這個我完全同意，因為他們就是受過醫療專業訓練的人員；但是藥師的專業以及不特定的醫事人員也都值得鼓勵並被納入，我認為這三個層次到時候應該要區分清楚，這是第一點。上一屆的爭端就在於到底誰可以納入、怎麼管理，然後就會牽涉到用什麼法規或什麼法條來管理、要比照什麼樣的辦法，其實到最後就是混在這裡而無法前進，所以我今天再次提出哪一些人是我們都肯認的，最後就用哪一些法律來適用。第二個部分就是剛才大家都提出有關附款許可的部分，我想這是這次再生醫療的議題當中最會被大家討論到的，某種程度來講，這很像我們在疫情期間所學到的疫苗EUA的概念。剛剛部長在回答其他委員的時候，也再次說明如果到時候附條件，那它就有五年的期限。,87,LCIDC01_1123101_00004
蘇巧慧,你剛剛也提到如果在五年的期限當中還沒有完成審查的話，就等於回歸到一般的第三期試驗，必須要自己去完成才有辦法取得正式藥證，但是就不能再展延了，是不是這樣？其實大家會很擔心的是，這個條件是不是放得太寬，以致於很多人會走這個巧門，然後變成一而再、再而三的展延，請問部長這個部分該怎麼處理呢？,88,LCIDC01_1123101_00004
蘇巧慧,這是肯定的嘛！,89,LCIDC01_1123101_00004
蘇巧慧,我想下個禮拜的修法過程大家會再一起討論，因為很多是細部的問題。目前個人大體上支持行政院版本，我的條件有三個：第一個是肯認各方的專業，第二個是創造專業不專屬的空間，第三個是附款許可應該更加嚴謹。以上是我在意的三個面向，先跟衛福部進行討論，下個禮拜我們再討論細部問題，謝謝部長。,90,LCIDC01_1123101_00004
洪申翰,（11時4分）部長好。我們終於等到今天，這是很多生技產業界，並且包括病友團體都非常期待的再生醫療雙法可以儘速通過！在瞭解這個法案的過程中，雖然我不是專業的醫療人員，可是接下來我基本上要從一般大眾的角度針對再生醫療雙法來進行一些討論跟提問。部長，坦白說，其實對一般民眾而言，這整個治療的療程，價格是比較昂貴的，也因為法規的限制，所以其實有很多人必須出國去做這個療程，所以其實我看到滿多的人說再生醫療其實是富人醫療，就這樣的說法，部長有沒有聽過？,91,LCIDC01_1123101_00004
