speaker,speech_text,speech_number,meeting_id
王婉諭,兒少法第八十四條其實已經清楚的定義出這個評鑑辦法，我們主管機關應該也要有責任來輔導、監督、檢查、獎勵以及定期評鑑。而衛福部在定期評鑑部分其實做得滿好的，每三年就會照評鑑辦法來實施評鑑，最近的三次分別是101年、104年及107年各做一次，下一次是在明年，我們想就這個部分來做討論。以現在的狀況來說，我們參考107年的某一家安置機構，這不是唯一的個案，我們只是先舉這個例子來說，就是說有某一家安置機構，在衛福部的報告裡面提到有一些建議改善和輔導機制，就是說其作息可能不符合兒童發展的考量，另外，這個收案的機構內，對於家庭的議題的協助和處遇並沒有主動介入，所以我們希望說這個主管機關也能夠一起來協助安置機構、一起來努力。但是，我們也可以看到，這家安置機構並不是107年才被評鑑出有這樣的建議事項，其實該同一個機構在101年及107年就曾經因違反兒少法第八十三條第四款被開罰，我不知道兩位是不是很清楚第八十三條第四款是什麼？,104,LCIDC01_1094701_00006
王婉諭,我先跟兩位報告第八十三條第一項第四款是規定：「發現兒童及少年受虐事實，未向直轄市、縣（市）主管機關通報。」，該機構其實已經有違反兒童少年福祉的情況，我們剛才提到應該要有開罰措施，應該要有輔導機制，沒有錯，所以我們來看一下這家機構從101年到現在的狀況，101年係違反了第八十三條第一項第四款，該年的評鑑是丙等；104年的評鑑還是丙等；106年的複評結果分提到它還是有一些狀況是不好的；107年的時候，又違法再繼續開罰，評鑑從丙等變成丁等。我們想說的是，這個主管機關不但是應該要辦理評鑑、辦理複評，其實複評的目的是希望能夠輔導和改善之後再來作評估它有沒有變好，而不是你們一直不停的評鑑、告訴這家機構說有哪些不好的情況而沒有進行輔導，所以我們希望主管機關在這部分是不是能夠更精準、一起來加強這個部分？剛剛提到說我們已經修法、可以來開罰，對，我看到在108年的時候劉建國委員等已提案修法，可以來開罰，甚至提議可以停辦的情況，但是我們也不知道像現在所舉的這家機構是什麼狀況，是不是能夠請兩位說明一下？是不是確實有開罰了？,105,LCIDC01_1094701_00006
王婉諭,當然。,106,LCIDC01_1094701_00006
王婉諭,其實不只是這個案例，其他還有在桃園和南投等地都有看到這樣的案例，就是持續的評鑑之後可能都是丙等或丁等的情況，所以，我們希望這個輔導機制可以建立起來。第一點就是希望社家署能夠有更積極的作為來加強輔導，甚至來強化這個評鑑機制。第二點，就像剛才提到的，如果真的不行，我們再來進行開罰和廢止的部分，因為我們也清楚現狀就是公立機構的部分其實很少，也很需要這些民間機構來處理，但另外一個議題是為什麼我們公部門在兒少安置上的投資這麼少？我們很希望可以來改善。但我們先針對私人的機構來討論，社家署應該也要有積極的作為來作輔導、轉銜和改善計畫。另外，針對這個持續不法情況、違法的情況或是不好的情況應更積極地來處理。再者，針對評鑑內容，我們也提出一個建議，雖然已經有納入個案訪談，但是因為畢竟是在同一個機構裡面，然後還有一些管理的考量，這些院童可能不好意思或不敢或受到壓力的情況下，他們其實沒有辦法表達他們自己的聲音，所以未來是否能夠考慮將已經離院院童的訪談也納入評鑑機制？,107,LCIDC01_1094701_00006
王婉諭,謝謝。另外，本席想跟你討論這個申訴的機制，其實CRC的國際審查結論也提到，就像剛才提到這個申訴的機制應該要適當支持它是在不透露隱私、然後他能夠安全的狀況下提出申訴，在衛福部提供給我們的資料提到，從99年到108年只有6件申訴的案件，並不是說這些機構做的非常好，因為這些申訴案件的數量其實遠遠低於因為這個行為而被開罰或處置的紀錄。剛才提到，這些院童如果遇到這些不好的情況或是他們希望申訴，卻因為擔心或害怕被處罰等等，所以他們並沒有辦法主動來提出這個不當管教的方式，我們也看到衛福部社家署這邊在105年的時候有訂定這個申訴的管道，甚至在107年的預算中也提出你們應該更積極來做第三方的協助機制和申訴管道，但我們從衛福部的少年之家網站卻可以看到所謂的外部申訴機制其實非常簡略和粗糙，僅說請撥打本部社會及家庭署專線04……，本席想建議的是，以這些院童在這個機構內的情況而言，他們不見得隨時可以有3C設備可以上網，不見得能夠這麼自由地去打電話，另外，打電話進去之後的通報機制是什麼？他們會擔心的是，我通報社家署之後，社家署說我們收到這個申訴，所以我來跟你做溝通。其實還是有可能會導致他在裡面因此而被不當對待。因此，我們希望這個申訴的部分能夠更細緻、更標準、清楚化，讓這些院童真的受到不當對待的時候，能夠有一個明確的申訴管道和機制，以保障他們的權益、保障他們的福祉。所以我們有提出三個政策的建議：第一，加強對於兒少申訴的隱蔽性，並保障其安危，而且一樣要有吹哨者條款，保護他們的安全、保護他們的福利。第二，基本上很多兒少都是在學，我們能否藉由學校做為申訴的管道，這樣才不會造成他在院內可能沒有足夠的設備或足夠的自由度來進行申訴，這方面是不是能夠考慮？第三，申訴機制應該要分流處理，要依不同情況來分齡或分類。以上三點意見，兩位是不是能夠接受和認同？,108,LCIDC01_1094701_00006
王婉諭,所以這幾個建議兩位都曾經看過，也清楚嘛？,109,LCIDC01_1094701_00006
王婉諭,雖然臺灣簽了CRC之後，我們確實有兒童的表意權，而兒少委員們也都提案出來，但是他們認為他們的聲音可能不被重視，他們只是講講而已，而沒有辦法得到實際的回應、協助甚至更積極的來面對。所以早上我們才提到，希望這些委員們能夠再次來表達，在我們的國家報告又要再一次出現的情況，我們是不是能夠認真的來看在上一次國家報告中曾經出現的這些問題，我們能夠一起努力來解決。另外，兒少的表意權真的不是找他們來開會而已，而是應該納入他們的聲音，如同我剛剛提到，我們希望現在仍在機構或是曾經有在機構但現已離院的人都可以來表達，其實我們的兒少委員裡面就有曾經也在機構安置，然後現在已經離院的少年，他們的聲音都非常的珍貴，也非常需要被聽見，所以我很希望衛福部能夠一起積極來協助和改善。,110,LCIDC01_1094701_00006
洪申翰,（11時4分）主席、各位列席官員、各位同仁。在這次疫情中，行政院提出紓困方案大概也有一個多月的時間，這段時間裡，目前看起來最大爭議的方案應該就是衛福部的急難紓困方案，這個方案其實還在進行之中，後續也有不少問題和不少疑問，有很多還是持續的從地方或民眾端提出來。我可以理解這個紓困方案比較急，也比較複雜，這個複雜包括原本我們對這群無勞保的弱勢就業者的掌握不足，這些都造成我們在制定這個方案先天上就比較困難。這段時間其實有很多人針對這個方案當時規劃的方式提出了各種評論跟討論，有幾個討論我想請教次長的意見。其中有幾個討論認為，當初之所以把疫情的紓困放到急難救助系統裡面，原因之一是急難救助的系統本來是要處理一些因為緊急事變而造成家戶生計突然陷入困境的狀況，所以在這個想法之下，就把因為疫情導致生計受困的事情當作是一種緊急事變，因而把它放進來。請問次長，一開始設計的原因是不是因為這樣子？,111,LCIDC01_1094701_00006
洪申翰,可是如果是按照剛剛次長的講法，其實不一定要把這次的紓困放到急難救助的內容裡面，所以現在有一些朋友在批評、指教說，其實一開始就不應該把紓困的方案放到急難救助的方案裡面。對於這樣的批評和想法，次長同意嗎？,112,LCIDC01_1094701_00006
洪申翰,我是問次長，你覺得同意嗎？因為我們在討論這個事情啊！,113,LCIDC01_1094701_00006
洪申翰,次長也當過勞動部次長，所以你現在的意思是，在一開始我們針對這一群人提供的支持跟資源，你覺得應該以勞動部來做支援是比較合理的，你現在意思是這樣子嗎？,114,LCIDC01_1094701_00006
洪申翰,次長，你當時有跟勞動部做過這個討論嗎？,115,LCIDC01_1094701_00006
洪申翰,所以你們一開始沒有跟勞動部做討論，然後你現在才開始在想，也許當時由勞動部來負責是比較適合的。坦白說，這個講法我覺得可能會讓很多人難以接受。,116,LCIDC01_1094701_00006
洪申翰,聽起來這個問題很大，甚至這個計畫不只是細節的問題，包括一開始是由哪幾個部會來負責，現在回過頭來看，次長對目前的安排跟規劃是有不同的想法。第一，目前在承辦這個業務的是社工司，請問社工司針對這個方案，原本急難救助的邏輯跟新舊方案之間邏輯的差異，甚至執行面我們可能會遇到的潛在問題，到方案的規劃，甚至到決策的建議，請問社工司或衛福部的幕僚單位，當初有沒有提供充足的資訊讓衛福部或行政院來作判斷？,117,LCIDC01_1094701_00006
洪申翰,所以當初在規劃這個方案時的幕僚作業，其實就沒有把充足的資訊跟可能會發生的情境做一併完整的考慮，是這個意思嗎？,118,LCIDC01_1094701_00006
洪申翰,次長，我必須說，我不是想針對任何的事務官，我覺得不管是政務官或事務官，在這個過程當中，大家都學到非常多的事情，甚至之前連蘇院長都出來道歉，這當然是種負責任的態度。但是我必須說，在這一次的經驗之中，到底有什麼地方該做而沒做好的？甚至是到時候聯繫不足，中央跟地方為什麼產生落差？行政院跟部會、衛福部到底為什麼產生落差？對於這些相關的資訊，我不是想要向下究責，但是我認為衛福部必須針對這個部分提出一份完整的檢討報告給國會。這部分次長或司長做不做得到？,119,LCIDC01_1094701_00006
洪申翰,我可以給時間，如果我給一個月的時間，你們能否提供完整的報告？因為當我看到今天衛福部提出來針對擴大紓困的報告，坦白說，裡面並沒有針對檢討的部分，只有針對現況怎麼執行的部分，換句話說，我們其實看不到你們從這個經驗裡面吸取的教訓，所以接下來如果在一個月的時間裡，請衛福部或社工司提供一個完整的報告給國會，可以嗎？,120,LCIDC01_1094701_00006
洪申翰,6月底提供報告可以嗎？現在已經快5月底了，對不對？,121,LCIDC01_1094701_00006
洪申翰,7月初可以嗎？,122,LCIDC01_1094701_00006
洪申翰,我尊重幕僚單位，所以給我一個時間啊！,123,LCIDC01_1094701_00006
洪申翰,7月初好不好？我不想跟你討價還價，我認為就7月初。最後一個問題，針對低收入戶、中低收入戶的就業服務，不管是就業的媒合或者是職業訓練，其實在一些數據上面可看到，在過去兩年的時間裡面，從社政系統轉入到勞政系統的人次明確下降，請問衛福部，為什麼會出現這樣的現象？,124,LCIDC01_1094701_00006
洪申翰,所以這個銜接的補強已經在進行了，是不是？,125,LCIDC01_1094701_00006
洪申翰,接下來希望你們把這個銜接補強的狀況也讓我辦公室能掌握，好不好？因為我覺得這部分很重要。,126,LCIDC01_1094701_00006
洪申翰,我自己認為在急難紓困方案裡面跟這個都會有關係。,127,LCIDC01_1094701_00006
洪申翰,我們發給他1萬元以後，他後續該怎麼回到比較正常的就業市場，都跟社政怎麼協助他轉到勞政體系裡面是有關係的。所以針對這個問題，希望能給我辦公室更完整的資訊，謝謝。,128,LCIDC01_1094701_00006
徐志榮,（11時14分）主席、各位列席官員、各位同仁。次長，那天謝謝您到苗栗來。今天520，是蔡總統就職典禮，當然大家都很關心總統的談話，我也希望在未來的4年，總統可以讓我們民生安和樂利，大家都能夠安居樂業。因為大家在開會，可能還沒有聽到總統講的話，其中四大面向裡面有一個是社會安定，我大概簡單唸一下：社會安定的部分是醫療健康網、社會安全網，接住每個需要幫助的人，其中內涵有提到，未來4年，我的目標就是要把這張網，做得更綿密，接住每一個需要幫助的人，儘量不要讓憾事再發生。我們很慶幸，也很高興總統有關心到這個區塊。在此請問次長，有關現行的社會安全網，部裡面知道還有哪些要加強的嗎？,129,LCIDC01_1094701_00006
徐志榮,我很高興聽到你這樣說，修法之後，最主要還是要落實、要務實。剛才總統也有講到這個名稱，就是精神疾病中的思覺失調症，這個被討論很多，還有缺乏病識感的問題，對此，部裡面有什麼應對的措施嗎？,130,LCIDC01_1094701_00006
徐志榮,我不知道受刑人有多少，但據本席瞭解，受刑人裡面有二、三千人有精神方面的疾病，當然他們也不可能一輩子在那裡面，刑期到了或者假釋出來以後，針對這些人要怎麼樣對他們加以輔導，這可能也是補社會安全網的一環，所以請你要更加關心。,131,LCIDC01_1094701_00006
徐志榮,老實說，我們當委員的，除了來立法院開會以外，最近因為疫情的關係，所以很多社區或社團的活動也減少了很多，我不知道其他委員，但是對我而言，我們在地方時常會去參加告別式，甚至還沒到告別式的時候，會先去捻香。次長那天去參加的告別式，我也要特別在這邊講一下，99歲仍是現任醫生，實在非常難得，生老病死，人難免要往這邊走，99歲還是執業醫師，這算是一種喜事。,132,LCIDC01_1094701_00006
徐志榮,但是有時候我們去捻香或是參加告別式的時候，會看到一些很年輕的照片，難免會問一下，有一部分是因為自殺，這方面希望你要多關心，這也是和社會安全網有關；甚至有些人要我們幫忙贊助，講不好聽一點，就是連棺材費用都沒有的這些低收入戶或窮苦人家，請次長也要加以關心。部裡面有訂定「加害人合併精神疾病整合性服務涵蓋率」，107年是30%，108年60%，今年則訂80%，今年部分先不講，108年訂的目標60%，有沒有達到？今年的80%，有可能會達到嗎？,133,LCIDC01_1094701_00006
徐志榮,但是不知道去年60%有沒有達到？你們一時沒有這個數字也沒關係。,134,LCIDC01_1094701_00006
徐志榮,沒關係，希望你們今年訂的80%能夠達到目標。今天520，也是蔡總統新任期的開始，希望政府從總統到部裡面以及各地方政府，大家一起齊心努力，讓這個社會安全網能夠真正地發揮作用。另外，疫情也越來越穩定，好幾天沒有確診病例，召委也把隔板拿走了，今天我也有點故意地不戴口罩，所以就表示疫情穩定。我要講的是，我們從5月1日開始針對長照機構有條件的放寬訪視規定，老實說，剛剛也講了，生老病死，在那邊的人幾乎都是年長者，我不敢說他們的時間不長，但至少比較有可能，我們都讀儒家思想的書，也滿孝順的，我主要的意思是，疫情穩定以後，這方面是不是可以慢慢地開放？特別是假日，兒女、孫子女要去探視的時候往往受到很多限制，有時規定同一個空間只能有一組人進去、一組不能超過3個人等等，可是我看了一下，你們這個規範裡面並沒有說探視的時間是多長，講得不好聽一點，哪家的人看了兩、三個小時，後面那家說不定就要等兩、三個小時還是怎麼樣。我是認為疫情已經穩定了，幾乎也沒有社區感染的問題，所以針對這方面是不是可以讓這些孝順的孩子們能夠有比較長的時間去看看他們的親人？甚至於反過來講，住在長照機構的人可能也很渴望自己的親人去探望他，所以本席在此建議你可以向疫情指揮中心反映一下，看是不是可以慢慢來開放，好不好？,135,LCIDC01_1094701_00006
徐志榮,對，我看你們5月1日發布的規定後面也有一條說會視情況再來調整，現在已經過了20天，疫情也越來越穩定，可是這20天來都還沒有再調整，所以這一點也在這邊反映給次長知道。好，謝謝次長。,136,LCIDC01_1094701_00006
張育美,"（11時24分）主席、各位列席官員、各位同仁。本席首先要請教蘇次長，現在的急難紓困是真的救急又救窮嗎？我們知道第1期的紓困預算是600億元，可是衛福部卻只占7,800萬元，這麼少的金額好像爹不疼、娘不愛，所以就沒有引起關注。可是5月4日之後，蘇院長開了一個看似德政的記者會，說會給沒投保但是有工作的勞工紓困，對該記者會所發布的內容，很多執政黨立委有意見，有關這個看似對紓困有幫忙的做法，中央也在跟地方互槓，所以我想請問次長，你們到底有沒有搞清楚急難救助和紓困的差別？",137,LCIDC01_1094701_00006
張育美,其實急難救助可能跟貧窮線掛鉤，紓困則是發生疫情之後過得比以前差一些，也就是要如何度過難關。我覺得應該是衛福部你們自己也弄混亂了，所以才充滿矛盾，因此民眾可能就會漏接。,138,LCIDC01_1094701_00006
張育美,也就是擴大嘛！本來是急難救助，現在就是把它擴大，包括有工作、沒勞保，受疫情影響的家庭。蘇院長的美意是如此，可是衛福部把它當作急難救助，也就是你們要求很高、要80分才可以，而蘇院長的意思是達到60分，也就是要讓普羅大眾多一點人獲得紓困，他的意思應該是如此。所以你要知道，這樣下去如果他的收入不是低於中低收入戶的話，就沒有辦法得到這種紓困了，對不對？,139,LCIDC01_1094701_00006
張育美,所以我是覺得，如果會讓大家confuse，為什麼不直接給他們紓困現金呢？因為他們要繳水電費，小孩子要讀書、上課，也需要相關的費用，還有房貸、學雜費等等，我的意思是說，不要像急難救助那麼嚴苛地要求必須達到80分，而是60分就好。我建議次長往這方面想，就不會發生地方槓上中央的狀況，你們執政黨的立委也有意見了啊！,140,LCIDC01_1094701_00006
張育美,好，謝謝，你有回答了。我的第二個問題是身心障礙者的早期療育。早期療育顧名思義是針對小朋友，這個部分我們知道監察院今年3月份有要求衛福部改善現行早期療育的辦理情形。衛福部本身有很多這方面的專家，同時也扮演父母官的角色，可是我要請問次長，你知道全臺灣能做早期療育聯合診斷的醫院有多少家，一家醫院又需要多少科別嗎？我本來是要考你的啦，現在我直接跟你講，能夠勝任這項工作的醫院一定要很大、有非常多完整的科別，以我們桃園市為例，只有7家，其中當然包括長庚醫院，也就是長庚以下共7家，科別很齊全，一定要有非常專業的專科醫師、專科人力才可以。因為只有7家，所以排隊要排多久你知道嗎？要早期診斷出需要早療的小朋友，第一是要發現問題，也就是要發現有問題的兒童，請問要發現有問題的兒童需要多久時間？你知道嗎？,141,LCIDC01_1094701_00006
張育美,對，評估比較重要！,142,LCIDC01_1094701_00006
張育美,次長，我跟你講，後面的治療是簡單的啦，因為復健科就可以。現在我是講前面的評估，你知道要花多少時間嗎？像桃園市只有7家，現在本席出示的是單一窗口評估流程的表格，你看，必須經過這麼多專科，包括身心科、耳鼻喉科、眼科等等一堆科，還有專業的物理治療師、職能治療師等等，你知道一個下午只能做一個嗎？你知道綜合報告書有幾頁嗎？診斷一名兒童可能需要十幾個各科醫師來會診，兩、三個小時才能診斷一位，那你知道有多少人在排隊嗎？次長！,143,LCIDC01_1094701_00006
張育美,對！請次長看一下，有這麼多科，一點也不隨便！我講的是一點也不隨便喔！,144,LCIDC01_1094701_00006
張育美,那就是這個醫院要夠大，一定要區域醫院以上，以桃園市為例，現在我們只有7家，量能很小，一天大概只能評估一個。有一所醫院還跟我講，他們星期一、三、五在做聯合評估，這樣一年也只能做到200個。所以我跟你講好了啦，小朋友最少要等3個月，最多要等6個月。你知道這個綜合報告書有幾頁嗎？,145,LCIDC01_1094701_00006
張育美,10頁到20頁，正常的OK，不正常的轉介。再請問次長，你知道一個科給多少錢嗎？例如他來幫忙診斷，這個科給多少錢？,146,LCIDC01_1094701_00006
張育美,"好，一個專科給500元而已，最高只給3,000元，而且要寫10到20頁的報告。所以，我們要知道民間疾苦，不能不食人間煙火，每個醫院都很辛苦，而且你要求的醫院是科別這麼多的，你只給3,000元，所以很多醫院都在抱怨。你知道一個小朋友每年都要去複診，因為小朋友會治療更好，或者更不好，所以他每年都要去再一次聯合診療，你知道嗎？次長，所以要多了解民眾的心聲、民眾的等待，我們讓這個小朋友等到3到6個月，總結就是量能不夠。",147,LCIDC01_1094701_00006
楊瓊瓔,主席、各位列席官員、各位同仁。先請教次長紓困專案，我剛剛聽到你非常有guts說你們一肩扛起，的確內容不是很清楚，但是你們仍舊願意做，但是目前中低收入戶這個標準是由財政部稅務官署裡頭會有一定的定量，其實我們討論到這裡，除了中低以外，我覺得最需要幫助的就是國保，所以剛開始我就說應該是要排富普發現金，不要造成所有機關，不管中央、地方的所有同仁大家忙得天翻地覆，這是一個非常離譜的政策。我們排富普發現金，今天我們已經是一個電子政府，我們已經有這個資料，造假假不了，為什麼還要讓民眾來申請？而且讓我們所有的官員、承辦人員天翻地覆，這是非常錯誤的，這是第一點，要檢討應該檢討這個。第二，國保的部分有330萬人，扣掉排富、扣掉身心障礙，因為只能接受一種最優惠的補助，如果扣掉這個大概三成，所以審慎考慮本席的建議，你們應該要好好去考慮，針對國保的人，我們是不是應該要普發現金，排富普發現金，而且排掉已經有其他項目的人，如果再扣掉三成，這才是真正協助民眾。次長的看法呢？,148,LCIDC01_1094701_00006
楊瓊瓔,對啊！所以這更離譜啊，沒有工作的人更需要協助，什麼都沒保的才是最需要協助，竟然我們是為了作業方便，所以排富普發現金才是最真正能夠協助民眾度過難關，我們不要在胡同裡頭繞圈。接下來請教WHA的問題，現在劉麗玲小姐告訴我們目前還沒收到邀請？,149,LCIDC01_1094701_00006
楊瓊瓔,我們說有很多好朋友，我認為世衛不能缺席臺灣，臺灣也不能缺席WHA，大家都有這樣的共識，那我們有什麼作為？我們說有很多好朋友，像德國，我們都說很好的朋友，德國是不是我們的好朋友？可是它在國際上的論點是如此，次長，你號稱臺灣衛福的阿信，我們針對WHA到底要怎麼精進作為？,150,LCIDC01_1094701_00006
楊瓊瓔,這當然啊！大家都努力。,151,LCIDC01_1094701_00006
楊瓊瓔,所以我們口中說的很多歐盟國家都是我們所稱的友好國家，是嗎？你這樣告訴我們民眾，我們很高興，我們也全力要支持，可是他們口中說出來是不一樣的，到底我們還有什麼方式？因為你們口中說的好友對我們在國際的發聲是不利的，這樣讓民眾會有反差，本席所要探討的是這個，當然，大家很辛苦，我們一定要團結一致，我們也希望方向應該是正確的，而不是嘴巴說的跟他們講的是不一樣的，這會讓民眾有反差的不知所措。,152,LCIDC01_1094701_00006
